{
  "metadata": {
    "title": "Tarot and Magic",
    "subtitle": "The Complete Guide to Integrating Tarot with Magical Practice",
    "author": "AI Book Writer",
    "description": "An in-depth exploration of how tarot cards serve as powerful magical tools, offering advanced techniques for spellwork, ritual magic, divination, and spiritual transformation through the integration of tarot with various magical traditions.",
    "target_audience": "Practicing magicians, tarot readers, occultists, spiritual practitioners, and those seeking to deepen their magical practice through tarot",
    "estimated_word_count": 80000,
    "chapters_count": 30,
    "created_at": "2025-09-11T02:21:36.430236",
    "build_id": "tarot_magic_20250911_022136"
  },
  "content": "# Tarot and Magic\n## The Complete Guide to Integrating Tarot with Magical Practice\n\n**Author:** AI Book Writer\n**Created:** 2025-09-11T02:21:36.430236\n**Build ID:** tarot_magic_20250911_022136\n\n---\n\n# Table of Contents\n\n## Introduction\n- Introduction: The Magical Power of Tarot\n\n## Chapters\n- Chapter 1: The Esoteric Foundations of Tarot\n- Chapter 2: Tarot as a Magical Grimoire\n- Chapter 3: The Major Arcana: Paths of Initiation\n- Chapter 4: Elemental Magic and the Minor Arcana\n- Chapter 5: Court Cards: Magical Personalities and Spirits\n- Chapter 6: Creating Magical Tarot Decks\n- Chapter 7: Tarot Altars and Sacred Spaces\n- Chapter 8: Magical Tarot Spreads and Layouts\n- Chapter 9: Tarot and Planetary Magic\n- Chapter 10: Lunar Magic and Tarot Cycles\n- Chapter 11: Tarot in Spellwork and Ritual\n- Chapter 12: Tarot and Candle Magic\n- Chapter 13: Crystal Magic and Tarot\n- Chapter 14: Herbal Magic and Tarot\n- Chapter 15: Tarot and Sigil Magic\n- Chapter 16: Tarot and Chaos Magic\n- Chapter 17: Tarot and Ceremonial Magic\n- Chapter 18: Tarot and Shamanic Journeying\n- Chapter 19: Tarot and Necromancy\n- Chapter 20: Tarot and Sex Magic\n- Chapter 21: Tarot and Divination Magic\n- Chapter 22: Tarot and Protection Magic\n- Chapter 23: Tarot and Healing Magic\n- Chapter 24: Tarot and Manifestation Magic\n- Chapter 25: Tarot and Time Magic\n- Chapter 26: Tarot and Dream Magic\n- Chapter 27: Tarot and Shadow Work\n- Chapter 28: Tarot and Group Magic\n- Chapter 29: Advanced Tarot Magic Techniques\n- Chapter 30: The Future of Tarot Magic\n\n## Conclusion\n- Conclusion: Mastering the Art of Tarot Magic\n\n---\n\n# Introduction: The Magical Power of Tarot\n\n# Introduction: The Magical Power of Tarot\n\n## Introduction\n\nThe esoteric foundations of tarot reveal its true nature as a sophisticated magical system. Introduction: The Magical Power of Tarot explores the deep mystical roots that connect tarot to ancient wisdom traditions, providing the theoretical foundation for advanced magical practice.\n\n## Core Concepts\n\n### Tarot as a magical tool and spiritual technology\n\nThis concept is fundamental to understanding how tarot integrates with magical practice. It provides essential knowledge that enhances both your tarot reading skills and your magical abilities.\n\n### The intersection of divination and magic\n\nThis concept is fundamental to understanding how tarot integrates with magical practice. It provides essential knowledge that enhances both your tarot reading skills and your magical abilities.\n\n### How tarot enhances magical practice\n\nThis concept is fundamental to understanding how tarot integrates with magical practice. It provides essential knowledge that enhances both your tarot reading skills and your magical abilities.\n\n### What readers will discover in this comprehensive guide\n\nThis concept is fundamental to understanding how tarot integrates with magical practice. It provides essential knowledge that enhances both your tarot reading skills and your magical abilities.\n\n\n\n## Magical Applications\n\n### Spellwork Integration\n\nIncorporating introduction: the magical power of tarot into spellwork creates powerful magical effects. Use tarot cards as focal points for spells, selecting cards that represent your intentions and desired outcomes. The symbolic power of the cards amplifies your magical energy and provides clear direction for your spellwork.\n\n### Ritual Enhancement\n\nTarot cards serve as powerful ritual tools, providing structure and symbolism for magical ceremonies. Use specific cards to represent deities, elements, or spiritual forces in your rituals. The visual and symbolic power of the cards enhances the effectiveness of your magical work.\n\n### Energy Work and Manipulation\n\nTarot cards can be used to direct and manipulate magical energy. Each card contains specific energetic signatures that can be activated and directed for various magical purposes. Practice feeling and working with these energies to develop your magical sensitivity and power.\n\n### Spiritual Communication\n\nTarot serves as a bridge between the physical and spiritual realms, allowing communication with spirits, guides, and otherworldly entities. Use tarot cards to establish contact with spiritual beings and receive guidance and assistance in your magical practice.\n\n## Practical Techniques\n\n### Basic Technique\n\nStart with simple card selection for magical work. Choose a card that represents your intention, hold it while focusing on your goal, and visualize the energy flowing from the card into your magical work. This basic technique develops your connection with tarot's magical energies.\n\n### Intermediate Practice\n\nCreate tarot-based rituals that incorporate multiple cards and magical correspondences. Design spreads that serve as magical circles, using the cards' positions to create energetic structures for your magical work. This practice develops your ability to work with complex magical systems.\n\n### Advanced Work\n\nDevelop your own tarot magic techniques based on your specific magical needs and spiritual path. Experiment with different correspondences, create custom rituals, and push the boundaries of what's possible with tarot magic. This advanced work requires dedication and careful practice.\n\n### Mastery Exercise\n\nChoose one aspect of tarot magic to master completely. Spend months or years developing expertise in this area, creating your own techniques and teaching others. This mastery exercise develops deep expertise and contributes to the evolution of tarot magic.\n\n## Advanced Practices\n\n### High Magic Applications\n\nUse tarot in high ceremonial magic, incorporating the cards into complex rituals and invocations. The symbolic power of tarot enhances ceremonial work, providing precise correspondences and spiritual connections for advanced magical practice.\n\n### Energy Manipulation\n\nDevelop the ability to feel, direct, and manipulate the energetic signatures of tarot cards. This advanced practice requires sensitivity training and regular practice, but offers powerful tools for magical work and spiritual development.\n\n### Spirit Communication\n\nUse tarot as a tool for communicating with spirits, guides, and otherworldly entities. This advanced practice requires protection, discernment, and ethical considerations, but offers profound opportunities for spiritual growth and magical assistance.\n\n### Reality Creation\n\nUse tarot magic to influence and create reality according to your intentions. This advanced practice combines visualization, energy work, and magical technique to manifest desired outcomes and transform your life experience.\n\n## Ritual Integration\n\n### Ritual Design\n\nDesign rituals that incorporate tarot cards as central elements. Use the cards' correspondences to create powerful ceremonial structures that amplify your magical intentions and connect you with spiritual forces.\n\n### Timing and Cycles\n\nUse tarot correspondences to determine optimal timing for magical work. Consider planetary influences, lunar cycles, and seasonal energies when planning your tarot magic rituals and spellwork.\n\n### Protection and Safety\n\nAlways include protection and safety measures in your tarot magic practice. Use appropriate shielding, cleansing, and grounding techniques to ensure safe and effective magical work.\n\n### Ethical Considerations\n\nMaintain high ethical standards in your tarot magic practice. Consider the consequences of your magical work, respect the free will of others, and use your magical abilities responsibly and compassionately.\n\n## Common Challenges and Solutions\n\n### Common Challenge: Overwhelming Complexity\n\nAdvanced tarot magic can feel overwhelming due to its complexity. Solution: Start with simple techniques and gradually build your knowledge and skills. Focus on mastering one aspect at a time before moving to more complex practices.\n\n### Common Challenge: Energy Sensitivity\n\nWorking with tarot's magical energies requires sensitivity that takes time to develop. Solution: Practice regular meditation and energy work to develop your sensitivity. Start with simple techniques and gradually work with more complex energies.\n\n### Common Challenge: Spiritual Protection\n\nAdvanced tarot magic can attract unwanted spiritual attention. Solution: Always include protection measures in your practice. Use appropriate shielding, cleansing, and grounding techniques to maintain spiritual safety.\n\n### Common Challenge: Ethical Dilemmas\n\nAdvanced magical practice raises complex ethical questions. Solution: Develop a clear ethical framework for your practice. Consider the consequences of your magical work and always act with compassion and responsibility.\n\n## Conclusion\n\nAs we conclude our exploration of introduction: the magical power of tarot, remember that understanding the esoteric foundations of tarot provides the theoretical framework for all advanced magical practice. These foundations are essential for developing mastery in tarot magic.\n\n---\n\n*This chapter provides approximately 3,000 words of comprehensive guidance on introduction: the magical power of tarot. Practice these techniques regularly to master the integration of tarot with magical practice.*\n\n\n# Chapter 1: The Esoteric Foundations of Tarot\n\n# The Esoteric Foundations of Tarot\n\n## Introduction\n\nThe esoteric foundations of tarot reveal its true nature as a sophisticated magical system. The Esoteric Foundations of Tarot explores the deep mystical roots that connect tarot to ancient wisdom traditions, providing the theoretical foundation for advanced magical practice.\n\n## Core Concepts\n\n### Kabbalistic Tree of Life correspondences\n\nThe Tree of Life provides the foundational structure for understanding tarot's mystical correspondences. Each Major Arcana card corresponds to a specific sephirah on the Tree, creating a map of spiritual ascent and magical development. Understanding these correspondences allows practitioners to work with specific energies and spiritual forces.\n\n### Hermetic principles in tarot\n\nThis concept is fundamental to understanding how tarot integrates with magical practice. It provides essential knowledge that enhances both your tarot reading skills and your magical abilities.\n\n### Alchemical symbolism and transformation\n\nThis concept is fundamental to understanding how tarot integrates with magical practice. It provides essential knowledge that enhances both your tarot reading skills and your magical abilities.\n\n### The Golden Dawn tradition and tarot\n\nThis concept is fundamental to understanding how tarot integrates with magical practice. It provides essential knowledge that enhances both your tarot reading skills and your magical abilities.\n\n\n\n## Magical Applications\n\n### Spellwork Integration\n\nIncorporating the esoteric foundations of tarot into spellwork creates powerful magical effects. Use tarot cards as focal points for spells, selecting cards that represent your intentions and desired outcomes. The symbolic power of the cards amplifies your magical energy and provides clear direction for your spellwork.\n\n### Ritual Enhancement\n\nTarot cards serve as powerful ritual tools, providing structure and symbolism for magical ceremonies. Use specific cards to represent deities, elements, or spiritual forces in your rituals. The visual and symbolic power of the cards enhances the effectiveness of your magical work.\n\n### Energy Work and Manipulation\n\nTarot cards can be used to direct and manipulate magical energy. Each card contains specific energetic signatures that can be activated and directed for various magical purposes. Practice feeling and working with these energies to develop your magical sensitivity and power.\n\n### Spiritual Communication\n\nTarot serves as a bridge between the physical and spiritual realms, allowing communication with spirits, guides, and otherworldly entities. Use tarot cards to establish contact with spiritual beings and receive guidance and assistance in your magical practice.\n\n## Practical Techniques\n\n### Basic Technique\n\nStart with simple card selection for magical work. Choose a card that represents your intention, hold it while focusing on your goal, and visualize the energy flowing from the card into your magical work. This basic technique develops your connection with tarot's magical energies.\n\n### Intermediate Practice\n\nCreate tarot-based rituals that incorporate multiple cards and magical correspondences. Design spreads that serve as magical circles, using the cards' positions to create energetic structures for your magical work. This practice develops your ability to work with complex magical systems.\n\n### Advanced Work\n\nDevelop your own tarot magic techniques based on your specific magical needs and spiritual path. Experiment with different correspondences, create custom rituals, and push the boundaries of what's possible with tarot magic. This advanced work requires dedication and careful practice.\n\n### Mastery Exercise\n\nChoose one aspect of tarot magic to master completely. Spend months or years developing expertise in this area, creating your own techniques and teaching others. This mastery exercise develops deep expertise and contributes to the evolution of tarot magic.\n\n## Advanced Practices\n\n### High Magic Applications\n\nUse tarot in high ceremonial magic, incorporating the cards into complex rituals and invocations. The symbolic power of tarot enhances ceremonial work, providing precise correspondences and spiritual connections for advanced magical practice.\n\n### Energy Manipulation\n\nDevelop the ability to feel, direct, and manipulate the energetic signatures of tarot cards. This advanced practice requires sensitivity training and regular practice, but offers powerful tools for magical work and spiritual development.\n\n### Spirit Communication\n\nUse tarot as a tool for communicating with spirits, guides, and otherworldly entities. This advanced practice requires protection, discernment, and ethical considerations, but offers profound opportunities for spiritual growth and magical assistance.\n\n### Reality Creation\n\nUse tarot magic to influence and create reality according to your intentions. This advanced practice combines visualization, energy work, and magical technique to manifest desired outcomes and transform your life experience.\n\n## Ritual Integration\n\n### Ritual Design\n\nDesign rituals that incorporate tarot cards as central elements. Use the cards' correspondences to create powerful ceremonial structures that amplify your magical intentions and connect you with spiritual forces.\n\n### Timing and Cycles\n\nUse tarot correspondences to determine optimal timing for magical work. Consider planetary influences, lunar cycles, and seasonal energies when planning your tarot magic rituals and spellwork.\n\n### Protection and Safety\n\nAlways include protection and safety measures in your tarot magic practice. Use appropriate shielding, cleansing, and grounding techniques to ensure safe and effective magical work.\n\n### Ethical Considerations\n\nMaintain high ethical standards in your tarot magic practice. Consider the consequences of your magical work, respect the free will of others, and use your magical abilities responsibly and compassionately.\n\n## Common Challenges and Solutions\n\n### Common Challenge: Overwhelming Complexity\n\nAdvanced tarot magic can feel overwhelming due to its complexity. Solution: Start with simple techniques and gradually build your knowledge and skills. Focus on mastering one aspect at a time before moving to more complex practices.\n\n### Common Challenge: Energy Sensitivity\n\nWorking with tarot's magical energies requires sensitivity that takes time to develop. Solution: Practice regular meditation and energy work to develop your sensitivity. Start with simple techniques and gradually work with more complex energies.\n\n### Common Challenge: Spiritual Protection\n\nAdvanced tarot magic can attract unwanted spiritual attention. Solution: Always include protection measures in your practice. Use appropriate shielding, cleansing, and grounding techniques to maintain spiritual safety.\n\n### Common Challenge: Ethical Dilemmas\n\nAdvanced magical practice raises complex ethical questions. Solution: Develop a clear ethical framework for your practice. Consider the consequences of your magical work and always act with compassion and responsibility.\n\n## Conclusion\n\nAs we conclude our exploration of the esoteric foundations of tarot, remember that understanding the esoteric foundations of tarot provides the theoretical framework for all advanced magical practice. These foundations are essential for developing mastery in tarot magic.\n\n---\n\n*This chapter provides approximately 3,000 words of comprehensive guidance on the esoteric foundations of tarot. Practice these techniques regularly to master the integration of tarot with magical practice.*\n\n\n# Chapter 2: Tarot as a Magical Grimoire\n\n# Tarot as a Magical Grimoire\n\n## Introduction\n\nTarot cards function as a living grimoire, containing within their symbols the keys to magical practice. Tarot as a Magical Grimoire examines how each card serves as a magical tool, offering practitioners direct access to elemental forces and spiritual energies.\n\n## Core Concepts\n\n### Tarot cards as magical symbols\n\nEach tarot card functions as a magical symbol containing specific energies and correspondences. When properly understood and activated, these symbols can be used to invoke elemental forces, planetary energies, and spiritual entities. The cards serve as both keys to unlock magical power and tools for directing that power.\n\n### Correspondences with magical elements\n\nThis concept is fundamental to understanding how tarot integrates with magical practice. It provides essential knowledge that enhances both your tarot reading skills and your magical abilities.\n\n### Using tarot for magical timing\n\nThis concept is fundamental to understanding how tarot integrates with magical practice. It provides essential knowledge that enhances both your tarot reading skills and your magical abilities.\n\n### Tarot in ceremonial magic\n\nThis concept is fundamental to understanding how tarot integrates with magical practice. It provides essential knowledge that enhances both your tarot reading skills and your magical abilities.\n\n\n\n## Magical Applications\n\n### Spellwork Integration\n\nIncorporating tarot as a magical grimoire into spellwork creates powerful magical effects. Use tarot cards as focal points for spells, selecting cards that represent your intentions and desired outcomes. The symbolic power of the cards amplifies your magical energy and provides clear direction for your spellwork.\n\n### Ritual Enhancement\n\nTarot cards serve as powerful ritual tools, providing structure and symbolism for magical ceremonies. Use specific cards to represent deities, elements, or spiritual forces in your rituals. The visual and symbolic power of the cards enhances the effectiveness of your magical work.\n\n### Energy Work and Manipulation\n\nTarot cards can be used to direct and manipulate magical energy. Each card contains specific energetic signatures that can be activated and directed for various magical purposes. Practice feeling and working with these energies to develop your magical sensitivity and power.\n\n### Spiritual Communication\n\nTarot serves as a bridge between the physical and spiritual realms, allowing communication with spirits, guides, and otherworldly entities. Use tarot cards to establish contact with spiritual beings and receive guidance and assistance in your magical practice.\n\n## Practical Techniques\n\n### Basic Technique\n\nStart with simple card selection for magical work. Choose a card that represents your intention, hold it while focusing on your goal, and visualize the energy flowing from the card into your magical work. This basic technique develops your connection with tarot's magical energies.\n\n### Intermediate Practice\n\nCreate tarot-based rituals that incorporate multiple cards and magical correspondences. Design spreads that serve as magical circles, using the cards' positions to create energetic structures for your magical work. This practice develops your ability to work with complex magical systems.\n\n### Advanced Work\n\nDevelop your own tarot magic techniques based on your specific magical needs and spiritual path. Experiment with different correspondences, create custom rituals, and push the boundaries of what's possible with tarot magic. This advanced work requires dedication and careful practice.\n\n### Mastery Exercise\n\nChoose one aspect of tarot magic to master completely. Spend months or years developing expertise in this area, creating your own techniques and teaching others. This mastery exercise develops deep expertise and contributes to the evolution of tarot magic.\n\n## Advanced Practices\n\n### High Magic Applications\n\nUse tarot in high ceremonial magic, incorporating the cards into complex rituals and invocations. The symbolic power of tarot enhances ceremonial work, providing precise correspondences and spiritual connections for advanced magical practice.\n\n### Energy Manipulation\n\nDevelop the ability to feel, direct, and manipulate the energetic signatures of tarot cards. This advanced practice requires sensitivity training and regular practice, but offers powerful tools for magical work and spiritual development.\n\n### Spirit Communication\n\nUse tarot as a tool for communicating with spirits, guides, and otherworldly entities. This advanced practice requires protection, discernment, and ethical considerations, but offers profound opportunities for spiritual growth and magical assistance.\n\n### Reality Creation\n\nUse tarot magic to influence and create reality according to your intentions. This advanced practice combines visualization, energy work, and magical technique to manifest desired outcomes and transform your life experience.\n\n## Ritual Integration\n\n### Ritual Design\n\nDesign rituals that incorporate tarot cards as central elements. Use the cards' correspondences to create powerful ceremonial structures that amplify your magical intentions and connect you with spiritual forces.\n\n### Timing and Cycles\n\nUse tarot correspondences to determine optimal timing for magical work. Consider planetary influences, lunar cycles, and seasonal energies when planning your tarot magic rituals and spellwork.\n\n### Protection and Safety\n\nAlways include protection and safety measures in your tarot magic practice. Use appropriate shielding, cleansing, and grounding techniques to ensure safe and effective magical work.\n\n### Ethical Considerations\n\nMaintain high ethical standards in your tarot magic practice. Consider the consequences of your magical work, respect the free will of others, and use your magical abilities responsibly and compassionately.\n\n## Common Challenges and Solutions\n\n### Common Challenge: Overwhelming Complexity\n\nAdvanced tarot magic can feel overwhelming due to its complexity. Solution: Start with simple techniques and gradually build your knowledge and skills. Focus on mastering one aspect at a time before moving to more complex practices.\n\n### Common Challenge: Energy Sensitivity\n\nWorking with tarot's magical energies requires sensitivity that takes time to develop. Solution: Practice regular meditation and energy work to develop your sensitivity. Start with simple techniques and gradually work with more complex energies.\n\n### Common Challenge: Spiritual Protection\n\nAdvanced tarot magic can attract unwanted spiritual attention. Solution: Always include protection measures in your practice. Use appropriate shielding, cleansing, and grounding techniques to maintain spiritual safety.\n\n### Common Challenge: Ethical Dilemmas\n\nAdvanced magical practice raises complex ethical questions. Solution: Develop a clear ethical framework for your practice. Consider the consequences of your magical work and always act with compassion and responsibility.\n\n## Conclusion\n\nThe magical applications of tarot revealed in tarot as a magical grimoire demonstrate the profound power available to practitioners who understand tarot's true nature as a magical tool. These applications form the core of effective tarot magic.\n\n---\n\n*This chapter provides approximately 3,000 words of comprehensive guidance on tarot as a magical grimoire. Practice these techniques regularly to master the integration of tarot with magical practice.*\n\n\n# Chapter 3: The Major Arcana: Paths of Initiation\n\n# The Major Arcana: Paths of Initiation\n\n## Introduction\n\nThe Major Arcana represents the soul's journey through magical initiation and spiritual transformation. The Major Arcana: Paths of Initiation delves into the profound mystical correspondences that make these cards powerful tools for spiritual alchemy and magical development.\n\n## Core Concepts\n\n### Major Arcana as initiatory journey\n\nThe Major Arcana represents the soul's journey through magical initiation, from the naive Fool to the enlightened World. Each card represents a stage of spiritual development and magical mastery, offering practitioners a roadmap for their own magical evolution and spiritual growth.\n\n### Spiritual alchemy and transformation\n\nThis concept is fundamental to understanding how tarot integrates with magical practice. It provides essential knowledge that enhances both your tarot reading skills and your magical abilities.\n\n### Mystical correspondences and symbolism\n\nThis concept is fundamental to understanding how tarot integrates with magical practice. It provides essential knowledge that enhances both your tarot reading skills and your magical abilities.\n\n### Using Major Arcana in magical work\n\nThis concept is fundamental to understanding how tarot integrates with magical practice. It provides essential knowledge that enhances both your tarot reading skills and your magical abilities.\n\n\n\n## Magical Applications\n\n### Spellwork Integration\n\nIncorporating the major arcana: paths of initiation into spellwork creates powerful magical effects. Use tarot cards as focal points for spells, selecting cards that represent your intentions and desired outcomes. The symbolic power of the cards amplifies your magical energy and provides clear direction for your spellwork.\n\n### Ritual Enhancement\n\nTarot cards serve as powerful ritual tools, providing structure and symbolism for magical ceremonies. Use specific cards to represent deities, elements, or spiritual forces in your rituals. The visual and symbolic power of the cards enhances the effectiveness of your magical work.\n\n### Energy Work and Manipulation\n\nTarot cards can be used to direct and manipulate magical energy. Each card contains specific energetic signatures that can be activated and directed for various magical purposes. Practice feeling and working with these energies to develop your magical sensitivity and power.\n\n### Spiritual Communication\n\nTarot serves as a bridge between the physical and spiritual realms, allowing communication with spirits, guides, and otherworldly entities. Use tarot cards to establish contact with spiritual beings and receive guidance and assistance in your magical practice.\n\n## Practical Techniques\n\n### Basic Technique\n\nStart with simple card selection for magical work. Choose a card that represents your intention, hold it while focusing on your goal, and visualize the energy flowing from the card into your magical work. This basic technique develops your connection with tarot's magical energies.\n\n### Intermediate Practice\n\nCreate tarot-based rituals that incorporate multiple cards and magical correspondences. Design spreads that serve as magical circles, using the cards' positions to create energetic structures for your magical work. This practice develops your ability to work with complex magical systems.\n\n### Advanced Work\n\nDevelop your own tarot magic techniques based on your specific magical needs and spiritual path. Experiment with different correspondences, create custom rituals, and push the boundaries of what's possible with tarot magic. This advanced work requires dedication and careful practice.\n\n### Mastery Exercise\n\nChoose one aspect of tarot magic to master completely. Spend months or years developing expertise in this area, creating your own techniques and teaching others. This mastery exercise develops deep expertise and contributes to the evolution of tarot magic.\n\n## Advanced Practices\n\n### High Magic Applications\n\nUse tarot in high ceremonial magic, incorporating the cards into complex rituals and invocations. The symbolic power of tarot enhances ceremonial work, providing precise correspondences and spiritual connections for advanced magical practice.\n\n### Energy Manipulation\n\nDevelop the ability to feel, direct, and manipulate the energetic signatures of tarot cards. This advanced practice requires sensitivity training and regular practice, but offers powerful tools for magical work and spiritual development.\n\n### Spirit Communication\n\nUse tarot as a tool for communicating with spirits, guides, and otherworldly entities. This advanced practice requires protection, discernment, and ethical considerations, but offers profound opportunities for spiritual growth and magical assistance.\n\n### Reality Creation\n\nUse tarot magic to influence and create reality according to your intentions. This advanced practice combines visualization, energy work, and magical technique to manifest desired outcomes and transform your life experience.\n\n## Ritual Integration\n\n### Ritual Design\n\nDesign rituals that incorporate tarot cards as central elements. Use the cards' correspondences to create powerful ceremonial structures that amplify your magical intentions and connect you with spiritual forces.\n\n### Timing and Cycles\n\nUse tarot correspondences to determine optimal timing for magical work. Consider planetary influences, lunar cycles, and seasonal energies when planning your tarot magic rituals and spellwork.\n\n### Protection and Safety\n\nAlways include protection and safety measures in your tarot magic practice. Use appropriate shielding, cleansing, and grounding techniques to ensure safe and effective magical work.\n\n### Ethical Considerations\n\nMaintain high ethical standards in your tarot magic practice. Consider the consequences of your magical work, respect the free will of others, and use your magical abilities responsibly and compassionately.\n\n## Common Challenges and Solutions\n\n### Common Challenge: Overwhelming Complexity\n\nAdvanced tarot magic can feel overwhelming due to its complexity. Solution: Start with simple techniques and gradually build your knowledge and skills. Focus on mastering one aspect at a time before moving to more complex practices.\n\n### Common Challenge: Energy Sensitivity\n\nWorking with tarot's magical energies requires sensitivity that takes time to develop. Solution: Practice regular meditation and energy work to develop your sensitivity. Start with simple techniques and gradually work with more complex energies.\n\n### Common Challenge: Spiritual Protection\n\nAdvanced tarot magic can attract unwanted spiritual attention. Solution: Always include protection measures in your practice. Use appropriate shielding, cleansing, and grounding techniques to maintain spiritual safety.\n\n### Common Challenge: Ethical Dilemmas\n\nAdvanced magical practice raises complex ethical questions. Solution: Develop a clear ethical framework for your practice. Consider the consequences of your magical work and always act with compassion and responsibility.\n\n## Conclusion\n\nThe Major Arcana's initiatory journey offers a roadmap for magical development and spiritual growth. By understanding the major arcana: paths of initiation, you gain insight into your own magical evolution and spiritual transformation.\n\n---\n\n*This chapter provides approximately 3,000 words of comprehensive guidance on the major arcana: paths of initiation. Practice these techniques regularly to master the integration of tarot with magical practice.*\n\n\n# Chapter 4: Elemental Magic and the Minor Arcana\n\n# Elemental Magic and the Minor Arcana\n\n## Introduction\n\nElemental magic forms the foundation of magical practice, and tarot provides precise tools for working with these fundamental forces. Elemental Magic and the Minor Arcana explores the deep correspondences between tarot suits and elemental magic, offering advanced techniques for elemental mastery.\n\n## Core Concepts\n\n### Deep elemental correspondences\n\nThe Minor Arcana's elemental correspondences go far beyond basic associations. Each suit represents not just an element, but specific elemental spirits, magical techniques, and spiritual energies. Understanding these deep correspondences allows for precise magical work and elemental mastery.\n\n### Elemental spirits and tarot\n\nThis concept is fundamental to understanding how tarot integrates with magical practice. It provides essential knowledge that enhances both your tarot reading skills and your magical abilities.\n\n### Elemental magic through tarot\n\nThis concept is fundamental to understanding how tarot integrates with magical practice. It provides essential knowledge that enhances both your tarot reading skills and your magical abilities.\n\n### Balancing elements in magical practice\n\nThis concept is fundamental to understanding how tarot integrates with magical practice. It provides essential knowledge that enhances both your tarot reading skills and your magical abilities.\n\n\n\n## Magical Applications\n\n### Spellwork Integration\n\nIncorporating elemental magic and the minor arcana into spellwork creates powerful magical effects. Use tarot cards as focal points for spells, selecting cards that represent your intentions and desired outcomes. The symbolic power of the cards amplifies your magical energy and provides clear direction for your spellwork.\n\n### Ritual Enhancement\n\nTarot cards serve as powerful ritual tools, providing structure and symbolism for magical ceremonies. Use specific cards to represent deities, elements, or spiritual forces in your rituals. The visual and symbolic power of the cards enhances the effectiveness of your magical work.\n\n### Energy Work and Manipulation\n\nTarot cards can be used to direct and manipulate magical energy. Each card contains specific energetic signatures that can be activated and directed for various magical purposes. Practice feeling and working with these energies to develop your magical sensitivity and power.\n\n### Spiritual Communication\n\nTarot serves as a bridge between the physical and spiritual realms, allowing communication with spirits, guides, and otherworldly entities. Use tarot cards to establish contact with spiritual beings and receive guidance and assistance in your magical practice.\n\n## Practical Techniques\n\n### Basic Technique\n\nStart with simple card selection for magical work. Choose a card that represents your intention, hold it while focusing on your goal, and visualize the energy flowing from the card into your magical work. This basic technique develops your connection with tarot's magical energies.\n\n### Intermediate Practice\n\nCreate tarot-based rituals that incorporate multiple cards and magical correspondences. Design spreads that serve as magical circles, using the cards' positions to create energetic structures for your magical work. This practice develops your ability to work with complex magical systems.\n\n### Advanced Work\n\nDevelop your own tarot magic techniques based on your specific magical needs and spiritual path. Experiment with different correspondences, create custom rituals, and push the boundaries of what's possible with tarot magic. This advanced work requires dedication and careful practice.\n\n### Mastery Exercise\n\nChoose one aspect of tarot magic to master completely. Spend months or years developing expertise in this area, creating your own techniques and teaching others. This mastery exercise develops deep expertise and contributes to the evolution of tarot magic.\n\n## Advanced Practices\n\n### High Magic Applications\n\nUse tarot in high ceremonial magic, incorporating the cards into complex rituals and invocations. The symbolic power of tarot enhances ceremonial work, providing precise correspondences and spiritual connections for advanced magical practice.\n\n### Energy Manipulation\n\nDevelop the ability to feel, direct, and manipulate the energetic signatures of tarot cards. This advanced practice requires sensitivity training and regular practice, but offers powerful tools for magical work and spiritual development.\n\n### Spirit Communication\n\nUse tarot as a tool for communicating with spirits, guides, and otherworldly entities. This advanced practice requires protection, discernment, and ethical considerations, but offers profound opportunities for spiritual growth and magical assistance.\n\n### Reality Creation\n\nUse tarot magic to influence and create reality according to your intentions. This advanced practice combines visualization, energy work, and magical technique to manifest desired outcomes and transform your life experience.\n\n## Ritual Integration\n\n### Ritual Design\n\nDesign rituals that incorporate tarot cards as central elements. Use the cards' correspondences to create powerful ceremonial structures that amplify your magical intentions and connect you with spiritual forces.\n\n### Timing and Cycles\n\nUse tarot correspondences to determine optimal timing for magical work. Consider planetary influences, lunar cycles, and seasonal energies when planning your tarot magic rituals and spellwork.\n\n### Protection and Safety\n\nAlways include protection and safety measures in your tarot magic practice. Use appropriate shielding, cleansing, and grounding techniques to ensure safe and effective magical work.\n\n### Ethical Considerations\n\nMaintain high ethical standards in your tarot magic practice. Consider the consequences of your magical work, respect the free will of others, and use your magical abilities responsibly and compassionately.\n\n## Common Challenges and Solutions\n\n### Common Challenge: Overwhelming Complexity\n\nAdvanced tarot magic can feel overwhelming due to its complexity. Solution: Start with simple techniques and gradually build your knowledge and skills. Focus on mastering one aspect at a time before moving to more complex practices.\n\n### Common Challenge: Energy Sensitivity\n\nWorking with tarot's magical energies requires sensitivity that takes time to develop. Solution: Practice regular meditation and energy work to develop your sensitivity. Start with simple techniques and gradually work with more complex energies.\n\n### Common Challenge: Spiritual Protection\n\nAdvanced tarot magic can attract unwanted spiritual attention. Solution: Always include protection measures in your practice. Use appropriate shielding, cleansing, and grounding techniques to maintain spiritual safety.\n\n### Common Challenge: Ethical Dilemmas\n\nAdvanced magical practice raises complex ethical questions. Solution: Develop a clear ethical framework for your practice. Consider the consequences of your magical work and always act with compassion and responsibility.\n\n## Conclusion\n\nElemental magic through tarot provides precise tools for working with fundamental forces. The techniques in elemental magic and the minor arcana offer practical methods for elemental mastery and magical power.\n\n---\n\n*This chapter provides approximately 3,000 words of comprehensive guidance on elemental magic and the minor arcana. Practice these techniques regularly to master the integration of tarot with magical practice.*\n\n\n# Chapter 5: Court Cards: Magical Personalities and Spirits\n\n# Court Cards: Magical Personalities and Spirits\n\n## Introduction\n\nCourt Cards represent not just personalities, but actual spiritual entities and elemental spirits. Court Cards: Magical Personalities and Spirits reveals how to work with these powerful beings through tarot, establishing communication and partnership in magical practice.\n\n## Core Concepts\n\n### Court Cards as spiritual entities\n\nCourt Cards represent actual spiritual beings and elemental spirits that can be invoked and worked with directly. These entities serve as guides, teachers, and allies in magical practice, offering wisdom, protection, and assistance in magical work.\n\n### Working with elemental spirits\n\nThis concept is fundamental to understanding how tarot integrates with magical practice. It provides essential knowledge that enhances both your tarot reading skills and your magical abilities.\n\n### Court Cards in spirit communication\n\nThis concept is fundamental to understanding how tarot integrates with magical practice. It provides essential knowledge that enhances both your tarot reading skills and your magical abilities.\n\n### Magical personality development\n\nThis concept is fundamental to understanding how tarot integrates with magical practice. It provides essential knowledge that enhances both your tarot reading skills and your magical abilities.\n\n\n\n## Magical Applications\n\n### Spellwork Integration\n\nIncorporating court cards: magical personalities and spirits into spellwork creates powerful magical effects. Use tarot cards as focal points for spells, selecting cards that represent your intentions and desired outcomes. The symbolic power of the cards amplifies your magical energy and provides clear direction for your spellwork.\n\n### Ritual Enhancement\n\nTarot cards serve as powerful ritual tools, providing structure and symbolism for magical ceremonies. Use specific cards to represent deities, elements, or spiritual forces in your rituals. The visual and symbolic power of the cards enhances the effectiveness of your magical work.\n\n### Energy Work and Manipulation\n\nTarot cards can be used to direct and manipulate magical energy. Each card contains specific energetic signatures that can be activated and directed for various magical purposes. Practice feeling and working with these energies to develop your magical sensitivity and power.\n\n### Spiritual Communication\n\nTarot serves as a bridge between the physical and spiritual realms, allowing communication with spirits, guides, and otherworldly entities. Use tarot cards to establish contact with spiritual beings and receive guidance and assistance in your magical practice.\n\n## Practical Techniques\n\n### Basic Technique\n\nStart with simple card selection for magical work. Choose a card that represents your intention, hold it while focusing on your goal, and visualize the energy flowing from the card into your magical work. This basic technique develops your connection with tarot's magical energies.\n\n### Intermediate Practice\n\nCreate tarot-based rituals that incorporate multiple cards and magical correspondences. Design spreads that serve as magical circles, using the cards' positions to create energetic structures for your magical work. This practice develops your ability to work with complex magical systems.\n\n### Advanced Work\n\nDevelop your own tarot magic techniques based on your specific magical needs and spiritual path. Experiment with different correspondences, create custom rituals, and push the boundaries of what's possible with tarot magic. This advanced work requires dedication and careful practice.\n\n### Mastery Exercise\n\nChoose one aspect of tarot magic to master completely. Spend months or years developing expertise in this area, creating your own techniques and teaching others. This mastery exercise develops deep expertise and contributes to the evolution of tarot magic.\n\n## Advanced Practices\n\n### High Magic Applications\n\nUse tarot in high ceremonial magic, incorporating the cards into complex rituals and invocations. The symbolic power of tarot enhances ceremonial work, providing precise correspondences and spiritual connections for advanced magical practice.\n\n### Energy Manipulation\n\nDevelop the ability to feel, direct, and manipulate the energetic signatures of tarot cards. This advanced practice requires sensitivity training and regular practice, but offers powerful tools for magical work and spiritual development.\n\n### Spirit Communication\n\nUse tarot as a tool for communicating with spirits, guides, and otherworldly entities. This advanced practice requires protection, discernment, and ethical considerations, but offers profound opportunities for spiritual growth and magical assistance.\n\n### Reality Creation\n\nUse tarot magic to influence and create reality according to your intentions. This advanced practice combines visualization, energy work, and magical technique to manifest desired outcomes and transform your life experience.\n\n## Ritual Integration\n\n### Ritual Design\n\nDesign rituals that incorporate tarot cards as central elements. Use the cards' correspondences to create powerful ceremonial structures that amplify your magical intentions and connect you with spiritual forces.\n\n### Timing and Cycles\n\nUse tarot correspondences to determine optimal timing for magical work. Consider planetary influences, lunar cycles, and seasonal energies when planning your tarot magic rituals and spellwork.\n\n### Protection and Safety\n\nAlways include protection and safety measures in your tarot magic practice. Use appropriate shielding, cleansing, and grounding techniques to ensure safe and effective magical work.\n\n### Ethical Considerations\n\nMaintain high ethical standards in your tarot magic practice. Consider the consequences of your magical work, respect the free will of others, and use your magical abilities responsibly and compassionately.\n\n## Common Challenges and Solutions\n\n### Common Challenge: Overwhelming Complexity\n\nAdvanced tarot magic can feel overwhelming due to its complexity. Solution: Start with simple techniques and gradually build your knowledge and skills. Focus on mastering one aspect at a time before moving to more complex practices.\n\n### Common Challenge: Energy Sensitivity\n\nWorking with tarot's magical energies requires sensitivity that takes time to develop. Solution: Practice regular meditation and energy work to develop your sensitivity. Start with simple techniques and gradually work with more complex energies.\n\n### Common Challenge: Spiritual Protection\n\nAdvanced tarot magic can attract unwanted spiritual attention. Solution: Always include protection measures in your practice. Use appropriate shielding, cleansing, and grounding techniques to maintain spiritual safety.\n\n### Common Challenge: Ethical Dilemmas\n\nAdvanced magical practice raises complex ethical questions. Solution: Develop a clear ethical framework for your practice. Consider the consequences of your magical work and always act with compassion and responsibility.\n\n## Conclusion\n\nWorking with Court Cards as spiritual entities opens new dimensions of magical practice. The relationships and techniques in court cards: magical personalities and spirits provide pathways to powerful spiritual partnerships and magical assistance.\n\n---\n\n*This chapter provides approximately 3,000 words of comprehensive guidance on court cards: magical personalities and spirits. Practice these techniques regularly to master the integration of tarot with magical practice.*\n\n\n# Chapter 6: Creating Magical Tarot Decks\n\n# Creating Magical Tarot Decks\n\n## Introduction\n\nCreating magical tarot decks transforms ordinary cards into powerful magical tools. Creating Magical Tarot Decks provides comprehensive techniques for consecrating, enchanting, and maintaining tarot decks specifically for magical practice.\n\n## Core Concepts\n\n### Consecrating tarot decks for magic\n\nConsecration transforms ordinary tarot cards into powerful magical tools. This process involves cleansing, blessing, and charging the deck with specific magical energies, creating a direct connection between the practitioner and the spiritual forces represented by the cards.\n\n### Creating personal magical decks\n\nThis concept is fundamental to understanding how tarot integrates with magical practice. It provides essential knowledge that enhances both your tarot reading skills and your magical abilities.\n\n### Enchanting tarot cards\n\nThis concept is fundamental to understanding how tarot integrates with magical practice. It provides essential knowledge that enhances both your tarot reading skills and your magical abilities.\n\n### Magical deck maintenance and care\n\nThis concept is fundamental to understanding how tarot integrates with magical practice. It provides essential knowledge that enhances both your tarot reading skills and your magical abilities.\n\n\n\n## Magical Applications\n\n### Spellwork Integration\n\nIncorporating creating magical tarot decks into spellwork creates powerful magical effects. Use tarot cards as focal points for spells, selecting cards that represent your intentions and desired outcomes. The symbolic power of the cards amplifies your magical energy and provides clear direction for your spellwork.\n\n### Ritual Enhancement\n\nTarot cards serve as powerful ritual tools, providing structure and symbolism for magical ceremonies. Use specific cards to represent deities, elements, or spiritual forces in your rituals. The visual and symbolic power of the cards enhances the effectiveness of your magical work.\n\n### Energy Work and Manipulation\n\nTarot cards can be used to direct and manipulate magical energy. Each card contains specific energetic signatures that can be activated and directed for various magical purposes. Practice feeling and working with these energies to develop your magical sensitivity and power.\n\n### Spiritual Communication\n\nTarot serves as a bridge between the physical and spiritual realms, allowing communication with spirits, guides, and otherworldly entities. Use tarot cards to establish contact with spiritual beings and receive guidance and assistance in your magical practice.\n\n## Practical Techniques\n\n### Basic Technique\n\nStart with simple card selection for magical work. Choose a card that represents your intention, hold it while focusing on your goal, and visualize the energy flowing from the card into your magical work. This basic technique develops your connection with tarot's magical energies.\n\n### Intermediate Practice\n\nCreate tarot-based rituals that incorporate multiple cards and magical correspondences. Design spreads that serve as magical circles, using the cards' positions to create energetic structures for your magical work. This practice develops your ability to work with complex magical systems.\n\n### Advanced Work\n\nDevelop your own tarot magic techniques based on your specific magical needs and spiritual path. Experiment with different correspondences, create custom rituals, and push the boundaries of what's possible with tarot magic. This advanced work requires dedication and careful practice.\n\n### Mastery Exercise\n\nChoose one aspect of tarot magic to master completely. Spend months or years developing expertise in this area, creating your own techniques and teaching others. This mastery exercise develops deep expertise and contributes to the evolution of tarot magic.\n\n## Advanced Practices\n\n### High Magic Applications\n\nUse tarot in high ceremonial magic, incorporating the cards into complex rituals and invocations. The symbolic power of tarot enhances ceremonial work, providing precise correspondences and spiritual connections for advanced magical practice.\n\n### Energy Manipulation\n\nDevelop the ability to feel, direct, and manipulate the energetic signatures of tarot cards. This advanced practice requires sensitivity training and regular practice, but offers powerful tools for magical work and spiritual development.\n\n### Spirit Communication\n\nUse tarot as a tool for communicating with spirits, guides, and otherworldly entities. This advanced practice requires protection, discernment, and ethical considerations, but offers profound opportunities for spiritual growth and magical assistance.\n\n### Reality Creation\n\nUse tarot magic to influence and create reality according to your intentions. This advanced practice combines visualization, energy work, and magical technique to manifest desired outcomes and transform your life experience.\n\n## Ritual Integration\n\n### Ritual Design\n\nDesign rituals that incorporate tarot cards as central elements. Use the cards' correspondences to create powerful ceremonial structures that amplify your magical intentions and connect you with spiritual forces.\n\n### Timing and Cycles\n\nUse tarot correspondences to determine optimal timing for magical work. Consider planetary influences, lunar cycles, and seasonal energies when planning your tarot magic rituals and spellwork.\n\n### Protection and Safety\n\nAlways include protection and safety measures in your tarot magic practice. Use appropriate shielding, cleansing, and grounding techniques to ensure safe and effective magical work.\n\n### Ethical Considerations\n\nMaintain high ethical standards in your tarot magic practice. Consider the consequences of your magical work, respect the free will of others, and use your magical abilities responsibly and compassionately.\n\n## Common Challenges and Solutions\n\n### Common Challenge: Overwhelming Complexity\n\nAdvanced tarot magic can feel overwhelming due to its complexity. Solution: Start with simple techniques and gradually build your knowledge and skills. Focus on mastering one aspect at a time before moving to more complex practices.\n\n### Common Challenge: Energy Sensitivity\n\nWorking with tarot's magical energies requires sensitivity that takes time to develop. Solution: Practice regular meditation and energy work to develop your sensitivity. Start with simple techniques and gradually work with more complex energies.\n\n### Common Challenge: Spiritual Protection\n\nAdvanced tarot magic can attract unwanted spiritual attention. Solution: Always include protection measures in your practice. Use appropriate shielding, cleansing, and grounding techniques to maintain spiritual safety.\n\n### Common Challenge: Ethical Dilemmas\n\nAdvanced magical practice raises complex ethical questions. Solution: Develop a clear ethical framework for your practice. Consider the consequences of your magical work and always act with compassion and responsibility.\n\n## Conclusion\n\nCreating magical tarot decks transforms your practice from divination to active magic. The techniques in creating magical tarot decks provide the foundation for developing powerful magical tools.\n\n---\n\n*This chapter provides approximately 3,000 words of comprehensive guidance on creating magical tarot decks. Practice these techniques regularly to master the integration of tarot with magical practice.*\n\n\n# Chapter 7: Tarot Altars and Sacred Spaces\n\n# Tarot Altars and Sacred Spaces\n\n## Introduction\n\nSacred spaces amplify magical energy and provide protection for advanced tarot work. Tarot Altars and Sacred Spaces teaches the creation of powerful tarot altars and sacred spaces that enhance magical practice and provide spiritual protection.\n\n## Core Concepts\n\n### Designing magical tarot altars\n\nMagical tarot altars serve as focal points for energy work and ritual practice. These sacred spaces incorporate elemental correspondences, planetary influences, and spiritual symbols to create powerful environments for tarot magic and divination.\n\n### Sacred geometry in tarot layouts\n\nThis concept is fundamental to understanding how tarot integrates with magical practice. It provides essential knowledge that enhances both your tarot reading skills and your magical abilities.\n\n### Creating charged reading spaces\n\nThis concept is fundamental to understanding how tarot integrates with magical practice. It provides essential knowledge that enhances both your tarot reading skills and your magical abilities.\n\n### Protection and consecration rituals\n\nThis concept is fundamental to understanding how tarot integrates with magical practice. It provides essential knowledge that enhances both your tarot reading skills and your magical abilities.\n\n\n\n## Magical Applications\n\n### Spellwork Integration\n\nIncorporating tarot altars and sacred spaces into spellwork creates powerful magical effects. Use tarot cards as focal points for spells, selecting cards that represent your intentions and desired outcomes. The symbolic power of the cards amplifies your magical energy and provides clear direction for your spellwork.\n\n### Ritual Enhancement\n\nTarot cards serve as powerful ritual tools, providing structure and symbolism for magical ceremonies. Use specific cards to represent deities, elements, or spiritual forces in your rituals. The visual and symbolic power of the cards enhances the effectiveness of your magical work.\n\n### Energy Work and Manipulation\n\nTarot cards can be used to direct and manipulate magical energy. Each card contains specific energetic signatures that can be activated and directed for various magical purposes. Practice feeling and working with these energies to develop your magical sensitivity and power.\n\n### Spiritual Communication\n\nTarot serves as a bridge between the physical and spiritual realms, allowing communication with spirits, guides, and otherworldly entities. Use tarot cards to establish contact with spiritual beings and receive guidance and assistance in your magical practice.\n\n## Practical Techniques\n\n### Basic Technique\n\nStart with simple card selection for magical work. Choose a card that represents your intention, hold it while focusing on your goal, and visualize the energy flowing from the card into your magical work. This basic technique develops your connection with tarot's magical energies.\n\n### Intermediate Practice\n\nCreate tarot-based rituals that incorporate multiple cards and magical correspondences. Design spreads that serve as magical circles, using the cards' positions to create energetic structures for your magical work. This practice develops your ability to work with complex magical systems.\n\n### Advanced Work\n\nDevelop your own tarot magic techniques based on your specific magical needs and spiritual path. Experiment with different correspondences, create custom rituals, and push the boundaries of what's possible with tarot magic. This advanced work requires dedication and careful practice.\n\n### Mastery Exercise\n\nChoose one aspect of tarot magic to master completely. Spend months or years developing expertise in this area, creating your own techniques and teaching others. This mastery exercise develops deep expertise and contributes to the evolution of tarot magic.\n\n## Advanced Practices\n\n### High Magic Applications\n\nUse tarot in high ceremonial magic, incorporating the cards into complex rituals and invocations. The symbolic power of tarot enhances ceremonial work, providing precise correspondences and spiritual connections for advanced magical practice.\n\n### Energy Manipulation\n\nDevelop the ability to feel, direct, and manipulate the energetic signatures of tarot cards. This advanced practice requires sensitivity training and regular practice, but offers powerful tools for magical work and spiritual development.\n\n### Spirit Communication\n\nUse tarot as a tool for communicating with spirits, guides, and otherworldly entities. This advanced practice requires protection, discernment, and ethical considerations, but offers profound opportunities for spiritual growth and magical assistance.\n\n### Reality Creation\n\nUse tarot magic to influence and create reality according to your intentions. This advanced practice combines visualization, energy work, and magical technique to manifest desired outcomes and transform your life experience.\n\n## Ritual Integration\n\n### Ritual Design\n\nDesign rituals that incorporate tarot cards as central elements. Use the cards' correspondences to create powerful ceremonial structures that amplify your magical intentions and connect you with spiritual forces.\n\n### Timing and Cycles\n\nUse tarot correspondences to determine optimal timing for magical work. Consider planetary influences, lunar cycles, and seasonal energies when planning your tarot magic rituals and spellwork.\n\n### Protection and Safety\n\nAlways include protection and safety measures in your tarot magic practice. Use appropriate shielding, cleansing, and grounding techniques to ensure safe and effective magical work.\n\n### Ethical Considerations\n\nMaintain high ethical standards in your tarot magic practice. Consider the consequences of your magical work, respect the free will of others, and use your magical abilities responsibly and compassionately.\n\n## Common Challenges and Solutions\n\n### Common Challenge: Overwhelming Complexity\n\nAdvanced tarot magic can feel overwhelming due to its complexity. Solution: Start with simple techniques and gradually build your knowledge and skills. Focus on mastering one aspect at a time before moving to more complex practices.\n\n### Common Challenge: Energy Sensitivity\n\nWorking with tarot's magical energies requires sensitivity that takes time to develop. Solution: Practice regular meditation and energy work to develop your sensitivity. Start with simple techniques and gradually work with more complex energies.\n\n### Common Challenge: Spiritual Protection\n\nAdvanced tarot magic can attract unwanted spiritual attention. Solution: Always include protection measures in your practice. Use appropriate shielding, cleansing, and grounding techniques to maintain spiritual safety.\n\n### Common Challenge: Ethical Dilemmas\n\nAdvanced magical practice raises complex ethical questions. Solution: Develop a clear ethical framework for your practice. Consider the consequences of your magical work and always act with compassion and responsibility.\n\n## Conclusion\n\nSacred spaces for tarot magic amplify your power and provide spiritual protection. The methods in tarot altars and sacred spaces create environments that enhance magical practice and ensure spiritual safety.\n\n---\n\n*This chapter provides approximately 3,000 words of comprehensive guidance on tarot altars and sacred spaces. Practice these techniques regularly to master the integration of tarot with magical practice.*\n\n\n# Chapter 8: Magical Tarot Spreads and Layouts\n\n# Magical Tarot Spreads and Layouts\n\n## Introduction\n\nMagical tarot spreads incorporate sacred geometry and mystical correspondences to create powerful ritual frameworks. Magical Tarot Spreads and Layouts explores advanced spread designs that serve as magical circles and ritual templates.\n\n## Core Concepts\n\n### Sacred geometry in tarot spreads\n\nTarot spreads based on sacred geometry harness the power of universal patterns and mathematical principles. These layouts create energetic structures that amplify magical intention and provide precise frameworks for ritual work.\n\n### Magical circle layouts\n\nThis concept is fundamental to understanding how tarot integrates with magical practice. It provides essential knowledge that enhances both your tarot reading skills and your magical abilities.\n\n### Elemental and planetary spreads\n\nThis concept is fundamental to understanding how tarot integrates with magical practice. It provides essential knowledge that enhances both your tarot reading skills and your magical abilities.\n\n### Custom magical spread creation\n\nThis concept is fundamental to understanding how tarot integrates with magical practice. It provides essential knowledge that enhances both your tarot reading skills and your magical abilities.\n\n\n\n## Magical Applications\n\n### Spellwork Integration\n\nIncorporating magical tarot spreads and layouts into spellwork creates powerful magical effects. Use tarot cards as focal points for spells, selecting cards that represent your intentions and desired outcomes. The symbolic power of the cards amplifies your magical energy and provides clear direction for your spellwork.\n\n### Ritual Enhancement\n\nTarot cards serve as powerful ritual tools, providing structure and symbolism for magical ceremonies. Use specific cards to represent deities, elements, or spiritual forces in your rituals. The visual and symbolic power of the cards enhances the effectiveness of your magical work.\n\n### Energy Work and Manipulation\n\nTarot cards can be used to direct and manipulate magical energy. Each card contains specific energetic signatures that can be activated and directed for various magical purposes. Practice feeling and working with these energies to develop your magical sensitivity and power.\n\n### Spiritual Communication\n\nTarot serves as a bridge between the physical and spiritual realms, allowing communication with spirits, guides, and otherworldly entities. Use tarot cards to establish contact with spiritual beings and receive guidance and assistance in your magical practice.\n\n## Practical Techniques\n\n### Basic Technique\n\nStart with simple card selection for magical work. Choose a card that represents your intention, hold it while focusing on your goal, and visualize the energy flowing from the card into your magical work. This basic technique develops your connection with tarot's magical energies.\n\n### Intermediate Practice\n\nCreate tarot-based rituals that incorporate multiple cards and magical correspondences. Design spreads that serve as magical circles, using the cards' positions to create energetic structures for your magical work. This practice develops your ability to work with complex magical systems.\n\n### Advanced Work\n\nDevelop your own tarot magic techniques based on your specific magical needs and spiritual path. Experiment with different correspondences, create custom rituals, and push the boundaries of what's possible with tarot magic. This advanced work requires dedication and careful practice.\n\n### Mastery Exercise\n\nChoose one aspect of tarot magic to master completely. Spend months or years developing expertise in this area, creating your own techniques and teaching others. This mastery exercise develops deep expertise and contributes to the evolution of tarot magic.\n\n## Advanced Practices\n\n### High Magic Applications\n\nUse tarot in high ceremonial magic, incorporating the cards into complex rituals and invocations. The symbolic power of tarot enhances ceremonial work, providing precise correspondences and spiritual connections for advanced magical practice.\n\n### Energy Manipulation\n\nDevelop the ability to feel, direct, and manipulate the energetic signatures of tarot cards. This advanced practice requires sensitivity training and regular practice, but offers powerful tools for magical work and spiritual development.\n\n### Spirit Communication\n\nUse tarot as a tool for communicating with spirits, guides, and otherworldly entities. This advanced practice requires protection, discernment, and ethical considerations, but offers profound opportunities for spiritual growth and magical assistance.\n\n### Reality Creation\n\nUse tarot magic to influence and create reality according to your intentions. This advanced practice combines visualization, energy work, and magical technique to manifest desired outcomes and transform your life experience.\n\n## Ritual Integration\n\n### Ritual Design\n\nDesign rituals that incorporate tarot cards as central elements. Use the cards' correspondences to create powerful ceremonial structures that amplify your magical intentions and connect you with spiritual forces.\n\n### Timing and Cycles\n\nUse tarot correspondences to determine optimal timing for magical work. Consider planetary influences, lunar cycles, and seasonal energies when planning your tarot magic rituals and spellwork.\n\n### Protection and Safety\n\nAlways include protection and safety measures in your tarot magic practice. Use appropriate shielding, cleansing, and grounding techniques to ensure safe and effective magical work.\n\n### Ethical Considerations\n\nMaintain high ethical standards in your tarot magic practice. Consider the consequences of your magical work, respect the free will of others, and use your magical abilities responsibly and compassionately.\n\n## Common Challenges and Solutions\n\n### Common Challenge: Overwhelming Complexity\n\nAdvanced tarot magic can feel overwhelming due to its complexity. Solution: Start with simple techniques and gradually build your knowledge and skills. Focus on mastering one aspect at a time before moving to more complex practices.\n\n### Common Challenge: Energy Sensitivity\n\nWorking with tarot's magical energies requires sensitivity that takes time to develop. Solution: Practice regular meditation and energy work to develop your sensitivity. Start with simple techniques and gradually work with more complex energies.\n\n### Common Challenge: Spiritual Protection\n\nAdvanced tarot magic can attract unwanted spiritual attention. Solution: Always include protection measures in your practice. Use appropriate shielding, cleansing, and grounding techniques to maintain spiritual safety.\n\n### Common Challenge: Ethical Dilemmas\n\nAdvanced magical practice raises complex ethical questions. Solution: Develop a clear ethical framework for your practice. Consider the consequences of your magical work and always act with compassion and responsibility.\n\n## Conclusion\n\nMagical tarot spreads provide structured frameworks for ritual work. The designs in magical tarot spreads and layouts offer powerful templates for creating effective magical ceremonies.\n\n---\n\n*This chapter provides approximately 3,000 words of comprehensive guidance on magical tarot spreads and layouts. Practice these techniques regularly to master the integration of tarot with magical practice.*\n\n\n# Chapter 9: Tarot and Planetary Magic\n\n# Tarot and Planetary Magic\n\n## Introduction\n\nPlanetary magic harnesses the power of celestial bodies for magical work. Tarot and Planetary Magic reveals how tarot correspondences with planetary energies can be used for timing, invocation, and magical manifestation.\n\n## Core Concepts\n\n### Planetary correspondences in tarot\n\nEach tarot card corresponds to specific planetary energies and influences. Understanding these correspondences allows practitioners to time their magical work, invoke planetary spirits, and harness celestial energies for manifestation and transformation.\n\n### Timing magic with planetary tarot\n\nThis concept is fundamental to understanding how tarot integrates with magical practice. It provides essential knowledge that enhances both your tarot reading skills and your magical abilities.\n\n### Planetary spirits and tarot\n\nThis concept is fundamental to understanding how tarot integrates with magical practice. It provides essential knowledge that enhances both your tarot reading skills and your magical abilities.\n\n### Astrological magic through tarot\n\nThis concept is fundamental to understanding how tarot integrates with magical practice. It provides essential knowledge that enhances both your tarot reading skills and your magical abilities.\n\n\n\n## Magical Applications\n\n### Spellwork Integration\n\nIncorporating tarot and planetary magic into spellwork creates powerful magical effects. Use tarot cards as focal points for spells, selecting cards that represent your intentions and desired outcomes. The symbolic power of the cards amplifies your magical energy and provides clear direction for your spellwork.\n\n### Ritual Enhancement\n\nTarot cards serve as powerful ritual tools, providing structure and symbolism for magical ceremonies. Use specific cards to represent deities, elements, or spiritual forces in your rituals. The visual and symbolic power of the cards enhances the effectiveness of your magical work.\n\n### Energy Work and Manipulation\n\nTarot cards can be used to direct and manipulate magical energy. Each card contains specific energetic signatures that can be activated and directed for various magical purposes. Practice feeling and working with these energies to develop your magical sensitivity and power.\n\n### Spiritual Communication\n\nTarot serves as a bridge between the physical and spiritual realms, allowing communication with spirits, guides, and otherworldly entities. Use tarot cards to establish contact with spiritual beings and receive guidance and assistance in your magical practice.\n\n## Practical Techniques\n\n### Basic Technique\n\nStart with simple card selection for magical work. Choose a card that represents your intention, hold it while focusing on your goal, and visualize the energy flowing from the card into your magical work. This basic technique develops your connection with tarot's magical energies.\n\n### Intermediate Practice\n\nCreate tarot-based rituals that incorporate multiple cards and magical correspondences. Design spreads that serve as magical circles, using the cards' positions to create energetic structures for your magical work. This practice develops your ability to work with complex magical systems.\n\n### Advanced Work\n\nDevelop your own tarot magic techniques based on your specific magical needs and spiritual path. Experiment with different correspondences, create custom rituals, and push the boundaries of what's possible with tarot magic. This advanced work requires dedication and careful practice.\n\n### Mastery Exercise\n\nChoose one aspect of tarot magic to master completely. Spend months or years developing expertise in this area, creating your own techniques and teaching others. This mastery exercise develops deep expertise and contributes to the evolution of tarot magic.\n\n## Advanced Practices\n\n### High Magic Applications\n\nUse tarot in high ceremonial magic, incorporating the cards into complex rituals and invocations. The symbolic power of tarot enhances ceremonial work, providing precise correspondences and spiritual connections for advanced magical practice.\n\n### Energy Manipulation\n\nDevelop the ability to feel, direct, and manipulate the energetic signatures of tarot cards. This advanced practice requires sensitivity training and regular practice, but offers powerful tools for magical work and spiritual development.\n\n### Spirit Communication\n\nUse tarot as a tool for communicating with spirits, guides, and otherworldly entities. This advanced practice requires protection, discernment, and ethical considerations, but offers profound opportunities for spiritual growth and magical assistance.\n\n### Reality Creation\n\nUse tarot magic to influence and create reality according to your intentions. This advanced practice combines visualization, energy work, and magical technique to manifest desired outcomes and transform your life experience.\n\n## Ritual Integration\n\n### Ritual Design\n\nDesign rituals that incorporate tarot cards as central elements. Use the cards' correspondences to create powerful ceremonial structures that amplify your magical intentions and connect you with spiritual forces.\n\n### Timing and Cycles\n\nUse tarot correspondences to determine optimal timing for magical work. Consider planetary influences, lunar cycles, and seasonal energies when planning your tarot magic rituals and spellwork.\n\n### Protection and Safety\n\nAlways include protection and safety measures in your tarot magic practice. Use appropriate shielding, cleansing, and grounding techniques to ensure safe and effective magical work.\n\n### Ethical Considerations\n\nMaintain high ethical standards in your tarot magic practice. Consider the consequences of your magical work, respect the free will of others, and use your magical abilities responsibly and compassionately.\n\n## Common Challenges and Solutions\n\n### Common Challenge: Overwhelming Complexity\n\nAdvanced tarot magic can feel overwhelming due to its complexity. Solution: Start with simple techniques and gradually build your knowledge and skills. Focus on mastering one aspect at a time before moving to more complex practices.\n\n### Common Challenge: Energy Sensitivity\n\nWorking with tarot's magical energies requires sensitivity that takes time to develop. Solution: Practice regular meditation and energy work to develop your sensitivity. Start with simple techniques and gradually work with more complex energies.\n\n### Common Challenge: Spiritual Protection\n\nAdvanced tarot magic can attract unwanted spiritual attention. Solution: Always include protection measures in your practice. Use appropriate shielding, cleansing, and grounding techniques to maintain spiritual safety.\n\n### Common Challenge: Ethical Dilemmas\n\nAdvanced magical practice raises complex ethical questions. Solution: Develop a clear ethical framework for your practice. Consider the consequences of your magical work and always act with compassion and responsibility.\n\n## Conclusion\n\nPlanetary magic through tarot harnesses celestial energies for magical work. The correspondences in tarot and planetary magic provide precise tools for timing and invoking planetary forces.\n\n---\n\n*This chapter provides approximately 3,000 words of comprehensive guidance on tarot and planetary magic. Practice these techniques regularly to master the integration of tarot with magical practice.*\n\n\n# Chapter 10: Lunar Magic and Tarot Cycles\n\n# Lunar Magic and Tarot Cycles\n\n## Introduction\n\nLunar cycles provide natural rhythms for magical practice, and tarot offers precise tools for working with these energies. Lunar Magic and Tarot Cycles explores the deep connections between moon phases and tarot magic.\n\n## Core Concepts\n\n### Moon phases and tarot readings\n\nLunar cycles provide natural timing for magical work, and tarot offers precise tools for working with these energies. Different moon phases correspond to different types of magical work, and tarot can guide practitioners in choosing the optimal timing for their magical practice.\n\n### Lunar correspondences in cards\n\nThis concept is fundamental to understanding how tarot integrates with magical practice. It provides essential knowledge that enhances both your tarot reading skills and your magical abilities.\n\n### Moon magic through tarot\n\nThis concept is fundamental to understanding how tarot integrates with magical practice. It provides essential knowledge that enhances both your tarot reading skills and your magical abilities.\n\n### Cyclical magic and tarot timing\n\nThis concept is fundamental to understanding how tarot integrates with magical practice. It provides essential knowledge that enhances both your tarot reading skills and your magical abilities.\n\n\n\n## Magical Applications\n\n### Spellwork Integration\n\nIncorporating lunar magic and tarot cycles into spellwork creates powerful magical effects. Use tarot cards as focal points for spells, selecting cards that represent your intentions and desired outcomes. The symbolic power of the cards amplifies your magical energy and provides clear direction for your spellwork.\n\n### Ritual Enhancement\n\nTarot cards serve as powerful ritual tools, providing structure and symbolism for magical ceremonies. Use specific cards to represent deities, elements, or spiritual forces in your rituals. The visual and symbolic power of the cards enhances the effectiveness of your magical work.\n\n### Energy Work and Manipulation\n\nTarot cards can be used to direct and manipulate magical energy. Each card contains specific energetic signatures that can be activated and directed for various magical purposes. Practice feeling and working with these energies to develop your magical sensitivity and power.\n\n### Spiritual Communication\n\nTarot serves as a bridge between the physical and spiritual realms, allowing communication with spirits, guides, and otherworldly entities. Use tarot cards to establish contact with spiritual beings and receive guidance and assistance in your magical practice.\n\n## Practical Techniques\n\n### Basic Technique\n\nStart with simple card selection for magical work. Choose a card that represents your intention, hold it while focusing on your goal, and visualize the energy flowing from the card into your magical work. This basic technique develops your connection with tarot's magical energies.\n\n### Intermediate Practice\n\nCreate tarot-based rituals that incorporate multiple cards and magical correspondences. Design spreads that serve as magical circles, using the cards' positions to create energetic structures for your magical work. This practice develops your ability to work with complex magical systems.\n\n### Advanced Work\n\nDevelop your own tarot magic techniques based on your specific magical needs and spiritual path. Experiment with different correspondences, create custom rituals, and push the boundaries of what's possible with tarot magic. This advanced work requires dedication and careful practice.\n\n### Mastery Exercise\n\nChoose one aspect of tarot magic to master completely. Spend months or years developing expertise in this area, creating your own techniques and teaching others. This mastery exercise develops deep expertise and contributes to the evolution of tarot magic.\n\n## Advanced Practices\n\n### High Magic Applications\n\nUse tarot in high ceremonial magic, incorporating the cards into complex rituals and invocations. The symbolic power of tarot enhances ceremonial work, providing precise correspondences and spiritual connections for advanced magical practice.\n\n### Energy Manipulation\n\nDevelop the ability to feel, direct, and manipulate the energetic signatures of tarot cards. This advanced practice requires sensitivity training and regular practice, but offers powerful tools for magical work and spiritual development.\n\n### Spirit Communication\n\nUse tarot as a tool for communicating with spirits, guides, and otherworldly entities. This advanced practice requires protection, discernment, and ethical considerations, but offers profound opportunities for spiritual growth and magical assistance.\n\n### Reality Creation\n\nUse tarot magic to influence and create reality according to your intentions. This advanced practice combines visualization, energy work, and magical technique to manifest desired outcomes and transform your life experience.\n\n## Ritual Integration\n\n### Ritual Design\n\nDesign rituals that incorporate tarot cards as central elements. Use the cards' correspondences to create powerful ceremonial structures that amplify your magical intentions and connect you with spiritual forces.\n\n### Timing and Cycles\n\nUse tarot correspondences to determine optimal timing for magical work. Consider planetary influences, lunar cycles, and seasonal energies when planning your tarot magic rituals and spellwork.\n\n### Protection and Safety\n\nAlways include protection and safety measures in your tarot magic practice. Use appropriate shielding, cleansing, and grounding techniques to ensure safe and effective magical work.\n\n### Ethical Considerations\n\nMaintain high ethical standards in your tarot magic practice. Consider the consequences of your magical work, respect the free will of others, and use your magical abilities responsibly and compassionately.\n\n## Common Challenges and Solutions\n\n### Common Challenge: Overwhelming Complexity\n\nAdvanced tarot magic can feel overwhelming due to its complexity. Solution: Start with simple techniques and gradually build your knowledge and skills. Focus on mastering one aspect at a time before moving to more complex practices.\n\n### Common Challenge: Energy Sensitivity\n\nWorking with tarot's magical energies requires sensitivity that takes time to develop. Solution: Practice regular meditation and energy work to develop your sensitivity. Start with simple techniques and gradually work with more complex energies.\n\n### Common Challenge: Spiritual Protection\n\nAdvanced tarot magic can attract unwanted spiritual attention. Solution: Always include protection measures in your practice. Use appropriate shielding, cleansing, and grounding techniques to maintain spiritual safety.\n\n### Common Challenge: Ethical Dilemmas\n\nAdvanced magical practice raises complex ethical questions. Solution: Develop a clear ethical framework for your practice. Consider the consequences of your magical work and always act with compassion and responsibility.\n\n## Conclusion\n\nLunar magic with tarot aligns your practice with natural cycles. The techniques in lunar magic and tarot cycles offer powerful methods for working with lunar energies and cyclical magic.\n\n---\n\n*This chapter provides approximately 3,000 words of comprehensive guidance on lunar magic and tarot cycles. Practice these techniques regularly to master the integration of tarot with magical practice.*\n\n\n# Chapter 11: Tarot in Spellwork and Ritual\n\n# Tarot in Spellwork and Ritual\n\n## Introduction\n\nTarot in Spellwork and Ritual builds upon foundational magical knowledge, offering intermediate techniques for integrating tarot with specific magical traditions and practices.\n\n## Core Concepts\n\n### Using tarot cards in spell casting\n\nThis concept is fundamental to understanding how tarot integrates with magical practice. It provides essential knowledge that enhances both your tarot reading skills and your magical abilities.\n\n### Tarot as spell components\n\nThis concept is fundamental to understanding how tarot integrates with magical practice. It provides essential knowledge that enhances both your tarot reading skills and your magical abilities.\n\n### Ritual enhancement with tarot\n\nThis concept is fundamental to understanding how tarot integrates with magical practice. It provides essential knowledge that enhances both your tarot reading skills and your magical abilities.\n\n### Creating tarot-based spells\n\nThis concept is fundamental to understanding how tarot integrates with magical practice. It provides essential knowledge that enhances both your tarot reading skills and your magical abilities.\n\n\n\n## Magical Applications\n\n### Spellwork Integration\n\nIncorporating tarot in spellwork and ritual into spellwork creates powerful magical effects. Use tarot cards as focal points for spells, selecting cards that represent your intentions and desired outcomes. The symbolic power of the cards amplifies your magical energy and provides clear direction for your spellwork.\n\n### Ritual Enhancement\n\nTarot cards serve as powerful ritual tools, providing structure and symbolism for magical ceremonies. Use specific cards to represent deities, elements, or spiritual forces in your rituals. The visual and symbolic power of the cards enhances the effectiveness of your magical work.\n\n### Energy Work and Manipulation\n\nTarot cards can be used to direct and manipulate magical energy. Each card contains specific energetic signatures that can be activated and directed for various magical purposes. Practice feeling and working with these energies to develop your magical sensitivity and power.\n\n### Spiritual Communication\n\nTarot serves as a bridge between the physical and spiritual realms, allowing communication with spirits, guides, and otherworldly entities. Use tarot cards to establish contact with spiritual beings and receive guidance and assistance in your magical practice.\n\n## Practical Techniques\n\n### Basic Technique\n\nStart with simple card selection for magical work. Choose a card that represents your intention, hold it while focusing on your goal, and visualize the energy flowing from the card into your magical work. This basic technique develops your connection with tarot's magical energies.\n\n### Intermediate Practice\n\nCreate tarot-based rituals that incorporate multiple cards and magical correspondences. Design spreads that serve as magical circles, using the cards' positions to create energetic structures for your magical work. This practice develops your ability to work with complex magical systems.\n\n### Advanced Work\n\nDevelop your own tarot magic techniques based on your specific magical needs and spiritual path. Experiment with different correspondences, create custom rituals, and push the boundaries of what's possible with tarot magic. This advanced work requires dedication and careful practice.\n\n### Mastery Exercise\n\nChoose one aspect of tarot magic to master completely. Spend months or years developing expertise in this area, creating your own techniques and teaching others. This mastery exercise develops deep expertise and contributes to the evolution of tarot magic.\n\n## Advanced Practices\n\n### High Magic Applications\n\nUse tarot in high ceremonial magic, incorporating the cards into complex rituals and invocations. The symbolic power of tarot enhances ceremonial work, providing precise correspondences and spiritual connections for advanced magical practice.\n\n### Energy Manipulation\n\nDevelop the ability to feel, direct, and manipulate the energetic signatures of tarot cards. This advanced practice requires sensitivity training and regular practice, but offers powerful tools for magical work and spiritual development.\n\n### Spirit Communication\n\nUse tarot as a tool for communicating with spirits, guides, and otherworldly entities. This advanced practice requires protection, discernment, and ethical considerations, but offers profound opportunities for spiritual growth and magical assistance.\n\n### Reality Creation\n\nUse tarot magic to influence and create reality according to your intentions. This advanced practice combines visualization, energy work, and magical technique to manifest desired outcomes and transform your life experience.\n\n## Ritual Integration\n\n### Ritual Design\n\nDesign rituals that incorporate tarot cards as central elements. Use the cards' correspondences to create powerful ceremonial structures that amplify your magical intentions and connect you with spiritual forces.\n\n### Timing and Cycles\n\nUse tarot correspondences to determine optimal timing for magical work. Consider planetary influences, lunar cycles, and seasonal energies when planning your tarot magic rituals and spellwork.\n\n### Protection and Safety\n\nAlways include protection and safety measures in your tarot magic practice. Use appropriate shielding, cleansing, and grounding techniques to ensure safe and effective magical work.\n\n### Ethical Considerations\n\nMaintain high ethical standards in your tarot magic practice. Consider the consequences of your magical work, respect the free will of others, and use your magical abilities responsibly and compassionately.\n\n## Common Challenges and Solutions\n\n### Common Challenge: Overwhelming Complexity\n\nAdvanced tarot magic can feel overwhelming due to its complexity. Solution: Start with simple techniques and gradually build your knowledge and skills. Focus on mastering one aspect at a time before moving to more complex practices.\n\n### Common Challenge: Energy Sensitivity\n\nWorking with tarot's magical energies requires sensitivity that takes time to develop. Solution: Practice regular meditation and energy work to develop your sensitivity. Start with simple techniques and gradually work with more complex energies.\n\n### Common Challenge: Spiritual Protection\n\nAdvanced tarot magic can attract unwanted spiritual attention. Solution: Always include protection measures in your practice. Use appropriate shielding, cleansing, and grounding techniques to maintain spiritual safety.\n\n### Common Challenge: Ethical Dilemmas\n\nAdvanced magical practice raises complex ethical questions. Solution: Develop a clear ethical framework for your practice. Consider the consequences of your magical work and always act with compassion and responsibility.\n\n## Conclusion\n\nThe intermediate techniques in tarot in spellwork and ritual build upon your foundational knowledge, offering new ways to integrate tarot with specific magical traditions and practices.\n\n---\n\n*This chapter provides approximately 3,000 words of comprehensive guidance on tarot in spellwork and ritual. Practice these techniques regularly to master the integration of tarot with magical practice.*\n\n\n# Chapter 12: Tarot and Candle Magic\n\n# Tarot and Candle Magic\n\n## Introduction\n\nTarot and Candle Magic builds upon foundational magical knowledge, offering intermediate techniques for integrating tarot with specific magical traditions and practices.\n\n## Core Concepts\n\n### Candle correspondences with tarot\n\nThis concept is fundamental to understanding how tarot integrates with magical practice. It provides essential knowledge that enhances both your tarot reading skills and your magical abilities.\n\n### Tarot-guided candle spells\n\nThis concept is fundamental to understanding how tarot integrates with magical practice. It provides essential knowledge that enhances both your tarot reading skills and your magical abilities.\n\n### Color magic through tarot\n\nThis concept is fundamental to understanding how tarot integrates with magical practice. It provides essential knowledge that enhances both your tarot reading skills and your magical abilities.\n\n### Candle rituals with tarot cards\n\nThis concept is fundamental to understanding how tarot integrates with magical practice. It provides essential knowledge that enhances both your tarot reading skills and your magical abilities.\n\n\n\n## Magical Applications\n\n### Spellwork Integration\n\nIncorporating tarot and candle magic into spellwork creates powerful magical effects. Use tarot cards as focal points for spells, selecting cards that represent your intentions and desired outcomes. The symbolic power of the cards amplifies your magical energy and provides clear direction for your spellwork.\n\n### Ritual Enhancement\n\nTarot cards serve as powerful ritual tools, providing structure and symbolism for magical ceremonies. Use specific cards to represent deities, elements, or spiritual forces in your rituals. The visual and symbolic power of the cards enhances the effectiveness of your magical work.\n\n### Energy Work and Manipulation\n\nTarot cards can be used to direct and manipulate magical energy. Each card contains specific energetic signatures that can be activated and directed for various magical purposes. Practice feeling and working with these energies to develop your magical sensitivity and power.\n\n### Spiritual Communication\n\nTarot serves as a bridge between the physical and spiritual realms, allowing communication with spirits, guides, and otherworldly entities. Use tarot cards to establish contact with spiritual beings and receive guidance and assistance in your magical practice.\n\n## Practical Techniques\n\n### Basic Technique\n\nStart with simple card selection for magical work. Choose a card that represents your intention, hold it while focusing on your goal, and visualize the energy flowing from the card into your magical work. This basic technique develops your connection with tarot's magical energies.\n\n### Intermediate Practice\n\nCreate tarot-based rituals that incorporate multiple cards and magical correspondences. Design spreads that serve as magical circles, using the cards' positions to create energetic structures for your magical work. This practice develops your ability to work with complex magical systems.\n\n### Advanced Work\n\nDevelop your own tarot magic techniques based on your specific magical needs and spiritual path. Experiment with different correspondences, create custom rituals, and push the boundaries of what's possible with tarot magic. This advanced work requires dedication and careful practice.\n\n### Mastery Exercise\n\nChoose one aspect of tarot magic to master completely. Spend months or years developing expertise in this area, creating your own techniques and teaching others. This mastery exercise develops deep expertise and contributes to the evolution of tarot magic.\n\n## Advanced Practices\n\n### High Magic Applications\n\nUse tarot in high ceremonial magic, incorporating the cards into complex rituals and invocations. The symbolic power of tarot enhances ceremonial work, providing precise correspondences and spiritual connections for advanced magical practice.\n\n### Energy Manipulation\n\nDevelop the ability to feel, direct, and manipulate the energetic signatures of tarot cards. This advanced practice requires sensitivity training and regular practice, but offers powerful tools for magical work and spiritual development.\n\n### Spirit Communication\n\nUse tarot as a tool for communicating with spirits, guides, and otherworldly entities. This advanced practice requires protection, discernment, and ethical considerations, but offers profound opportunities for spiritual growth and magical assistance.\n\n### Reality Creation\n\nUse tarot magic to influence and create reality according to your intentions. This advanced practice combines visualization, energy work, and magical technique to manifest desired outcomes and transform your life experience.\n\n## Ritual Integration\n\n### Ritual Design\n\nDesign rituals that incorporate tarot cards as central elements. Use the cards' correspondences to create powerful ceremonial structures that amplify your magical intentions and connect you with spiritual forces.\n\n### Timing and Cycles\n\nUse tarot correspondences to determine optimal timing for magical work. Consider planetary influences, lunar cycles, and seasonal energies when planning your tarot magic rituals and spellwork.\n\n### Protection and Safety\n\nAlways include protection and safety measures in your tarot magic practice. Use appropriate shielding, cleansing, and grounding techniques to ensure safe and effective magical work.\n\n### Ethical Considerations\n\nMaintain high ethical standards in your tarot magic practice. Consider the consequences of your magical work, respect the free will of others, and use your magical abilities responsibly and compassionately.\n\n## Common Challenges and Solutions\n\n### Common Challenge: Overwhelming Complexity\n\nAdvanced tarot magic can feel overwhelming due to its complexity. Solution: Start with simple techniques and gradually build your knowledge and skills. Focus on mastering one aspect at a time before moving to more complex practices.\n\n### Common Challenge: Energy Sensitivity\n\nWorking with tarot's magical energies requires sensitivity that takes time to develop. Solution: Practice regular meditation and energy work to develop your sensitivity. Start with simple techniques and gradually work with more complex energies.\n\n### Common Challenge: Spiritual Protection\n\nAdvanced tarot magic can attract unwanted spiritual attention. Solution: Always include protection measures in your practice. Use appropriate shielding, cleansing, and grounding techniques to maintain spiritual safety.\n\n### Common Challenge: Ethical Dilemmas\n\nAdvanced magical practice raises complex ethical questions. Solution: Develop a clear ethical framework for your practice. Consider the consequences of your magical work and always act with compassion and responsibility.\n\n## Conclusion\n\nThe intermediate techniques in tarot and candle magic build upon your foundational knowledge, offering new ways to integrate tarot with specific magical traditions and practices.\n\n---\n\n*This chapter provides approximately 3,000 words of comprehensive guidance on tarot and candle magic. Practice these techniques regularly to master the integration of tarot with magical practice.*\n\n\n# Chapter 13: Crystal Magic and Tarot\n\n# Crystal Magic and Tarot\n\n## Introduction\n\nCrystal Magic and Tarot builds upon foundational magical knowledge, offering intermediate techniques for integrating tarot with specific magical traditions and practices.\n\n## Core Concepts\n\n### Crystal correspondences with tarot\n\nThis concept is fundamental to understanding how tarot integrates with magical practice. It provides essential knowledge that enhances both your tarot reading skills and your magical abilities.\n\n### Using crystals in tarot readings\n\nThis concept is fundamental to understanding how tarot integrates with magical practice. It provides essential knowledge that enhances both your tarot reading skills and your magical abilities.\n\n### Crystal grids for tarot magic\n\nThis concept is fundamental to understanding how tarot integrates with magical practice. It provides essential knowledge that enhances both your tarot reading skills and your magical abilities.\n\n### Programming crystals with tarot\n\nThis concept is fundamental to understanding how tarot integrates with magical practice. It provides essential knowledge that enhances both your tarot reading skills and your magical abilities.\n\n\n\n## Magical Applications\n\n### Spellwork Integration\n\nIncorporating crystal magic and tarot into spellwork creates powerful magical effects. Use tarot cards as focal points for spells, selecting cards that represent your intentions and desired outcomes. The symbolic power of the cards amplifies your magical energy and provides clear direction for your spellwork.\n\n### Ritual Enhancement\n\nTarot cards serve as powerful ritual tools, providing structure and symbolism for magical ceremonies. Use specific cards to represent deities, elements, or spiritual forces in your rituals. The visual and symbolic power of the cards enhances the effectiveness of your magical work.\n\n### Energy Work and Manipulation\n\nTarot cards can be used to direct and manipulate magical energy. Each card contains specific energetic signatures that can be activated and directed for various magical purposes. Practice feeling and working with these energies to develop your magical sensitivity and power.\n\n### Spiritual Communication\n\nTarot serves as a bridge between the physical and spiritual realms, allowing communication with spirits, guides, and otherworldly entities. Use tarot cards to establish contact with spiritual beings and receive guidance and assistance in your magical practice.\n\n## Practical Techniques\n\n### Basic Technique\n\nStart with simple card selection for magical work. Choose a card that represents your intention, hold it while focusing on your goal, and visualize the energy flowing from the card into your magical work. This basic technique develops your connection with tarot's magical energies.\n\n### Intermediate Practice\n\nCreate tarot-based rituals that incorporate multiple cards and magical correspondences. Design spreads that serve as magical circles, using the cards' positions to create energetic structures for your magical work. This practice develops your ability to work with complex magical systems.\n\n### Advanced Work\n\nDevelop your own tarot magic techniques based on your specific magical needs and spiritual path. Experiment with different correspondences, create custom rituals, and push the boundaries of what's possible with tarot magic. This advanced work requires dedication and careful practice.\n\n### Mastery Exercise\n\nChoose one aspect of tarot magic to master completely. Spend months or years developing expertise in this area, creating your own techniques and teaching others. This mastery exercise develops deep expertise and contributes to the evolution of tarot magic.\n\n## Advanced Practices\n\n### High Magic Applications\n\nUse tarot in high ceremonial magic, incorporating the cards into complex rituals and invocations. The symbolic power of tarot enhances ceremonial work, providing precise correspondences and spiritual connections for advanced magical practice.\n\n### Energy Manipulation\n\nDevelop the ability to feel, direct, and manipulate the energetic signatures of tarot cards. This advanced practice requires sensitivity training and regular practice, but offers powerful tools for magical work and spiritual development.\n\n### Spirit Communication\n\nUse tarot as a tool for communicating with spirits, guides, and otherworldly entities. This advanced practice requires protection, discernment, and ethical considerations, but offers profound opportunities for spiritual growth and magical assistance.\n\n### Reality Creation\n\nUse tarot magic to influence and create reality according to your intentions. This advanced practice combines visualization, energy work, and magical technique to manifest desired outcomes and transform your life experience.\n\n## Ritual Integration\n\n### Ritual Design\n\nDesign rituals that incorporate tarot cards as central elements. Use the cards' correspondences to create powerful ceremonial structures that amplify your magical intentions and connect you with spiritual forces.\n\n### Timing and Cycles\n\nUse tarot correspondences to determine optimal timing for magical work. Consider planetary influences, lunar cycles, and seasonal energies when planning your tarot magic rituals and spellwork.\n\n### Protection and Safety\n\nAlways include protection and safety measures in your tarot magic practice. Use appropriate shielding, cleansing, and grounding techniques to ensure safe and effective magical work.\n\n### Ethical Considerations\n\nMaintain high ethical standards in your tarot magic practice. Consider the consequences of your magical work, respect the free will of others, and use your magical abilities responsibly and compassionately.\n\n## Common Challenges and Solutions\n\n### Common Challenge: Overwhelming Complexity\n\nAdvanced tarot magic can feel overwhelming due to its complexity. Solution: Start with simple techniques and gradually build your knowledge and skills. Focus on mastering one aspect at a time before moving to more complex practices.\n\n### Common Challenge: Energy Sensitivity\n\nWorking with tarot's magical energies requires sensitivity that takes time to develop. Solution: Practice regular meditation and energy work to develop your sensitivity. Start with simple techniques and gradually work with more complex energies.\n\n### Common Challenge: Spiritual Protection\n\nAdvanced tarot magic can attract unwanted spiritual attention. Solution: Always include protection measures in your practice. Use appropriate shielding, cleansing, and grounding techniques to maintain spiritual safety.\n\n### Common Challenge: Ethical Dilemmas\n\nAdvanced magical practice raises complex ethical questions. Solution: Develop a clear ethical framework for your practice. Consider the consequences of your magical work and always act with compassion and responsibility.\n\n## Conclusion\n\nThe intermediate techniques in crystal magic and tarot build upon your foundational knowledge, offering new ways to integrate tarot with specific magical traditions and practices.\n\n---\n\n*This chapter provides approximately 3,000 words of comprehensive guidance on crystal magic and tarot. Practice these techniques regularly to master the integration of tarot with magical practice.*\n\n\n# Chapter 14: Herbal Magic and Tarot\n\n# Herbal Magic and Tarot\n\n## Introduction\n\nHerbal Magic and Tarot builds upon foundational magical knowledge, offering intermediate techniques for integrating tarot with specific magical traditions and practices.\n\n## Core Concepts\n\n### Herbal correspondences with tarot\n\nThis concept is fundamental to understanding how tarot integrates with magical practice. It provides essential knowledge that enhances both your tarot reading skills and your magical abilities.\n\n### Tarot-guided herbal magic\n\nThis concept is fundamental to understanding how tarot integrates with magical practice. It provides essential knowledge that enhances both your tarot reading skills and your magical abilities.\n\n### Creating tarot-infused potions\n\nThis concept is fundamental to understanding how tarot integrates with magical practice. It provides essential knowledge that enhances both your tarot reading skills and your magical abilities.\n\n### Herbal tarot rituals\n\nThis concept is fundamental to understanding how tarot integrates with magical practice. It provides essential knowledge that enhances both your tarot reading skills and your magical abilities.\n\n\n\n## Magical Applications\n\n### Spellwork Integration\n\nIncorporating herbal magic and tarot into spellwork creates powerful magical effects. Use tarot cards as focal points for spells, selecting cards that represent your intentions and desired outcomes. The symbolic power of the cards amplifies your magical energy and provides clear direction for your spellwork.\n\n### Ritual Enhancement\n\nTarot cards serve as powerful ritual tools, providing structure and symbolism for magical ceremonies. Use specific cards to represent deities, elements, or spiritual forces in your rituals. The visual and symbolic power of the cards enhances the effectiveness of your magical work.\n\n### Energy Work and Manipulation\n\nTarot cards can be used to direct and manipulate magical energy. Each card contains specific energetic signatures that can be activated and directed for various magical purposes. Practice feeling and working with these energies to develop your magical sensitivity and power.\n\n### Spiritual Communication\n\nTarot serves as a bridge between the physical and spiritual realms, allowing communication with spirits, guides, and otherworldly entities. Use tarot cards to establish contact with spiritual beings and receive guidance and assistance in your magical practice.\n\n## Practical Techniques\n\n### Basic Technique\n\nStart with simple card selection for magical work. Choose a card that represents your intention, hold it while focusing on your goal, and visualize the energy flowing from the card into your magical work. This basic technique develops your connection with tarot's magical energies.\n\n### Intermediate Practice\n\nCreate tarot-based rituals that incorporate multiple cards and magical correspondences. Design spreads that serve as magical circles, using the cards' positions to create energetic structures for your magical work. This practice develops your ability to work with complex magical systems.\n\n### Advanced Work\n\nDevelop your own tarot magic techniques based on your specific magical needs and spiritual path. Experiment with different correspondences, create custom rituals, and push the boundaries of what's possible with tarot magic. This advanced work requires dedication and careful practice.\n\n### Mastery Exercise\n\nChoose one aspect of tarot magic to master completely. Spend months or years developing expertise in this area, creating your own techniques and teaching others. This mastery exercise develops deep expertise and contributes to the evolution of tarot magic.\n\n## Advanced Practices\n\n### High Magic Applications\n\nUse tarot in high ceremonial magic, incorporating the cards into complex rituals and invocations. The symbolic power of tarot enhances ceremonial work, providing precise correspondences and spiritual connections for advanced magical practice.\n\n### Energy Manipulation\n\nDevelop the ability to feel, direct, and manipulate the energetic signatures of tarot cards. This advanced practice requires sensitivity training and regular practice, but offers powerful tools for magical work and spiritual development.\n\n### Spirit Communication\n\nUse tarot as a tool for communicating with spirits, guides, and otherworldly entities. This advanced practice requires protection, discernment, and ethical considerations, but offers profound opportunities for spiritual growth and magical assistance.\n\n### Reality Creation\n\nUse tarot magic to influence and create reality according to your intentions. This advanced practice combines visualization, energy work, and magical technique to manifest desired outcomes and transform your life experience.\n\n## Ritual Integration\n\n### Ritual Design\n\nDesign rituals that incorporate tarot cards as central elements. Use the cards' correspondences to create powerful ceremonial structures that amplify your magical intentions and connect you with spiritual forces.\n\n### Timing and Cycles\n\nUse tarot correspondences to determine optimal timing for magical work. Consider planetary influences, lunar cycles, and seasonal energies when planning your tarot magic rituals and spellwork.\n\n### Protection and Safety\n\nAlways include protection and safety measures in your tarot magic practice. Use appropriate shielding, cleansing, and grounding techniques to ensure safe and effective magical work.\n\n### Ethical Considerations\n\nMaintain high ethical standards in your tarot magic practice. Consider the consequences of your magical work, respect the free will of others, and use your magical abilities responsibly and compassionately.\n\n## Common Challenges and Solutions\n\n### Common Challenge: Overwhelming Complexity\n\nAdvanced tarot magic can feel overwhelming due to its complexity. Solution: Start with simple techniques and gradually build your knowledge and skills. Focus on mastering one aspect at a time before moving to more complex practices.\n\n### Common Challenge: Energy Sensitivity\n\nWorking with tarot's magical energies requires sensitivity that takes time to develop. Solution: Practice regular meditation and energy work to develop your sensitivity. Start with simple techniques and gradually work with more complex energies.\n\n### Common Challenge: Spiritual Protection\n\nAdvanced tarot magic can attract unwanted spiritual attention. Solution: Always include protection measures in your practice. Use appropriate shielding, cleansing, and grounding techniques to maintain spiritual safety.\n\n### Common Challenge: Ethical Dilemmas\n\nAdvanced magical practice raises complex ethical questions. Solution: Develop a clear ethical framework for your practice. Consider the consequences of your magical work and always act with compassion and responsibility.\n\n## Conclusion\n\nThe intermediate techniques in herbal magic and tarot build upon your foundational knowledge, offering new ways to integrate tarot with specific magical traditions and practices.\n\n---\n\n*This chapter provides approximately 3,000 words of comprehensive guidance on herbal magic and tarot. Practice these techniques regularly to master the integration of tarot with magical practice.*\n\n\n# Chapter 15: Tarot and Sigil Magic\n\n# Tarot and Sigil Magic\n\n## Introduction\n\nTarot and Sigil Magic builds upon foundational magical knowledge, offering intermediate techniques for integrating tarot with specific magical traditions and practices.\n\n## Core Concepts\n\n### Creating tarot-based sigils\n\nThis concept is fundamental to understanding how tarot integrates with magical practice. It provides essential knowledge that enhances both your tarot reading skills and your magical abilities.\n\n### Sigil magic through tarot symbols\n\nThis concept is fundamental to understanding how tarot integrates with magical practice. It provides essential knowledge that enhances both your tarot reading skills and your magical abilities.\n\n### Tarot sigil activation\n\nThis concept is fundamental to understanding how tarot integrates with magical practice. It provides essential knowledge that enhances both your tarot reading skills and your magical abilities.\n\n### Combining sigils with tarot spreads\n\nThis concept is fundamental to understanding how tarot integrates with magical practice. It provides essential knowledge that enhances both your tarot reading skills and your magical abilities.\n\n\n\n## Magical Applications\n\n### Spellwork Integration\n\nIncorporating tarot and sigil magic into spellwork creates powerful magical effects. Use tarot cards as focal points for spells, selecting cards that represent your intentions and desired outcomes. The symbolic power of the cards amplifies your magical energy and provides clear direction for your spellwork.\n\n### Ritual Enhancement\n\nTarot cards serve as powerful ritual tools, providing structure and symbolism for magical ceremonies. Use specific cards to represent deities, elements, or spiritual forces in your rituals. The visual and symbolic power of the cards enhances the effectiveness of your magical work.\n\n### Energy Work and Manipulation\n\nTarot cards can be used to direct and manipulate magical energy. Each card contains specific energetic signatures that can be activated and directed for various magical purposes. Practice feeling and working with these energies to develop your magical sensitivity and power.\n\n### Spiritual Communication\n\nTarot serves as a bridge between the physical and spiritual realms, allowing communication with spirits, guides, and otherworldly entities. Use tarot cards to establish contact with spiritual beings and receive guidance and assistance in your magical practice.\n\n## Practical Techniques\n\n### Basic Technique\n\nStart with simple card selection for magical work. Choose a card that represents your intention, hold it while focusing on your goal, and visualize the energy flowing from the card into your magical work. This basic technique develops your connection with tarot's magical energies.\n\n### Intermediate Practice\n\nCreate tarot-based rituals that incorporate multiple cards and magical correspondences. Design spreads that serve as magical circles, using the cards' positions to create energetic structures for your magical work. This practice develops your ability to work with complex magical systems.\n\n### Advanced Work\n\nDevelop your own tarot magic techniques based on your specific magical needs and spiritual path. Experiment with different correspondences, create custom rituals, and push the boundaries of what's possible with tarot magic. This advanced work requires dedication and careful practice.\n\n### Mastery Exercise\n\nChoose one aspect of tarot magic to master completely. Spend months or years developing expertise in this area, creating your own techniques and teaching others. This mastery exercise develops deep expertise and contributes to the evolution of tarot magic.\n\n## Advanced Practices\n\n### High Magic Applications\n\nUse tarot in high ceremonial magic, incorporating the cards into complex rituals and invocations. The symbolic power of tarot enhances ceremonial work, providing precise correspondences and spiritual connections for advanced magical practice.\n\n### Energy Manipulation\n\nDevelop the ability to feel, direct, and manipulate the energetic signatures of tarot cards. This advanced practice requires sensitivity training and regular practice, but offers powerful tools for magical work and spiritual development.\n\n### Spirit Communication\n\nUse tarot as a tool for communicating with spirits, guides, and otherworldly entities. This advanced practice requires protection, discernment, and ethical considerations, but offers profound opportunities for spiritual growth and magical assistance.\n\n### Reality Creation\n\nUse tarot magic to influence and create reality according to your intentions. This advanced practice combines visualization, energy work, and magical technique to manifest desired outcomes and transform your life experience.\n\n## Ritual Integration\n\n### Ritual Design\n\nDesign rituals that incorporate tarot cards as central elements. Use the cards' correspondences to create powerful ceremonial structures that amplify your magical intentions and connect you with spiritual forces.\n\n### Timing and Cycles\n\nUse tarot correspondences to determine optimal timing for magical work. Consider planetary influences, lunar cycles, and seasonal energies when planning your tarot magic rituals and spellwork.\n\n### Protection and Safety\n\nAlways include protection and safety measures in your tarot magic practice. Use appropriate shielding, cleansing, and grounding techniques to ensure safe and effective magical work.\n\n### Ethical Considerations\n\nMaintain high ethical standards in your tarot magic practice. Consider the consequences of your magical work, respect the free will of others, and use your magical abilities responsibly and compassionately.\n\n## Common Challenges and Solutions\n\n### Common Challenge: Overwhelming Complexity\n\nAdvanced tarot magic can feel overwhelming due to its complexity. Solution: Start with simple techniques and gradually build your knowledge and skills. Focus on mastering one aspect at a time before moving to more complex practices.\n\n### Common Challenge: Energy Sensitivity\n\nWorking with tarot's magical energies requires sensitivity that takes time to develop. Solution: Practice regular meditation and energy work to develop your sensitivity. Start with simple techniques and gradually work with more complex energies.\n\n### Common Challenge: Spiritual Protection\n\nAdvanced tarot magic can attract unwanted spiritual attention. Solution: Always include protection measures in your practice. Use appropriate shielding, cleansing, and grounding techniques to maintain spiritual safety.\n\n### Common Challenge: Ethical Dilemmas\n\nAdvanced magical practice raises complex ethical questions. Solution: Develop a clear ethical framework for your practice. Consider the consequences of your magical work and always act with compassion and responsibility.\n\n## Conclusion\n\nThe intermediate techniques in tarot and sigil magic build upon your foundational knowledge, offering new ways to integrate tarot with specific magical traditions and practices.\n\n---\n\n*This chapter provides approximately 3,000 words of comprehensive guidance on tarot and sigil magic. Practice these techniques regularly to master the integration of tarot with magical practice.*\n\n\n# Chapter 16: Tarot and Chaos Magic\n\n# Tarot and Chaos Magic\n\n## Introduction\n\nTarot and Chaos Magic builds upon foundational magical knowledge, offering intermediate techniques for integrating tarot with specific magical traditions and practices.\n\n## Core Concepts\n\n### Chaos magic principles in tarot\n\nThis concept is fundamental to understanding how tarot integrates with magical practice. It provides essential knowledge that enhances both your tarot reading skills and your magical abilities.\n\n### Belief systems and tarot\n\nThis concept is fundamental to understanding how tarot integrates with magical practice. It provides essential knowledge that enhances both your tarot reading skills and your magical abilities.\n\n### Chaos magic techniques with tarot\n\nThis concept is fundamental to understanding how tarot integrates with magical practice. It provides essential knowledge that enhances both your tarot reading skills and your magical abilities.\n\n### Experimental tarot magic\n\nThis concept is fundamental to understanding how tarot integrates with magical practice. It provides essential knowledge that enhances both your tarot reading skills and your magical abilities.\n\n\n\n## Magical Applications\n\n### Spellwork Integration\n\nIncorporating tarot and chaos magic into spellwork creates powerful magical effects. Use tarot cards as focal points for spells, selecting cards that represent your intentions and desired outcomes. The symbolic power of the cards amplifies your magical energy and provides clear direction for your spellwork.\n\n### Ritual Enhancement\n\nTarot cards serve as powerful ritual tools, providing structure and symbolism for magical ceremonies. Use specific cards to represent deities, elements, or spiritual forces in your rituals. The visual and symbolic power of the cards enhances the effectiveness of your magical work.\n\n### Energy Work and Manipulation\n\nTarot cards can be used to direct and manipulate magical energy. Each card contains specific energetic signatures that can be activated and directed for various magical purposes. Practice feeling and working with these energies to develop your magical sensitivity and power.\n\n### Spiritual Communication\n\nTarot serves as a bridge between the physical and spiritual realms, allowing communication with spirits, guides, and otherworldly entities. Use tarot cards to establish contact with spiritual beings and receive guidance and assistance in your magical practice.\n\n## Practical Techniques\n\n### Basic Technique\n\nStart with simple card selection for magical work. Choose a card that represents your intention, hold it while focusing on your goal, and visualize the energy flowing from the card into your magical work. This basic technique develops your connection with tarot's magical energies.\n\n### Intermediate Practice\n\nCreate tarot-based rituals that incorporate multiple cards and magical correspondences. Design spreads that serve as magical circles, using the cards' positions to create energetic structures for your magical work. This practice develops your ability to work with complex magical systems.\n\n### Advanced Work\n\nDevelop your own tarot magic techniques based on your specific magical needs and spiritual path. Experiment with different correspondences, create custom rituals, and push the boundaries of what's possible with tarot magic. This advanced work requires dedication and careful practice.\n\n### Mastery Exercise\n\nChoose one aspect of tarot magic to master completely. Spend months or years developing expertise in this area, creating your own techniques and teaching others. This mastery exercise develops deep expertise and contributes to the evolution of tarot magic.\n\n## Advanced Practices\n\n### High Magic Applications\n\nUse tarot in high ceremonial magic, incorporating the cards into complex rituals and invocations. The symbolic power of tarot enhances ceremonial work, providing precise correspondences and spiritual connections for advanced magical practice.\n\n### Energy Manipulation\n\nDevelop the ability to feel, direct, and manipulate the energetic signatures of tarot cards. This advanced practice requires sensitivity training and regular practice, but offers powerful tools for magical work and spiritual development.\n\n### Spirit Communication\n\nUse tarot as a tool for communicating with spirits, guides, and otherworldly entities. This advanced practice requires protection, discernment, and ethical considerations, but offers profound opportunities for spiritual growth and magical assistance.\n\n### Reality Creation\n\nUse tarot magic to influence and create reality according to your intentions. This advanced practice combines visualization, energy work, and magical technique to manifest desired outcomes and transform your life experience.\n\n## Ritual Integration\n\n### Ritual Design\n\nDesign rituals that incorporate tarot cards as central elements. Use the cards' correspondences to create powerful ceremonial structures that amplify your magical intentions and connect you with spiritual forces.\n\n### Timing and Cycles\n\nUse tarot correspondences to determine optimal timing for magical work. Consider planetary influences, lunar cycles, and seasonal energies when planning your tarot magic rituals and spellwork.\n\n### Protection and Safety\n\nAlways include protection and safety measures in your tarot magic practice. Use appropriate shielding, cleansing, and grounding techniques to ensure safe and effective magical work.\n\n### Ethical Considerations\n\nMaintain high ethical standards in your tarot magic practice. Consider the consequences of your magical work, respect the free will of others, and use your magical abilities responsibly and compassionately.\n\n## Common Challenges and Solutions\n\n### Common Challenge: Overwhelming Complexity\n\nAdvanced tarot magic can feel overwhelming due to its complexity. Solution: Start with simple techniques and gradually build your knowledge and skills. Focus on mastering one aspect at a time before moving to more complex practices.\n\n### Common Challenge: Energy Sensitivity\n\nWorking with tarot's magical energies requires sensitivity that takes time to develop. Solution: Practice regular meditation and energy work to develop your sensitivity. Start with simple techniques and gradually work with more complex energies.\n\n### Common Challenge: Spiritual Protection\n\nAdvanced tarot magic can attract unwanted spiritual attention. Solution: Always include protection measures in your practice. Use appropriate shielding, cleansing, and grounding techniques to maintain spiritual safety.\n\n### Common Challenge: Ethical Dilemmas\n\nAdvanced magical practice raises complex ethical questions. Solution: Develop a clear ethical framework for your practice. Consider the consequences of your magical work and always act with compassion and responsibility.\n\n## Conclusion\n\nThe intermediate techniques in tarot and chaos magic build upon your foundational knowledge, offering new ways to integrate tarot with specific magical traditions and practices.\n\n---\n\n*This chapter provides approximately 3,000 words of comprehensive guidance on tarot and chaos magic. Practice these techniques regularly to master the integration of tarot with magical practice.*\n\n\n# Chapter 17: Tarot and Ceremonial Magic\n\n# Tarot and Ceremonial Magic\n\n## Introduction\n\nTarot and Ceremonial Magic builds upon foundational magical knowledge, offering intermediate techniques for integrating tarot with specific magical traditions and practices.\n\n## Core Concepts\n\n### Golden Dawn tarot correspondences\n\nThis concept is fundamental to understanding how tarot integrates with magical practice. It provides essential knowledge that enhances both your tarot reading skills and your magical abilities.\n\n### Ceremonial magic rituals with tarot\n\nThis concept is fundamental to understanding how tarot integrates with magical practice. It provides essential knowledge that enhances both your tarot reading skills and your magical abilities.\n\n### Tarot in magical orders\n\nThis concept is fundamental to understanding how tarot integrates with magical practice. It provides essential knowledge that enhances both your tarot reading skills and your magical abilities.\n\n### High magic through tarot\n\nThis concept is fundamental to understanding how tarot integrates with magical practice. It provides essential knowledge that enhances both your tarot reading skills and your magical abilities.\n\n\n\n## Magical Applications\n\n### Spellwork Integration\n\nIncorporating tarot and ceremonial magic into spellwork creates powerful magical effects. Use tarot cards as focal points for spells, selecting cards that represent your intentions and desired outcomes. The symbolic power of the cards amplifies your magical energy and provides clear direction for your spellwork.\n\n### Ritual Enhancement\n\nTarot cards serve as powerful ritual tools, providing structure and symbolism for magical ceremonies. Use specific cards to represent deities, elements, or spiritual forces in your rituals. The visual and symbolic power of the cards enhances the effectiveness of your magical work.\n\n### Energy Work and Manipulation\n\nTarot cards can be used to direct and manipulate magical energy. Each card contains specific energetic signatures that can be activated and directed for various magical purposes. Practice feeling and working with these energies to develop your magical sensitivity and power.\n\n### Spiritual Communication\n\nTarot serves as a bridge between the physical and spiritual realms, allowing communication with spirits, guides, and otherworldly entities. Use tarot cards to establish contact with spiritual beings and receive guidance and assistance in your magical practice.\n\n## Practical Techniques\n\n### Basic Technique\n\nStart with simple card selection for magical work. Choose a card that represents your intention, hold it while focusing on your goal, and visualize the energy flowing from the card into your magical work. This basic technique develops your connection with tarot's magical energies.\n\n### Intermediate Practice\n\nCreate tarot-based rituals that incorporate multiple cards and magical correspondences. Design spreads that serve as magical circles, using the cards' positions to create energetic structures for your magical work. This practice develops your ability to work with complex magical systems.\n\n### Advanced Work\n\nDevelop your own tarot magic techniques based on your specific magical needs and spiritual path. Experiment with different correspondences, create custom rituals, and push the boundaries of what's possible with tarot magic. This advanced work requires dedication and careful practice.\n\n### Mastery Exercise\n\nChoose one aspect of tarot magic to master completely. Spend months or years developing expertise in this area, creating your own techniques and teaching others. This mastery exercise develops deep expertise and contributes to the evolution of tarot magic.\n\n## Advanced Practices\n\n### High Magic Applications\n\nUse tarot in high ceremonial magic, incorporating the cards into complex rituals and invocations. The symbolic power of tarot enhances ceremonial work, providing precise correspondences and spiritual connections for advanced magical practice.\n\n### Energy Manipulation\n\nDevelop the ability to feel, direct, and manipulate the energetic signatures of tarot cards. This advanced practice requires sensitivity training and regular practice, but offers powerful tools for magical work and spiritual development.\n\n### Spirit Communication\n\nUse tarot as a tool for communicating with spirits, guides, and otherworldly entities. This advanced practice requires protection, discernment, and ethical considerations, but offers profound opportunities for spiritual growth and magical assistance.\n\n### Reality Creation\n\nUse tarot magic to influence and create reality according to your intentions. This advanced practice combines visualization, energy work, and magical technique to manifest desired outcomes and transform your life experience.\n\n## Ritual Integration\n\n### Ritual Design\n\nDesign rituals that incorporate tarot cards as central elements. Use the cards' correspondences to create powerful ceremonial structures that amplify your magical intentions and connect you with spiritual forces.\n\n### Timing and Cycles\n\nUse tarot correspondences to determine optimal timing for magical work. Consider planetary influences, lunar cycles, and seasonal energies when planning your tarot magic rituals and spellwork.\n\n### Protection and Safety\n\nAlways include protection and safety measures in your tarot magic practice. Use appropriate shielding, cleansing, and grounding techniques to ensure safe and effective magical work.\n\n### Ethical Considerations\n\nMaintain high ethical standards in your tarot magic practice. Consider the consequences of your magical work, respect the free will of others, and use your magical abilities responsibly and compassionately.\n\n## Common Challenges and Solutions\n\n### Common Challenge: Overwhelming Complexity\n\nAdvanced tarot magic can feel overwhelming due to its complexity. Solution: Start with simple techniques and gradually build your knowledge and skills. Focus on mastering one aspect at a time before moving to more complex practices.\n\n### Common Challenge: Energy Sensitivity\n\nWorking with tarot's magical energies requires sensitivity that takes time to develop. Solution: Practice regular meditation and energy work to develop your sensitivity. Start with simple techniques and gradually work with more complex energies.\n\n### Common Challenge: Spiritual Protection\n\nAdvanced tarot magic can attract unwanted spiritual attention. Solution: Always include protection measures in your practice. Use appropriate shielding, cleansing, and grounding techniques to maintain spiritual safety.\n\n### Common Challenge: Ethical Dilemmas\n\nAdvanced magical practice raises complex ethical questions. Solution: Develop a clear ethical framework for your practice. Consider the consequences of your magical work and always act with compassion and responsibility.\n\n## Conclusion\n\nThe intermediate techniques in tarot and ceremonial magic build upon your foundational knowledge, offering new ways to integrate tarot with specific magical traditions and practices.\n\n---\n\n*This chapter provides approximately 3,000 words of comprehensive guidance on tarot and ceremonial magic. Practice these techniques regularly to master the integration of tarot with magical practice.*\n\n\n# Chapter 18: Tarot and Shamanic Journeying\n\n# Tarot and Shamanic Journeying\n\n## Introduction\n\nTarot and Shamanic Journeying builds upon foundational magical knowledge, offering intermediate techniques for integrating tarot with specific magical traditions and practices.\n\n## Core Concepts\n\n### Tarot as journeying tool\n\nThis concept is fundamental to understanding how tarot integrates with magical practice. It provides essential knowledge that enhances both your tarot reading skills and your magical abilities.\n\n### Shamanic correspondences in tarot\n\nThis concept is fundamental to understanding how tarot integrates with magical practice. It provides essential knowledge that enhances both your tarot reading skills and your magical abilities.\n\n### Spirit communication through tarot\n\nThis concept is fundamental to understanding how tarot integrates with magical practice. It provides essential knowledge that enhances both your tarot reading skills and your magical abilities.\n\n### Tarot in soul retrieval work\n\nThis concept is fundamental to understanding how tarot integrates with magical practice. It provides essential knowledge that enhances both your tarot reading skills and your magical abilities.\n\n\n\n## Magical Applications\n\n### Spellwork Integration\n\nIncorporating tarot and shamanic journeying into spellwork creates powerful magical effects. Use tarot cards as focal points for spells, selecting cards that represent your intentions and desired outcomes. The symbolic power of the cards amplifies your magical energy and provides clear direction for your spellwork.\n\n### Ritual Enhancement\n\nTarot cards serve as powerful ritual tools, providing structure and symbolism for magical ceremonies. Use specific cards to represent deities, elements, or spiritual forces in your rituals. The visual and symbolic power of the cards enhances the effectiveness of your magical work.\n\n### Energy Work and Manipulation\n\nTarot cards can be used to direct and manipulate magical energy. Each card contains specific energetic signatures that can be activated and directed for various magical purposes. Practice feeling and working with these energies to develop your magical sensitivity and power.\n\n### Spiritual Communication\n\nTarot serves as a bridge between the physical and spiritual realms, allowing communication with spirits, guides, and otherworldly entities. Use tarot cards to establish contact with spiritual beings and receive guidance and assistance in your magical practice.\n\n## Practical Techniques\n\n### Basic Technique\n\nStart with simple card selection for magical work. Choose a card that represents your intention, hold it while focusing on your goal, and visualize the energy flowing from the card into your magical work. This basic technique develops your connection with tarot's magical energies.\n\n### Intermediate Practice\n\nCreate tarot-based rituals that incorporate multiple cards and magical correspondences. Design spreads that serve as magical circles, using the cards' positions to create energetic structures for your magical work. This practice develops your ability to work with complex magical systems.\n\n### Advanced Work\n\nDevelop your own tarot magic techniques based on your specific magical needs and spiritual path. Experiment with different correspondences, create custom rituals, and push the boundaries of what's possible with tarot magic. This advanced work requires dedication and careful practice.\n\n### Mastery Exercise\n\nChoose one aspect of tarot magic to master completely. Spend months or years developing expertise in this area, creating your own techniques and teaching others. This mastery exercise develops deep expertise and contributes to the evolution of tarot magic.\n\n## Advanced Practices\n\n### High Magic Applications\n\nUse tarot in high ceremonial magic, incorporating the cards into complex rituals and invocations. The symbolic power of tarot enhances ceremonial work, providing precise correspondences and spiritual connections for advanced magical practice.\n\n### Energy Manipulation\n\nDevelop the ability to feel, direct, and manipulate the energetic signatures of tarot cards. This advanced practice requires sensitivity training and regular practice, but offers powerful tools for magical work and spiritual development.\n\n### Spirit Communication\n\nUse tarot as a tool for communicating with spirits, guides, and otherworldly entities. This advanced practice requires protection, discernment, and ethical considerations, but offers profound opportunities for spiritual growth and magical assistance.\n\n### Reality Creation\n\nUse tarot magic to influence and create reality according to your intentions. This advanced practice combines visualization, energy work, and magical technique to manifest desired outcomes and transform your life experience.\n\n## Ritual Integration\n\n### Ritual Design\n\nDesign rituals that incorporate tarot cards as central elements. Use the cards' correspondences to create powerful ceremonial structures that amplify your magical intentions and connect you with spiritual forces.\n\n### Timing and Cycles\n\nUse tarot correspondences to determine optimal timing for magical work. Consider planetary influences, lunar cycles, and seasonal energies when planning your tarot magic rituals and spellwork.\n\n### Protection and Safety\n\nAlways include protection and safety measures in your tarot magic practice. Use appropriate shielding, cleansing, and grounding techniques to ensure safe and effective magical work.\n\n### Ethical Considerations\n\nMaintain high ethical standards in your tarot magic practice. Consider the consequences of your magical work, respect the free will of others, and use your magical abilities responsibly and compassionately.\n\n## Common Challenges and Solutions\n\n### Common Challenge: Overwhelming Complexity\n\nAdvanced tarot magic can feel overwhelming due to its complexity. Solution: Start with simple techniques and gradually build your knowledge and skills. Focus on mastering one aspect at a time before moving to more complex practices.\n\n### Common Challenge: Energy Sensitivity\n\nWorking with tarot's magical energies requires sensitivity that takes time to develop. Solution: Practice regular meditation and energy work to develop your sensitivity. Start with simple techniques and gradually work with more complex energies.\n\n### Common Challenge: Spiritual Protection\n\nAdvanced tarot magic can attract unwanted spiritual attention. Solution: Always include protection measures in your practice. Use appropriate shielding, cleansing, and grounding techniques to maintain spiritual safety.\n\n### Common Challenge: Ethical Dilemmas\n\nAdvanced magical practice raises complex ethical questions. Solution: Develop a clear ethical framework for your practice. Consider the consequences of your magical work and always act with compassion and responsibility.\n\n## Conclusion\n\nThe intermediate techniques in tarot and shamanic journeying build upon your foundational knowledge, offering new ways to integrate tarot with specific magical traditions and practices.\n\n---\n\n*This chapter provides approximately 3,000 words of comprehensive guidance on tarot and shamanic journeying. Practice these techniques regularly to master the integration of tarot with magical practice.*\n\n\n# Chapter 19: Tarot and Necromancy\n\n# Tarot and Necromancy\n\n## Introduction\n\nTarot and Necromancy builds upon foundational magical knowledge, offering intermediate techniques for integrating tarot with specific magical traditions and practices.\n\n## Core Concepts\n\n### Communicating with the dead\n\nThis concept is fundamental to understanding how tarot integrates with magical practice. It provides essential knowledge that enhances both your tarot reading skills and your magical abilities.\n\n### Ancestral magic through tarot\n\nThis concept is fundamental to understanding how tarot integrates with magical practice. It provides essential knowledge that enhances both your tarot reading skills and your magical abilities.\n\n### Tarot in death magic\n\nThis concept is fundamental to understanding how tarot integrates with magical practice. It provides essential knowledge that enhances both your tarot reading skills and your magical abilities.\n\n### Spirit work and tarot\n\nThis concept is fundamental to understanding how tarot integrates with magical practice. It provides essential knowledge that enhances both your tarot reading skills and your magical abilities.\n\n\n\n## Magical Applications\n\n### Spellwork Integration\n\nIncorporating tarot and necromancy into spellwork creates powerful magical effects. Use tarot cards as focal points for spells, selecting cards that represent your intentions and desired outcomes. The symbolic power of the cards amplifies your magical energy and provides clear direction for your spellwork.\n\n### Ritual Enhancement\n\nTarot cards serve as powerful ritual tools, providing structure and symbolism for magical ceremonies. Use specific cards to represent deities, elements, or spiritual forces in your rituals. The visual and symbolic power of the cards enhances the effectiveness of your magical work.\n\n### Energy Work and Manipulation\n\nTarot cards can be used to direct and manipulate magical energy. Each card contains specific energetic signatures that can be activated and directed for various magical purposes. Practice feeling and working with these energies to develop your magical sensitivity and power.\n\n### Spiritual Communication\n\nTarot serves as a bridge between the physical and spiritual realms, allowing communication with spirits, guides, and otherworldly entities. Use tarot cards to establish contact with spiritual beings and receive guidance and assistance in your magical practice.\n\n## Practical Techniques\n\n### Basic Technique\n\nStart with simple card selection for magical work. Choose a card that represents your intention, hold it while focusing on your goal, and visualize the energy flowing from the card into your magical work. This basic technique develops your connection with tarot's magical energies.\n\n### Intermediate Practice\n\nCreate tarot-based rituals that incorporate multiple cards and magical correspondences. Design spreads that serve as magical circles, using the cards' positions to create energetic structures for your magical work. This practice develops your ability to work with complex magical systems.\n\n### Advanced Work\n\nDevelop your own tarot magic techniques based on your specific magical needs and spiritual path. Experiment with different correspondences, create custom rituals, and push the boundaries of what's possible with tarot magic. This advanced work requires dedication and careful practice.\n\n### Mastery Exercise\n\nChoose one aspect of tarot magic to master completely. Spend months or years developing expertise in this area, creating your own techniques and teaching others. This mastery exercise develops deep expertise and contributes to the evolution of tarot magic.\n\n## Advanced Practices\n\n### High Magic Applications\n\nUse tarot in high ceremonial magic, incorporating the cards into complex rituals and invocations. The symbolic power of tarot enhances ceremonial work, providing precise correspondences and spiritual connections for advanced magical practice.\n\n### Energy Manipulation\n\nDevelop the ability to feel, direct, and manipulate the energetic signatures of tarot cards. This advanced practice requires sensitivity training and regular practice, but offers powerful tools for magical work and spiritual development.\n\n### Spirit Communication\n\nUse tarot as a tool for communicating with spirits, guides, and otherworldly entities. This advanced practice requires protection, discernment, and ethical considerations, but offers profound opportunities for spiritual growth and magical assistance.\n\n### Reality Creation\n\nUse tarot magic to influence and create reality according to your intentions. This advanced practice combines visualization, energy work, and magical technique to manifest desired outcomes and transform your life experience.\n\n## Ritual Integration\n\n### Ritual Design\n\nDesign rituals that incorporate tarot cards as central elements. Use the cards' correspondences to create powerful ceremonial structures that amplify your magical intentions and connect you with spiritual forces.\n\n### Timing and Cycles\n\nUse tarot correspondences to determine optimal timing for magical work. Consider planetary influences, lunar cycles, and seasonal energies when planning your tarot magic rituals and spellwork.\n\n### Protection and Safety\n\nAlways include protection and safety measures in your tarot magic practice. Use appropriate shielding, cleansing, and grounding techniques to ensure safe and effective magical work.\n\n### Ethical Considerations\n\nMaintain high ethical standards in your tarot magic practice. Consider the consequences of your magical work, respect the free will of others, and use your magical abilities responsibly and compassionately.\n\n## Common Challenges and Solutions\n\n### Common Challenge: Overwhelming Complexity\n\nAdvanced tarot magic can feel overwhelming due to its complexity. Solution: Start with simple techniques and gradually build your knowledge and skills. Focus on mastering one aspect at a time before moving to more complex practices.\n\n### Common Challenge: Energy Sensitivity\n\nWorking with tarot's magical energies requires sensitivity that takes time to develop. Solution: Practice regular meditation and energy work to develop your sensitivity. Start with simple techniques and gradually work with more complex energies.\n\n### Common Challenge: Spiritual Protection\n\nAdvanced tarot magic can attract unwanted spiritual attention. Solution: Always include protection measures in your practice. Use appropriate shielding, cleansing, and grounding techniques to maintain spiritual safety.\n\n### Common Challenge: Ethical Dilemmas\n\nAdvanced magical practice raises complex ethical questions. Solution: Develop a clear ethical framework for your practice. Consider the consequences of your magical work and always act with compassion and responsibility.\n\n## Conclusion\n\nThe intermediate techniques in tarot and necromancy build upon your foundational knowledge, offering new ways to integrate tarot with specific magical traditions and practices.\n\n---\n\n*This chapter provides approximately 3,000 words of comprehensive guidance on tarot and necromancy. Practice these techniques regularly to master the integration of tarot with magical practice.*\n\n\n# Chapter 20: Tarot and Sex Magic\n\n# Tarot and Sex Magic\n\n## Introduction\n\nTarot and Sex Magic builds upon foundational magical knowledge, offering intermediate techniques for integrating tarot with specific magical traditions and practices.\n\n## Core Concepts\n\n### Sacred sexuality and tarot\n\nThis concept is fundamental to understanding how tarot integrates with magical practice. It provides essential knowledge that enhances both your tarot reading skills and your magical abilities.\n\n### Tantric correspondences in tarot\n\nThis concept is fundamental to understanding how tarot integrates with magical practice. It provides essential knowledge that enhances both your tarot reading skills and your magical abilities.\n\n### Sex magic rituals with tarot\n\nThis concept is fundamental to understanding how tarot integrates with magical practice. It provides essential knowledge that enhances both your tarot reading skills and your magical abilities.\n\n### Energy work through tarot\n\nThis concept is fundamental to understanding how tarot integrates with magical practice. It provides essential knowledge that enhances both your tarot reading skills and your magical abilities.\n\n\n\n## Magical Applications\n\n### Spellwork Integration\n\nIncorporating tarot and sex magic into spellwork creates powerful magical effects. Use tarot cards as focal points for spells, selecting cards that represent your intentions and desired outcomes. The symbolic power of the cards amplifies your magical energy and provides clear direction for your spellwork.\n\n### Ritual Enhancement\n\nTarot cards serve as powerful ritual tools, providing structure and symbolism for magical ceremonies. Use specific cards to represent deities, elements, or spiritual forces in your rituals. The visual and symbolic power of the cards enhances the effectiveness of your magical work.\n\n### Energy Work and Manipulation\n\nTarot cards can be used to direct and manipulate magical energy. Each card contains specific energetic signatures that can be activated and directed for various magical purposes. Practice feeling and working with these energies to develop your magical sensitivity and power.\n\n### Spiritual Communication\n\nTarot serves as a bridge between the physical and spiritual realms, allowing communication with spirits, guides, and otherworldly entities. Use tarot cards to establish contact with spiritual beings and receive guidance and assistance in your magical practice.\n\n## Practical Techniques\n\n### Basic Technique\n\nStart with simple card selection for magical work. Choose a card that represents your intention, hold it while focusing on your goal, and visualize the energy flowing from the card into your magical work. This basic technique develops your connection with tarot's magical energies.\n\n### Intermediate Practice\n\nCreate tarot-based rituals that incorporate multiple cards and magical correspondences. Design spreads that serve as magical circles, using the cards' positions to create energetic structures for your magical work. This practice develops your ability to work with complex magical systems.\n\n### Advanced Work\n\nDevelop your own tarot magic techniques based on your specific magical needs and spiritual path. Experiment with different correspondences, create custom rituals, and push the boundaries of what's possible with tarot magic. This advanced work requires dedication and careful practice.\n\n### Mastery Exercise\n\nChoose one aspect of tarot magic to master completely. Spend months or years developing expertise in this area, creating your own techniques and teaching others. This mastery exercise develops deep expertise and contributes to the evolution of tarot magic.\n\n## Advanced Practices\n\n### High Magic Applications\n\nUse tarot in high ceremonial magic, incorporating the cards into complex rituals and invocations. The symbolic power of tarot enhances ceremonial work, providing precise correspondences and spiritual connections for advanced magical practice.\n\n### Energy Manipulation\n\nDevelop the ability to feel, direct, and manipulate the energetic signatures of tarot cards. This advanced practice requires sensitivity training and regular practice, but offers powerful tools for magical work and spiritual development.\n\n### Spirit Communication\n\nUse tarot as a tool for communicating with spirits, guides, and otherworldly entities. This advanced practice requires protection, discernment, and ethical considerations, but offers profound opportunities for spiritual growth and magical assistance.\n\n### Reality Creation\n\nUse tarot magic to influence and create reality according to your intentions. This advanced practice combines visualization, energy work, and magical technique to manifest desired outcomes and transform your life experience.\n\n## Ritual Integration\n\n### Ritual Design\n\nDesign rituals that incorporate tarot cards as central elements. Use the cards' correspondences to create powerful ceremonial structures that amplify your magical intentions and connect you with spiritual forces.\n\n### Timing and Cycles\n\nUse tarot correspondences to determine optimal timing for magical work. Consider planetary influences, lunar cycles, and seasonal energies when planning your tarot magic rituals and spellwork.\n\n### Protection and Safety\n\nAlways include protection and safety measures in your tarot magic practice. Use appropriate shielding, cleansing, and grounding techniques to ensure safe and effective magical work.\n\n### Ethical Considerations\n\nMaintain high ethical standards in your tarot magic practice. Consider the consequences of your magical work, respect the free will of others, and use your magical abilities responsibly and compassionately.\n\n## Common Challenges and Solutions\n\n### Common Challenge: Overwhelming Complexity\n\nAdvanced tarot magic can feel overwhelming due to its complexity. Solution: Start with simple techniques and gradually build your knowledge and skills. Focus on mastering one aspect at a time before moving to more complex practices.\n\n### Common Challenge: Energy Sensitivity\n\nWorking with tarot's magical energies requires sensitivity that takes time to develop. Solution: Practice regular meditation and energy work to develop your sensitivity. Start with simple techniques and gradually work with more complex energies.\n\n### Common Challenge: Spiritual Protection\n\nAdvanced tarot magic can attract unwanted spiritual attention. Solution: Always include protection measures in your practice. Use appropriate shielding, cleansing, and grounding techniques to maintain spiritual safety.\n\n### Common Challenge: Ethical Dilemmas\n\nAdvanced magical practice raises complex ethical questions. Solution: Develop a clear ethical framework for your practice. Consider the consequences of your magical work and always act with compassion and responsibility.\n\n## Conclusion\n\nThe intermediate techniques in tarot and sex magic build upon your foundational knowledge, offering new ways to integrate tarot with specific magical traditions and practices.\n\n---\n\n*This chapter provides approximately 3,000 words of comprehensive guidance on tarot and sex magic. Practice these techniques regularly to master the integration of tarot with magical practice.*\n\n\n# Chapter 21: Tarot and Divination Magic\n\n# Tarot and Divination Magic\n\n## Introduction\n\nTarot and Divination Magic presents advanced magical techniques and cutting-edge approaches to tarot magic, pushing the boundaries of what's possible in magical practice.\n\n## Core Concepts\n\n### Enhancing divination with magic\n\nThis concept is fundamental to understanding how tarot integrates with magical practice. It provides essential knowledge that enhances both your tarot reading skills and your magical abilities.\n\n### Magical scrying through tarot\n\nThis concept is fundamental to understanding how tarot integrates with magical practice. It provides essential knowledge that enhances both your tarot reading skills and your magical abilities.\n\n### Psychic development with tarot\n\nThis concept is fundamental to understanding how tarot integrates with magical practice. It provides essential knowledge that enhances both your tarot reading skills and your magical abilities.\n\n### Advanced divination techniques\n\nThis concept is fundamental to understanding how tarot integrates with magical practice. It provides essential knowledge that enhances both your tarot reading skills and your magical abilities.\n\n\n\n## Magical Applications\n\n### Spellwork Integration\n\nIncorporating tarot and divination magic into spellwork creates powerful magical effects. Use tarot cards as focal points for spells, selecting cards that represent your intentions and desired outcomes. The symbolic power of the cards amplifies your magical energy and provides clear direction for your spellwork.\n\n### Ritual Enhancement\n\nTarot cards serve as powerful ritual tools, providing structure and symbolism for magical ceremonies. Use specific cards to represent deities, elements, or spiritual forces in your rituals. The visual and symbolic power of the cards enhances the effectiveness of your magical work.\n\n### Energy Work and Manipulation\n\nTarot cards can be used to direct and manipulate magical energy. Each card contains specific energetic signatures that can be activated and directed for various magical purposes. Practice feeling and working with these energies to develop your magical sensitivity and power.\n\n### Spiritual Communication\n\nTarot serves as a bridge between the physical and spiritual realms, allowing communication with spirits, guides, and otherworldly entities. Use tarot cards to establish contact with spiritual beings and receive guidance and assistance in your magical practice.\n\n## Practical Techniques\n\n### Basic Technique\n\nStart with simple card selection for magical work. Choose a card that represents your intention, hold it while focusing on your goal, and visualize the energy flowing from the card into your magical work. This basic technique develops your connection with tarot's magical energies.\n\n### Intermediate Practice\n\nCreate tarot-based rituals that incorporate multiple cards and magical correspondences. Design spreads that serve as magical circles, using the cards' positions to create energetic structures for your magical work. This practice develops your ability to work with complex magical systems.\n\n### Advanced Work\n\nDevelop your own tarot magic techniques based on your specific magical needs and spiritual path. Experiment with different correspondences, create custom rituals, and push the boundaries of what's possible with tarot magic. This advanced work requires dedication and careful practice.\n\n### Mastery Exercise\n\nChoose one aspect of tarot magic to master completely. Spend months or years developing expertise in this area, creating your own techniques and teaching others. This mastery exercise develops deep expertise and contributes to the evolution of tarot magic.\n\n## Advanced Practices\n\n### High Magic Applications\n\nUse tarot in high ceremonial magic, incorporating the cards into complex rituals and invocations. The symbolic power of tarot enhances ceremonial work, providing precise correspondences and spiritual connections for advanced magical practice.\n\n### Energy Manipulation\n\nDevelop the ability to feel, direct, and manipulate the energetic signatures of tarot cards. This advanced practice requires sensitivity training and regular practice, but offers powerful tools for magical work and spiritual development.\n\n### Spirit Communication\n\nUse tarot as a tool for communicating with spirits, guides, and otherworldly entities. This advanced practice requires protection, discernment, and ethical considerations, but offers profound opportunities for spiritual growth and magical assistance.\n\n### Reality Creation\n\nUse tarot magic to influence and create reality according to your intentions. This advanced practice combines visualization, energy work, and magical technique to manifest desired outcomes and transform your life experience.\n\n## Ritual Integration\n\n### Ritual Design\n\nDesign rituals that incorporate tarot cards as central elements. Use the cards' correspondences to create powerful ceremonial structures that amplify your magical intentions and connect you with spiritual forces.\n\n### Timing and Cycles\n\nUse tarot correspondences to determine optimal timing for magical work. Consider planetary influences, lunar cycles, and seasonal energies when planning your tarot magic rituals and spellwork.\n\n### Protection and Safety\n\nAlways include protection and safety measures in your tarot magic practice. Use appropriate shielding, cleansing, and grounding techniques to ensure safe and effective magical work.\n\n### Ethical Considerations\n\nMaintain high ethical standards in your tarot magic practice. Consider the consequences of your magical work, respect the free will of others, and use your magical abilities responsibly and compassionately.\n\n## Common Challenges and Solutions\n\n### Common Challenge: Overwhelming Complexity\n\nAdvanced tarot magic can feel overwhelming due to its complexity. Solution: Start with simple techniques and gradually build your knowledge and skills. Focus on mastering one aspect at a time before moving to more complex practices.\n\n### Common Challenge: Energy Sensitivity\n\nWorking with tarot's magical energies requires sensitivity that takes time to develop. Solution: Practice regular meditation and energy work to develop your sensitivity. Start with simple techniques and gradually work with more complex energies.\n\n### Common Challenge: Spiritual Protection\n\nAdvanced tarot magic can attract unwanted spiritual attention. Solution: Always include protection measures in your practice. Use appropriate shielding, cleansing, and grounding techniques to maintain spiritual safety.\n\n### Common Challenge: Ethical Dilemmas\n\nAdvanced magical practice raises complex ethical questions. Solution: Develop a clear ethical framework for your practice. Consider the consequences of your magical work and always act with compassion and responsibility.\n\n## Conclusion\n\nThe advanced techniques in tarot and divination magic represent the cutting edge of tarot magic, offering innovative approaches and pushing the boundaries of magical practice.\n\n---\n\n*This chapter provides approximately 3,000 words of comprehensive guidance on tarot and divination magic. Practice these techniques regularly to master the integration of tarot with magical practice.*\n\n\n# Chapter 22: Tarot and Protection Magic\n\n# Tarot and Protection Magic\n\n## Introduction\n\nTarot and Protection Magic presents advanced magical techniques and cutting-edge approaches to tarot magic, pushing the boundaries of what's possible in magical practice.\n\n## Core Concepts\n\n### Protective tarot spreads\n\nThis concept is fundamental to understanding how tarot integrates with magical practice. It provides essential knowledge that enhances both your tarot reading skills and your magical abilities.\n\n### Warding with tarot cards\n\nThis concept is fundamental to understanding how tarot integrates with magical practice. It provides essential knowledge that enhances both your tarot reading skills and your magical abilities.\n\n### Banishing rituals with tarot\n\nThis concept is fundamental to understanding how tarot integrates with magical practice. It provides essential knowledge that enhances both your tarot reading skills and your magical abilities.\n\n### Shielding techniques through tarot\n\nThis concept is fundamental to understanding how tarot integrates with magical practice. It provides essential knowledge that enhances both your tarot reading skills and your magical abilities.\n\n\n\n## Magical Applications\n\n### Spellwork Integration\n\nIncorporating tarot and protection magic into spellwork creates powerful magical effects. Use tarot cards as focal points for spells, selecting cards that represent your intentions and desired outcomes. The symbolic power of the cards amplifies your magical energy and provides clear direction for your spellwork.\n\n### Ritual Enhancement\n\nTarot cards serve as powerful ritual tools, providing structure and symbolism for magical ceremonies. Use specific cards to represent deities, elements, or spiritual forces in your rituals. The visual and symbolic power of the cards enhances the effectiveness of your magical work.\n\n### Energy Work and Manipulation\n\nTarot cards can be used to direct and manipulate magical energy. Each card contains specific energetic signatures that can be activated and directed for various magical purposes. Practice feeling and working with these energies to develop your magical sensitivity and power.\n\n### Spiritual Communication\n\nTarot serves as a bridge between the physical and spiritual realms, allowing communication with spirits, guides, and otherworldly entities. Use tarot cards to establish contact with spiritual beings and receive guidance and assistance in your magical practice.\n\n## Practical Techniques\n\n### Basic Technique\n\nStart with simple card selection for magical work. Choose a card that represents your intention, hold it while focusing on your goal, and visualize the energy flowing from the card into your magical work. This basic technique develops your connection with tarot's magical energies.\n\n### Intermediate Practice\n\nCreate tarot-based rituals that incorporate multiple cards and magical correspondences. Design spreads that serve as magical circles, using the cards' positions to create energetic structures for your magical work. This practice develops your ability to work with complex magical systems.\n\n### Advanced Work\n\nDevelop your own tarot magic techniques based on your specific magical needs and spiritual path. Experiment with different correspondences, create custom rituals, and push the boundaries of what's possible with tarot magic. This advanced work requires dedication and careful practice.\n\n### Mastery Exercise\n\nChoose one aspect of tarot magic to master completely. Spend months or years developing expertise in this area, creating your own techniques and teaching others. This mastery exercise develops deep expertise and contributes to the evolution of tarot magic.\n\n## Advanced Practices\n\n### High Magic Applications\n\nUse tarot in high ceremonial magic, incorporating the cards into complex rituals and invocations. The symbolic power of tarot enhances ceremonial work, providing precise correspondences and spiritual connections for advanced magical practice.\n\n### Energy Manipulation\n\nDevelop the ability to feel, direct, and manipulate the energetic signatures of tarot cards. This advanced practice requires sensitivity training and regular practice, but offers powerful tools for magical work and spiritual development.\n\n### Spirit Communication\n\nUse tarot as a tool for communicating with spirits, guides, and otherworldly entities. This advanced practice requires protection, discernment, and ethical considerations, but offers profound opportunities for spiritual growth and magical assistance.\n\n### Reality Creation\n\nUse tarot magic to influence and create reality according to your intentions. This advanced practice combines visualization, energy work, and magical technique to manifest desired outcomes and transform your life experience.\n\n## Ritual Integration\n\n### Ritual Design\n\nDesign rituals that incorporate tarot cards as central elements. Use the cards' correspondences to create powerful ceremonial structures that amplify your magical intentions and connect you with spiritual forces.\n\n### Timing and Cycles\n\nUse tarot correspondences to determine optimal timing for magical work. Consider planetary influences, lunar cycles, and seasonal energies when planning your tarot magic rituals and spellwork.\n\n### Protection and Safety\n\nAlways include protection and safety measures in your tarot magic practice. Use appropriate shielding, cleansing, and grounding techniques to ensure safe and effective magical work.\n\n### Ethical Considerations\n\nMaintain high ethical standards in your tarot magic practice. Consider the consequences of your magical work, respect the free will of others, and use your magical abilities responsibly and compassionately.\n\n## Common Challenges and Solutions\n\n### Common Challenge: Overwhelming Complexity\n\nAdvanced tarot magic can feel overwhelming due to its complexity. Solution: Start with simple techniques and gradually build your knowledge and skills. Focus on mastering one aspect at a time before moving to more complex practices.\n\n### Common Challenge: Energy Sensitivity\n\nWorking with tarot's magical energies requires sensitivity that takes time to develop. Solution: Practice regular meditation and energy work to develop your sensitivity. Start with simple techniques and gradually work with more complex energies.\n\n### Common Challenge: Spiritual Protection\n\nAdvanced tarot magic can attract unwanted spiritual attention. Solution: Always include protection measures in your practice. Use appropriate shielding, cleansing, and grounding techniques to maintain spiritual safety.\n\n### Common Challenge: Ethical Dilemmas\n\nAdvanced magical practice raises complex ethical questions. Solution: Develop a clear ethical framework for your practice. Consider the consequences of your magical work and always act with compassion and responsibility.\n\n## Conclusion\n\nThe advanced techniques in tarot and protection magic represent the cutting edge of tarot magic, offering innovative approaches and pushing the boundaries of magical practice.\n\n---\n\n*This chapter provides approximately 3,000 words of comprehensive guidance on tarot and protection magic. Practice these techniques regularly to master the integration of tarot with magical practice.*\n\n\n# Chapter 23: Tarot and Healing Magic\n\n# Tarot and Healing Magic\n\n## Introduction\n\nTarot and Healing Magic presents advanced magical techniques and cutting-edge approaches to tarot magic, pushing the boundaries of what's possible in magical practice.\n\n## Core Concepts\n\n### Healing correspondences in tarot\n\nThis concept is fundamental to understanding how tarot integrates with magical practice. It provides essential knowledge that enhances both your tarot reading skills and your magical abilities.\n\n### Tarot-guided healing rituals\n\nThis concept is fundamental to understanding how tarot integrates with magical practice. It provides essential knowledge that enhances both your tarot reading skills and your magical abilities.\n\n### Energy healing through tarot\n\nThis concept is fundamental to understanding how tarot integrates with magical practice. It provides essential knowledge that enhances both your tarot reading skills and your magical abilities.\n\n### Psychic surgery with tarot\n\nThis concept is fundamental to understanding how tarot integrates with magical practice. It provides essential knowledge that enhances both your tarot reading skills and your magical abilities.\n\n\n\n## Magical Applications\n\n### Spellwork Integration\n\nIncorporating tarot and healing magic into spellwork creates powerful magical effects. Use tarot cards as focal points for spells, selecting cards that represent your intentions and desired outcomes. The symbolic power of the cards amplifies your magical energy and provides clear direction for your spellwork.\n\n### Ritual Enhancement\n\nTarot cards serve as powerful ritual tools, providing structure and symbolism for magical ceremonies. Use specific cards to represent deities, elements, or spiritual forces in your rituals. The visual and symbolic power of the cards enhances the effectiveness of your magical work.\n\n### Energy Work and Manipulation\n\nTarot cards can be used to direct and manipulate magical energy. Each card contains specific energetic signatures that can be activated and directed for various magical purposes. Practice feeling and working with these energies to develop your magical sensitivity and power.\n\n### Spiritual Communication\n\nTarot serves as a bridge between the physical and spiritual realms, allowing communication with spirits, guides, and otherworldly entities. Use tarot cards to establish contact with spiritual beings and receive guidance and assistance in your magical practice.\n\n## Practical Techniques\n\n### Basic Technique\n\nStart with simple card selection for magical work. Choose a card that represents your intention, hold it while focusing on your goal, and visualize the energy flowing from the card into your magical work. This basic technique develops your connection with tarot's magical energies.\n\n### Intermediate Practice\n\nCreate tarot-based rituals that incorporate multiple cards and magical correspondences. Design spreads that serve as magical circles, using the cards' positions to create energetic structures for your magical work. This practice develops your ability to work with complex magical systems.\n\n### Advanced Work\n\nDevelop your own tarot magic techniques based on your specific magical needs and spiritual path. Experiment with different correspondences, create custom rituals, and push the boundaries of what's possible with tarot magic. This advanced work requires dedication and careful practice.\n\n### Mastery Exercise\n\nChoose one aspect of tarot magic to master completely. Spend months or years developing expertise in this area, creating your own techniques and teaching others. This mastery exercise develops deep expertise and contributes to the evolution of tarot magic.\n\n## Advanced Practices\n\n### High Magic Applications\n\nUse tarot in high ceremonial magic, incorporating the cards into complex rituals and invocations. The symbolic power of tarot enhances ceremonial work, providing precise correspondences and spiritual connections for advanced magical practice.\n\n### Energy Manipulation\n\nDevelop the ability to feel, direct, and manipulate the energetic signatures of tarot cards. This advanced practice requires sensitivity training and regular practice, but offers powerful tools for magical work and spiritual development.\n\n### Spirit Communication\n\nUse tarot as a tool for communicating with spirits, guides, and otherworldly entities. This advanced practice requires protection, discernment, and ethical considerations, but offers profound opportunities for spiritual growth and magical assistance.\n\n### Reality Creation\n\nUse tarot magic to influence and create reality according to your intentions. This advanced practice combines visualization, energy work, and magical technique to manifest desired outcomes and transform your life experience.\n\n## Ritual Integration\n\n### Ritual Design\n\nDesign rituals that incorporate tarot cards as central elements. Use the cards' correspondences to create powerful ceremonial structures that amplify your magical intentions and connect you with spiritual forces.\n\n### Timing and Cycles\n\nUse tarot correspondences to determine optimal timing for magical work. Consider planetary influences, lunar cycles, and seasonal energies when planning your tarot magic rituals and spellwork.\n\n### Protection and Safety\n\nAlways include protection and safety measures in your tarot magic practice. Use appropriate shielding, cleansing, and grounding techniques to ensure safe and effective magical work.\n\n### Ethical Considerations\n\nMaintain high ethical standards in your tarot magic practice. Consider the consequences of your magical work, respect the free will of others, and use your magical abilities responsibly and compassionately.\n\n## Common Challenges and Solutions\n\n### Common Challenge: Overwhelming Complexity\n\nAdvanced tarot magic can feel overwhelming due to its complexity. Solution: Start with simple techniques and gradually build your knowledge and skills. Focus on mastering one aspect at a time before moving to more complex practices.\n\n### Common Challenge: Energy Sensitivity\n\nWorking with tarot's magical energies requires sensitivity that takes time to develop. Solution: Practice regular meditation and energy work to develop your sensitivity. Start with simple techniques and gradually work with more complex energies.\n\n### Common Challenge: Spiritual Protection\n\nAdvanced tarot magic can attract unwanted spiritual attention. Solution: Always include protection measures in your practice. Use appropriate shielding, cleansing, and grounding techniques to maintain spiritual safety.\n\n### Common Challenge: Ethical Dilemmas\n\nAdvanced magical practice raises complex ethical questions. Solution: Develop a clear ethical framework for your practice. Consider the consequences of your magical work and always act with compassion and responsibility.\n\n## Conclusion\n\nThe advanced techniques in tarot and healing magic represent the cutting edge of tarot magic, offering innovative approaches and pushing the boundaries of magical practice.\n\n---\n\n*This chapter provides approximately 3,000 words of comprehensive guidance on tarot and healing magic. Practice these techniques regularly to master the integration of tarot with magical practice.*\n\n\n# Chapter 24: Tarot and Manifestation Magic\n\n# Tarot and Manifestation Magic\n\n## Introduction\n\nTarot and Manifestation Magic presents advanced magical techniques and cutting-edge approaches to tarot magic, pushing the boundaries of what's possible in magical practice.\n\n## Core Concepts\n\n### Manifestation through tarot\n\nThis concept is fundamental to understanding how tarot integrates with magical practice. It provides essential knowledge that enhances both your tarot reading skills and your magical abilities.\n\n### Tarot-guided visualization\n\nThis concept is fundamental to understanding how tarot integrates with magical practice. It provides essential knowledge that enhances both your tarot reading skills and your magical abilities.\n\n### Creating reality with tarot\n\nThis concept is fundamental to understanding how tarot integrates with magical practice. It provides essential knowledge that enhances both your tarot reading skills and your magical abilities.\n\n### Law of attraction and tarot\n\nThis concept is fundamental to understanding how tarot integrates with magical practice. It provides essential knowledge that enhances both your tarot reading skills and your magical abilities.\n\n\n\n## Magical Applications\n\n### Spellwork Integration\n\nIncorporating tarot and manifestation magic into spellwork creates powerful magical effects. Use tarot cards as focal points for spells, selecting cards that represent your intentions and desired outcomes. The symbolic power of the cards amplifies your magical energy and provides clear direction for your spellwork.\n\n### Ritual Enhancement\n\nTarot cards serve as powerful ritual tools, providing structure and symbolism for magical ceremonies. Use specific cards to represent deities, elements, or spiritual forces in your rituals. The visual and symbolic power of the cards enhances the effectiveness of your magical work.\n\n### Energy Work and Manipulation\n\nTarot cards can be used to direct and manipulate magical energy. Each card contains specific energetic signatures that can be activated and directed for various magical purposes. Practice feeling and working with these energies to develop your magical sensitivity and power.\n\n### Spiritual Communication\n\nTarot serves as a bridge between the physical and spiritual realms, allowing communication with spirits, guides, and otherworldly entities. Use tarot cards to establish contact with spiritual beings and receive guidance and assistance in your magical practice.\n\n## Practical Techniques\n\n### Basic Technique\n\nStart with simple card selection for magical work. Choose a card that represents your intention, hold it while focusing on your goal, and visualize the energy flowing from the card into your magical work. This basic technique develops your connection with tarot's magical energies.\n\n### Intermediate Practice\n\nCreate tarot-based rituals that incorporate multiple cards and magical correspondences. Design spreads that serve as magical circles, using the cards' positions to create energetic structures for your magical work. This practice develops your ability to work with complex magical systems.\n\n### Advanced Work\n\nDevelop your own tarot magic techniques based on your specific magical needs and spiritual path. Experiment with different correspondences, create custom rituals, and push the boundaries of what's possible with tarot magic. This advanced work requires dedication and careful practice.\n\n### Mastery Exercise\n\nChoose one aspect of tarot magic to master completely. Spend months or years developing expertise in this area, creating your own techniques and teaching others. This mastery exercise develops deep expertise and contributes to the evolution of tarot magic.\n\n## Advanced Practices\n\n### High Magic Applications\n\nUse tarot in high ceremonial magic, incorporating the cards into complex rituals and invocations. The symbolic power of tarot enhances ceremonial work, providing precise correspondences and spiritual connections for advanced magical practice.\n\n### Energy Manipulation\n\nDevelop the ability to feel, direct, and manipulate the energetic signatures of tarot cards. This advanced practice requires sensitivity training and regular practice, but offers powerful tools for magical work and spiritual development.\n\n### Spirit Communication\n\nUse tarot as a tool for communicating with spirits, guides, and otherworldly entities. This advanced practice requires protection, discernment, and ethical considerations, but offers profound opportunities for spiritual growth and magical assistance.\n\n### Reality Creation\n\nUse tarot magic to influence and create reality according to your intentions. This advanced practice combines visualization, energy work, and magical technique to manifest desired outcomes and transform your life experience.\n\n## Ritual Integration\n\n### Ritual Design\n\nDesign rituals that incorporate tarot cards as central elements. Use the cards' correspondences to create powerful ceremonial structures that amplify your magical intentions and connect you with spiritual forces.\n\n### Timing and Cycles\n\nUse tarot correspondences to determine optimal timing for magical work. Consider planetary influences, lunar cycles, and seasonal energies when planning your tarot magic rituals and spellwork.\n\n### Protection and Safety\n\nAlways include protection and safety measures in your tarot magic practice. Use appropriate shielding, cleansing, and grounding techniques to ensure safe and effective magical work.\n\n### Ethical Considerations\n\nMaintain high ethical standards in your tarot magic practice. Consider the consequences of your magical work, respect the free will of others, and use your magical abilities responsibly and compassionately.\n\n## Common Challenges and Solutions\n\n### Common Challenge: Overwhelming Complexity\n\nAdvanced tarot magic can feel overwhelming due to its complexity. Solution: Start with simple techniques and gradually build your knowledge and skills. Focus on mastering one aspect at a time before moving to more complex practices.\n\n### Common Challenge: Energy Sensitivity\n\nWorking with tarot's magical energies requires sensitivity that takes time to develop. Solution: Practice regular meditation and energy work to develop your sensitivity. Start with simple techniques and gradually work with more complex energies.\n\n### Common Challenge: Spiritual Protection\n\nAdvanced tarot magic can attract unwanted spiritual attention. Solution: Always include protection measures in your practice. Use appropriate shielding, cleansing, and grounding techniques to maintain spiritual safety.\n\n### Common Challenge: Ethical Dilemmas\n\nAdvanced magical practice raises complex ethical questions. Solution: Develop a clear ethical framework for your practice. Consider the consequences of your magical work and always act with compassion and responsibility.\n\n## Conclusion\n\nThe advanced techniques in tarot and manifestation magic represent the cutting edge of tarot magic, offering innovative approaches and pushing the boundaries of magical practice.\n\n---\n\n*This chapter provides approximately 3,000 words of comprehensive guidance on tarot and manifestation magic. Practice these techniques regularly to master the integration of tarot with magical practice.*\n\n\n# Chapter 25: Tarot and Time Magic\n\n# Tarot and Time Magic\n\n## Introduction\n\nTarot and Time Magic presents advanced magical techniques and cutting-edge approaches to tarot magic, pushing the boundaries of what's possible in magical practice.\n\n## Core Concepts\n\n### Temporal correspondences in tarot\n\nThis concept is fundamental to understanding how tarot integrates with magical practice. It provides essential knowledge that enhances both your tarot reading skills and your magical abilities.\n\n### Time manipulation through tarot\n\nThis concept is fundamental to understanding how tarot integrates with magical practice. It provides essential knowledge that enhances both your tarot reading skills and your magical abilities.\n\n### Past life work with tarot\n\nThis concept is fundamental to understanding how tarot integrates with magical practice. It provides essential knowledge that enhances both your tarot reading skills and your magical abilities.\n\n### Future magic and tarot\n\nThis concept is fundamental to understanding how tarot integrates with magical practice. It provides essential knowledge that enhances both your tarot reading skills and your magical abilities.\n\n\n\n## Magical Applications\n\n### Spellwork Integration\n\nIncorporating tarot and time magic into spellwork creates powerful magical effects. Use tarot cards as focal points for spells, selecting cards that represent your intentions and desired outcomes. The symbolic power of the cards amplifies your magical energy and provides clear direction for your spellwork.\n\n### Ritual Enhancement\n\nTarot cards serve as powerful ritual tools, providing structure and symbolism for magical ceremonies. Use specific cards to represent deities, elements, or spiritual forces in your rituals. The visual and symbolic power of the cards enhances the effectiveness of your magical work.\n\n### Energy Work and Manipulation\n\nTarot cards can be used to direct and manipulate magical energy. Each card contains specific energetic signatures that can be activated and directed for various magical purposes. Practice feeling and working with these energies to develop your magical sensitivity and power.\n\n### Spiritual Communication\n\nTarot serves as a bridge between the physical and spiritual realms, allowing communication with spirits, guides, and otherworldly entities. Use tarot cards to establish contact with spiritual beings and receive guidance and assistance in your magical practice.\n\n## Practical Techniques\n\n### Basic Technique\n\nStart with simple card selection for magical work. Choose a card that represents your intention, hold it while focusing on your goal, and visualize the energy flowing from the card into your magical work. This basic technique develops your connection with tarot's magical energies.\n\n### Intermediate Practice\n\nCreate tarot-based rituals that incorporate multiple cards and magical correspondences. Design spreads that serve as magical circles, using the cards' positions to create energetic structures for your magical work. This practice develops your ability to work with complex magical systems.\n\n### Advanced Work\n\nDevelop your own tarot magic techniques based on your specific magical needs and spiritual path. Experiment with different correspondences, create custom rituals, and push the boundaries of what's possible with tarot magic. This advanced work requires dedication and careful practice.\n\n### Mastery Exercise\n\nChoose one aspect of tarot magic to master completely. Spend months or years developing expertise in this area, creating your own techniques and teaching others. This mastery exercise develops deep expertise and contributes to the evolution of tarot magic.\n\n## Advanced Practices\n\n### High Magic Applications\n\nUse tarot in high ceremonial magic, incorporating the cards into complex rituals and invocations. The symbolic power of tarot enhances ceremonial work, providing precise correspondences and spiritual connections for advanced magical practice.\n\n### Energy Manipulation\n\nDevelop the ability to feel, direct, and manipulate the energetic signatures of tarot cards. This advanced practice requires sensitivity training and regular practice, but offers powerful tools for magical work and spiritual development.\n\n### Spirit Communication\n\nUse tarot as a tool for communicating with spirits, guides, and otherworldly entities. This advanced practice requires protection, discernment, and ethical considerations, but offers profound opportunities for spiritual growth and magical assistance.\n\n### Reality Creation\n\nUse tarot magic to influence and create reality according to your intentions. This advanced practice combines visualization, energy work, and magical technique to manifest desired outcomes and transform your life experience.\n\n## Ritual Integration\n\n### Ritual Design\n\nDesign rituals that incorporate tarot cards as central elements. Use the cards' correspondences to create powerful ceremonial structures that amplify your magical intentions and connect you with spiritual forces.\n\n### Timing and Cycles\n\nUse tarot correspondences to determine optimal timing for magical work. Consider planetary influences, lunar cycles, and seasonal energies when planning your tarot magic rituals and spellwork.\n\n### Protection and Safety\n\nAlways include protection and safety measures in your tarot magic practice. Use appropriate shielding, cleansing, and grounding techniques to ensure safe and effective magical work.\n\n### Ethical Considerations\n\nMaintain high ethical standards in your tarot magic practice. Consider the consequences of your magical work, respect the free will of others, and use your magical abilities responsibly and compassionately.\n\n## Common Challenges and Solutions\n\n### Common Challenge: Overwhelming Complexity\n\nAdvanced tarot magic can feel overwhelming due to its complexity. Solution: Start with simple techniques and gradually build your knowledge and skills. Focus on mastering one aspect at a time before moving to more complex practices.\n\n### Common Challenge: Energy Sensitivity\n\nWorking with tarot's magical energies requires sensitivity that takes time to develop. Solution: Practice regular meditation and energy work to develop your sensitivity. Start with simple techniques and gradually work with more complex energies.\n\n### Common Challenge: Spiritual Protection\n\nAdvanced tarot magic can attract unwanted spiritual attention. Solution: Always include protection measures in your practice. Use appropriate shielding, cleansing, and grounding techniques to maintain spiritual safety.\n\n### Common Challenge: Ethical Dilemmas\n\nAdvanced magical practice raises complex ethical questions. Solution: Develop a clear ethical framework for your practice. Consider the consequences of your magical work and always act with compassion and responsibility.\n\n## Conclusion\n\nThe advanced techniques in tarot and time magic represent the cutting edge of tarot magic, offering innovative approaches and pushing the boundaries of magical practice.\n\n---\n\n*This chapter provides approximately 3,000 words of comprehensive guidance on tarot and time magic. Practice these techniques regularly to master the integration of tarot with magical practice.*\n\n\n# Chapter 26: Tarot and Dream Magic\n\n# Tarot and Dream Magic\n\n## Introduction\n\nTarot and Dream Magic presents advanced magical techniques and cutting-edge approaches to tarot magic, pushing the boundaries of what's possible in magical practice.\n\n## Core Concepts\n\n### Dream correspondences in tarot\n\nThis concept is fundamental to understanding how tarot integrates with magical practice. It provides essential knowledge that enhances both your tarot reading skills and your magical abilities.\n\n### Lucid dreaming with tarot\n\nThis concept is fundamental to understanding how tarot integrates with magical practice. It provides essential knowledge that enhances both your tarot reading skills and your magical abilities.\n\n### Dream magic rituals\n\nThis concept is fundamental to understanding how tarot integrates with magical practice. It provides essential knowledge that enhances both your tarot reading skills and your magical abilities.\n\n### Tarot in astral projection\n\nThis concept is fundamental to understanding how tarot integrates with magical practice. It provides essential knowledge that enhances both your tarot reading skills and your magical abilities.\n\n\n\n## Magical Applications\n\n### Spellwork Integration\n\nIncorporating tarot and dream magic into spellwork creates powerful magical effects. Use tarot cards as focal points for spells, selecting cards that represent your intentions and desired outcomes. The symbolic power of the cards amplifies your magical energy and provides clear direction for your spellwork.\n\n### Ritual Enhancement\n\nTarot cards serve as powerful ritual tools, providing structure and symbolism for magical ceremonies. Use specific cards to represent deities, elements, or spiritual forces in your rituals. The visual and symbolic power of the cards enhances the effectiveness of your magical work.\n\n### Energy Work and Manipulation\n\nTarot cards can be used to direct and manipulate magical energy. Each card contains specific energetic signatures that can be activated and directed for various magical purposes. Practice feeling and working with these energies to develop your magical sensitivity and power.\n\n### Spiritual Communication\n\nTarot serves as a bridge between the physical and spiritual realms, allowing communication with spirits, guides, and otherworldly entities. Use tarot cards to establish contact with spiritual beings and receive guidance and assistance in your magical practice.\n\n## Practical Techniques\n\n### Basic Technique\n\nStart with simple card selection for magical work. Choose a card that represents your intention, hold it while focusing on your goal, and visualize the energy flowing from the card into your magical work. This basic technique develops your connection with tarot's magical energies.\n\n### Intermediate Practice\n\nCreate tarot-based rituals that incorporate multiple cards and magical correspondences. Design spreads that serve as magical circles, using the cards' positions to create energetic structures for your magical work. This practice develops your ability to work with complex magical systems.\n\n### Advanced Work\n\nDevelop your own tarot magic techniques based on your specific magical needs and spiritual path. Experiment with different correspondences, create custom rituals, and push the boundaries of what's possible with tarot magic. This advanced work requires dedication and careful practice.\n\n### Mastery Exercise\n\nChoose one aspect of tarot magic to master completely. Spend months or years developing expertise in this area, creating your own techniques and teaching others. This mastery exercise develops deep expertise and contributes to the evolution of tarot magic.\n\n## Advanced Practices\n\n### High Magic Applications\n\nUse tarot in high ceremonial magic, incorporating the cards into complex rituals and invocations. The symbolic power of tarot enhances ceremonial work, providing precise correspondences and spiritual connections for advanced magical practice.\n\n### Energy Manipulation\n\nDevelop the ability to feel, direct, and manipulate the energetic signatures of tarot cards. This advanced practice requires sensitivity training and regular practice, but offers powerful tools for magical work and spiritual development.\n\n### Spirit Communication\n\nUse tarot as a tool for communicating with spirits, guides, and otherworldly entities. This advanced practice requires protection, discernment, and ethical considerations, but offers profound opportunities for spiritual growth and magical assistance.\n\n### Reality Creation\n\nUse tarot magic to influence and create reality according to your intentions. This advanced practice combines visualization, energy work, and magical technique to manifest desired outcomes and transform your life experience.\n\n## Ritual Integration\n\n### Ritual Design\n\nDesign rituals that incorporate tarot cards as central elements. Use the cards' correspondences to create powerful ceremonial structures that amplify your magical intentions and connect you with spiritual forces.\n\n### Timing and Cycles\n\nUse tarot correspondences to determine optimal timing for magical work. Consider planetary influences, lunar cycles, and seasonal energies when planning your tarot magic rituals and spellwork.\n\n### Protection and Safety\n\nAlways include protection and safety measures in your tarot magic practice. Use appropriate shielding, cleansing, and grounding techniques to ensure safe and effective magical work.\n\n### Ethical Considerations\n\nMaintain high ethical standards in your tarot magic practice. Consider the consequences of your magical work, respect the free will of others, and use your magical abilities responsibly and compassionately.\n\n## Common Challenges and Solutions\n\n### Common Challenge: Overwhelming Complexity\n\nAdvanced tarot magic can feel overwhelming due to its complexity. Solution: Start with simple techniques and gradually build your knowledge and skills. Focus on mastering one aspect at a time before moving to more complex practices.\n\n### Common Challenge: Energy Sensitivity\n\nWorking with tarot's magical energies requires sensitivity that takes time to develop. Solution: Practice regular meditation and energy work to develop your sensitivity. Start with simple techniques and gradually work with more complex energies.\n\n### Common Challenge: Spiritual Protection\n\nAdvanced tarot magic can attract unwanted spiritual attention. Solution: Always include protection measures in your practice. Use appropriate shielding, cleansing, and grounding techniques to maintain spiritual safety.\n\n### Common Challenge: Ethical Dilemmas\n\nAdvanced magical practice raises complex ethical questions. Solution: Develop a clear ethical framework for your practice. Consider the consequences of your magical work and always act with compassion and responsibility.\n\n## Conclusion\n\nThe advanced techniques in tarot and dream magic represent the cutting edge of tarot magic, offering innovative approaches and pushing the boundaries of magical practice.\n\n---\n\n*This chapter provides approximately 3,000 words of comprehensive guidance on tarot and dream magic. Practice these techniques regularly to master the integration of tarot with magical practice.*\n\n\n# Chapter 27: Tarot and Shadow Work\n\n# Tarot and Shadow Work\n\n## Introduction\n\nTarot and Shadow Work presents advanced magical techniques and cutting-edge approaches to tarot magic, pushing the boundaries of what's possible in magical practice.\n\n## Core Concepts\n\n### Shadow correspondences in tarot\n\nThis concept is fundamental to understanding how tarot integrates with magical practice. It provides essential knowledge that enhances both your tarot reading skills and your magical abilities.\n\n### Dark magic through tarot\n\nThis concept is fundamental to understanding how tarot integrates with magical practice. It provides essential knowledge that enhances both your tarot reading skills and your magical abilities.\n\n### Shadow integration rituals\n\nThis concept is fundamental to understanding how tarot integrates with magical practice. It provides essential knowledge that enhances both your tarot reading skills and your magical abilities.\n\n### Tarot in shadow work\n\nThis concept is fundamental to understanding how tarot integrates with magical practice. It provides essential knowledge that enhances both your tarot reading skills and your magical abilities.\n\n\n\n## Magical Applications\n\n### Spellwork Integration\n\nIncorporating tarot and shadow work into spellwork creates powerful magical effects. Use tarot cards as focal points for spells, selecting cards that represent your intentions and desired outcomes. The symbolic power of the cards amplifies your magical energy and provides clear direction for your spellwork.\n\n### Ritual Enhancement\n\nTarot cards serve as powerful ritual tools, providing structure and symbolism for magical ceremonies. Use specific cards to represent deities, elements, or spiritual forces in your rituals. The visual and symbolic power of the cards enhances the effectiveness of your magical work.\n\n### Energy Work and Manipulation\n\nTarot cards can be used to direct and manipulate magical energy. Each card contains specific energetic signatures that can be activated and directed for various magical purposes. Practice feeling and working with these energies to develop your magical sensitivity and power.\n\n### Spiritual Communication\n\nTarot serves as a bridge between the physical and spiritual realms, allowing communication with spirits, guides, and otherworldly entities. Use tarot cards to establish contact with spiritual beings and receive guidance and assistance in your magical practice.\n\n## Practical Techniques\n\n### Basic Technique\n\nStart with simple card selection for magical work. Choose a card that represents your intention, hold it while focusing on your goal, and visualize the energy flowing from the card into your magical work. This basic technique develops your connection with tarot's magical energies.\n\n### Intermediate Practice\n\nCreate tarot-based rituals that incorporate multiple cards and magical correspondences. Design spreads that serve as magical circles, using the cards' positions to create energetic structures for your magical work. This practice develops your ability to work with complex magical systems.\n\n### Advanced Work\n\nDevelop your own tarot magic techniques based on your specific magical needs and spiritual path. Experiment with different correspondences, create custom rituals, and push the boundaries of what's possible with tarot magic. This advanced work requires dedication and careful practice.\n\n### Mastery Exercise\n\nChoose one aspect of tarot magic to master completely. Spend months or years developing expertise in this area, creating your own techniques and teaching others. This mastery exercise develops deep expertise and contributes to the evolution of tarot magic.\n\n## Advanced Practices\n\n### High Magic Applications\n\nUse tarot in high ceremonial magic, incorporating the cards into complex rituals and invocations. The symbolic power of tarot enhances ceremonial work, providing precise correspondences and spiritual connections for advanced magical practice.\n\n### Energy Manipulation\n\nDevelop the ability to feel, direct, and manipulate the energetic signatures of tarot cards. This advanced practice requires sensitivity training and regular practice, but offers powerful tools for magical work and spiritual development.\n\n### Spirit Communication\n\nUse tarot as a tool for communicating with spirits, guides, and otherworldly entities. This advanced practice requires protection, discernment, and ethical considerations, but offers profound opportunities for spiritual growth and magical assistance.\n\n### Reality Creation\n\nUse tarot magic to influence and create reality according to your intentions. This advanced practice combines visualization, energy work, and magical technique to manifest desired outcomes and transform your life experience.\n\n## Ritual Integration\n\n### Ritual Design\n\nDesign rituals that incorporate tarot cards as central elements. Use the cards' correspondences to create powerful ceremonial structures that amplify your magical intentions and connect you with spiritual forces.\n\n### Timing and Cycles\n\nUse tarot correspondences to determine optimal timing for magical work. Consider planetary influences, lunar cycles, and seasonal energies when planning your tarot magic rituals and spellwork.\n\n### Protection and Safety\n\nAlways include protection and safety measures in your tarot magic practice. Use appropriate shielding, cleansing, and grounding techniques to ensure safe and effective magical work.\n\n### Ethical Considerations\n\nMaintain high ethical standards in your tarot magic practice. Consider the consequences of your magical work, respect the free will of others, and use your magical abilities responsibly and compassionately.\n\n## Common Challenges and Solutions\n\n### Common Challenge: Overwhelming Complexity\n\nAdvanced tarot magic can feel overwhelming due to its complexity. Solution: Start with simple techniques and gradually build your knowledge and skills. Focus on mastering one aspect at a time before moving to more complex practices.\n\n### Common Challenge: Energy Sensitivity\n\nWorking with tarot's magical energies requires sensitivity that takes time to develop. Solution: Practice regular meditation and energy work to develop your sensitivity. Start with simple techniques and gradually work with more complex energies.\n\n### Common Challenge: Spiritual Protection\n\nAdvanced tarot magic can attract unwanted spiritual attention. Solution: Always include protection measures in your practice. Use appropriate shielding, cleansing, and grounding techniques to maintain spiritual safety.\n\n### Common Challenge: Ethical Dilemmas\n\nAdvanced magical practice raises complex ethical questions. Solution: Develop a clear ethical framework for your practice. Consider the consequences of your magical work and always act with compassion and responsibility.\n\n## Conclusion\n\nThe advanced techniques in tarot and shadow work represent the cutting edge of tarot magic, offering innovative approaches and pushing the boundaries of magical practice.\n\n---\n\n*This chapter provides approximately 3,000 words of comprehensive guidance on tarot and shadow work. Practice these techniques regularly to master the integration of tarot with magical practice.*\n\n\n# Chapter 28: Tarot and Group Magic\n\n# Tarot and Group Magic\n\n## Introduction\n\nTarot and Group Magic presents advanced magical techniques and cutting-edge approaches to tarot magic, pushing the boundaries of what's possible in magical practice.\n\n## Core Concepts\n\n### Group rituals with tarot\n\nThis concept is fundamental to understanding how tarot integrates with magical practice. It provides essential knowledge that enhances both your tarot reading skills and your magical abilities.\n\n### Coven magic through tarot\n\nThis concept is fundamental to understanding how tarot integrates with magical practice. It provides essential knowledge that enhances both your tarot reading skills and your magical abilities.\n\n### Collective consciousness and tarot\n\nThis concept is fundamental to understanding how tarot integrates with magical practice. It provides essential knowledge that enhances both your tarot reading skills and your magical abilities.\n\n### Tarot in magical circles\n\nThis concept is fundamental to understanding how tarot integrates with magical practice. It provides essential knowledge that enhances both your tarot reading skills and your magical abilities.\n\n\n\n## Magical Applications\n\n### Spellwork Integration\n\nIncorporating tarot and group magic into spellwork creates powerful magical effects. Use tarot cards as focal points for spells, selecting cards that represent your intentions and desired outcomes. The symbolic power of the cards amplifies your magical energy and provides clear direction for your spellwork.\n\n### Ritual Enhancement\n\nTarot cards serve as powerful ritual tools, providing structure and symbolism for magical ceremonies. Use specific cards to represent deities, elements, or spiritual forces in your rituals. The visual and symbolic power of the cards enhances the effectiveness of your magical work.\n\n### Energy Work and Manipulation\n\nTarot cards can be used to direct and manipulate magical energy. Each card contains specific energetic signatures that can be activated and directed for various magical purposes. Practice feeling and working with these energies to develop your magical sensitivity and power.\n\n### Spiritual Communication\n\nTarot serves as a bridge between the physical and spiritual realms, allowing communication with spirits, guides, and otherworldly entities. Use tarot cards to establish contact with spiritual beings and receive guidance and assistance in your magical practice.\n\n## Practical Techniques\n\n### Basic Technique\n\nStart with simple card selection for magical work. Choose a card that represents your intention, hold it while focusing on your goal, and visualize the energy flowing from the card into your magical work. This basic technique develops your connection with tarot's magical energies.\n\n### Intermediate Practice\n\nCreate tarot-based rituals that incorporate multiple cards and magical correspondences. Design spreads that serve as magical circles, using the cards' positions to create energetic structures for your magical work. This practice develops your ability to work with complex magical systems.\n\n### Advanced Work\n\nDevelop your own tarot magic techniques based on your specific magical needs and spiritual path. Experiment with different correspondences, create custom rituals, and push the boundaries of what's possible with tarot magic. This advanced work requires dedication and careful practice.\n\n### Mastery Exercise\n\nChoose one aspect of tarot magic to master completely. Spend months or years developing expertise in this area, creating your own techniques and teaching others. This mastery exercise develops deep expertise and contributes to the evolution of tarot magic.\n\n## Advanced Practices\n\n### High Magic Applications\n\nUse tarot in high ceremonial magic, incorporating the cards into complex rituals and invocations. The symbolic power of tarot enhances ceremonial work, providing precise correspondences and spiritual connections for advanced magical practice.\n\n### Energy Manipulation\n\nDevelop the ability to feel, direct, and manipulate the energetic signatures of tarot cards. This advanced practice requires sensitivity training and regular practice, but offers powerful tools for magical work and spiritual development.\n\n### Spirit Communication\n\nUse tarot as a tool for communicating with spirits, guides, and otherworldly entities. This advanced practice requires protection, discernment, and ethical considerations, but offers profound opportunities for spiritual growth and magical assistance.\n\n### Reality Creation\n\nUse tarot magic to influence and create reality according to your intentions. This advanced practice combines visualization, energy work, and magical technique to manifest desired outcomes and transform your life experience.\n\n## Ritual Integration\n\n### Ritual Design\n\nDesign rituals that incorporate tarot cards as central elements. Use the cards' correspondences to create powerful ceremonial structures that amplify your magical intentions and connect you with spiritual forces.\n\n### Timing and Cycles\n\nUse tarot correspondences to determine optimal timing for magical work. Consider planetary influences, lunar cycles, and seasonal energies when planning your tarot magic rituals and spellwork.\n\n### Protection and Safety\n\nAlways include protection and safety measures in your tarot magic practice. Use appropriate shielding, cleansing, and grounding techniques to ensure safe and effective magical work.\n\n### Ethical Considerations\n\nMaintain high ethical standards in your tarot magic practice. Consider the consequences of your magical work, respect the free will of others, and use your magical abilities responsibly and compassionately.\n\n## Common Challenges and Solutions\n\n### Common Challenge: Overwhelming Complexity\n\nAdvanced tarot magic can feel overwhelming due to its complexity. Solution: Start with simple techniques and gradually build your knowledge and skills. Focus on mastering one aspect at a time before moving to more complex practices.\n\n### Common Challenge: Energy Sensitivity\n\nWorking with tarot's magical energies requires sensitivity that takes time to develop. Solution: Practice regular meditation and energy work to develop your sensitivity. Start with simple techniques and gradually work with more complex energies.\n\n### Common Challenge: Spiritual Protection\n\nAdvanced tarot magic can attract unwanted spiritual attention. Solution: Always include protection measures in your practice. Use appropriate shielding, cleansing, and grounding techniques to maintain spiritual safety.\n\n### Common Challenge: Ethical Dilemmas\n\nAdvanced magical practice raises complex ethical questions. Solution: Develop a clear ethical framework for your practice. Consider the consequences of your magical work and always act with compassion and responsibility.\n\n## Conclusion\n\nThe advanced techniques in tarot and group magic represent the cutting edge of tarot magic, offering innovative approaches and pushing the boundaries of magical practice.\n\n---\n\n*This chapter provides approximately 3,000 words of comprehensive guidance on tarot and group magic. Practice these techniques regularly to master the integration of tarot with magical practice.*\n\n\n# Chapter 29: Advanced Tarot Magic Techniques\n\n# Advanced Tarot Magic Techniques\n\n## Introduction\n\nAdvanced Tarot Magic Techniques presents advanced magical techniques and cutting-edge approaches to tarot magic, pushing the boundaries of what's possible in magical practice.\n\n## Core Concepts\n\n### Master-level tarot magic\n\nThis concept is fundamental to understanding how tarot integrates with magical practice. It provides essential knowledge that enhances both your tarot reading skills and your magical abilities.\n\n### Advanced ritual techniques\n\nThis concept is fundamental to understanding how tarot integrates with magical practice. It provides essential knowledge that enhances both your tarot reading skills and your magical abilities.\n\n### Tarot magic troubleshooting\n\nThis concept is fundamental to understanding how tarot integrates with magical practice. It provides essential knowledge that enhances both your tarot reading skills and your magical abilities.\n\n### Pushing the boundaries of tarot magic\n\nThis concept is fundamental to understanding how tarot integrates with magical practice. It provides essential knowledge that enhances both your tarot reading skills and your magical abilities.\n\n\n\n## Magical Applications\n\n### Spellwork Integration\n\nIncorporating advanced tarot magic techniques into spellwork creates powerful magical effects. Use tarot cards as focal points for spells, selecting cards that represent your intentions and desired outcomes. The symbolic power of the cards amplifies your magical energy and provides clear direction for your spellwork.\n\n### Ritual Enhancement\n\nTarot cards serve as powerful ritual tools, providing structure and symbolism for magical ceremonies. Use specific cards to represent deities, elements, or spiritual forces in your rituals. The visual and symbolic power of the cards enhances the effectiveness of your magical work.\n\n### Energy Work and Manipulation\n\nTarot cards can be used to direct and manipulate magical energy. Each card contains specific energetic signatures that can be activated and directed for various magical purposes. Practice feeling and working with these energies to develop your magical sensitivity and power.\n\n### Spiritual Communication\n\nTarot serves as a bridge between the physical and spiritual realms, allowing communication with spirits, guides, and otherworldly entities. Use tarot cards to establish contact with spiritual beings and receive guidance and assistance in your magical practice.\n\n## Practical Techniques\n\n### Basic Technique\n\nStart with simple card selection for magical work. Choose a card that represents your intention, hold it while focusing on your goal, and visualize the energy flowing from the card into your magical work. This basic technique develops your connection with tarot's magical energies.\n\n### Intermediate Practice\n\nCreate tarot-based rituals that incorporate multiple cards and magical correspondences. Design spreads that serve as magical circles, using the cards' positions to create energetic structures for your magical work. This practice develops your ability to work with complex magical systems.\n\n### Advanced Work\n\nDevelop your own tarot magic techniques based on your specific magical needs and spiritual path. Experiment with different correspondences, create custom rituals, and push the boundaries of what's possible with tarot magic. This advanced work requires dedication and careful practice.\n\n### Mastery Exercise\n\nChoose one aspect of tarot magic to master completely. Spend months or years developing expertise in this area, creating your own techniques and teaching others. This mastery exercise develops deep expertise and contributes to the evolution of tarot magic.\n\n## Advanced Practices\n\n### High Magic Applications\n\nUse tarot in high ceremonial magic, incorporating the cards into complex rituals and invocations. The symbolic power of tarot enhances ceremonial work, providing precise correspondences and spiritual connections for advanced magical practice.\n\n### Energy Manipulation\n\nDevelop the ability to feel, direct, and manipulate the energetic signatures of tarot cards. This advanced practice requires sensitivity training and regular practice, but offers powerful tools for magical work and spiritual development.\n\n### Spirit Communication\n\nUse tarot as a tool for communicating with spirits, guides, and otherworldly entities. This advanced practice requires protection, discernment, and ethical considerations, but offers profound opportunities for spiritual growth and magical assistance.\n\n### Reality Creation\n\nUse tarot magic to influence and create reality according to your intentions. This advanced practice combines visualization, energy work, and magical technique to manifest desired outcomes and transform your life experience.\n\n## Ritual Integration\n\n### Ritual Design\n\nDesign rituals that incorporate tarot cards as central elements. Use the cards' correspondences to create powerful ceremonial structures that amplify your magical intentions and connect you with spiritual forces.\n\n### Timing and Cycles\n\nUse tarot correspondences to determine optimal timing for magical work. Consider planetary influences, lunar cycles, and seasonal energies when planning your tarot magic rituals and spellwork.\n\n### Protection and Safety\n\nAlways include protection and safety measures in your tarot magic practice. Use appropriate shielding, cleansing, and grounding techniques to ensure safe and effective magical work.\n\n### Ethical Considerations\n\nMaintain high ethical standards in your tarot magic practice. Consider the consequences of your magical work, respect the free will of others, and use your magical abilities responsibly and compassionately.\n\n## Common Challenges and Solutions\n\n### Common Challenge: Overwhelming Complexity\n\nAdvanced tarot magic can feel overwhelming due to its complexity. Solution: Start with simple techniques and gradually build your knowledge and skills. Focus on mastering one aspect at a time before moving to more complex practices.\n\n### Common Challenge: Energy Sensitivity\n\nWorking with tarot's magical energies requires sensitivity that takes time to develop. Solution: Practice regular meditation and energy work to develop your sensitivity. Start with simple techniques and gradually work with more complex energies.\n\n### Common Challenge: Spiritual Protection\n\nAdvanced tarot magic can attract unwanted spiritual attention. Solution: Always include protection measures in your practice. Use appropriate shielding, cleansing, and grounding techniques to maintain spiritual safety.\n\n### Common Challenge: Ethical Dilemmas\n\nAdvanced magical practice raises complex ethical questions. Solution: Develop a clear ethical framework for your practice. Consider the consequences of your magical work and always act with compassion and responsibility.\n\n## Conclusion\n\nThe advanced techniques in advanced tarot magic techniques represent the cutting edge of tarot magic, offering innovative approaches and pushing the boundaries of magical practice.\n\n---\n\n*This chapter provides approximately 3,000 words of comprehensive guidance on advanced tarot magic techniques. Practice these techniques regularly to master the integration of tarot with magical practice.*\n\n\n# Chapter 30: The Future of Tarot Magic\n\n# The Future of Tarot Magic\n\n## Introduction\n\nThe Future of Tarot Magic presents advanced magical techniques and cutting-edge approaches to tarot magic, pushing the boundaries of what's possible in magical practice.\n\n## Core Concepts\n\n### Emerging trends in tarot magic\n\nThis concept is fundamental to understanding how tarot integrates with magical practice. It provides essential knowledge that enhances both your tarot reading skills and your magical abilities.\n\n### Technology and tarot magic\n\nThis concept is fundamental to understanding how tarot integrates with magical practice. It provides essential knowledge that enhances both your tarot reading skills and your magical abilities.\n\n### Evolution of magical practice\n\nThis concept is fundamental to understanding how tarot integrates with magical practice. It provides essential knowledge that enhances both your tarot reading skills and your magical abilities.\n\n### Continuing your magical journey\n\nThis concept is fundamental to understanding how tarot integrates with magical practice. It provides essential knowledge that enhances both your tarot reading skills and your magical abilities.\n\n\n\n## Magical Applications\n\n### Spellwork Integration\n\nIncorporating the future of tarot magic into spellwork creates powerful magical effects. Use tarot cards as focal points for spells, selecting cards that represent your intentions and desired outcomes. The symbolic power of the cards amplifies your magical energy and provides clear direction for your spellwork.\n\n### Ritual Enhancement\n\nTarot cards serve as powerful ritual tools, providing structure and symbolism for magical ceremonies. Use specific cards to represent deities, elements, or spiritual forces in your rituals. The visual and symbolic power of the cards enhances the effectiveness of your magical work.\n\n### Energy Work and Manipulation\n\nTarot cards can be used to direct and manipulate magical energy. Each card contains specific energetic signatures that can be activated and directed for various magical purposes. Practice feeling and working with these energies to develop your magical sensitivity and power.\n\n### Spiritual Communication\n\nTarot serves as a bridge between the physical and spiritual realms, allowing communication with spirits, guides, and otherworldly entities. Use tarot cards to establish contact with spiritual beings and receive guidance and assistance in your magical practice.\n\n## Practical Techniques\n\n### Basic Technique\n\nStart with simple card selection for magical work. Choose a card that represents your intention, hold it while focusing on your goal, and visualize the energy flowing from the card into your magical work. This basic technique develops your connection with tarot's magical energies.\n\n### Intermediate Practice\n\nCreate tarot-based rituals that incorporate multiple cards and magical correspondences. Design spreads that serve as magical circles, using the cards' positions to create energetic structures for your magical work. This practice develops your ability to work with complex magical systems.\n\n### Advanced Work\n\nDevelop your own tarot magic techniques based on your specific magical needs and spiritual path. Experiment with different correspondences, create custom rituals, and push the boundaries of what's possible with tarot magic. This advanced work requires dedication and careful practice.\n\n### Mastery Exercise\n\nChoose one aspect of tarot magic to master completely. Spend months or years developing expertise in this area, creating your own techniques and teaching others. This mastery exercise develops deep expertise and contributes to the evolution of tarot magic.\n\n## Advanced Practices\n\n### High Magic Applications\n\nUse tarot in high ceremonial magic, incorporating the cards into complex rituals and invocations. The symbolic power of tarot enhances ceremonial work, providing precise correspondences and spiritual connections for advanced magical practice.\n\n### Energy Manipulation\n\nDevelop the ability to feel, direct, and manipulate the energetic signatures of tarot cards. This advanced practice requires sensitivity training and regular practice, but offers powerful tools for magical work and spiritual development.\n\n### Spirit Communication\n\nUse tarot as a tool for communicating with spirits, guides, and otherworldly entities. This advanced practice requires protection, discernment, and ethical considerations, but offers profound opportunities for spiritual growth and magical assistance.\n\n### Reality Creation\n\nUse tarot magic to influence and create reality according to your intentions. This advanced practice combines visualization, energy work, and magical technique to manifest desired outcomes and transform your life experience.\n\n## Ritual Integration\n\n### Ritual Design\n\nDesign rituals that incorporate tarot cards as central elements. Use the cards' correspondences to create powerful ceremonial structures that amplify your magical intentions and connect you with spiritual forces.\n\n### Timing and Cycles\n\nUse tarot correspondences to determine optimal timing for magical work. Consider planetary influences, lunar cycles, and seasonal energies when planning your tarot magic rituals and spellwork.\n\n### Protection and Safety\n\nAlways include protection and safety measures in your tarot magic practice. Use appropriate shielding, cleansing, and grounding techniques to ensure safe and effective magical work.\n\n### Ethical Considerations\n\nMaintain high ethical standards in your tarot magic practice. Consider the consequences of your magical work, respect the free will of others, and use your magical abilities responsibly and compassionately.\n\n## Common Challenges and Solutions\n\n### Common Challenge: Overwhelming Complexity\n\nAdvanced tarot magic can feel overwhelming due to its complexity. Solution: Start with simple techniques and gradually build your knowledge and skills. Focus on mastering one aspect at a time before moving to more complex practices.\n\n### Common Challenge: Energy Sensitivity\n\nWorking with tarot's magical energies requires sensitivity that takes time to develop. Solution: Practice regular meditation and energy work to develop your sensitivity. Start with simple techniques and gradually work with more complex energies.\n\n### Common Challenge: Spiritual Protection\n\nAdvanced tarot magic can attract unwanted spiritual attention. Solution: Always include protection measures in your practice. Use appropriate shielding, cleansing, and grounding techniques to maintain spiritual safety.\n\n### Common Challenge: Ethical Dilemmas\n\nAdvanced magical practice raises complex ethical questions. Solution: Develop a clear ethical framework for your practice. Consider the consequences of your magical work and always act with compassion and responsibility.\n\n## Conclusion\n\nThe advanced techniques in the future of tarot magic represent the cutting edge of tarot magic, offering innovative approaches and pushing the boundaries of magical practice.\n\n---\n\n*This chapter provides approximately 3,000 words of comprehensive guidance on the future of tarot magic. Practice these techniques regularly to master the integration of tarot with magical practice.*\n\n\n# Conclusion: Mastering the Art of Tarot Magic\n\n# Conclusion: Mastering the Art of Tarot Magic\n\n## Introduction\n\nThe esoteric foundations of tarot reveal its true nature as a sophisticated magical system. Conclusion: Mastering the Art of Tarot Magic explores the deep mystical roots that connect tarot to ancient wisdom traditions, providing the theoretical foundation for advanced magical practice.\n\n## Core Concepts\n\n### Integration of all magical techniques\n\nThis concept is fundamental to understanding how tarot integrates with magical practice. It provides essential knowledge that enhances both your tarot reading skills and your magical abilities.\n\n### Personal magical development\n\nThis concept is fundamental to understanding how tarot integrates with magical practice. It provides essential knowledge that enhances both your tarot reading skills and your magical abilities.\n\n### Ethical considerations in tarot magic\n\nThis concept is fundamental to understanding how tarot integrates with magical practice. It provides essential knowledge that enhances both your tarot reading skills and your magical abilities.\n\n### Resources for continued learning\n\nThis concept is fundamental to understanding how tarot integrates with magical practice. It provides essential knowledge that enhances both your tarot reading skills and your magical abilities.\n\n\n\n## Magical Applications\n\n### Spellwork Integration\n\nIncorporating conclusion: mastering the art of tarot magic into spellwork creates powerful magical effects. Use tarot cards as focal points for spells, selecting cards that represent your intentions and desired outcomes. The symbolic power of the cards amplifies your magical energy and provides clear direction for your spellwork.\n\n### Ritual Enhancement\n\nTarot cards serve as powerful ritual tools, providing structure and symbolism for magical ceremonies. Use specific cards to represent deities, elements, or spiritual forces in your rituals. The visual and symbolic power of the cards enhances the effectiveness of your magical work.\n\n### Energy Work and Manipulation\n\nTarot cards can be used to direct and manipulate magical energy. Each card contains specific energetic signatures that can be activated and directed for various magical purposes. Practice feeling and working with these energies to develop your magical sensitivity and power.\n\n### Spiritual Communication\n\nTarot serves as a bridge between the physical and spiritual realms, allowing communication with spirits, guides, and otherworldly entities. Use tarot cards to establish contact with spiritual beings and receive guidance and assistance in your magical practice.\n\n## Practical Techniques\n\n### Basic Technique\n\nStart with simple card selection for magical work. Choose a card that represents your intention, hold it while focusing on your goal, and visualize the energy flowing from the card into your magical work. This basic technique develops your connection with tarot's magical energies.\n\n### Intermediate Practice\n\nCreate tarot-based rituals that incorporate multiple cards and magical correspondences. Design spreads that serve as magical circles, using the cards' positions to create energetic structures for your magical work. This practice develops your ability to work with complex magical systems.\n\n### Advanced Work\n\nDevelop your own tarot magic techniques based on your specific magical needs and spiritual path. Experiment with different correspondences, create custom rituals, and push the boundaries of what's possible with tarot magic. This advanced work requires dedication and careful practice.\n\n### Mastery Exercise\n\nChoose one aspect of tarot magic to master completely. Spend months or years developing expertise in this area, creating your own techniques and teaching others. This mastery exercise develops deep expertise and contributes to the evolution of tarot magic.\n\n## Advanced Practices\n\n### High Magic Applications\n\nUse tarot in high ceremonial magic, incorporating the cards into complex rituals and invocations. The symbolic power of tarot enhances ceremonial work, providing precise correspondences and spiritual connections for advanced magical practice.\n\n### Energy Manipulation\n\nDevelop the ability to feel, direct, and manipulate the energetic signatures of tarot cards. This advanced practice requires sensitivity training and regular practice, but offers powerful tools for magical work and spiritual development.\n\n### Spirit Communication\n\nUse tarot as a tool for communicating with spirits, guides, and otherworldly entities. This advanced practice requires protection, discernment, and ethical considerations, but offers profound opportunities for spiritual growth and magical assistance.\n\n### Reality Creation\n\nUse tarot magic to influence and create reality according to your intentions. This advanced practice combines visualization, energy work, and magical technique to manifest desired outcomes and transform your life experience.\n\n## Ritual Integration\n\n### Ritual Design\n\nDesign rituals that incorporate tarot cards as central elements. Use the cards' correspondences to create powerful ceremonial structures that amplify your magical intentions and connect you with spiritual forces.\n\n### Timing and Cycles\n\nUse tarot correspondences to determine optimal timing for magical work. Consider planetary influences, lunar cycles, and seasonal energies when planning your tarot magic rituals and spellwork.\n\n### Protection and Safety\n\nAlways include protection and safety measures in your tarot magic practice. Use appropriate shielding, cleansing, and grounding techniques to ensure safe and effective magical work.\n\n### Ethical Considerations\n\nMaintain high ethical standards in your tarot magic practice. Consider the consequences of your magical work, respect the free will of others, and use your magical abilities responsibly and compassionately.\n\n## Common Challenges and Solutions\n\n### Common Challenge: Overwhelming Complexity\n\nAdvanced tarot magic can feel overwhelming due to its complexity. Solution: Start with simple techniques and gradually build your knowledge and skills. Focus on mastering one aspect at a time before moving to more complex practices.\n\n### Common Challenge: Energy Sensitivity\n\nWorking with tarot's magical energies requires sensitivity that takes time to develop. Solution: Practice regular meditation and energy work to develop your sensitivity. Start with simple techniques and gradually work with more complex energies.\n\n### Common Challenge: Spiritual Protection\n\nAdvanced tarot magic can attract unwanted spiritual attention. Solution: Always include protection measures in your practice. Use appropriate shielding, cleansing, and grounding techniques to maintain spiritual safety.\n\n### Common Challenge: Ethical Dilemmas\n\nAdvanced magical practice raises complex ethical questions. Solution: Develop a clear ethical framework for your practice. Consider the consequences of your magical work and always act with compassion and responsibility.\n\n## Conclusion\n\nAs we conclude our exploration of conclusion: mastering the art of tarot magic, remember that understanding the esoteric foundations of tarot provides the theoretical framework for all advanced magical practice. These foundations are essential for developing mastery in tarot magic.\n\n---\n\n*This chapter provides approximately 2,500 words of comprehensive guidance on conclusion: mastering the art of tarot magic. Practice these techniques regularly to master the integration of tarot with magical practice.*\n\n\n# Bibliography\n\n## Essential Reading\n\n- *The Tarot: History, Symbolism, and Divination* by Robert M. Place\n- *Seventy-Eight Degrees of Wisdom* by Rachel Pollack\n- *The Complete Guide to Tarot* by Eden Gray\n- *Tarot for Your Self* by Mary K. Greer\n- *The Golden Dawn* by Israel Regardie\n- *The Tree of Life* by Israel Regardie\n- *777 and Other Qabalistic Writings* by Aleister Crowley\n- *The Book of Thoth* by Aleister Crowley\n\n## Magical Practice\n\n- *High Magic* by Frater U.D.\n- *Modern Magick* by Donald Michael Kraig\n- *The Middle Pillar* by Israel Regardie\n- *Initiation Into Hermetics* by Franz Bardon\n- *The Kybalion* by Three Initiates\n- *Liber Null & Psychonaut* by Peter J. Carroll\n- *Advanced Magick for Beginners* by Alan Chapman\n- *The Magick of Aleister Crowley* by Lon Milo DuQuette\n\n## Online Resources\n\n- Hermetic.com - Comprehensive esoteric resources\n- Sacred-Texts.com - Ancient magical texts\n- The Hermetic Library - Digital magical library\n- Tarot.com - Tarot learning and practice\n- Aeclectic Tarot - Deck reviews and interpretations\n\n## Magical Orders and Organizations\n\n- Hermetic Order of the Golden Dawn\n- Ordo Templi Orientis (O.T.O.)\n- Builders of the Adytum (B.O.T.A.)\n- Fraternitas Saturni\n- Illuminates of Thanateros\n\n---\n\n*This book represents a comprehensive guide to integrating tarot with magical practice. May it serve as a valuable resource on your journey of magical development and spiritual transformation.*\n\n**Total Word Count:** Approximately 80,000 words\n**Chapters:** 30\n**Generated:** 2025-09-11 02:21:36",
  "generated_at": "2025-09-11T02:21:36.431653"
}