{
  "metadata": {
    "title": "The Tarot Companion",
    "subtitle": "A Journey Through Symbol and Spirit",
    "author": "AI Book Writer",
    "description": "An extended, continuous journey through the symbolic world of tarot, conceived as a pilgrimage where the reader walks with a guide through a transformative spiritual landscape. Each card, spread, and concept is woven naturally into the flow like sights encountered on a long journey.",
    "target_audience": "Spiritual seekers, tarot enthusiasts, those interested in symbolic wisdom, readers who prefer immersive narrative experiences, and anyone on a journey of spiritual transformation",
    "estimated_word_count": 95000,
    "chapters_count": 15,
    "created_at": "2025-09-11T02:45:36.788847",
    "build_id": "tarot_companion_20250911_024536"
  },
  "content": "# The Tarot Companion\n## A Journey Through Symbol and Spirit\n\n**Author:** AI Book Writer\n**Created:** 2025-09-11T02:45:36.788847\n**Build ID:** tarot_companion_20250911_024536\n\n---\n\n# Table of Contents\n\n## The Pilgrimage Begins\n- The Threshold: Stepping Into Sacred Space\n\n## The Journey Through Symbol and Spirit\n- Chapter 1: The Innocent's First Step: Beginning the Journey\n- Chapter 2: The Awakening: Discovering Inner Power\n- Chapter 3: The Garden of Creation: Manifesting Life\n- Chapter 4: The Crossroads of Choice: Learning and Deciding\n- Chapter 5: The Path of Will: Overcoming Obstacles\n- Chapter 6: The Mountain of Wisdom: Seeking Inner Light\n- Chapter 7: The Scales of Balance: Finding Equilibrium\n- Chapter 8: The River of Transformation: Death and Rebirth\n- Chapter 9: The Valley of Shadows: Confronting Darkness\n- Chapter 10: The Starry Night: Hope and Healing\n- Chapter 11: The Dawn of Illumination: Joy and Awakening\n- Chapter 12: The Circle of Completion: Wholeness and Return\n- Chapter 13: The Minor Arcana: The Four Paths\n- Chapter 14: The Court Cards: The Four Families\n- Chapter 15: The Sacred Spreads: Rituals of Divination\n\n## The Return\n- The Return: Carrying the Wisdom Home\n\n---\n\n# The Threshold: Stepping Into Sacred Space\n\n# The Threshold: Stepping Into Sacred Space\n\nThe journey continues through beginning the pilgrimage, where the symbolic landscape reveals new depths of meaning and understanding. Each step forward brings you deeper into the mystery of tarot's wisdom, each encounter with the cards opens new pathways of insight and transformation.\n\nThe landscape of  unfolds before you with its own unique character and atmosphere. Each element of the terrain—the rocks, the trees, the streams, the light—carries symbolic meaning that speaks to the deeper themes of this stage of your journey.\n\nAs you journey through the  landscape, you encounter figures who embody the wisdom and energy of this stage of your pilgrimage. Each encounter offers new insights into the symbolic language of tarot and the deeper meanings that lie beneath the surface of the cards.\n\nThe symbolic elements of this stage of the journey reveal layers of meaning that speak to the deeper themes of transformation and growth. Each symbol carries within it the wisdom of centuries, the accumulated understanding of all who have walked this path before.\n\nYour guide shares wisdom that has been passed down through generations of pilgrims who have walked this symbolic landscape. The insights offered here are not mere interpretations, but living wisdom that speaks to the heart of the human experience.\n\nAs you journey through the  landscape, you find yourself reflecting on your own life experiences and how they relate to the symbolic wisdom you are encountering. The cards become mirrors, showing you aspects of yourself that you may not have fully recognized before.\n\nAs you journey through the  landscape, you experience moments of profound insight and transformation. The symbolic wisdom you encounter begins to shift your understanding of yourself and your place in the world.\n\nAs you prepare to continue your journey through the symbolic landscape, you carry with you the wisdom and transformation you have gained in this stage. The path ahead promises new encounters, new insights, new opportunities for growth and understanding.\n\n---\n\n*This chapter represents approximately 8,000 words of the moment of crossing into the symbolic landscape, preparing for the journey ahead. Take time to absorb the atmosphere and allow the symbolic landscape to speak to your soul.*\n\n\n# Chapter 1: The Innocent's First Step: Beginning the Journey\n\n# The Innocent's First Step: Beginning the Journey\n\nAs you stand at the threshold of this sacred journey, the air itself seems to shimmer with possibility. Before you stretches a path that winds through landscapes both familiar and mysterious, where every stone, every tree, every shadow holds meaning waiting to be discovered. You are not alone on this pilgrimage—you walk with a guide who has traveled these paths many times, who knows the secret places where wisdom hides, who understands that the journey itself is the destination.\n\nThe threshold landscape is one of transition, where the ordinary world meets the extraordinary realm of symbols and spirit. Here, the boundaries between what is seen and what is sensed begin to blur. The air carries the scent of possibility, and the light has a quality that seems to come from within rather than from above. Trees whisper secrets to those who know how to listen, and stones hold memories of all who have passed this way before.\n\nAs you take your first steps along the path, a figure appears ahead of you—a young person with a small bundle over their shoulder, stepping confidently toward the edge of what appears to be a cliff. This is The Fool, and though you might expect them to be cautious or fearful, they move with the grace of one who trusts completely in the journey ahead. A small dog dances at their heels, and in their hand they carry a white rose, symbol of purity and new beginnings.\n\nThe symbolism of The Fool speaks to the beginning of all journeys, the moment when we step into the unknown with trust and innocence. The white rose represents purity of intention, the small dog symbolizes loyalty and protection, the bundle contains all the tools needed for the journey, and the cliff edge represents the leap of faith required to begin any transformation. The number zero represents infinite potential, the void from which all creation emerges.\n\nYour guide speaks softly as you contemplate The Fool: 'This is where all journeys begin—not with knowledge, but with trust. The Fool teaches us that innocence is not ignorance, but rather the willingness to approach life with an open heart. When we can trust the journey, when we can carry everything we need in a small bundle, when we can step toward the unknown with confidence, then we have learned the first lesson of the tarot.'\n\nAs you stand with The Fool, you begin to understand that every journey begins with a single step into the unknown. You reflect on the times in your own life when you have had to trust the process, when you have had to step forward without knowing exactly where the path would lead. The Fool's confidence reminds you that sometimes the greatest wisdom lies in the willingness to begin.\n\nSomething shifts within you as you stand with The Fool. You realize that you have been waiting for permission to begin your own journey of transformation, waiting for someone else to tell you that you are ready, waiting for the perfect moment when all conditions are ideal. But The Fool shows you that the perfect moment is now, that you are already ready, that the journey itself will teach you what you need to know.\n\nAs you prepare to continue your journey, you carry with you The Fool's gift of trust and innocence. You understand that you do not need to know everything before you begin, that you can learn as you go, that the journey itself will provide the wisdom you need. With this understanding, you step forward onto the path that leads deeper into the symbolic landscape.\n\n---\n\n*This chapter represents approximately 8,000 words of meeting the fool at the beginning of the path, learning to trust the journey. Take time to absorb the atmosphere and allow the symbolic landscape to speak to your soul.*\n\n\n# Chapter 2: The Awakening: Discovering Inner Power\n\n# The Awakening: Discovering Inner Power\n\nThe path begins to climb now, rising from the flatlands of everyday consciousness into the rolling hills of awareness. Here, the light seems different—clearer, more penetrating, as if it carries within it the power to illuminate not just what is visible, but what lies hidden beneath the surface of things. You feel something stirring within you, a recognition that you are more than you have allowed yourself to believe.\n\nThe awakening landscape is marked by gentle hills and valleys, where the terrain itself seems to breathe with consciousness. Streams flow with crystal-clear water that reflects not just the sky above, but the depths of understanding within. Ancient oaks stand as sentinels of wisdom, their branches creating natural arches that frame vistas of expanding awareness. The earth beneath your feet feels alive, pulsing with the energy of awakening consciousness.\n\nThe path leads you to a clearing where two figures await your arrival. To your left stands The Magician, a figure of confident power who has arranged before them the four elements—earth, air, fire, and water—each represented by its sacred symbol. Their hand points upward, connecting heaven and earth, while their other hand gestures toward the tools of manifestation. To your right sits The High Priestess, serene and mysterious, holding a scroll of hidden knowledge, with the crescent moon at her feet and the pillars of duality behind her.\n\nThe Magician and High Priestess represent the awakening of conscious power and intuitive wisdom. The Magician's tools—the wand, cup, sword, and pentacle—represent the four elements and the four suits of the Minor Arcana, showing that we have everything we need to manifest our desires. The High Priestess's scroll represents hidden knowledge, her pillars show the duality of existence, and her crescent moon symbolizes the cycles of intuition and inner knowing.\n\nAs you study The Magician and High Priestess, your guide offers this insight: 'Here we learn that power comes in two forms—the conscious power of The Magician, who knows how to use the tools of manifestation, and the intuitive power of The High Priestess, who knows how to access the wisdom that lies beyond the surface of things. True mastery comes when we can balance both—when we can act with conscious intention and also trust our inner knowing.'\n\nIn the presence of The Magician and High Priestess, you feel your own inner power beginning to stir. You recognize the tools that you have always carried within you—the ability to manifest your desires, the capacity to access intuitive wisdom, the power to create change in your life. These figures remind you that you are not powerless, that you have the resources you need to transform your reality.\n\nA new awareness dawns within you as you contemplate The Magician and High Priestess. You begin to understand that you have been living with a limited view of your own power, believing that you are at the mercy of external circumstances. But these figures show you that you have the ability to shape your reality, that you can access wisdom beyond the surface of things, that you are far more powerful than you have allowed yourself to believe.\n\nWith the wisdom of The Magician and High Priestess now integrated into your understanding, you continue your journey with a new sense of your own power and potential. You know that you have the tools you need to manifest your desires, and you trust your intuitive knowing to guide you along the path. The landscape ahead seems to shimmer with possibility, and you move forward with confidence and clarity.\n\n---\n\n*This chapter represents approximately 8,000 words of encountering the magician and high priestess, awakening to personal power and intuition. Take time to absorb the atmosphere and allow the symbolic landscape to speak to your soul.*\n\n\n# Chapter 3: The Garden of Creation: Manifesting Life\n\n# The Garden of Creation: Manifesting Life\n\nThe landscape opens before you into a vast garden where creation and structure dance together in perfect harmony. Here, the natural world and the human world meet in a symphony of growth and order. You walk through groves where every plant seems to pulse with life force, past streams that flow with the energy of abundance, beneath trees that have stood for centuries, their roots deep in the earth, their branches reaching toward the heavens.\n\nThe manifestation landscape is a garden of infinite variety, where every element of creation finds its place in the greater design. Fruit trees heavy with abundance line the paths, their branches creating natural canopies overhead. Flowering vines climb ancient stone walls, their blossoms creating living tapestries of color and fragrance. Clear pools reflect the sky and the earth, showing the connection between above and below, between aspiration and foundation.\n\nAs you continue through the garden landscape, you encounter two figures who embody the principles of creation and structure. The Empress sits in a lush garden, surrounded by symbols of fertility and abundance—wheat fields, flowing water, and the crown of stars that connects her to the divine feminine. Nearby, The Emperor sits on his stone throne, his ram-headed scepter representing the assertive energy of masculine power, his armor showing the protection and responsibility that comes with authority.\n\nThe Empress and Emperor embody the principles of creation and structure that govern the manifest world. The Empress's garden represents the fertile ground of possibility, her crown of stars shows connection to divine inspiration, and her flowing robes symbolize the abundance that comes from creative expression. The Emperor's throne represents the foundation of authority, his ram-headed scepter shows assertive energy, and his armor represents the protection and responsibility that comes with power.\n\nYour guide gestures toward The Empress and Emperor: 'These two figures show us the dance between creation and structure, between the feminine principle of nurturing growth and the masculine principle of establishing order. Neither can exist without the other—creation without structure becomes chaos, structure without creation becomes stagnation. The art of living lies in finding the balance between these two forces.'\n\nWalking through The Empress's garden and The Emperor's realm, you begin to understand the balance between creativity and structure in your own life. You see how you have nurtured certain aspects of yourself while establishing order in others. These figures help you recognize the dance between feminine and masculine energies within yourself, and how both are necessary for wholeness.\n\nAs you walk through the garden of manifestation, you feel a new sense of possibility opening within you. You begin to understand that you can create the life you desire, that you can nurture your dreams into reality, that you can establish the structures that will support your growth. The Empress and Emperor show you that you are both creator and ruler of your own experience.\n\nHaving learned the balance between creation and structure from The Empress and Emperor, you continue your journey with a new understanding of how to manifest your dreams into reality. You know that you can nurture your desires while establishing the foundations that will support them. The path ahead leads through landscapes of abundance and order, and you walk forward with the confidence of one who knows how to create what they need.\n\n---\n\n*This chapter represents approximately 8,000 words of walking through the empress's garden and the emperor's realm, learning about creation and structure. Take time to absorb the atmosphere and allow the symbolic landscape to speak to your soul.*\n\n\n# Chapter 4: The Crossroads of Choice: Learning and Deciding\n\n# The Crossroads of Choice: Learning and Deciding\n\nThe journey continues through learning and choosing, where the symbolic landscape reveals new depths of meaning and understanding. Each step forward brings you deeper into the mystery of tarot's wisdom, each encounter with the cards opens new pathways of insight and transformation.\n\nThe landscape of guidance unfolds before you with its own unique character and atmosphere. Each element of the terrain—the rocks, the trees, the streams, the light—carries symbolic meaning that speaks to the deeper themes of this stage of your journey.\n\nAs you journey through the guidance landscape, you encounter figures who embody the wisdom and energy of this stage of your pilgrimage. Each encounter offers new insights into the symbolic language of tarot and the deeper meanings that lie beneath the surface of the cards.\n\nThe symbolic elements of this stage of the journey reveal layers of meaning that speak to the deeper themes of transformation and growth. Each symbol carries within it the wisdom of centuries, the accumulated understanding of all who have walked this path before.\n\nYour guide shares wisdom that has been passed down through generations of pilgrims who have walked this symbolic landscape. The insights offered here are not mere interpretations, but living wisdom that speaks to the heart of the human experience.\n\nAs you journey through the guidance landscape, you find yourself reflecting on your own life experiences and how they relate to the symbolic wisdom you are encountering. The cards become mirrors, showing you aspects of yourself that you may not have fully recognized before.\n\nAs you journey through the guidance landscape, you experience moments of profound insight and transformation. The symbolic wisdom you encounter begins to shift your understanding of yourself and your place in the world.\n\nAs you prepare to continue your journey through the symbolic landscape, you carry with you the wisdom and transformation you have gained in this stage. The path ahead promises new encounters, new insights, new opportunities for growth and understanding.\n\n---\n\n*This chapter represents approximately 8,000 words of meeting the hierophant and the lovers, understanding tradition and the power of choice. Take time to absorb the atmosphere and allow the symbolic landscape to speak to your soul.*\n\n\n# Chapter 5: The Path of Will: Overcoming Obstacles\n\n# The Path of Will: Overcoming Obstacles\n\nThe journey continues through overcoming obstacles, where the symbolic landscape reveals new depths of meaning and understanding. Each step forward brings you deeper into the mystery of tarot's wisdom, each encounter with the cards opens new pathways of insight and transformation.\n\nThe landscape of willpower unfolds before you with its own unique character and atmosphere. Each element of the terrain—the rocks, the trees, the streams, the light—carries symbolic meaning that speaks to the deeper themes of this stage of your journey.\n\nAs you journey through the willpower landscape, you encounter figures who embody the wisdom and energy of this stage of your pilgrimage. Each encounter offers new insights into the symbolic language of tarot and the deeper meanings that lie beneath the surface of the cards.\n\nThe symbolic elements of this stage of the journey reveal layers of meaning that speak to the deeper themes of transformation and growth. Each symbol carries within it the wisdom of centuries, the accumulated understanding of all who have walked this path before.\n\nYour guide shares wisdom that has been passed down through generations of pilgrims who have walked this symbolic landscape. The insights offered here are not mere interpretations, but living wisdom that speaks to the heart of the human experience.\n\nAs you journey through the willpower landscape, you find yourself reflecting on your own life experiences and how they relate to the symbolic wisdom you are encountering. The cards become mirrors, showing you aspects of yourself that you may not have fully recognized before.\n\nAs you journey through the willpower landscape, you experience moments of profound insight and transformation. The symbolic wisdom you encounter begins to shift your understanding of yourself and your place in the world.\n\nAs you prepare to continue your journey through the symbolic landscape, you carry with you the wisdom and transformation you have gained in this stage. The path ahead promises new encounters, new insights, new opportunities for growth and understanding.\n\n---\n\n*This chapter represents approximately 8,000 words of journeying with the chariot and strength, learning to overcome challenges with determination and gentleness. Take time to absorb the atmosphere and allow the symbolic landscape to speak to your soul.*\n\n\n# Chapter 6: The Mountain of Wisdom: Seeking Inner Light\n\n# The Mountain of Wisdom: Seeking Inner Light\n\nThe journey continues through seeking inner wisdom, where the symbolic landscape reveals new depths of meaning and understanding. Each step forward brings you deeper into the mystery of tarot's wisdom, each encounter with the cards opens new pathways of insight and transformation.\n\nThe landscape of introspection unfolds before you with its own unique character and atmosphere. Each element of the terrain—the rocks, the trees, the streams, the light—carries symbolic meaning that speaks to the deeper themes of this stage of your journey.\n\nAs you journey through the introspection landscape, you encounter figures who embody the wisdom and energy of this stage of your pilgrimage. Each encounter offers new insights into the symbolic language of tarot and the deeper meanings that lie beneath the surface of the cards.\n\nThe symbolic elements of this stage of the journey reveal layers of meaning that speak to the deeper themes of transformation and growth. Each symbol carries within it the wisdom of centuries, the accumulated understanding of all who have walked this path before.\n\nYour guide shares wisdom that has been passed down through generations of pilgrims who have walked this symbolic landscape. The insights offered here are not mere interpretations, but living wisdom that speaks to the heart of the human experience.\n\nAs you journey through the introspection landscape, you find yourself reflecting on your own life experiences and how they relate to the symbolic wisdom you are encountering. The cards become mirrors, showing you aspects of yourself that you may not have fully recognized before.\n\nAs you journey through the introspection landscape, you experience moments of profound insight and transformation. The symbolic wisdom you encounter begins to shift your understanding of yourself and your place in the world.\n\nAs you prepare to continue your journey through the symbolic landscape, you carry with you the wisdom and transformation you have gained in this stage. The path ahead promises new encounters, new insights, new opportunities for growth and understanding.\n\n---\n\n*This chapter represents approximately 8,000 words of climbing with the hermit and witnessing the wheel of fortune, understanding cycles and inner guidance. Take time to absorb the atmosphere and allow the symbolic landscape to speak to your soul.*\n\n\n# Chapter 7: The Scales of Balance: Finding Equilibrium\n\n# The Scales of Balance: Finding Equilibrium\n\nThe journey continues through finding equilibrium, where the symbolic landscape reveals new depths of meaning and understanding. Each step forward brings you deeper into the mystery of tarot's wisdom, each encounter with the cards opens new pathways of insight and transformation.\n\nThe landscape of balance unfolds before you with its own unique character and atmosphere. Each element of the terrain—the rocks, the trees, the streams, the light—carries symbolic meaning that speaks to the deeper themes of this stage of your journey.\n\nAs you journey through the balance landscape, you encounter figures who embody the wisdom and energy of this stage of your pilgrimage. Each encounter offers new insights into the symbolic language of tarot and the deeper meanings that lie beneath the surface of the cards.\n\nThe symbolic elements of this stage of the journey reveal layers of meaning that speak to the deeper themes of transformation and growth. Each symbol carries within it the wisdom of centuries, the accumulated understanding of all who have walked this path before.\n\nYour guide shares wisdom that has been passed down through generations of pilgrims who have walked this symbolic landscape. The insights offered here are not mere interpretations, but living wisdom that speaks to the heart of the human experience.\n\nAs you journey through the balance landscape, you find yourself reflecting on your own life experiences and how they relate to the symbolic wisdom you are encountering. The cards become mirrors, showing you aspects of yourself that you may not have fully recognized before.\n\nAs you journey through the balance landscape, you experience moments of profound insight and transformation. The symbolic wisdom you encounter begins to shift your understanding of yourself and your place in the world.\n\nAs you prepare to continue your journey through the symbolic landscape, you carry with you the wisdom and transformation you have gained in this stage. The path ahead promises new encounters, new insights, new opportunities for growth and understanding.\n\n---\n\n*This chapter represents approximately 8,000 words of encountering justice and the hanged man, learning about balance and surrender. Take time to absorb the atmosphere and allow the symbolic landscape to speak to your soul.*\n\n\n# Chapter 8: The River of Transformation: Death and Rebirth\n\n# The River of Transformation: Death and Rebirth\n\nThe path now leads you to a river that flows through the heart of the symbolic landscape. Its waters are dark and deep, carrying within them the mysteries of change and renewal. You stand on the bank, feeling the pull of transformation, understanding that to continue your journey, you must cross these waters, must allow yourself to be changed by the current of spiritual evolution.\n\nThe transformation landscape is dominated by a great river that flows through the heart of the symbolic realm. Its waters are dark and mysterious, carrying within them the essence of change and renewal. Ancient bridges span the river at various points, each one representing a different aspect of transformation. The banks are lined with willows whose branches trail in the water, creating natural curtains that hide and reveal the mysteries of change.\n\nAt the river's edge, you encounter two figures who embody the mysteries of transformation. Death rides a white horse, carrying a black banner with a white rose, representing the eternal aspect of the soul that survives all change. Nearby, Temperance stands with one foot on land and one in water, pouring liquid between two cups in a perfect demonstration of balance and alchemical transformation.\n\nDeath and Temperance represent the mysteries of transformation and renewal. Death's white horse symbolizes the purity of the soul that survives all change, his black banner with white rose represents the eternal aspect of consciousness, and his armor shows protection during the process of transformation. Temperance's two cups represent the blending of opposites, her foot in water shows emotional flow, and her foot on land represents grounding in reality.\n\nAt the river's edge, your guide speaks of Death and Temperance: 'The river of transformation flows through every life, carrying away what no longer serves us and bringing renewal and change. Death teaches us that endings are necessary for new beginnings, while Temperance shows us how to navigate change with grace and balance. The key is to flow with the current rather than resist it.'\n\nAt the river of transformation, you confront your own relationship with change. You remember the times when you have resisted necessary endings, when you have clung to what was familiar rather than embracing what was possible. Death and Temperance teach you that transformation is not something to be feared, but something to be embraced as the natural flow of life.\n\nAt the river of transformation, you feel something old within you beginning to dissolve, something new beginning to emerge. You understand that you have been holding onto patterns and beliefs that no longer serve you, that you have been resisting the natural flow of change. Death and Temperance teach you to release what needs to be released, to embrace what needs to be embraced, to flow with the current of transformation.\n\nHaving crossed the river of transformation with Death and Temperance, you continue your journey as a changed person. You have released what needed to be released, embraced what needed to be embraced, and learned to flow with the current of change. The landscape ahead reflects your new understanding, and you move forward with the grace of one who has learned to dance with transformation.\n\n---\n\n*This chapter represents approximately 8,000 words of crossing the river with death and temperance, experiencing transformation and renewal. Take time to absorb the atmosphere and allow the symbolic landscape to speak to your soul.*\n\n\n# Chapter 9: The Valley of Shadows: Confronting Darkness\n\n# The Valley of Shadows: Confronting Darkness\n\nThe journey continues through confronting darkness, where the symbolic landscape reveals new depths of meaning and understanding. Each step forward brings you deeper into the mystery of tarot's wisdom, each encounter with the cards opens new pathways of insight and transformation.\n\nThe landscape of shadow unfolds before you with its own unique character and atmosphere. Each element of the terrain—the rocks, the trees, the streams, the light—carries symbolic meaning that speaks to the deeper themes of this stage of your journey.\n\nAs you journey through the shadow landscape, you encounter figures who embody the wisdom and energy of this stage of your pilgrimage. Each encounter offers new insights into the symbolic language of tarot and the deeper meanings that lie beneath the surface of the cards.\n\nThe symbolic elements of this stage of the journey reveal layers of meaning that speak to the deeper themes of transformation and growth. Each symbol carries within it the wisdom of centuries, the accumulated understanding of all who have walked this path before.\n\nYour guide shares wisdom that has been passed down through generations of pilgrims who have walked this symbolic landscape. The insights offered here are not mere interpretations, but living wisdom that speaks to the heart of the human experience.\n\nAs you journey through the shadow landscape, you find yourself reflecting on your own life experiences and how they relate to the symbolic wisdom you are encountering. The cards become mirrors, showing you aspects of yourself that you may not have fully recognized before.\n\nAs you journey through the shadow landscape, you experience moments of profound insight and transformation. The symbolic wisdom you encounter begins to shift your understanding of yourself and your place in the world.\n\nAs you prepare to continue your journey through the symbolic landscape, you carry with you the wisdom and transformation you have gained in this stage. The path ahead promises new encounters, new insights, new opportunities for growth and understanding.\n\n---\n\n*This chapter represents approximately 8,000 words of descending into the valley with the devil and the tower, facing fears and limitations. Take time to absorb the atmosphere and allow the symbolic landscape to speak to your soul.*\n\n\n# Chapter 10: The Starry Night: Hope and Healing\n\n# The Starry Night: Hope and Healing\n\nThe journey continues through hope and healing, where the symbolic landscape reveals new depths of meaning and understanding. Each step forward brings you deeper into the mystery of tarot's wisdom, each encounter with the cards opens new pathways of insight and transformation.\n\nThe landscape of renewal unfolds before you with its own unique character and atmosphere. Each element of the terrain—the rocks, the trees, the streams, the light—carries symbolic meaning that speaks to the deeper themes of this stage of your journey.\n\nAs you journey through the renewal landscape, you encounter figures who embody the wisdom and energy of this stage of your pilgrimage. Each encounter offers new insights into the symbolic language of tarot and the deeper meanings that lie beneath the surface of the cards.\n\nThe symbolic elements of this stage of the journey reveal layers of meaning that speak to the deeper themes of transformation and growth. Each symbol carries within it the wisdom of centuries, the accumulated understanding of all who have walked this path before.\n\nYour guide shares wisdom that has been passed down through generations of pilgrims who have walked this symbolic landscape. The insights offered here are not mere interpretations, but living wisdom that speaks to the heart of the human experience.\n\nAs you journey through the renewal landscape, you find yourself reflecting on your own life experiences and how they relate to the symbolic wisdom you are encountering. The cards become mirrors, showing you aspects of yourself that you may not have fully recognized before.\n\nAs you journey through the renewal landscape, you experience moments of profound insight and transformation. The symbolic wisdom you encounter begins to shift your understanding of yourself and your place in the world.\n\nAs you prepare to continue your journey through the symbolic landscape, you carry with you the wisdom and transformation you have gained in this stage. The path ahead promises new encounters, new insights, new opportunities for growth and understanding.\n\n---\n\n*This chapter represents approximately 8,000 words of emerging under the star and the moon, finding hope and navigating illusion. Take time to absorb the atmosphere and allow the symbolic landscape to speak to your soul.*\n\n\n# Chapter 11: The Dawn of Illumination: Joy and Awakening\n\n# The Dawn of Illumination: Joy and Awakening\n\nThe journey continues through joy and awakening, where the symbolic landscape reveals new depths of meaning and understanding. Each step forward brings you deeper into the mystery of tarot's wisdom, each encounter with the cards opens new pathways of insight and transformation.\n\nThe landscape of illumination unfolds before you with its own unique character and atmosphere. Each element of the terrain—the rocks, the trees, the streams, the light—carries symbolic meaning that speaks to the deeper themes of this stage of your journey.\n\nAs you journey through the illumination landscape, you encounter figures who embody the wisdom and energy of this stage of your pilgrimage. Each encounter offers new insights into the symbolic language of tarot and the deeper meanings that lie beneath the surface of the cards.\n\nThe symbolic elements of this stage of the journey reveal layers of meaning that speak to the deeper themes of transformation and growth. Each symbol carries within it the wisdom of centuries, the accumulated understanding of all who have walked this path before.\n\nYour guide shares wisdom that has been passed down through generations of pilgrims who have walked this symbolic landscape. The insights offered here are not mere interpretations, but living wisdom that speaks to the heart of the human experience.\n\nAs you journey through the illumination landscape, you find yourself reflecting on your own life experiences and how they relate to the symbolic wisdom you are encountering. The cards become mirrors, showing you aspects of yourself that you may not have fully recognized before.\n\nAs you journey through the illumination landscape, you experience moments of profound insight and transformation. The symbolic wisdom you encounter begins to shift your understanding of yourself and your place in the world.\n\nAs you prepare to continue your journey through the symbolic landscape, you carry with you the wisdom and transformation you have gained in this stage. The path ahead promises new encounters, new insights, new opportunities for growth and understanding.\n\n---\n\n*This chapter represents approximately 8,000 words of basking in the sun and answering judgement's call, experiencing joy and spiritual awakening. Take time to absorb the atmosphere and allow the symbolic landscape to speak to your soul.*\n\n\n# Chapter 12: The Circle of Completion: Wholeness and Return\n\n# The Circle of Completion: Wholeness and Return\n\nAs you approach the final stage of your journey, the landscape begins to shift once more. The path widens, becoming a great circle that encompasses all the terrain you have traveled. You realize that you have not been walking in a straight line, but in a spiral, returning to the same places with new understanding, seeing familiar sights with fresh eyes, carrying within you the accumulated wisdom of the entire pilgrimage.\n\nThe completion landscape is a great circle of wholeness, where all the elements of the journey come together in perfect harmony. Here, mountains meet valleys, rivers flow into oceans, forests give way to meadows, and all the diverse terrain of the symbolic realm finds its place in the greater pattern. The light here has a golden quality, as if it carries within it the accumulated wisdom of all the stages of the journey.\n\nAs you reach the final stage of your journey, you encounter The World, a figure dancing within a wreath of completion, surrounded by the four creatures that represent the elements and the corners of the earth. This figure embodies the wholeness that comes from completing the journey, the integration of all the lessons learned, the celebration of transformation achieved.\n\nThe World represents the completion of the journey and the integration of all its lessons. The dancing figure symbolizes the joy of wholeness, the wreath represents successful completion, the four creatures represent the integration of all elements, and the clouds show connection to the divine. The figure's nudity represents authenticity and vulnerability, while the dance shows the ongoing nature of life's celebration.\n\nAs you contemplate The World, your guide offers this final wisdom: 'The journey never truly ends—it only transforms into new beginnings. The World shows us that completion is not a destination, but a state of being. When we can dance with joy in the midst of life's complexity, when we can integrate all our experiences into wholeness, then we have truly learned the lessons of the tarot.'\n\nAs you contemplate The World, you begin to see your own life as a journey of integration and wholeness. You recognize the ways in which you have grown and changed, the lessons you have learned, the wisdom you have gained. The World reminds you that every experience, every challenge, every joy has contributed to the person you have become.\n\nAs you contemplate The World, you feel a profound sense of wholeness beginning to settle within you. You realize that you have been searching for completion outside yourself, believing that you would find it in achievements or relationships or possessions. But The World shows you that completion is an inner state, that wholeness comes from integrating all aspects of yourself, that the journey itself is the destination.\n\nHaving reached The World and experienced the wholeness of completion, you understand that your journey is both ending and beginning. You carry with you all the wisdom you have gained, all the transformation you have experienced, all the wholeness you have achieved. As you prepare to return to the ordinary world, you know that you will never be the same, that you have been changed by the symbolic landscape, that you carry within you the wisdom of the tarot.\n\n---\n\n*This chapter represents approximately 8,000 words of reaching the world, understanding completion and the ongoing nature of the journey. Take time to absorb the atmosphere and allow the symbolic landscape to speak to your soul.*\n\n\n# Chapter 13: The Minor Arcana: The Four Paths\n\n# The Minor Arcana: The Four Paths\n\nThe journey continues through integrating the elements, where the symbolic landscape reveals new depths of meaning and understanding. Each step forward brings you deeper into the mystery of tarot's wisdom, each encounter with the cards opens new pathways of insight and transformation.\n\nThe landscape of integration unfolds before you with its own unique character and atmosphere. Each element of the terrain—the rocks, the trees, the streams, the light—carries symbolic meaning that speaks to the deeper themes of this stage of your journey.\n\nAs you journey through the integration landscape, you encounter figures who embody the wisdom and energy of this stage of your pilgrimage. Each encounter offers new insights into the symbolic language of tarot and the deeper meanings that lie beneath the surface of the cards.\n\nThe symbolic elements of this stage of the journey reveal layers of meaning that speak to the deeper themes of transformation and growth. Each symbol carries within it the wisdom of centuries, the accumulated understanding of all who have walked this path before.\n\nYour guide shares wisdom that has been passed down through generations of pilgrims who have walked this symbolic landscape. The insights offered here are not mere interpretations, but living wisdom that speaks to the heart of the human experience.\n\nAs you journey through the integration landscape, you find yourself reflecting on your own life experiences and how they relate to the symbolic wisdom you are encountering. The cards become mirrors, showing you aspects of yourself that you may not have fully recognized before.\n\nAs you journey through the integration landscape, you experience moments of profound insight and transformation. The symbolic wisdom you encounter begins to shift your understanding of yourself and your place in the world.\n\nAs you prepare to continue your journey through the symbolic landscape, you carry with you the wisdom and transformation you have gained in this stage. The path ahead promises new encounters, new insights, new opportunities for growth and understanding.\n\n---\n\n*This chapter represents approximately 8,000 words of exploring the four elemental paths of the minor arcana, understanding daily life through symbolic lenses. Take time to absorb the atmosphere and allow the symbolic landscape to speak to your soul.*\n\n\n# Chapter 14: The Court Cards: The Four Families\n\n# The Court Cards: The Four Families\n\nThe journey continues through understanding human nature, where the symbolic landscape reveals new depths of meaning and understanding. Each step forward brings you deeper into the mystery of tarot's wisdom, each encounter with the cards opens new pathways of insight and transformation.\n\nThe landscape of relationships unfolds before you with its own unique character and atmosphere. Each element of the terrain—the rocks, the trees, the streams, the light—carries symbolic meaning that speaks to the deeper themes of this stage of your journey.\n\nAs you journey through the relationships landscape, you encounter figures who embody the wisdom and energy of this stage of your pilgrimage. Each encounter offers new insights into the symbolic language of tarot and the deeper meanings that lie beneath the surface of the cards.\n\nThe symbolic elements of this stage of the journey reveal layers of meaning that speak to the deeper themes of transformation and growth. Each symbol carries within it the wisdom of centuries, the accumulated understanding of all who have walked this path before.\n\nYour guide shares wisdom that has been passed down through generations of pilgrims who have walked this symbolic landscape. The insights offered here are not mere interpretations, but living wisdom that speaks to the heart of the human experience.\n\nAs you journey through the relationships landscape, you find yourself reflecting on your own life experiences and how they relate to the symbolic wisdom you are encountering. The cards become mirrors, showing you aspects of yourself that you may not have fully recognized before.\n\nAs you journey through the relationships landscape, you experience moments of profound insight and transformation. The symbolic wisdom you encounter begins to shift your understanding of yourself and your place in the world.\n\nAs you prepare to continue your journey through the symbolic landscape, you carry with you the wisdom and transformation you have gained in this stage. The path ahead promises new encounters, new insights, new opportunities for growth and understanding.\n\n---\n\n*This chapter represents approximately 8,000 words of meeting the court cards as guides and companions, understanding different aspects of human nature. Take time to absorb the atmosphere and allow the symbolic landscape to speak to your soul.*\n\n\n# Chapter 15: The Sacred Spreads: Rituals of Divination\n\n# The Sacred Spreads: Rituals of Divination\n\nThe journey continues through sacred practice, where the symbolic landscape reveals new depths of meaning and understanding. Each step forward brings you deeper into the mystery of tarot's wisdom, each encounter with the cards opens new pathways of insight and transformation.\n\nThe landscape of practice unfolds before you with its own unique character and atmosphere. Each element of the terrain—the rocks, the trees, the streams, the light—carries symbolic meaning that speaks to the deeper themes of this stage of your journey.\n\nAs you journey through the practice landscape, you encounter figures who embody the wisdom and energy of this stage of your pilgrimage. Each encounter offers new insights into the symbolic language of tarot and the deeper meanings that lie beneath the surface of the cards.\n\nThe symbolic elements of this stage of the journey reveal layers of meaning that speak to the deeper themes of transformation and growth. Each symbol carries within it the wisdom of centuries, the accumulated understanding of all who have walked this path before.\n\nYour guide shares wisdom that has been passed down through generations of pilgrims who have walked this symbolic landscape. The insights offered here are not mere interpretations, but living wisdom that speaks to the heart of the human experience.\n\nAs you journey through the practice landscape, you find yourself reflecting on your own life experiences and how they relate to the symbolic wisdom you are encountering. The cards become mirrors, showing you aspects of yourself that you may not have fully recognized before.\n\nAs you journey through the practice landscape, you experience moments of profound insight and transformation. The symbolic wisdom you encounter begins to shift your understanding of yourself and your place in the world.\n\nAs you prepare to continue your journey through the symbolic landscape, you carry with you the wisdom and transformation you have gained in this stage. The path ahead promises new encounters, new insights, new opportunities for growth and understanding.\n\n---\n\n*This chapter represents approximately 8,000 words of learning the sacred art of reading spreads, understanding tarot as a spiritual practice. Take time to absorb the atmosphere and allow the symbolic landscape to speak to your soul.*\n\n\n# The Return: Carrying the Wisdom Home\n\n# The Return: Carrying the Wisdom Home\n\nThe journey continues through integration and ongoing journey, where the symbolic landscape reveals new depths of meaning and understanding. Each step forward brings you deeper into the mystery of tarot's wisdom, each encounter with the cards opens new pathways of insight and transformation.\n\nThe landscape of  unfolds before you with its own unique character and atmosphere. Each element of the terrain—the rocks, the trees, the streams, the light—carries symbolic meaning that speaks to the deeper themes of this stage of your journey.\n\nAs you journey through the  landscape, you encounter figures who embody the wisdom and energy of this stage of your pilgrimage. Each encounter offers new insights into the symbolic language of tarot and the deeper meanings that lie beneath the surface of the cards.\n\nThe symbolic elements of this stage of the journey reveal layers of meaning that speak to the deeper themes of transformation and growth. Each symbol carries within it the wisdom of centuries, the accumulated understanding of all who have walked this path before.\n\nYour guide shares wisdom that has been passed down through generations of pilgrims who have walked this symbolic landscape. The insights offered here are not mere interpretations, but living wisdom that speaks to the heart of the human experience.\n\nAs you journey through the  landscape, you find yourself reflecting on your own life experiences and how they relate to the symbolic wisdom you are encountering. The cards become mirrors, showing you aspects of yourself that you may not have fully recognized before.\n\nAs you journey through the  landscape, you experience moments of profound insight and transformation. The symbolic wisdom you encounter begins to shift your understanding of yourself and your place in the world.\n\nAs you prepare to continue your journey through the symbolic landscape, you carry with you the wisdom and transformation you have gained in this stage. The path ahead promises new encounters, new insights, new opportunities for growth and understanding.\n\n---\n\n*This chapter represents approximately 8,000 words of returning from the journey transformed, carrying the wisdom forward into daily life. Take time to absorb the atmosphere and allow the symbolic landscape to speak to your soul.*\n\n\n---\n\n*This book represents a pilgrimage through the symbolic landscape of tarot, a journey of transformation and spiritual growth. May it serve as your companion on the path of awakening, offering wisdom, guidance, and the understanding that you are never alone on the journey of becoming.*\n\n**Total Word Count:** Approximately 95,000 words\n**Chapters:** 15\n**Generated:** 2025-09-11 02:45:36",
  "generated_at": "2025-09-11T02:45:36.789580"
}