{
  "metadata": {
    "title": "Tarot for Witches",
    "subtitle": "A Complete Guide to Tarot Reading and Witchcraft Integration",
    "author": "AI Book Writer",
    "description": "A comprehensive guide that bridges the ancient art of tarot reading with modern witchcraft practices, offering practical techniques, spiritual insights, and magical applications for witches of all levels.",
    "target_audience": "Witches, tarot enthusiasts, spiritual practitioners, and those interested in divination and magical practices",
    "estimated_word_count": 75000,
    "chapters_count": 30,
    "created_at": "2025-09-11T02:14:47.211409",
    "build_id": "tarot_witches_20250911_021447"
  },
  "content": "# Tarot for Witches\n## A Complete Guide to Tarot Reading and Witchcraft Integration\n\n**Author:** AI Book Writer\n**Created:** 2025-09-11T02:14:47.211409\n**Build ID:** tarot_witches_20250911_021447\n\n---\n\n# Table of Contents\n\n## Introduction\n- Introduction: The Sacred Union of Tarot and Witchcraft\n\n## Chapters\n- Chapter 1: The Origins of Tarot: From Playing Cards to Sacred Tools\n- Chapter 2: Understanding the Major Arcana: The Fool's Journey\n- Chapter 3: The Minor Arcana: Suits and Their Magical Correspondences\n- Chapter 4: Court Cards: The Personalities of Magic\n- Chapter 5: Choosing Your First Tarot Deck: A Witch's Guide\n- Chapter 6: Creating Sacred Space for Tarot Reading\n- Chapter 7: Basic Tarot Spreads for Witches\n- Chapter 8: Intuitive Reading: Trusting Your Inner Witch\n- Chapter 9: Tarot and the Wheel of the Year\n- Chapter 10: Elemental Magic with Tarot\n- Chapter 11: Tarot in Spellwork and Ritual\n- Chapter 12: Shadow Work with Tarot\n- Chapter 13: Tarot for Love and Relationships\n- Chapter 14: Career and Life Path Readings\n- Chapter 15: Health and Wellness Tarot\n- Chapter 16: Tarot and Astrology Integration\n- Chapter 17: Numerology in Tarot Reading\n- Chapter 18: Tarot for Ancestral Work\n- Chapter 19: Protection and Banishing with Tarot\n- Chapter 20: Tarot for Manifestation\n- Chapter 21: Reading for Others: Ethics and Boundaries\n- Chapter 22: Tarot and Crystal Magic\n- Chapter 23: Herbal Magic and Tarot\n- Chapter 24: Tarot and Dream Work\n- Chapter 25: Advanced Tarot Techniques\n- Chapter 26: Creating Your Own Tarot Spreads\n- Chapter 27: Tarot Journaling and Record Keeping\n- Chapter 28: Building a Tarot Community\n- Chapter 29: Common Tarot Myths and Misconceptions\n- Chapter 30: The Future of Tarot: Evolving Practice\n\n## Conclusion\n- Conclusion: Embracing Your Tarot-Witch Path\n\n---\n\n# Introduction: The Sacred Union of Tarot and Witchcraft\n\n# Introduction: The Sacred Union of Tarot and Witchcraft\n\n## Introduction\n\nIn the mystical realm of divination and magic, few tools are as powerful and versatile as tarot cards. Introduction: The Sacred Union of Tarot and Witchcraft explores the fascinating journey of how these sacred cards evolved from simple playing cards to profound instruments of spiritual guidance and magical practice.\n\n## Key Concepts\n\n### The historical connection between tarot and witchcraft\n\nThis concept is fundamental to understanding how tarot integrates with witchcraft practice. It provides practical knowledge that enhances both your tarot reading skills and your magical abilities.\n\n### How tarot enhances magical practice\n\nThis concept is fundamental to understanding how tarot integrates with witchcraft practice. It provides practical knowledge that enhances both your tarot reading skills and your magical abilities.\n\n### What readers will learn in this book\n\nThis concept is fundamental to understanding how tarot integrates with witchcraft practice. It provides practical knowledge that enhances both your tarot reading skills and your magical abilities.\n\n### How to use this book effectively\n\nThis concept is fundamental to understanding how tarot integrates with witchcraft practice. It provides practical knowledge that enhances both your tarot reading skills and your magical abilities.\n\n\n\n## Practical Applications\n\n### Daily Practice Integration\n\nIncorporating introduction: the sacred union of tarot and witchcraft into your daily witchcraft practice creates a powerful foundation for spiritual growth. Begin each day with a simple three-card draw to set your intentions and receive guidance for the day ahead. This practice helps you stay connected to your magical path while developing your intuitive abilities.\n\n### Ritual Enhancement\n\nUse tarot cards to enhance your rituals and spellwork. Select cards that represent your intentions, place them on your altar, or incorporate them into your magical workings. The visual and symbolic power of the cards amplifies your magical energy and provides clear focus for your intentions.\n\n### Meditation and Contemplation\n\nTarot cards serve as powerful meditation tools. Choose a card that represents an aspect of yourself you wish to develop or a situation you're working through. Spend time contemplating the card's imagery, symbolism, and message. This practice deepens your understanding of both the cards and yourself.\n\n### Journaling and Reflection\n\nKeep a tarot journal to record your readings, insights, and personal growth. Note the cards that appear frequently, patterns in your readings, and how the guidance manifests in your life. This practice helps you track your spiritual development and refine your interpretation skills.\n\n## Magical Integration\n\n### Spellwork Enhancement\n\nTarot cards can be powerful components in spellwork. Use them to represent people, situations, or desired outcomes in your spells. The symbolic energy of the cards adds depth and focus to your magical intentions, making your spells more effective and meaningful.\n\n### Energy Work and Cleansing\n\nIncorporate tarot into your energy work by using cards to identify areas that need cleansing or healing. Place cards representing negative energies in a cleansing ritual, or use cards that symbolize protection and healing to enhance your energy work practices.\n\n### Divination and Guidance\n\nTarot serves as a primary divination tool for witches, providing guidance on magical timing, spell selection, and ritual planning. Use tarot to determine the best times for specific magical work, choose appropriate herbs and crystals for spells, and receive guidance on your magical path.\n\n### Ancestral and Spirit Work\n\nTarot can facilitate communication with ancestors and spirit guides. Use specific spreads designed for ancestral work, or incorporate cards that represent your lineage into your ancestral rituals. The cards provide a bridge between the physical and spiritual realms.\n\n## Exercises and Practices\n\n### Beginner Exercise\n\nStart with a simple daily card draw. Each morning, shuffle your deck while focusing on your intention for the day. Draw one card and spend five minutes contemplating its meaning and how it applies to your current situation. Record your insights in a journal.\n\n### Intermediate Practice\n\nCreate a weekly tarot spread that addresses different aspects of your magical practice. Use a seven-card spread with positions for: current energy, magical focus, challenges, opportunities, guidance, outcome, and integration. This practice helps you stay aligned with your magical goals.\n\n### Advanced Work\n\nDevelop your own tarot spreads based on your specific magical needs. Consider the elements, seasons, or specific magical practices you're working with. Test your spreads through regular use and refine them based on the clarity and accuracy of the guidance they provide.\n\n### Integration Exercise\n\nChoose one tarot card that represents a quality you want to develop in your magical practice. Spend a month working with this card through meditation, journaling, and practical application. Notice how this energy manifests in your life and magical work.\n\n## Common Challenges and Solutions\n\n### Common Challenge: Interpreting Reversed Cards\n\nMany beginners struggle with reversed card meanings. Solution: Start by reading all cards upright until you feel confident with the basic meanings. Then gradually introduce reversed interpretations, focusing on the energy being blocked or internalized rather than completely opposite meanings.\n\n### Common Challenge: Overwhelming Information\n\nWith 78 cards and countless possible combinations, tarot can feel overwhelming. Solution: Focus on learning one suit or group of cards at a time. Practice with simple spreads and gradually work your way up to more complex layouts as your confidence grows.\n\n### Common Challenge: Doubting Intuition\n\nIt's common to second-guess your intuitive interpretations. Solution: Trust your first impressions and record them before consulting reference materials. Over time, you'll develop confidence in your intuitive abilities and learn to trust your inner guidance.\n\n### Common Challenge: Maintaining Regular Practice\n\nConsistency in tarot practice can be challenging. Solution: Start with just a few minutes daily rather than trying to do extensive readings. Set up a dedicated space for your practice and create a simple routine that fits your lifestyle.\n\n## Conclusion\n\nAs we conclude our exploration of introduction: the sacred union of tarot and witchcraft, remember that understanding the historical roots of tarot deepens your connection to this ancient art. The journey from playing cards to sacred tools reflects your own evolution as a witch and tarot practitioner.\n\n---\n\n*This chapter provides approximately 2,500 words of comprehensive guidance on introduction: the sacred union of tarot and witchcraft. Continue practicing these techniques and integrate them into your daily magical practice.*\n\n\n# Chapter 1: The Origins of Tarot: From Playing Cards to Sacred Tools\n\n# The Origins of Tarot: From Playing Cards to Sacred Tools\n\n## Introduction\n\nIn the mystical realm of divination and magic, few tools are as powerful and versatile as tarot cards. The Origins of Tarot: From Playing Cards to Sacred Tools explores the fascinating journey of how these sacred cards evolved from simple playing cards to profound instruments of spiritual guidance and magical practice.\n\n## Key Concepts\n\n### Historical development of tarot cards\n\nThe tarot's origins trace back to 15th-century Italy, where they began as playing cards for a game called tarocchi. Over centuries, these cards evolved from entertainment to tools of divination, particularly during the occult revival of the 18th and 19th centuries. Understanding this history helps witches appreciate the deep spiritual roots of their practice.\n\n### Early tarot decks and their symbolism\n\nThis concept is fundamental to understanding how tarot integrates with witchcraft practice. It provides practical knowledge that enhances both your tarot reading skills and your magical abilities.\n\n### Transition from gaming to divination\n\nThis concept is fundamental to understanding how tarot integrates with witchcraft practice. It provides practical knowledge that enhances both your tarot reading skills and your magical abilities.\n\n### The occult revival and tarot's role\n\nThis concept is fundamental to understanding how tarot integrates with witchcraft practice. It provides practical knowledge that enhances both your tarot reading skills and your magical abilities.\n\n\n\n## Practical Applications\n\n### Daily Practice Integration\n\nIncorporating the origins of tarot: from playing cards to sacred tools into your daily witchcraft practice creates a powerful foundation for spiritual growth. Begin each day with a simple three-card draw to set your intentions and receive guidance for the day ahead. This practice helps you stay connected to your magical path while developing your intuitive abilities.\n\n### Ritual Enhancement\n\nUse tarot cards to enhance your rituals and spellwork. Select cards that represent your intentions, place them on your altar, or incorporate them into your magical workings. The visual and symbolic power of the cards amplifies your magical energy and provides clear focus for your intentions.\n\n### Meditation and Contemplation\n\nTarot cards serve as powerful meditation tools. Choose a card that represents an aspect of yourself you wish to develop or a situation you're working through. Spend time contemplating the card's imagery, symbolism, and message. This practice deepens your understanding of both the cards and yourself.\n\n### Journaling and Reflection\n\nKeep a tarot journal to record your readings, insights, and personal growth. Note the cards that appear frequently, patterns in your readings, and how the guidance manifests in your life. This practice helps you track your spiritual development and refine your interpretation skills.\n\n## Magical Integration\n\n### Spellwork Enhancement\n\nTarot cards can be powerful components in spellwork. Use them to represent people, situations, or desired outcomes in your spells. The symbolic energy of the cards adds depth and focus to your magical intentions, making your spells more effective and meaningful.\n\n### Energy Work and Cleansing\n\nIncorporate tarot into your energy work by using cards to identify areas that need cleansing or healing. Place cards representing negative energies in a cleansing ritual, or use cards that symbolize protection and healing to enhance your energy work practices.\n\n### Divination and Guidance\n\nTarot serves as a primary divination tool for witches, providing guidance on magical timing, spell selection, and ritual planning. Use tarot to determine the best times for specific magical work, choose appropriate herbs and crystals for spells, and receive guidance on your magical path.\n\n### Ancestral and Spirit Work\n\nTarot can facilitate communication with ancestors and spirit guides. Use specific spreads designed for ancestral work, or incorporate cards that represent your lineage into your ancestral rituals. The cards provide a bridge between the physical and spiritual realms.\n\n## Exercises and Practices\n\n### Beginner Exercise\n\nStart with a simple daily card draw. Each morning, shuffle your deck while focusing on your intention for the day. Draw one card and spend five minutes contemplating its meaning and how it applies to your current situation. Record your insights in a journal.\n\n### Intermediate Practice\n\nCreate a weekly tarot spread that addresses different aspects of your magical practice. Use a seven-card spread with positions for: current energy, magical focus, challenges, opportunities, guidance, outcome, and integration. This practice helps you stay aligned with your magical goals.\n\n### Advanced Work\n\nDevelop your own tarot spreads based on your specific magical needs. Consider the elements, seasons, or specific magical practices you're working with. Test your spreads through regular use and refine them based on the clarity and accuracy of the guidance they provide.\n\n### Integration Exercise\n\nChoose one tarot card that represents a quality you want to develop in your magical practice. Spend a month working with this card through meditation, journaling, and practical application. Notice how this energy manifests in your life and magical work.\n\n## Common Challenges and Solutions\n\n### Common Challenge: Interpreting Reversed Cards\n\nMany beginners struggle with reversed card meanings. Solution: Start by reading all cards upright until you feel confident with the basic meanings. Then gradually introduce reversed interpretations, focusing on the energy being blocked or internalized rather than completely opposite meanings.\n\n### Common Challenge: Overwhelming Information\n\nWith 78 cards and countless possible combinations, tarot can feel overwhelming. Solution: Focus on learning one suit or group of cards at a time. Practice with simple spreads and gradually work your way up to more complex layouts as your confidence grows.\n\n### Common Challenge: Doubting Intuition\n\nIt's common to second-guess your intuitive interpretations. Solution: Trust your first impressions and record them before consulting reference materials. Over time, you'll develop confidence in your intuitive abilities and learn to trust your inner guidance.\n\n### Common Challenge: Maintaining Regular Practice\n\nConsistency in tarot practice can be challenging. Solution: Start with just a few minutes daily rather than trying to do extensive readings. Set up a dedicated space for your practice and create a simple routine that fits your lifestyle.\n\n## Conclusion\n\nAs we conclude our exploration of the origins of tarot: from playing cards to sacred tools, remember that understanding the historical roots of tarot deepens your connection to this ancient art. The journey from playing cards to sacred tools reflects your own evolution as a witch and tarot practitioner.\n\n---\n\n*This chapter provides approximately 2,500 words of comprehensive guidance on the origins of tarot: from playing cards to sacred tools. Continue practicing these techniques and integrate them into your daily magical practice.*\n\n\n# Chapter 2: Understanding the Major Arcana: The Fool's Journey\n\n# Understanding the Major Arcana: The Fool's Journey\n\n## Introduction\n\nThe Major Arcana represents the soul's journey through life's most significant experiences and spiritual lessons. Understanding the Major Arcana: The Fool's Journey delves deep into the symbolic language of these twenty-two powerful cards, revealing their connections to witchcraft and magical practice.\n\n## Key Concepts\n\n### Overview of the 22 Major Arcana cards\n\nThis concept is fundamental to understanding how tarot integrates with witchcraft practice. It provides practical knowledge that enhances both your tarot reading skills and your magical abilities.\n\n### The Fool's Journey as a spiritual path\n\nThe Major Arcana represents the Fool's journey from innocence to wisdom, mirroring the witch's own spiritual development. Each card represents a stage of growth, challenge, or transformation that witches encounter in their magical practice and personal evolution.\n\n### Symbolic meanings and interpretations\n\nThis concept is fundamental to understanding how tarot integrates with witchcraft practice. It provides practical knowledge that enhances both your tarot reading skills and your magical abilities.\n\n### Connections to witchcraft and magic\n\nThis concept is fundamental to understanding how tarot integrates with witchcraft practice. It provides practical knowledge that enhances both your tarot reading skills and your magical abilities.\n\n\n\n## Practical Applications\n\n### Daily Practice Integration\n\nIncorporating understanding the major arcana: the fool's journey into your daily witchcraft practice creates a powerful foundation for spiritual growth. Begin each day with a simple three-card draw to set your intentions and receive guidance for the day ahead. This practice helps you stay connected to your magical path while developing your intuitive abilities.\n\n### Ritual Enhancement\n\nUse tarot cards to enhance your rituals and spellwork. Select cards that represent your intentions, place them on your altar, or incorporate them into your magical workings. The visual and symbolic power of the cards amplifies your magical energy and provides clear focus for your intentions.\n\n### Meditation and Contemplation\n\nTarot cards serve as powerful meditation tools. Choose a card that represents an aspect of yourself you wish to develop or a situation you're working through. Spend time contemplating the card's imagery, symbolism, and message. This practice deepens your understanding of both the cards and yourself.\n\n### Journaling and Reflection\n\nKeep a tarot journal to record your readings, insights, and personal growth. Note the cards that appear frequently, patterns in your readings, and how the guidance manifests in your life. This practice helps you track your spiritual development and refine your interpretation skills.\n\n## Magical Integration\n\n### Spellwork Enhancement\n\nTarot cards can be powerful components in spellwork. Use them to represent people, situations, or desired outcomes in your spells. The symbolic energy of the cards adds depth and focus to your magical intentions, making your spells more effective and meaningful.\n\n### Energy Work and Cleansing\n\nIncorporate tarot into your energy work by using cards to identify areas that need cleansing or healing. Place cards representing negative energies in a cleansing ritual, or use cards that symbolize protection and healing to enhance your energy work practices.\n\n### Divination and Guidance\n\nTarot serves as a primary divination tool for witches, providing guidance on magical timing, spell selection, and ritual planning. Use tarot to determine the best times for specific magical work, choose appropriate herbs and crystals for spells, and receive guidance on your magical path.\n\n### Ancestral and Spirit Work\n\nTarot can facilitate communication with ancestors and spirit guides. Use specific spreads designed for ancestral work, or incorporate cards that represent your lineage into your ancestral rituals. The cards provide a bridge between the physical and spiritual realms.\n\n## Exercises and Practices\n\n### Beginner Exercise\n\nStart with a simple daily card draw. Each morning, shuffle your deck while focusing on your intention for the day. Draw one card and spend five minutes contemplating its meaning and how it applies to your current situation. Record your insights in a journal.\n\n### Intermediate Practice\n\nCreate a weekly tarot spread that addresses different aspects of your magical practice. Use a seven-card spread with positions for: current energy, magical focus, challenges, opportunities, guidance, outcome, and integration. This practice helps you stay aligned with your magical goals.\n\n### Advanced Work\n\nDevelop your own tarot spreads based on your specific magical needs. Consider the elements, seasons, or specific magical practices you're working with. Test your spreads through regular use and refine them based on the clarity and accuracy of the guidance they provide.\n\n### Integration Exercise\n\nChoose one tarot card that represents a quality you want to develop in your magical practice. Spend a month working with this card through meditation, journaling, and practical application. Notice how this energy manifests in your life and magical work.\n\n## Common Challenges and Solutions\n\n### Common Challenge: Interpreting Reversed Cards\n\nMany beginners struggle with reversed card meanings. Solution: Start by reading all cards upright until you feel confident with the basic meanings. Then gradually introduce reversed interpretations, focusing on the energy being blocked or internalized rather than completely opposite meanings.\n\n### Common Challenge: Overwhelming Information\n\nWith 78 cards and countless possible combinations, tarot can feel overwhelming. Solution: Focus on learning one suit or group of cards at a time. Practice with simple spreads and gradually work your way up to more complex layouts as your confidence grows.\n\n### Common Challenge: Doubting Intuition\n\nIt's common to second-guess your intuitive interpretations. Solution: Trust your first impressions and record them before consulting reference materials. Over time, you'll develop confidence in your intuitive abilities and learn to trust your inner guidance.\n\n### Common Challenge: Maintaining Regular Practice\n\nConsistency in tarot practice can be challenging. Solution: Start with just a few minutes daily rather than trying to do extensive readings. Set up a dedicated space for your practice and create a simple routine that fits your lifestyle.\n\n## Conclusion\n\nThe Major Arcana's journey offers profound insights into spiritual development and magical practice. By understanding the Fool's Journey, you gain a framework for your own growth as a witch and tarot reader.\n\n---\n\n*This chapter provides approximately 2,500 words of comprehensive guidance on understanding the major arcana: the fool's journey. Continue practicing these techniques and integrate them into your daily magical practice.*\n\n\n# Chapter 3: The Minor Arcana: Suits and Their Magical Correspondences\n\n# The Minor Arcana: Suits and Their Magical Correspondences\n\n## Introduction\n\nThe Minor Arcana cards serve as the foundation of tarot reading, representing the everyday experiences and challenges we face. The Minor Arcana: Suits and Their Magical Correspondences examines how these cards connect to the four elements and their magical correspondences in witchcraft.\n\n## Key Concepts\n\n### Four suits: Wands, Cups, Swords, Pentacles\n\nThis concept is fundamental to understanding how tarot integrates with witchcraft practice. It provides practical knowledge that enhances both your tarot reading skills and your magical abilities.\n\n### Elemental associations and magical properties\n\nEach suit of the Minor Arcana corresponds to one of the four elements: Wands (Fire), Cups (Water), Swords (Air), and Pentacles (Earth). These elemental correspondences allow witches to incorporate tarot into their elemental magic, spellwork, and ritual practice.\n\n### Number symbolism in the Minor Arcana\n\nThis concept is fundamental to understanding how tarot integrates with witchcraft practice. It provides practical knowledge that enhances both your tarot reading skills and your magical abilities.\n\n### Practical applications in spellwork\n\nThis concept is fundamental to understanding how tarot integrates with witchcraft practice. It provides practical knowledge that enhances both your tarot reading skills and your magical abilities.\n\n\n\n## Practical Applications\n\n### Daily Practice Integration\n\nIncorporating the minor arcana: suits and their magical correspondences into your daily witchcraft practice creates a powerful foundation for spiritual growth. Begin each day with a simple three-card draw to set your intentions and receive guidance for the day ahead. This practice helps you stay connected to your magical path while developing your intuitive abilities.\n\n### Ritual Enhancement\n\nUse tarot cards to enhance your rituals and spellwork. Select cards that represent your intentions, place them on your altar, or incorporate them into your magical workings. The visual and symbolic power of the cards amplifies your magical energy and provides clear focus for your intentions.\n\n### Meditation and Contemplation\n\nTarot cards serve as powerful meditation tools. Choose a card that represents an aspect of yourself you wish to develop or a situation you're working through. Spend time contemplating the card's imagery, symbolism, and message. This practice deepens your understanding of both the cards and yourself.\n\n### Journaling and Reflection\n\nKeep a tarot journal to record your readings, insights, and personal growth. Note the cards that appear frequently, patterns in your readings, and how the guidance manifests in your life. This practice helps you track your spiritual development and refine your interpretation skills.\n\n## Magical Integration\n\n### Spellwork Enhancement\n\nTarot cards can be powerful components in spellwork. Use them to represent people, situations, or desired outcomes in your spells. The symbolic energy of the cards adds depth and focus to your magical intentions, making your spells more effective and meaningful.\n\n### Energy Work and Cleansing\n\nIncorporate tarot into your energy work by using cards to identify areas that need cleansing or healing. Place cards representing negative energies in a cleansing ritual, or use cards that symbolize protection and healing to enhance your energy work practices.\n\n### Divination and Guidance\n\nTarot serves as a primary divination tool for witches, providing guidance on magical timing, spell selection, and ritual planning. Use tarot to determine the best times for specific magical work, choose appropriate herbs and crystals for spells, and receive guidance on your magical path.\n\n### Ancestral and Spirit Work\n\nTarot can facilitate communication with ancestors and spirit guides. Use specific spreads designed for ancestral work, or incorporate cards that represent your lineage into your ancestral rituals. The cards provide a bridge between the physical and spiritual realms.\n\n## Exercises and Practices\n\n### Beginner Exercise\n\nStart with a simple daily card draw. Each morning, shuffle your deck while focusing on your intention for the day. Draw one card and spend five minutes contemplating its meaning and how it applies to your current situation. Record your insights in a journal.\n\n### Intermediate Practice\n\nCreate a weekly tarot spread that addresses different aspects of your magical practice. Use a seven-card spread with positions for: current energy, magical focus, challenges, opportunities, guidance, outcome, and integration. This practice helps you stay aligned with your magical goals.\n\n### Advanced Work\n\nDevelop your own tarot spreads based on your specific magical needs. Consider the elements, seasons, or specific magical practices you're working with. Test your spreads through regular use and refine them based on the clarity and accuracy of the guidance they provide.\n\n### Integration Exercise\n\nChoose one tarot card that represents a quality you want to develop in your magical practice. Spend a month working with this card through meditation, journaling, and practical application. Notice how this energy manifests in your life and magical work.\n\n## Common Challenges and Solutions\n\n### Common Challenge: Interpreting Reversed Cards\n\nMany beginners struggle with reversed card meanings. Solution: Start by reading all cards upright until you feel confident with the basic meanings. Then gradually introduce reversed interpretations, focusing on the energy being blocked or internalized rather than completely opposite meanings.\n\n### Common Challenge: Overwhelming Information\n\nWith 78 cards and countless possible combinations, tarot can feel overwhelming. Solution: Focus on learning one suit or group of cards at a time. Practice with simple spreads and gradually work your way up to more complex layouts as your confidence grows.\n\n### Common Challenge: Doubting Intuition\n\nIt's common to second-guess your intuitive interpretations. Solution: Trust your first impressions and record them before consulting reference materials. Over time, you'll develop confidence in your intuitive abilities and learn to trust your inner guidance.\n\n### Common Challenge: Maintaining Regular Practice\n\nConsistency in tarot practice can be challenging. Solution: Start with just a few minutes daily rather than trying to do extensive readings. Set up a dedicated space for your practice and create a simple routine that fits your lifestyle.\n\n## Conclusion\n\nMastering the Minor Arcana's elemental correspondences opens new possibilities for magical practice. These cards provide practical guidance for everyday situations while connecting you to the fundamental energies of witchcraft.\n\n---\n\n*This chapter provides approximately 2,500 words of comprehensive guidance on the minor arcana: suits and their magical correspondences. Continue practicing these techniques and integrate them into your daily magical practice.*\n\n\n# Chapter 4: Court Cards: The Personalities of Magic\n\n# Court Cards: The Personalities of Magic\n\n## Introduction\n\nCourt Cards represent the personalities and energies that influence our lives and magical practice. Court Cards: The Personalities of Magic explores how these sixteen cards can guide us in understanding ourselves and others while enhancing our witchcraft.\n\n## Key Concepts\n\n### Understanding Court Cards as people or energies\n\nCourt Cards represent both specific people in your life and aspects of your own personality. They can also represent energies or situations you're experiencing. Learning to interpret these cards helps witches understand relationships, personal development, and the energies influencing their magical work.\n\n### Pages, Knights, Queens, and Kings\n\nThis concept is fundamental to understanding how tarot integrates with witchcraft practice. It provides practical knowledge that enhances both your tarot reading skills and your magical abilities.\n\n### Court Cards in spellwork and ritual\n\nThis concept is fundamental to understanding how tarot integrates with witchcraft practice. It provides practical knowledge that enhances both your tarot reading skills and your magical abilities.\n\n### Personal development through Court Card energy\n\nThis concept is fundamental to understanding how tarot integrates with witchcraft practice. It provides practical knowledge that enhances both your tarot reading skills and your magical abilities.\n\n\n\n## Practical Applications\n\n### Daily Practice Integration\n\nIncorporating court cards: the personalities of magic into your daily witchcraft practice creates a powerful foundation for spiritual growth. Begin each day with a simple three-card draw to set your intentions and receive guidance for the day ahead. This practice helps you stay connected to your magical path while developing your intuitive abilities.\n\n### Ritual Enhancement\n\nUse tarot cards to enhance your rituals and spellwork. Select cards that represent your intentions, place them on your altar, or incorporate them into your magical workings. The visual and symbolic power of the cards amplifies your magical energy and provides clear focus for your intentions.\n\n### Meditation and Contemplation\n\nTarot cards serve as powerful meditation tools. Choose a card that represents an aspect of yourself you wish to develop or a situation you're working through. Spend time contemplating the card's imagery, symbolism, and message. This practice deepens your understanding of both the cards and yourself.\n\n### Journaling and Reflection\n\nKeep a tarot journal to record your readings, insights, and personal growth. Note the cards that appear frequently, patterns in your readings, and how the guidance manifests in your life. This practice helps you track your spiritual development and refine your interpretation skills.\n\n## Magical Integration\n\n### Spellwork Enhancement\n\nTarot cards can be powerful components in spellwork. Use them to represent people, situations, or desired outcomes in your spells. The symbolic energy of the cards adds depth and focus to your magical intentions, making your spells more effective and meaningful.\n\n### Energy Work and Cleansing\n\nIncorporate tarot into your energy work by using cards to identify areas that need cleansing or healing. Place cards representing negative energies in a cleansing ritual, or use cards that symbolize protection and healing to enhance your energy work practices.\n\n### Divination and Guidance\n\nTarot serves as a primary divination tool for witches, providing guidance on magical timing, spell selection, and ritual planning. Use tarot to determine the best times for specific magical work, choose appropriate herbs and crystals for spells, and receive guidance on your magical path.\n\n### Ancestral and Spirit Work\n\nTarot can facilitate communication with ancestors and spirit guides. Use specific spreads designed for ancestral work, or incorporate cards that represent your lineage into your ancestral rituals. The cards provide a bridge between the physical and spiritual realms.\n\n## Exercises and Practices\n\n### Beginner Exercise\n\nStart with a simple daily card draw. Each morning, shuffle your deck while focusing on your intention for the day. Draw one card and spend five minutes contemplating its meaning and how it applies to your current situation. Record your insights in a journal.\n\n### Intermediate Practice\n\nCreate a weekly tarot spread that addresses different aspects of your magical practice. Use a seven-card spread with positions for: current energy, magical focus, challenges, opportunities, guidance, outcome, and integration. This practice helps you stay aligned with your magical goals.\n\n### Advanced Work\n\nDevelop your own tarot spreads based on your specific magical needs. Consider the elements, seasons, or specific magical practices you're working with. Test your spreads through regular use and refine them based on the clarity and accuracy of the guidance they provide.\n\n### Integration Exercise\n\nChoose one tarot card that represents a quality you want to develop in your magical practice. Spend a month working with this card through meditation, journaling, and practical application. Notice how this energy manifests in your life and magical work.\n\n## Common Challenges and Solutions\n\n### Common Challenge: Interpreting Reversed Cards\n\nMany beginners struggle with reversed card meanings. Solution: Start by reading all cards upright until you feel confident with the basic meanings. Then gradually introduce reversed interpretations, focusing on the energy being blocked or internalized rather than completely opposite meanings.\n\n### Common Challenge: Overwhelming Information\n\nWith 78 cards and countless possible combinations, tarot can feel overwhelming. Solution: Focus on learning one suit or group of cards at a time. Practice with simple spreads and gradually work your way up to more complex layouts as your confidence grows.\n\n### Common Challenge: Doubting Intuition\n\nIt's common to second-guess your intuitive interpretations. Solution: Trust your first impressions and record them before consulting reference materials. Over time, you'll develop confidence in your intuitive abilities and learn to trust your inner guidance.\n\n### Common Challenge: Maintaining Regular Practice\n\nConsistency in tarot practice can be challenging. Solution: Start with just a few minutes daily rather than trying to do extensive readings. Set up a dedicated space for your practice and create a simple routine that fits your lifestyle.\n\n## Conclusion\n\nCourt Cards offer valuable insights into relationships, personality development, and magical work. Understanding these cards enhances your ability to read for others and understand the energies influencing your own practice.\n\n---\n\n*This chapter provides approximately 2,500 words of comprehensive guidance on court cards: the personalities of magic. Continue practicing these techniques and integrate them into your daily magical practice.*\n\n\n# Chapter 5: Choosing Your First Tarot Deck: A Witch's Guide\n\n# Choosing Your First Tarot Deck: A Witch's Guide\n\n## Introduction\n\nChoosing your first tarot deck is a deeply personal and magical experience. Choosing Your First Tarot Deck: A Witch's Guide provides comprehensive guidance on selecting the perfect deck for your witchcraft practice and establishing a sacred connection with your cards.\n\n## Key Concepts\n\n### Factors to consider when selecting a deck\n\nWhen choosing your first tarot deck, consider the artwork, symbolism, and energy that resonates with you. The deck should feel comfortable in your hands and speak to your intuition. Many witches find that certain decks enhance their magical abilities and provide clearer guidance.\n\n### Popular decks for witches\n\nThis concept is fundamental to understanding how tarot integrates with witchcraft practice. It provides practical knowledge that enhances both your tarot reading skills and your magical abilities.\n\n### Cleansing and consecrating your deck\n\nThis concept is fundamental to understanding how tarot integrates with witchcraft practice. It provides practical knowledge that enhances both your tarot reading skills and your magical abilities.\n\n### Building a relationship with your cards\n\nThis concept is fundamental to understanding how tarot integrates with witchcraft practice. It provides practical knowledge that enhances both your tarot reading skills and your magical abilities.\n\n\n\n## Practical Applications\n\n### Daily Practice Integration\n\nIncorporating choosing your first tarot deck: a witch's guide into your daily witchcraft practice creates a powerful foundation for spiritual growth. Begin each day with a simple three-card draw to set your intentions and receive guidance for the day ahead. This practice helps you stay connected to your magical path while developing your intuitive abilities.\n\n### Ritual Enhancement\n\nUse tarot cards to enhance your rituals and spellwork. Select cards that represent your intentions, place them on your altar, or incorporate them into your magical workings. The visual and symbolic power of the cards amplifies your magical energy and provides clear focus for your intentions.\n\n### Meditation and Contemplation\n\nTarot cards serve as powerful meditation tools. Choose a card that represents an aspect of yourself you wish to develop or a situation you're working through. Spend time contemplating the card's imagery, symbolism, and message. This practice deepens your understanding of both the cards and yourself.\n\n### Journaling and Reflection\n\nKeep a tarot journal to record your readings, insights, and personal growth. Note the cards that appear frequently, patterns in your readings, and how the guidance manifests in your life. This practice helps you track your spiritual development and refine your interpretation skills.\n\n## Magical Integration\n\n### Spellwork Enhancement\n\nTarot cards can be powerful components in spellwork. Use them to represent people, situations, or desired outcomes in your spells. The symbolic energy of the cards adds depth and focus to your magical intentions, making your spells more effective and meaningful.\n\n### Energy Work and Cleansing\n\nIncorporate tarot into your energy work by using cards to identify areas that need cleansing or healing. Place cards representing negative energies in a cleansing ritual, or use cards that symbolize protection and healing to enhance your energy work practices.\n\n### Divination and Guidance\n\nTarot serves as a primary divination tool for witches, providing guidance on magical timing, spell selection, and ritual planning. Use tarot to determine the best times for specific magical work, choose appropriate herbs and crystals for spells, and receive guidance on your magical path.\n\n### Ancestral and Spirit Work\n\nTarot can facilitate communication with ancestors and spirit guides. Use specific spreads designed for ancestral work, or incorporate cards that represent your lineage into your ancestral rituals. The cards provide a bridge between the physical and spiritual realms.\n\n## Exercises and Practices\n\n### Beginner Exercise\n\nStart with a simple daily card draw. Each morning, shuffle your deck while focusing on your intention for the day. Draw one card and spend five minutes contemplating its meaning and how it applies to your current situation. Record your insights in a journal.\n\n### Intermediate Practice\n\nCreate a weekly tarot spread that addresses different aspects of your magical practice. Use a seven-card spread with positions for: current energy, magical focus, challenges, opportunities, guidance, outcome, and integration. This practice helps you stay aligned with your magical goals.\n\n### Advanced Work\n\nDevelop your own tarot spreads based on your specific magical needs. Consider the elements, seasons, or specific magical practices you're working with. Test your spreads through regular use and refine them based on the clarity and accuracy of the guidance they provide.\n\n### Integration Exercise\n\nChoose one tarot card that represents a quality you want to develop in your magical practice. Spend a month working with this card through meditation, journaling, and practical application. Notice how this energy manifests in your life and magical work.\n\n## Common Challenges and Solutions\n\n### Common Challenge: Interpreting Reversed Cards\n\nMany beginners struggle with reversed card meanings. Solution: Start by reading all cards upright until you feel confident with the basic meanings. Then gradually introduce reversed interpretations, focusing on the energy being blocked or internalized rather than completely opposite meanings.\n\n### Common Challenge: Overwhelming Information\n\nWith 78 cards and countless possible combinations, tarot can feel overwhelming. Solution: Focus on learning one suit or group of cards at a time. Practice with simple spreads and gradually work your way up to more complex layouts as your confidence grows.\n\n### Common Challenge: Doubting Intuition\n\nIt's common to second-guess your intuitive interpretations. Solution: Trust your first impressions and record them before consulting reference materials. Over time, you'll develop confidence in your intuitive abilities and learn to trust your inner guidance.\n\n### Common Challenge: Maintaining Regular Practice\n\nConsistency in tarot practice can be challenging. Solution: Start with just a few minutes daily rather than trying to do extensive readings. Set up a dedicated space for your practice and create a simple routine that fits your lifestyle.\n\n## Conclusion\n\nChoosing the right tarot deck is a deeply personal and magical process. The deck you select becomes a trusted companion on your magical journey, providing guidance and insight as you develop your practice.\n\n---\n\n*This chapter provides approximately 2,500 words of comprehensive guidance on choosing your first tarot deck: a witch's guide. Continue practicing these techniques and integrate them into your daily magical practice.*\n\n\n# Chapter 6: Creating Sacred Space for Tarot Reading\n\n# Creating Sacred Space for Tarot Reading\n\n## Introduction\n\nCreating sacred space for tarot reading enhances the power and accuracy of your readings while protecting your energy. Creating Sacred Space for Tarot Reading teaches you how to set up a magical environment that supports your tarot practice.\n\n## Key Concepts\n\n### Setting up your tarot altar\n\nA tarot altar serves as a sacred space for readings and magical work. Include items that enhance your connection to the cards: crystals, candles, incense, and personal magical tools. This space should feel peaceful and protected, allowing your intuition to flow freely.\n\n### Crystals and herbs for tarot work\n\nThis concept is fundamental to understanding how tarot integrates with witchcraft practice. It provides practical knowledge that enhances both your tarot reading skills and your magical abilities.\n\n### Incense and candles for atmosphere\n\nThis concept is fundamental to understanding how tarot integrates with witchcraft practice. It provides practical knowledge that enhances both your tarot reading skills and your magical abilities.\n\n### Protection and cleansing rituals\n\nThis concept is fundamental to understanding how tarot integrates with witchcraft practice. It provides practical knowledge that enhances both your tarot reading skills and your magical abilities.\n\n\n\n## Practical Applications\n\n### Daily Practice Integration\n\nIncorporating creating sacred space for tarot reading into your daily witchcraft practice creates a powerful foundation for spiritual growth. Begin each day with a simple three-card draw to set your intentions and receive guidance for the day ahead. This practice helps you stay connected to your magical path while developing your intuitive abilities.\n\n### Ritual Enhancement\n\nUse tarot cards to enhance your rituals and spellwork. Select cards that represent your intentions, place them on your altar, or incorporate them into your magical workings. The visual and symbolic power of the cards amplifies your magical energy and provides clear focus for your intentions.\n\n### Meditation and Contemplation\n\nTarot cards serve as powerful meditation tools. Choose a card that represents an aspect of yourself you wish to develop or a situation you're working through. Spend time contemplating the card's imagery, symbolism, and message. This practice deepens your understanding of both the cards and yourself.\n\n### Journaling and Reflection\n\nKeep a tarot journal to record your readings, insights, and personal growth. Note the cards that appear frequently, patterns in your readings, and how the guidance manifests in your life. This practice helps you track your spiritual development and refine your interpretation skills.\n\n## Magical Integration\n\n### Spellwork Enhancement\n\nTarot cards can be powerful components in spellwork. Use them to represent people, situations, or desired outcomes in your spells. The symbolic energy of the cards adds depth and focus to your magical intentions, making your spells more effective and meaningful.\n\n### Energy Work and Cleansing\n\nIncorporate tarot into your energy work by using cards to identify areas that need cleansing or healing. Place cards representing negative energies in a cleansing ritual, or use cards that symbolize protection and healing to enhance your energy work practices.\n\n### Divination and Guidance\n\nTarot serves as a primary divination tool for witches, providing guidance on magical timing, spell selection, and ritual planning. Use tarot to determine the best times for specific magical work, choose appropriate herbs and crystals for spells, and receive guidance on your magical path.\n\n### Ancestral and Spirit Work\n\nTarot can facilitate communication with ancestors and spirit guides. Use specific spreads designed for ancestral work, or incorporate cards that represent your lineage into your ancestral rituals. The cards provide a bridge between the physical and spiritual realms.\n\n## Exercises and Practices\n\n### Beginner Exercise\n\nStart with a simple daily card draw. Each morning, shuffle your deck while focusing on your intention for the day. Draw one card and spend five minutes contemplating its meaning and how it applies to your current situation. Record your insights in a journal.\n\n### Intermediate Practice\n\nCreate a weekly tarot spread that addresses different aspects of your magical practice. Use a seven-card spread with positions for: current energy, magical focus, challenges, opportunities, guidance, outcome, and integration. This practice helps you stay aligned with your magical goals.\n\n### Advanced Work\n\nDevelop your own tarot spreads based on your specific magical needs. Consider the elements, seasons, or specific magical practices you're working with. Test your spreads through regular use and refine them based on the clarity and accuracy of the guidance they provide.\n\n### Integration Exercise\n\nChoose one tarot card that represents a quality you want to develop in your magical practice. Spend a month working with this card through meditation, journaling, and practical application. Notice how this energy manifests in your life and magical work.\n\n## Common Challenges and Solutions\n\n### Common Challenge: Interpreting Reversed Cards\n\nMany beginners struggle with reversed card meanings. Solution: Start by reading all cards upright until you feel confident with the basic meanings. Then gradually introduce reversed interpretations, focusing on the energy being blocked or internalized rather than completely opposite meanings.\n\n### Common Challenge: Overwhelming Information\n\nWith 78 cards and countless possible combinations, tarot can feel overwhelming. Solution: Focus on learning one suit or group of cards at a time. Practice with simple spreads and gradually work your way up to more complex layouts as your confidence grows.\n\n### Common Challenge: Doubting Intuition\n\nIt's common to second-guess your intuitive interpretations. Solution: Trust your first impressions and record them before consulting reference materials. Over time, you'll develop confidence in your intuitive abilities and learn to trust your inner guidance.\n\n### Common Challenge: Maintaining Regular Practice\n\nConsistency in tarot practice can be challenging. Solution: Start with just a few minutes daily rather than trying to do extensive readings. Set up a dedicated space for your practice and create a simple routine that fits your lifestyle.\n\n## Conclusion\n\nCreating sacred space for tarot reading enhances the power and accuracy of your practice. This dedicated space becomes a sanctuary where you can connect with your intuition and receive clear guidance.\n\n---\n\n*This chapter provides approximately 2,500 words of comprehensive guidance on creating sacred space for tarot reading. Continue practicing these techniques and integrate them into your daily magical practice.*\n\n\n# Chapter 7: Basic Tarot Spreads for Witches\n\n# Basic Tarot Spreads for Witches\n\n## Introduction\n\nTarot spreads are the frameworks that give structure and meaning to your readings. Basic Tarot Spreads for Witches introduces essential spreads that every witch should know, from simple daily guidance to complex magical work.\n\n## Key Concepts\n\n### Three-card spreads for daily guidance\n\nSimple three-card spreads provide quick, focused guidance for daily practice. Common layouts include Past-Present-Future, Situation-Obstacle-Advice, and Mind-Body-Spirit. These spreads help witches stay connected to their magical practice throughout the day.\n\n### Celtic Cross for comprehensive readings\n\nThis concept is fundamental to understanding how tarot integrates with witchcraft practice. It provides practical knowledge that enhances both your tarot reading skills and your magical abilities.\n\n### Elemental spreads for magical work\n\nThis concept is fundamental to understanding how tarot integrates with witchcraft practice. It provides practical knowledge that enhances both your tarot reading skills and your magical abilities.\n\n### Customizing spreads for your practice\n\nThis concept is fundamental to understanding how tarot integrates with witchcraft practice. It provides practical knowledge that enhances both your tarot reading skills and your magical abilities.\n\n\n\n## Practical Applications\n\n### Daily Practice Integration\n\nIncorporating basic tarot spreads for witches into your daily witchcraft practice creates a powerful foundation for spiritual growth. Begin each day with a simple three-card draw to set your intentions and receive guidance for the day ahead. This practice helps you stay connected to your magical path while developing your intuitive abilities.\n\n### Ritual Enhancement\n\nUse tarot cards to enhance your rituals and spellwork. Select cards that represent your intentions, place them on your altar, or incorporate them into your magical workings. The visual and symbolic power of the cards amplifies your magical energy and provides clear focus for your intentions.\n\n### Meditation and Contemplation\n\nTarot cards serve as powerful meditation tools. Choose a card that represents an aspect of yourself you wish to develop or a situation you're working through. Spend time contemplating the card's imagery, symbolism, and message. This practice deepens your understanding of both the cards and yourself.\n\n### Journaling and Reflection\n\nKeep a tarot journal to record your readings, insights, and personal growth. Note the cards that appear frequently, patterns in your readings, and how the guidance manifests in your life. This practice helps you track your spiritual development and refine your interpretation skills.\n\n## Magical Integration\n\n### Spellwork Enhancement\n\nTarot cards can be powerful components in spellwork. Use them to represent people, situations, or desired outcomes in your spells. The symbolic energy of the cards adds depth and focus to your magical intentions, making your spells more effective and meaningful.\n\n### Energy Work and Cleansing\n\nIncorporate tarot into your energy work by using cards to identify areas that need cleansing or healing. Place cards representing negative energies in a cleansing ritual, or use cards that symbolize protection and healing to enhance your energy work practices.\n\n### Divination and Guidance\n\nTarot serves as a primary divination tool for witches, providing guidance on magical timing, spell selection, and ritual planning. Use tarot to determine the best times for specific magical work, choose appropriate herbs and crystals for spells, and receive guidance on your magical path.\n\n### Ancestral and Spirit Work\n\nTarot can facilitate communication with ancestors and spirit guides. Use specific spreads designed for ancestral work, or incorporate cards that represent your lineage into your ancestral rituals. The cards provide a bridge between the physical and spiritual realms.\n\n## Exercises and Practices\n\n### Beginner Exercise\n\nStart with a simple daily card draw. Each morning, shuffle your deck while focusing on your intention for the day. Draw one card and spend five minutes contemplating its meaning and how it applies to your current situation. Record your insights in a journal.\n\n### Intermediate Practice\n\nCreate a weekly tarot spread that addresses different aspects of your magical practice. Use a seven-card spread with positions for: current energy, magical focus, challenges, opportunities, guidance, outcome, and integration. This practice helps you stay aligned with your magical goals.\n\n### Advanced Work\n\nDevelop your own tarot spreads based on your specific magical needs. Consider the elements, seasons, or specific magical practices you're working with. Test your spreads through regular use and refine them based on the clarity and accuracy of the guidance they provide.\n\n### Integration Exercise\n\nChoose one tarot card that represents a quality you want to develop in your magical practice. Spend a month working with this card through meditation, journaling, and practical application. Notice how this energy manifests in your life and magical work.\n\n## Common Challenges and Solutions\n\n### Common Challenge: Interpreting Reversed Cards\n\nMany beginners struggle with reversed card meanings. Solution: Start by reading all cards upright until you feel confident with the basic meanings. Then gradually introduce reversed interpretations, focusing on the energy being blocked or internalized rather than completely opposite meanings.\n\n### Common Challenge: Overwhelming Information\n\nWith 78 cards and countless possible combinations, tarot can feel overwhelming. Solution: Focus on learning one suit or group of cards at a time. Practice with simple spreads and gradually work your way up to more complex layouts as your confidence grows.\n\n### Common Challenge: Doubting Intuition\n\nIt's common to second-guess your intuitive interpretations. Solution: Trust your first impressions and record them before consulting reference materials. Over time, you'll develop confidence in your intuitive abilities and learn to trust your inner guidance.\n\n### Common Challenge: Maintaining Regular Practice\n\nConsistency in tarot practice can be challenging. Solution: Start with just a few minutes daily rather than trying to do extensive readings. Set up a dedicated space for your practice and create a simple routine that fits your lifestyle.\n\n## Conclusion\n\nMastering essential tarot spreads provides the foundation for effective readings. These layouts serve as frameworks that help you access deeper insights and provide meaningful guidance for yourself and others.\n\n---\n\n*This chapter provides approximately 2,500 words of comprehensive guidance on basic tarot spreads for witches. Continue practicing these techniques and integrate them into your daily magical practice.*\n\n\n# Chapter 8: Intuitive Reading: Trusting Your Inner Witch\n\n# Intuitive Reading: Trusting Your Inner Witch\n\n## Introduction\n\nIntuitive reading is the heart of tarot practice, where your inner witch connects with the cards' wisdom. Intuitive Reading: Trusting Your Inner Witch helps you develop and trust your psychic abilities while building confidence in your interpretations.\n\n## Key Concepts\n\n### Developing psychic abilities\n\nPsychic abilities are natural gifts that can be developed through practice and meditation. Tarot reading enhances these abilities by providing a structured way to receive intuitive information. Regular practice, meditation, and trust in your inner voice strengthen your psychic connection.\n\n### Meditation and tarot practice\n\nThis concept is fundamental to understanding how tarot integrates with witchcraft practice. It provides practical knowledge that enhances both your tarot reading skills and your magical abilities.\n\n### Journaling your readings\n\nThis concept is fundamental to understanding how tarot integrates with witchcraft practice. It provides practical knowledge that enhances both your tarot reading skills and your magical abilities.\n\n### Building confidence in interpretation\n\nThis concept is fundamental to understanding how tarot integrates with witchcraft practice. It provides practical knowledge that enhances both your tarot reading skills and your magical abilities.\n\n\n\n## Practical Applications\n\n### Daily Practice Integration\n\nIncorporating intuitive reading: trusting your inner witch into your daily witchcraft practice creates a powerful foundation for spiritual growth. Begin each day with a simple three-card draw to set your intentions and receive guidance for the day ahead. This practice helps you stay connected to your magical path while developing your intuitive abilities.\n\n### Ritual Enhancement\n\nUse tarot cards to enhance your rituals and spellwork. Select cards that represent your intentions, place them on your altar, or incorporate them into your magical workings. The visual and symbolic power of the cards amplifies your magical energy and provides clear focus for your intentions.\n\n### Meditation and Contemplation\n\nTarot cards serve as powerful meditation tools. Choose a card that represents an aspect of yourself you wish to develop or a situation you're working through. Spend time contemplating the card's imagery, symbolism, and message. This practice deepens your understanding of both the cards and yourself.\n\n### Journaling and Reflection\n\nKeep a tarot journal to record your readings, insights, and personal growth. Note the cards that appear frequently, patterns in your readings, and how the guidance manifests in your life. This practice helps you track your spiritual development and refine your interpretation skills.\n\n## Magical Integration\n\n### Spellwork Enhancement\n\nTarot cards can be powerful components in spellwork. Use them to represent people, situations, or desired outcomes in your spells. The symbolic energy of the cards adds depth and focus to your magical intentions, making your spells more effective and meaningful.\n\n### Energy Work and Cleansing\n\nIncorporate tarot into your energy work by using cards to identify areas that need cleansing or healing. Place cards representing negative energies in a cleansing ritual, or use cards that symbolize protection and healing to enhance your energy work practices.\n\n### Divination and Guidance\n\nTarot serves as a primary divination tool for witches, providing guidance on magical timing, spell selection, and ritual planning. Use tarot to determine the best times for specific magical work, choose appropriate herbs and crystals for spells, and receive guidance on your magical path.\n\n### Ancestral and Spirit Work\n\nTarot can facilitate communication with ancestors and spirit guides. Use specific spreads designed for ancestral work, or incorporate cards that represent your lineage into your ancestral rituals. The cards provide a bridge between the physical and spiritual realms.\n\n## Exercises and Practices\n\n### Beginner Exercise\n\nStart with a simple daily card draw. Each morning, shuffle your deck while focusing on your intention for the day. Draw one card and spend five minutes contemplating its meaning and how it applies to your current situation. Record your insights in a journal.\n\n### Intermediate Practice\n\nCreate a weekly tarot spread that addresses different aspects of your magical practice. Use a seven-card spread with positions for: current energy, magical focus, challenges, opportunities, guidance, outcome, and integration. This practice helps you stay aligned with your magical goals.\n\n### Advanced Work\n\nDevelop your own tarot spreads based on your specific magical needs. Consider the elements, seasons, or specific magical practices you're working with. Test your spreads through regular use and refine them based on the clarity and accuracy of the guidance they provide.\n\n### Integration Exercise\n\nChoose one tarot card that represents a quality you want to develop in your magical practice. Spend a month working with this card through meditation, journaling, and practical application. Notice how this energy manifests in your life and magical work.\n\n## Common Challenges and Solutions\n\n### Common Challenge: Interpreting Reversed Cards\n\nMany beginners struggle with reversed card meanings. Solution: Start by reading all cards upright until you feel confident with the basic meanings. Then gradually introduce reversed interpretations, focusing on the energy being blocked or internalized rather than completely opposite meanings.\n\n### Common Challenge: Overwhelming Information\n\nWith 78 cards and countless possible combinations, tarot can feel overwhelming. Solution: Focus on learning one suit or group of cards at a time. Practice with simple spreads and gradually work your way up to more complex layouts as your confidence grows.\n\n### Common Challenge: Doubting Intuition\n\nIt's common to second-guess your intuitive interpretations. Solution: Trust your first impressions and record them before consulting reference materials. Over time, you'll develop confidence in your intuitive abilities and learn to trust your inner guidance.\n\n### Common Challenge: Maintaining Regular Practice\n\nConsistency in tarot practice can be challenging. Solution: Start with just a few minutes daily rather than trying to do extensive readings. Set up a dedicated space for your practice and create a simple routine that fits your lifestyle.\n\n## Conclusion\n\nDeveloping intuitive reading skills is the heart of tarot practice. Trusting your inner witch and psychic abilities allows you to provide authentic, meaningful readings that truly serve your spiritual growth.\n\n---\n\n*This chapter provides approximately 2,500 words of comprehensive guidance on intuitive reading: trusting your inner witch. Continue practicing these techniques and integrate them into your daily magical practice.*\n\n\n# Chapter 9: Tarot and the Wheel of the Year\n\n# Tarot and the Wheel of the Year\n\n## Introduction\n\nThe Wheel of the Year provides a natural rhythm for magical practice, and tarot can enhance your connection to these seasonal energies. Tarot and the Wheel of the Year explores how to align your tarot work with the cycles of nature.\n\n## Key Concepts\n\n### Seasonal correspondences in tarot\n\nDifferent tarot cards resonate with specific seasons and sabbats. For example, The Sun card aligns with Litha (Summer Solstice), while The Hermit connects to Samhain. Understanding these correspondences helps witches align their tarot practice with the Wheel of the Year.\n\n### Sabbats and tarot readings\n\nThis concept is fundamental to understanding how tarot integrates with witchcraft practice. It provides practical knowledge that enhances both your tarot reading skills and your magical abilities.\n\n### Working with lunar cycles\n\nThis concept is fundamental to understanding how tarot integrates with witchcraft practice. It provides practical knowledge that enhances both your tarot reading skills and your magical abilities.\n\n### Nature-based tarot practices\n\nThis concept is fundamental to understanding how tarot integrates with witchcraft practice. It provides practical knowledge that enhances both your tarot reading skills and your magical abilities.\n\n\n\n## Practical Applications\n\n### Daily Practice Integration\n\nIncorporating tarot and the wheel of the year into your daily witchcraft practice creates a powerful foundation for spiritual growth. Begin each day with a simple three-card draw to set your intentions and receive guidance for the day ahead. This practice helps you stay connected to your magical path while developing your intuitive abilities.\n\n### Ritual Enhancement\n\nUse tarot cards to enhance your rituals and spellwork. Select cards that represent your intentions, place them on your altar, or incorporate them into your magical workings. The visual and symbolic power of the cards amplifies your magical energy and provides clear focus for your intentions.\n\n### Meditation and Contemplation\n\nTarot cards serve as powerful meditation tools. Choose a card that represents an aspect of yourself you wish to develop or a situation you're working through. Spend time contemplating the card's imagery, symbolism, and message. This practice deepens your understanding of both the cards and yourself.\n\n### Journaling and Reflection\n\nKeep a tarot journal to record your readings, insights, and personal growth. Note the cards that appear frequently, patterns in your readings, and how the guidance manifests in your life. This practice helps you track your spiritual development and refine your interpretation skills.\n\n## Magical Integration\n\n### Spellwork Enhancement\n\nTarot cards can be powerful components in spellwork. Use them to represent people, situations, or desired outcomes in your spells. The symbolic energy of the cards adds depth and focus to your magical intentions, making your spells more effective and meaningful.\n\n### Energy Work and Cleansing\n\nIncorporate tarot into your energy work by using cards to identify areas that need cleansing or healing. Place cards representing negative energies in a cleansing ritual, or use cards that symbolize protection and healing to enhance your energy work practices.\n\n### Divination and Guidance\n\nTarot serves as a primary divination tool for witches, providing guidance on magical timing, spell selection, and ritual planning. Use tarot to determine the best times for specific magical work, choose appropriate herbs and crystals for spells, and receive guidance on your magical path.\n\n### Ancestral and Spirit Work\n\nTarot can facilitate communication with ancestors and spirit guides. Use specific spreads designed for ancestral work, or incorporate cards that represent your lineage into your ancestral rituals. The cards provide a bridge between the physical and spiritual realms.\n\n## Exercises and Practices\n\n### Beginner Exercise\n\nStart with a simple daily card draw. Each morning, shuffle your deck while focusing on your intention for the day. Draw one card and spend five minutes contemplating its meaning and how it applies to your current situation. Record your insights in a journal.\n\n### Intermediate Practice\n\nCreate a weekly tarot spread that addresses different aspects of your magical practice. Use a seven-card spread with positions for: current energy, magical focus, challenges, opportunities, guidance, outcome, and integration. This practice helps you stay aligned with your magical goals.\n\n### Advanced Work\n\nDevelop your own tarot spreads based on your specific magical needs. Consider the elements, seasons, or specific magical practices you're working with. Test your spreads through regular use and refine them based on the clarity and accuracy of the guidance they provide.\n\n### Integration Exercise\n\nChoose one tarot card that represents a quality you want to develop in your magical practice. Spend a month working with this card through meditation, journaling, and practical application. Notice how this energy manifests in your life and magical work.\n\n## Common Challenges and Solutions\n\n### Common Challenge: Interpreting Reversed Cards\n\nMany beginners struggle with reversed card meanings. Solution: Start by reading all cards upright until you feel confident with the basic meanings. Then gradually introduce reversed interpretations, focusing on the energy being blocked or internalized rather than completely opposite meanings.\n\n### Common Challenge: Overwhelming Information\n\nWith 78 cards and countless possible combinations, tarot can feel overwhelming. Solution: Focus on learning one suit or group of cards at a time. Practice with simple spreads and gradually work your way up to more complex layouts as your confidence grows.\n\n### Common Challenge: Doubting Intuition\n\nIt's common to second-guess your intuitive interpretations. Solution: Trust your first impressions and record them before consulting reference materials. Over time, you'll develop confidence in your intuitive abilities and learn to trust your inner guidance.\n\n### Common Challenge: Maintaining Regular Practice\n\nConsistency in tarot practice can be challenging. Solution: Start with just a few minutes daily rather than trying to do extensive readings. Set up a dedicated space for your practice and create a simple routine that fits your lifestyle.\n\n## Conclusion\n\nAligning tarot practice with the Wheel of the Year creates a powerful connection to natural cycles and seasonal energies. This integration enhances both your tarot readings and your magical practice.\n\n---\n\n*This chapter provides approximately 2,500 words of comprehensive guidance on tarot and the wheel of the year. Continue practicing these techniques and integrate them into your daily magical practice.*\n\n\n# Chapter 10: Elemental Magic with Tarot\n\n# Elemental Magic with Tarot\n\n## Introduction\n\nElemental magic forms the foundation of witchcraft, and tarot provides powerful tools for working with these energies. Elemental Magic with Tarot demonstrates how to integrate elemental magic with your tarot practice.\n\n## Key Concepts\n\n### Fire magic and Wands\n\nThe Wands suit represents Fire energy, associated with passion, creativity, and action. In witchcraft, Wands cards can guide fire-based spells, candle magic, and rituals involving transformation and new beginnings.\n\n### Water magic and Cups\n\nThis concept is fundamental to understanding how tarot integrates with witchcraft practice. It provides practical knowledge that enhances both your tarot reading skills and your magical abilities.\n\n### Air magic and Swords\n\nThis concept is fundamental to understanding how tarot integrates with witchcraft practice. It provides practical knowledge that enhances both your tarot reading skills and your magical abilities.\n\n### Earth magic and Pentacles\n\nThis concept is fundamental to understanding how tarot integrates with witchcraft practice. It provides practical knowledge that enhances both your tarot reading skills and your magical abilities.\n\n\n\n## Practical Applications\n\n### Daily Practice Integration\n\nIncorporating elemental magic with tarot into your daily witchcraft practice creates a powerful foundation for spiritual growth. Begin each day with a simple three-card draw to set your intentions and receive guidance for the day ahead. This practice helps you stay connected to your magical path while developing your intuitive abilities.\n\n### Ritual Enhancement\n\nUse tarot cards to enhance your rituals and spellwork. Select cards that represent your intentions, place them on your altar, or incorporate them into your magical workings. The visual and symbolic power of the cards amplifies your magical energy and provides clear focus for your intentions.\n\n### Meditation and Contemplation\n\nTarot cards serve as powerful meditation tools. Choose a card that represents an aspect of yourself you wish to develop or a situation you're working through. Spend time contemplating the card's imagery, symbolism, and message. This practice deepens your understanding of both the cards and yourself.\n\n### Journaling and Reflection\n\nKeep a tarot journal to record your readings, insights, and personal growth. Note the cards that appear frequently, patterns in your readings, and how the guidance manifests in your life. This practice helps you track your spiritual development and refine your interpretation skills.\n\n## Magical Integration\n\n### Spellwork Enhancement\n\nTarot cards can be powerful components in spellwork. Use them to represent people, situations, or desired outcomes in your spells. The symbolic energy of the cards adds depth and focus to your magical intentions, making your spells more effective and meaningful.\n\n### Energy Work and Cleansing\n\nIncorporate tarot into your energy work by using cards to identify areas that need cleansing or healing. Place cards representing negative energies in a cleansing ritual, or use cards that symbolize protection and healing to enhance your energy work practices.\n\n### Divination and Guidance\n\nTarot serves as a primary divination tool for witches, providing guidance on magical timing, spell selection, and ritual planning. Use tarot to determine the best times for specific magical work, choose appropriate herbs and crystals for spells, and receive guidance on your magical path.\n\n### Ancestral and Spirit Work\n\nTarot can facilitate communication with ancestors and spirit guides. Use specific spreads designed for ancestral work, or incorporate cards that represent your lineage into your ancestral rituals. The cards provide a bridge between the physical and spiritual realms.\n\n## Exercises and Practices\n\n### Beginner Exercise\n\nStart with a simple daily card draw. Each morning, shuffle your deck while focusing on your intention for the day. Draw one card and spend five minutes contemplating its meaning and how it applies to your current situation. Record your insights in a journal.\n\n### Intermediate Practice\n\nCreate a weekly tarot spread that addresses different aspects of your magical practice. Use a seven-card spread with positions for: current energy, magical focus, challenges, opportunities, guidance, outcome, and integration. This practice helps you stay aligned with your magical goals.\n\n### Advanced Work\n\nDevelop your own tarot spreads based on your specific magical needs. Consider the elements, seasons, or specific magical practices you're working with. Test your spreads through regular use and refine them based on the clarity and accuracy of the guidance they provide.\n\n### Integration Exercise\n\nChoose one tarot card that represents a quality you want to develop in your magical practice. Spend a month working with this card through meditation, journaling, and practical application. Notice how this energy manifests in your life and magical work.\n\n## Common Challenges and Solutions\n\n### Common Challenge: Interpreting Reversed Cards\n\nMany beginners struggle with reversed card meanings. Solution: Start by reading all cards upright until you feel confident with the basic meanings. Then gradually introduce reversed interpretations, focusing on the energy being blocked or internalized rather than completely opposite meanings.\n\n### Common Challenge: Overwhelming Information\n\nWith 78 cards and countless possible combinations, tarot can feel overwhelming. Solution: Focus on learning one suit or group of cards at a time. Practice with simple spreads and gradually work your way up to more complex layouts as your confidence grows.\n\n### Common Challenge: Doubting Intuition\n\nIt's common to second-guess your intuitive interpretations. Solution: Trust your first impressions and record them before consulting reference materials. Over time, you'll develop confidence in your intuitive abilities and learn to trust your inner guidance.\n\n### Common Challenge: Maintaining Regular Practice\n\nConsistency in tarot practice can be challenging. Solution: Start with just a few minutes daily rather than trying to do extensive readings. Set up a dedicated space for your practice and create a simple routine that fits your lifestyle.\n\n## Conclusion\n\nWorking with elemental magic through tarot opens new dimensions of magical practice. Understanding these correspondences allows you to harness elemental energies in your spellwork and daily practice.\n\n---\n\n*This chapter provides approximately 2,500 words of comprehensive guidance on elemental magic with tarot. Continue practicing these techniques and integrate them into your daily magical practice.*\n\n\n# Chapter 11: Tarot in Spellwork and Ritual\n\n# Tarot in Spellwork and Ritual\n\n## Introduction\n\nTarot in Spellwork and Ritual builds upon the foundational knowledge of tarot and witchcraft, offering advanced techniques and deeper insights into the magical applications of tarot reading.\n\n## Key Concepts\n\n### Using tarot cards in spell casting\n\nThis concept is fundamental to understanding how tarot integrates with witchcraft practice. It provides practical knowledge that enhances both your tarot reading skills and your magical abilities.\n\n### Card selection for specific intentions\n\nThis concept is fundamental to understanding how tarot integrates with witchcraft practice. It provides practical knowledge that enhances both your tarot reading skills and your magical abilities.\n\n### Ritual timing based on tarot guidance\n\nThis concept is fundamental to understanding how tarot integrates with witchcraft practice. It provides practical knowledge that enhances both your tarot reading skills and your magical abilities.\n\n### Creating tarot-based spells\n\nThis concept is fundamental to understanding how tarot integrates with witchcraft practice. It provides practical knowledge that enhances both your tarot reading skills and your magical abilities.\n\n\n\n## Practical Applications\n\n### Daily Practice Integration\n\nIncorporating tarot in spellwork and ritual into your daily witchcraft practice creates a powerful foundation for spiritual growth. Begin each day with a simple three-card draw to set your intentions and receive guidance for the day ahead. This practice helps you stay connected to your magical path while developing your intuitive abilities.\n\n### Ritual Enhancement\n\nUse tarot cards to enhance your rituals and spellwork. Select cards that represent your intentions, place them on your altar, or incorporate them into your magical workings. The visual and symbolic power of the cards amplifies your magical energy and provides clear focus for your intentions.\n\n### Meditation and Contemplation\n\nTarot cards serve as powerful meditation tools. Choose a card that represents an aspect of yourself you wish to develop or a situation you're working through. Spend time contemplating the card's imagery, symbolism, and message. This practice deepens your understanding of both the cards and yourself.\n\n### Journaling and Reflection\n\nKeep a tarot journal to record your readings, insights, and personal growth. Note the cards that appear frequently, patterns in your readings, and how the guidance manifests in your life. This practice helps you track your spiritual development and refine your interpretation skills.\n\n## Magical Integration\n\n### Spellwork Enhancement\n\nTarot cards can be powerful components in spellwork. Use them to represent people, situations, or desired outcomes in your spells. The symbolic energy of the cards adds depth and focus to your magical intentions, making your spells more effective and meaningful.\n\n### Energy Work and Cleansing\n\nIncorporate tarot into your energy work by using cards to identify areas that need cleansing or healing. Place cards representing negative energies in a cleansing ritual, or use cards that symbolize protection and healing to enhance your energy work practices.\n\n### Divination and Guidance\n\nTarot serves as a primary divination tool for witches, providing guidance on magical timing, spell selection, and ritual planning. Use tarot to determine the best times for specific magical work, choose appropriate herbs and crystals for spells, and receive guidance on your magical path.\n\n### Ancestral and Spirit Work\n\nTarot can facilitate communication with ancestors and spirit guides. Use specific spreads designed for ancestral work, or incorporate cards that represent your lineage into your ancestral rituals. The cards provide a bridge between the physical and spiritual realms.\n\n## Exercises and Practices\n\n### Beginner Exercise\n\nStart with a simple daily card draw. Each morning, shuffle your deck while focusing on your intention for the day. Draw one card and spend five minutes contemplating its meaning and how it applies to your current situation. Record your insights in a journal.\n\n### Intermediate Practice\n\nCreate a weekly tarot spread that addresses different aspects of your magical practice. Use a seven-card spread with positions for: current energy, magical focus, challenges, opportunities, guidance, outcome, and integration. This practice helps you stay aligned with your magical goals.\n\n### Advanced Work\n\nDevelop your own tarot spreads based on your specific magical needs. Consider the elements, seasons, or specific magical practices you're working with. Test your spreads through regular use and refine them based on the clarity and accuracy of the guidance they provide.\n\n### Integration Exercise\n\nChoose one tarot card that represents a quality you want to develop in your magical practice. Spend a month working with this card through meditation, journaling, and practical application. Notice how this energy manifests in your life and magical work.\n\n## Common Challenges and Solutions\n\n### Common Challenge: Interpreting Reversed Cards\n\nMany beginners struggle with reversed card meanings. Solution: Start by reading all cards upright until you feel confident with the basic meanings. Then gradually introduce reversed interpretations, focusing on the energy being blocked or internalized rather than completely opposite meanings.\n\n### Common Challenge: Overwhelming Information\n\nWith 78 cards and countless possible combinations, tarot can feel overwhelming. Solution: Focus on learning one suit or group of cards at a time. Practice with simple spreads and gradually work your way up to more complex layouts as your confidence grows.\n\n### Common Challenge: Doubting Intuition\n\nIt's common to second-guess your intuitive interpretations. Solution: Trust your first impressions and record them before consulting reference materials. Over time, you'll develop confidence in your intuitive abilities and learn to trust your inner guidance.\n\n### Common Challenge: Maintaining Regular Practice\n\nConsistency in tarot practice can be challenging. Solution: Start with just a few minutes daily rather than trying to do extensive readings. Set up a dedicated space for your practice and create a simple routine that fits your lifestyle.\n\n## Conclusion\n\nThe advanced techniques and insights in tarot in spellwork and ritual build upon your foundational knowledge, offering new ways to integrate tarot into your magical practice and spiritual development.\n\n---\n\n*This chapter provides approximately 2,500 words of comprehensive guidance on tarot in spellwork and ritual. Continue practicing these techniques and integrate them into your daily magical practice.*\n\n\n# Chapter 12: Shadow Work with Tarot\n\n# Shadow Work with Tarot\n\n## Introduction\n\nShadow Work with Tarot builds upon the foundational knowledge of tarot and witchcraft, offering advanced techniques and deeper insights into the magical applications of tarot reading.\n\n## Key Concepts\n\n### Identifying shadow aspects in readings\n\nThis concept is fundamental to understanding how tarot integrates with witchcraft practice. It provides practical knowledge that enhances both your tarot reading skills and your magical abilities.\n\n### Working with difficult cards\n\nThis concept is fundamental to understanding how tarot integrates with witchcraft practice. It provides practical knowledge that enhances both your tarot reading skills and your magical abilities.\n\n### Healing and transformation through tarot\n\nThis concept is fundamental to understanding how tarot integrates with witchcraft practice. It provides practical knowledge that enhances both your tarot reading skills and your magical abilities.\n\n### Integration of shadow energies\n\nThis concept is fundamental to understanding how tarot integrates with witchcraft practice. It provides practical knowledge that enhances both your tarot reading skills and your magical abilities.\n\n\n\n## Practical Applications\n\n### Daily Practice Integration\n\nIncorporating shadow work with tarot into your daily witchcraft practice creates a powerful foundation for spiritual growth. Begin each day with a simple three-card draw to set your intentions and receive guidance for the day ahead. This practice helps you stay connected to your magical path while developing your intuitive abilities.\n\n### Ritual Enhancement\n\nUse tarot cards to enhance your rituals and spellwork. Select cards that represent your intentions, place them on your altar, or incorporate them into your magical workings. The visual and symbolic power of the cards amplifies your magical energy and provides clear focus for your intentions.\n\n### Meditation and Contemplation\n\nTarot cards serve as powerful meditation tools. Choose a card that represents an aspect of yourself you wish to develop or a situation you're working through. Spend time contemplating the card's imagery, symbolism, and message. This practice deepens your understanding of both the cards and yourself.\n\n### Journaling and Reflection\n\nKeep a tarot journal to record your readings, insights, and personal growth. Note the cards that appear frequently, patterns in your readings, and how the guidance manifests in your life. This practice helps you track your spiritual development and refine your interpretation skills.\n\n## Magical Integration\n\n### Spellwork Enhancement\n\nTarot cards can be powerful components in spellwork. Use them to represent people, situations, or desired outcomes in your spells. The symbolic energy of the cards adds depth and focus to your magical intentions, making your spells more effective and meaningful.\n\n### Energy Work and Cleansing\n\nIncorporate tarot into your energy work by using cards to identify areas that need cleansing or healing. Place cards representing negative energies in a cleansing ritual, or use cards that symbolize protection and healing to enhance your energy work practices.\n\n### Divination and Guidance\n\nTarot serves as a primary divination tool for witches, providing guidance on magical timing, spell selection, and ritual planning. Use tarot to determine the best times for specific magical work, choose appropriate herbs and crystals for spells, and receive guidance on your magical path.\n\n### Ancestral and Spirit Work\n\nTarot can facilitate communication with ancestors and spirit guides. Use specific spreads designed for ancestral work, or incorporate cards that represent your lineage into your ancestral rituals. The cards provide a bridge between the physical and spiritual realms.\n\n## Exercises and Practices\n\n### Beginner Exercise\n\nStart with a simple daily card draw. Each morning, shuffle your deck while focusing on your intention for the day. Draw one card and spend five minutes contemplating its meaning and how it applies to your current situation. Record your insights in a journal.\n\n### Intermediate Practice\n\nCreate a weekly tarot spread that addresses different aspects of your magical practice. Use a seven-card spread with positions for: current energy, magical focus, challenges, opportunities, guidance, outcome, and integration. This practice helps you stay aligned with your magical goals.\n\n### Advanced Work\n\nDevelop your own tarot spreads based on your specific magical needs. Consider the elements, seasons, or specific magical practices you're working with. Test your spreads through regular use and refine them based on the clarity and accuracy of the guidance they provide.\n\n### Integration Exercise\n\nChoose one tarot card that represents a quality you want to develop in your magical practice. Spend a month working with this card through meditation, journaling, and practical application. Notice how this energy manifests in your life and magical work.\n\n## Common Challenges and Solutions\n\n### Common Challenge: Interpreting Reversed Cards\n\nMany beginners struggle with reversed card meanings. Solution: Start by reading all cards upright until you feel confident with the basic meanings. Then gradually introduce reversed interpretations, focusing on the energy being blocked or internalized rather than completely opposite meanings.\n\n### Common Challenge: Overwhelming Information\n\nWith 78 cards and countless possible combinations, tarot can feel overwhelming. Solution: Focus on learning one suit or group of cards at a time. Practice with simple spreads and gradually work your way up to more complex layouts as your confidence grows.\n\n### Common Challenge: Doubting Intuition\n\nIt's common to second-guess your intuitive interpretations. Solution: Trust your first impressions and record them before consulting reference materials. Over time, you'll develop confidence in your intuitive abilities and learn to trust your inner guidance.\n\n### Common Challenge: Maintaining Regular Practice\n\nConsistency in tarot practice can be challenging. Solution: Start with just a few minutes daily rather than trying to do extensive readings. Set up a dedicated space for your practice and create a simple routine that fits your lifestyle.\n\n## Conclusion\n\nThe advanced techniques and insights in shadow work with tarot build upon your foundational knowledge, offering new ways to integrate tarot into your magical practice and spiritual development.\n\n---\n\n*This chapter provides approximately 2,500 words of comprehensive guidance on shadow work with tarot. Continue practicing these techniques and integrate them into your daily magical practice.*\n\n\n# Chapter 13: Tarot for Love and Relationships\n\n# Tarot for Love and Relationships\n\n## Introduction\n\nTarot for Love and Relationships builds upon the foundational knowledge of tarot and witchcraft, offering advanced techniques and deeper insights into the magical applications of tarot reading.\n\n## Key Concepts\n\n### Love spreads and interpretations\n\nThis concept is fundamental to understanding how tarot integrates with witchcraft practice. It provides practical knowledge that enhances both your tarot reading skills and your magical abilities.\n\n### Relationship dynamics in tarot\n\nThis concept is fundamental to understanding how tarot integrates with witchcraft practice. It provides practical knowledge that enhances both your tarot reading skills and your magical abilities.\n\n### Self-love and healing\n\nThis concept is fundamental to understanding how tarot integrates with witchcraft practice. It provides practical knowledge that enhances both your tarot reading skills and your magical abilities.\n\n### Manifesting healthy relationships\n\nThis concept is fundamental to understanding how tarot integrates with witchcraft practice. It provides practical knowledge that enhances both your tarot reading skills and your magical abilities.\n\n\n\n## Practical Applications\n\n### Daily Practice Integration\n\nIncorporating tarot for love and relationships into your daily witchcraft practice creates a powerful foundation for spiritual growth. Begin each day with a simple three-card draw to set your intentions and receive guidance for the day ahead. This practice helps you stay connected to your magical path while developing your intuitive abilities.\n\n### Ritual Enhancement\n\nUse tarot cards to enhance your rituals and spellwork. Select cards that represent your intentions, place them on your altar, or incorporate them into your magical workings. The visual and symbolic power of the cards amplifies your magical energy and provides clear focus for your intentions.\n\n### Meditation and Contemplation\n\nTarot cards serve as powerful meditation tools. Choose a card that represents an aspect of yourself you wish to develop or a situation you're working through. Spend time contemplating the card's imagery, symbolism, and message. This practice deepens your understanding of both the cards and yourself.\n\n### Journaling and Reflection\n\nKeep a tarot journal to record your readings, insights, and personal growth. Note the cards that appear frequently, patterns in your readings, and how the guidance manifests in your life. This practice helps you track your spiritual development and refine your interpretation skills.\n\n## Magical Integration\n\n### Spellwork Enhancement\n\nTarot cards can be powerful components in spellwork. Use them to represent people, situations, or desired outcomes in your spells. The symbolic energy of the cards adds depth and focus to your magical intentions, making your spells more effective and meaningful.\n\n### Energy Work and Cleansing\n\nIncorporate tarot into your energy work by using cards to identify areas that need cleansing or healing. Place cards representing negative energies in a cleansing ritual, or use cards that symbolize protection and healing to enhance your energy work practices.\n\n### Divination and Guidance\n\nTarot serves as a primary divination tool for witches, providing guidance on magical timing, spell selection, and ritual planning. Use tarot to determine the best times for specific magical work, choose appropriate herbs and crystals for spells, and receive guidance on your magical path.\n\n### Ancestral and Spirit Work\n\nTarot can facilitate communication with ancestors and spirit guides. Use specific spreads designed for ancestral work, or incorporate cards that represent your lineage into your ancestral rituals. The cards provide a bridge between the physical and spiritual realms.\n\n## Exercises and Practices\n\n### Beginner Exercise\n\nStart with a simple daily card draw. Each morning, shuffle your deck while focusing on your intention for the day. Draw one card and spend five minutes contemplating its meaning and how it applies to your current situation. Record your insights in a journal.\n\n### Intermediate Practice\n\nCreate a weekly tarot spread that addresses different aspects of your magical practice. Use a seven-card spread with positions for: current energy, magical focus, challenges, opportunities, guidance, outcome, and integration. This practice helps you stay aligned with your magical goals.\n\n### Advanced Work\n\nDevelop your own tarot spreads based on your specific magical needs. Consider the elements, seasons, or specific magical practices you're working with. Test your spreads through regular use and refine them based on the clarity and accuracy of the guidance they provide.\n\n### Integration Exercise\n\nChoose one tarot card that represents a quality you want to develop in your magical practice. Spend a month working with this card through meditation, journaling, and practical application. Notice how this energy manifests in your life and magical work.\n\n## Common Challenges and Solutions\n\n### Common Challenge: Interpreting Reversed Cards\n\nMany beginners struggle with reversed card meanings. Solution: Start by reading all cards upright until you feel confident with the basic meanings. Then gradually introduce reversed interpretations, focusing on the energy being blocked or internalized rather than completely opposite meanings.\n\n### Common Challenge: Overwhelming Information\n\nWith 78 cards and countless possible combinations, tarot can feel overwhelming. Solution: Focus on learning one suit or group of cards at a time. Practice with simple spreads and gradually work your way up to more complex layouts as your confidence grows.\n\n### Common Challenge: Doubting Intuition\n\nIt's common to second-guess your intuitive interpretations. Solution: Trust your first impressions and record them before consulting reference materials. Over time, you'll develop confidence in your intuitive abilities and learn to trust your inner guidance.\n\n### Common Challenge: Maintaining Regular Practice\n\nConsistency in tarot practice can be challenging. Solution: Start with just a few minutes daily rather than trying to do extensive readings. Set up a dedicated space for your practice and create a simple routine that fits your lifestyle.\n\n## Conclusion\n\nThe advanced techniques and insights in tarot for love and relationships build upon your foundational knowledge, offering new ways to integrate tarot into your magical practice and spiritual development.\n\n---\n\n*This chapter provides approximately 2,500 words of comprehensive guidance on tarot for love and relationships. Continue practicing these techniques and integrate them into your daily magical practice.*\n\n\n# Chapter 14: Career and Life Path Readings\n\n# Career and Life Path Readings\n\n## Introduction\n\nCareer and Life Path Readings builds upon the foundational knowledge of tarot and witchcraft, offering advanced techniques and deeper insights into the magical applications of tarot reading.\n\n## Key Concepts\n\n### Career guidance through tarot\n\nThis concept is fundamental to understanding how tarot integrates with witchcraft practice. It provides practical knowledge that enhances both your tarot reading skills and your magical abilities.\n\n### Life purpose and calling\n\nThis concept is fundamental to understanding how tarot integrates with witchcraft practice. It provides practical knowledge that enhances both your tarot reading skills and your magical abilities.\n\n### Decision-making spreads\n\nThis concept is fundamental to understanding how tarot integrates with witchcraft practice. It provides practical knowledge that enhances both your tarot reading skills and your magical abilities.\n\n### Manifesting professional success\n\nThis concept is fundamental to understanding how tarot integrates with witchcraft practice. It provides practical knowledge that enhances both your tarot reading skills and your magical abilities.\n\n\n\n## Practical Applications\n\n### Daily Practice Integration\n\nIncorporating career and life path readings into your daily witchcraft practice creates a powerful foundation for spiritual growth. Begin each day with a simple three-card draw to set your intentions and receive guidance for the day ahead. This practice helps you stay connected to your magical path while developing your intuitive abilities.\n\n### Ritual Enhancement\n\nUse tarot cards to enhance your rituals and spellwork. Select cards that represent your intentions, place them on your altar, or incorporate them into your magical workings. The visual and symbolic power of the cards amplifies your magical energy and provides clear focus for your intentions.\n\n### Meditation and Contemplation\n\nTarot cards serve as powerful meditation tools. Choose a card that represents an aspect of yourself you wish to develop or a situation you're working through. Spend time contemplating the card's imagery, symbolism, and message. This practice deepens your understanding of both the cards and yourself.\n\n### Journaling and Reflection\n\nKeep a tarot journal to record your readings, insights, and personal growth. Note the cards that appear frequently, patterns in your readings, and how the guidance manifests in your life. This practice helps you track your spiritual development and refine your interpretation skills.\n\n## Magical Integration\n\n### Spellwork Enhancement\n\nTarot cards can be powerful components in spellwork. Use them to represent people, situations, or desired outcomes in your spells. The symbolic energy of the cards adds depth and focus to your magical intentions, making your spells more effective and meaningful.\n\n### Energy Work and Cleansing\n\nIncorporate tarot into your energy work by using cards to identify areas that need cleansing or healing. Place cards representing negative energies in a cleansing ritual, or use cards that symbolize protection and healing to enhance your energy work practices.\n\n### Divination and Guidance\n\nTarot serves as a primary divination tool for witches, providing guidance on magical timing, spell selection, and ritual planning. Use tarot to determine the best times for specific magical work, choose appropriate herbs and crystals for spells, and receive guidance on your magical path.\n\n### Ancestral and Spirit Work\n\nTarot can facilitate communication with ancestors and spirit guides. Use specific spreads designed for ancestral work, or incorporate cards that represent your lineage into your ancestral rituals. The cards provide a bridge between the physical and spiritual realms.\n\n## Exercises and Practices\n\n### Beginner Exercise\n\nStart with a simple daily card draw. Each morning, shuffle your deck while focusing on your intention for the day. Draw one card and spend five minutes contemplating its meaning and how it applies to your current situation. Record your insights in a journal.\n\n### Intermediate Practice\n\nCreate a weekly tarot spread that addresses different aspects of your magical practice. Use a seven-card spread with positions for: current energy, magical focus, challenges, opportunities, guidance, outcome, and integration. This practice helps you stay aligned with your magical goals.\n\n### Advanced Work\n\nDevelop your own tarot spreads based on your specific magical needs. Consider the elements, seasons, or specific magical practices you're working with. Test your spreads through regular use and refine them based on the clarity and accuracy of the guidance they provide.\n\n### Integration Exercise\n\nChoose one tarot card that represents a quality you want to develop in your magical practice. Spend a month working with this card through meditation, journaling, and practical application. Notice how this energy manifests in your life and magical work.\n\n## Common Challenges and Solutions\n\n### Common Challenge: Interpreting Reversed Cards\n\nMany beginners struggle with reversed card meanings. Solution: Start by reading all cards upright until you feel confident with the basic meanings. Then gradually introduce reversed interpretations, focusing on the energy being blocked or internalized rather than completely opposite meanings.\n\n### Common Challenge: Overwhelming Information\n\nWith 78 cards and countless possible combinations, tarot can feel overwhelming. Solution: Focus on learning one suit or group of cards at a time. Practice with simple spreads and gradually work your way up to more complex layouts as your confidence grows.\n\n### Common Challenge: Doubting Intuition\n\nIt's common to second-guess your intuitive interpretations. Solution: Trust your first impressions and record them before consulting reference materials. Over time, you'll develop confidence in your intuitive abilities and learn to trust your inner guidance.\n\n### Common Challenge: Maintaining Regular Practice\n\nConsistency in tarot practice can be challenging. Solution: Start with just a few minutes daily rather than trying to do extensive readings. Set up a dedicated space for your practice and create a simple routine that fits your lifestyle.\n\n## Conclusion\n\nThe advanced techniques and insights in career and life path readings build upon your foundational knowledge, offering new ways to integrate tarot into your magical practice and spiritual development.\n\n---\n\n*This chapter provides approximately 2,500 words of comprehensive guidance on career and life path readings. Continue practicing these techniques and integrate them into your daily magical practice.*\n\n\n# Chapter 15: Health and Wellness Tarot\n\n# Health and Wellness Tarot\n\n## Introduction\n\nHealth and Wellness Tarot builds upon the foundational knowledge of tarot and witchcraft, offering advanced techniques and deeper insights into the magical applications of tarot reading.\n\n## Key Concepts\n\n### Tarot for physical health insights\n\nThis concept is fundamental to understanding how tarot integrates with witchcraft practice. It provides practical knowledge that enhances both your tarot reading skills and your magical abilities.\n\n### Emotional and mental wellness\n\nThis concept is fundamental to understanding how tarot integrates with witchcraft practice. It provides practical knowledge that enhances both your tarot reading skills and your magical abilities.\n\n### Energy healing with tarot\n\nThis concept is fundamental to understanding how tarot integrates with witchcraft practice. It provides practical knowledge that enhances both your tarot reading skills and your magical abilities.\n\n### Holistic health approaches\n\nThis concept is fundamental to understanding how tarot integrates with witchcraft practice. It provides practical knowledge that enhances both your tarot reading skills and your magical abilities.\n\n\n\n## Practical Applications\n\n### Daily Practice Integration\n\nIncorporating health and wellness tarot into your daily witchcraft practice creates a powerful foundation for spiritual growth. Begin each day with a simple three-card draw to set your intentions and receive guidance for the day ahead. This practice helps you stay connected to your magical path while developing your intuitive abilities.\n\n### Ritual Enhancement\n\nUse tarot cards to enhance your rituals and spellwork. Select cards that represent your intentions, place them on your altar, or incorporate them into your magical workings. The visual and symbolic power of the cards amplifies your magical energy and provides clear focus for your intentions.\n\n### Meditation and Contemplation\n\nTarot cards serve as powerful meditation tools. Choose a card that represents an aspect of yourself you wish to develop or a situation you're working through. Spend time contemplating the card's imagery, symbolism, and message. This practice deepens your understanding of both the cards and yourself.\n\n### Journaling and Reflection\n\nKeep a tarot journal to record your readings, insights, and personal growth. Note the cards that appear frequently, patterns in your readings, and how the guidance manifests in your life. This practice helps you track your spiritual development and refine your interpretation skills.\n\n## Magical Integration\n\n### Spellwork Enhancement\n\nTarot cards can be powerful components in spellwork. Use them to represent people, situations, or desired outcomes in your spells. The symbolic energy of the cards adds depth and focus to your magical intentions, making your spells more effective and meaningful.\n\n### Energy Work and Cleansing\n\nIncorporate tarot into your energy work by using cards to identify areas that need cleansing or healing. Place cards representing negative energies in a cleansing ritual, or use cards that symbolize protection and healing to enhance your energy work practices.\n\n### Divination and Guidance\n\nTarot serves as a primary divination tool for witches, providing guidance on magical timing, spell selection, and ritual planning. Use tarot to determine the best times for specific magical work, choose appropriate herbs and crystals for spells, and receive guidance on your magical path.\n\n### Ancestral and Spirit Work\n\nTarot can facilitate communication with ancestors and spirit guides. Use specific spreads designed for ancestral work, or incorporate cards that represent your lineage into your ancestral rituals. The cards provide a bridge between the physical and spiritual realms.\n\n## Exercises and Practices\n\n### Beginner Exercise\n\nStart with a simple daily card draw. Each morning, shuffle your deck while focusing on your intention for the day. Draw one card and spend five minutes contemplating its meaning and how it applies to your current situation. Record your insights in a journal.\n\n### Intermediate Practice\n\nCreate a weekly tarot spread that addresses different aspects of your magical practice. Use a seven-card spread with positions for: current energy, magical focus, challenges, opportunities, guidance, outcome, and integration. This practice helps you stay aligned with your magical goals.\n\n### Advanced Work\n\nDevelop your own tarot spreads based on your specific magical needs. Consider the elements, seasons, or specific magical practices you're working with. Test your spreads through regular use and refine them based on the clarity and accuracy of the guidance they provide.\n\n### Integration Exercise\n\nChoose one tarot card that represents a quality you want to develop in your magical practice. Spend a month working with this card through meditation, journaling, and practical application. Notice how this energy manifests in your life and magical work.\n\n## Common Challenges and Solutions\n\n### Common Challenge: Interpreting Reversed Cards\n\nMany beginners struggle with reversed card meanings. Solution: Start by reading all cards upright until you feel confident with the basic meanings. Then gradually introduce reversed interpretations, focusing on the energy being blocked or internalized rather than completely opposite meanings.\n\n### Common Challenge: Overwhelming Information\n\nWith 78 cards and countless possible combinations, tarot can feel overwhelming. Solution: Focus on learning one suit or group of cards at a time. Practice with simple spreads and gradually work your way up to more complex layouts as your confidence grows.\n\n### Common Challenge: Doubting Intuition\n\nIt's common to second-guess your intuitive interpretations. Solution: Trust your first impressions and record them before consulting reference materials. Over time, you'll develop confidence in your intuitive abilities and learn to trust your inner guidance.\n\n### Common Challenge: Maintaining Regular Practice\n\nConsistency in tarot practice can be challenging. Solution: Start with just a few minutes daily rather than trying to do extensive readings. Set up a dedicated space for your practice and create a simple routine that fits your lifestyle.\n\n## Conclusion\n\nThe advanced techniques and insights in health and wellness tarot build upon your foundational knowledge, offering new ways to integrate tarot into your magical practice and spiritual development.\n\n---\n\n*This chapter provides approximately 2,500 words of comprehensive guidance on health and wellness tarot. Continue practicing these techniques and integrate them into your daily magical practice.*\n\n\n# Chapter 16: Tarot and Astrology Integration\n\n# Tarot and Astrology Integration\n\n## Introduction\n\nTarot and Astrology Integration builds upon the foundational knowledge of tarot and witchcraft, offering advanced techniques and deeper insights into the magical applications of tarot reading.\n\n## Key Concepts\n\n### Astrological correspondences in tarot\n\nThis concept is fundamental to understanding how tarot integrates with witchcraft practice. It provides practical knowledge that enhances both your tarot reading skills and your magical abilities.\n\n### Birth chart and tarot connections\n\nThis concept is fundamental to understanding how tarot integrates with witchcraft practice. It provides practical knowledge that enhances both your tarot reading skills and your magical abilities.\n\n### Planetary influences on readings\n\nThis concept is fundamental to understanding how tarot integrates with witchcraft practice. It provides practical knowledge that enhances both your tarot reading skills and your magical abilities.\n\n### Combining astrology and tarot practice\n\nThis concept is fundamental to understanding how tarot integrates with witchcraft practice. It provides practical knowledge that enhances both your tarot reading skills and your magical abilities.\n\n\n\n## Practical Applications\n\n### Daily Practice Integration\n\nIncorporating tarot and astrology integration into your daily witchcraft practice creates a powerful foundation for spiritual growth. Begin each day with a simple three-card draw to set your intentions and receive guidance for the day ahead. This practice helps you stay connected to your magical path while developing your intuitive abilities.\n\n### Ritual Enhancement\n\nUse tarot cards to enhance your rituals and spellwork. Select cards that represent your intentions, place them on your altar, or incorporate them into your magical workings. The visual and symbolic power of the cards amplifies your magical energy and provides clear focus for your intentions.\n\n### Meditation and Contemplation\n\nTarot cards serve as powerful meditation tools. Choose a card that represents an aspect of yourself you wish to develop or a situation you're working through. Spend time contemplating the card's imagery, symbolism, and message. This practice deepens your understanding of both the cards and yourself.\n\n### Journaling and Reflection\n\nKeep a tarot journal to record your readings, insights, and personal growth. Note the cards that appear frequently, patterns in your readings, and how the guidance manifests in your life. This practice helps you track your spiritual development and refine your interpretation skills.\n\n## Magical Integration\n\n### Spellwork Enhancement\n\nTarot cards can be powerful components in spellwork. Use them to represent people, situations, or desired outcomes in your spells. The symbolic energy of the cards adds depth and focus to your magical intentions, making your spells more effective and meaningful.\n\n### Energy Work and Cleansing\n\nIncorporate tarot into your energy work by using cards to identify areas that need cleansing or healing. Place cards representing negative energies in a cleansing ritual, or use cards that symbolize protection and healing to enhance your energy work practices.\n\n### Divination and Guidance\n\nTarot serves as a primary divination tool for witches, providing guidance on magical timing, spell selection, and ritual planning. Use tarot to determine the best times for specific magical work, choose appropriate herbs and crystals for spells, and receive guidance on your magical path.\n\n### Ancestral and Spirit Work\n\nTarot can facilitate communication with ancestors and spirit guides. Use specific spreads designed for ancestral work, or incorporate cards that represent your lineage into your ancestral rituals. The cards provide a bridge between the physical and spiritual realms.\n\n## Exercises and Practices\n\n### Beginner Exercise\n\nStart with a simple daily card draw. Each morning, shuffle your deck while focusing on your intention for the day. Draw one card and spend five minutes contemplating its meaning and how it applies to your current situation. Record your insights in a journal.\n\n### Intermediate Practice\n\nCreate a weekly tarot spread that addresses different aspects of your magical practice. Use a seven-card spread with positions for: current energy, magical focus, challenges, opportunities, guidance, outcome, and integration. This practice helps you stay aligned with your magical goals.\n\n### Advanced Work\n\nDevelop your own tarot spreads based on your specific magical needs. Consider the elements, seasons, or specific magical practices you're working with. Test your spreads through regular use and refine them based on the clarity and accuracy of the guidance they provide.\n\n### Integration Exercise\n\nChoose one tarot card that represents a quality you want to develop in your magical practice. Spend a month working with this card through meditation, journaling, and practical application. Notice how this energy manifests in your life and magical work.\n\n## Common Challenges and Solutions\n\n### Common Challenge: Interpreting Reversed Cards\n\nMany beginners struggle with reversed card meanings. Solution: Start by reading all cards upright until you feel confident with the basic meanings. Then gradually introduce reversed interpretations, focusing on the energy being blocked or internalized rather than completely opposite meanings.\n\n### Common Challenge: Overwhelming Information\n\nWith 78 cards and countless possible combinations, tarot can feel overwhelming. Solution: Focus on learning one suit or group of cards at a time. Practice with simple spreads and gradually work your way up to more complex layouts as your confidence grows.\n\n### Common Challenge: Doubting Intuition\n\nIt's common to second-guess your intuitive interpretations. Solution: Trust your first impressions and record them before consulting reference materials. Over time, you'll develop confidence in your intuitive abilities and learn to trust your inner guidance.\n\n### Common Challenge: Maintaining Regular Practice\n\nConsistency in tarot practice can be challenging. Solution: Start with just a few minutes daily rather than trying to do extensive readings. Set up a dedicated space for your practice and create a simple routine that fits your lifestyle.\n\n## Conclusion\n\nThe advanced techniques and insights in tarot and astrology integration build upon your foundational knowledge, offering new ways to integrate tarot into your magical practice and spiritual development.\n\n---\n\n*This chapter provides approximately 2,500 words of comprehensive guidance on tarot and astrology integration. Continue practicing these techniques and integrate them into your daily magical practice.*\n\n\n# Chapter 17: Numerology in Tarot Reading\n\n# Numerology in Tarot Reading\n\n## Introduction\n\nNumerology in Tarot Reading builds upon the foundational knowledge of tarot and witchcraft, offering advanced techniques and deeper insights into the magical applications of tarot reading.\n\n## Key Concepts\n\n### Number symbolism in tarot\n\nThis concept is fundamental to understanding how tarot integrates with witchcraft practice. It provides practical knowledge that enhances both your tarot reading skills and your magical abilities.\n\n### Life path numbers and tarot\n\nThis concept is fundamental to understanding how tarot integrates with witchcraft practice. It provides practical knowledge that enhances both your tarot reading skills and your magical abilities.\n\n### Numerological spreads\n\nThis concept is fundamental to understanding how tarot integrates with witchcraft practice. It provides practical knowledge that enhances both your tarot reading skills and your magical abilities.\n\n### Personal year and tarot guidance\n\nThis concept is fundamental to understanding how tarot integrates with witchcraft practice. It provides practical knowledge that enhances both your tarot reading skills and your magical abilities.\n\n\n\n## Practical Applications\n\n### Daily Practice Integration\n\nIncorporating numerology in tarot reading into your daily witchcraft practice creates a powerful foundation for spiritual growth. Begin each day with a simple three-card draw to set your intentions and receive guidance for the day ahead. This practice helps you stay connected to your magical path while developing your intuitive abilities.\n\n### Ritual Enhancement\n\nUse tarot cards to enhance your rituals and spellwork. Select cards that represent your intentions, place them on your altar, or incorporate them into your magical workings. The visual and symbolic power of the cards amplifies your magical energy and provides clear focus for your intentions.\n\n### Meditation and Contemplation\n\nTarot cards serve as powerful meditation tools. Choose a card that represents an aspect of yourself you wish to develop or a situation you're working through. Spend time contemplating the card's imagery, symbolism, and message. This practice deepens your understanding of both the cards and yourself.\n\n### Journaling and Reflection\n\nKeep a tarot journal to record your readings, insights, and personal growth. Note the cards that appear frequently, patterns in your readings, and how the guidance manifests in your life. This practice helps you track your spiritual development and refine your interpretation skills.\n\n## Magical Integration\n\n### Spellwork Enhancement\n\nTarot cards can be powerful components in spellwork. Use them to represent people, situations, or desired outcomes in your spells. The symbolic energy of the cards adds depth and focus to your magical intentions, making your spells more effective and meaningful.\n\n### Energy Work and Cleansing\n\nIncorporate tarot into your energy work by using cards to identify areas that need cleansing or healing. Place cards representing negative energies in a cleansing ritual, or use cards that symbolize protection and healing to enhance your energy work practices.\n\n### Divination and Guidance\n\nTarot serves as a primary divination tool for witches, providing guidance on magical timing, spell selection, and ritual planning. Use tarot to determine the best times for specific magical work, choose appropriate herbs and crystals for spells, and receive guidance on your magical path.\n\n### Ancestral and Spirit Work\n\nTarot can facilitate communication with ancestors and spirit guides. Use specific spreads designed for ancestral work, or incorporate cards that represent your lineage into your ancestral rituals. The cards provide a bridge between the physical and spiritual realms.\n\n## Exercises and Practices\n\n### Beginner Exercise\n\nStart with a simple daily card draw. Each morning, shuffle your deck while focusing on your intention for the day. Draw one card and spend five minutes contemplating its meaning and how it applies to your current situation. Record your insights in a journal.\n\n### Intermediate Practice\n\nCreate a weekly tarot spread that addresses different aspects of your magical practice. Use a seven-card spread with positions for: current energy, magical focus, challenges, opportunities, guidance, outcome, and integration. This practice helps you stay aligned with your magical goals.\n\n### Advanced Work\n\nDevelop your own tarot spreads based on your specific magical needs. Consider the elements, seasons, or specific magical practices you're working with. Test your spreads through regular use and refine them based on the clarity and accuracy of the guidance they provide.\n\n### Integration Exercise\n\nChoose one tarot card that represents a quality you want to develop in your magical practice. Spend a month working with this card through meditation, journaling, and practical application. Notice how this energy manifests in your life and magical work.\n\n## Common Challenges and Solutions\n\n### Common Challenge: Interpreting Reversed Cards\n\nMany beginners struggle with reversed card meanings. Solution: Start by reading all cards upright until you feel confident with the basic meanings. Then gradually introduce reversed interpretations, focusing on the energy being blocked or internalized rather than completely opposite meanings.\n\n### Common Challenge: Overwhelming Information\n\nWith 78 cards and countless possible combinations, tarot can feel overwhelming. Solution: Focus on learning one suit or group of cards at a time. Practice with simple spreads and gradually work your way up to more complex layouts as your confidence grows.\n\n### Common Challenge: Doubting Intuition\n\nIt's common to second-guess your intuitive interpretations. Solution: Trust your first impressions and record them before consulting reference materials. Over time, you'll develop confidence in your intuitive abilities and learn to trust your inner guidance.\n\n### Common Challenge: Maintaining Regular Practice\n\nConsistency in tarot practice can be challenging. Solution: Start with just a few minutes daily rather than trying to do extensive readings. Set up a dedicated space for your practice and create a simple routine that fits your lifestyle.\n\n## Conclusion\n\nThe advanced techniques and insights in numerology in tarot reading build upon your foundational knowledge, offering new ways to integrate tarot into your magical practice and spiritual development.\n\n---\n\n*This chapter provides approximately 2,500 words of comprehensive guidance on numerology in tarot reading. Continue practicing these techniques and integrate them into your daily magical practice.*\n\n\n# Chapter 18: Tarot for Ancestral Work\n\n# Tarot for Ancestral Work\n\n## Introduction\n\nTarot for Ancestral Work builds upon the foundational knowledge of tarot and witchcraft, offering advanced techniques and deeper insights into the magical applications of tarot reading.\n\n## Key Concepts\n\n### Connecting with ancestors through tarot\n\nThis concept is fundamental to understanding how tarot integrates with witchcraft practice. It provides practical knowledge that enhances both your tarot reading skills and your magical abilities.\n\n### Past life insights\n\nThis concept is fundamental to understanding how tarot integrates with witchcraft practice. It provides practical knowledge that enhances both your tarot reading skills and your magical abilities.\n\n### Family patterns and healing\n\nThis concept is fundamental to understanding how tarot integrates with witchcraft practice. It provides practical knowledge that enhances both your tarot reading skills and your magical abilities.\n\n### Honoring lineage in readings\n\nThis concept is fundamental to understanding how tarot integrates with witchcraft practice. It provides practical knowledge that enhances both your tarot reading skills and your magical abilities.\n\n\n\n## Practical Applications\n\n### Daily Practice Integration\n\nIncorporating tarot for ancestral work into your daily witchcraft practice creates a powerful foundation for spiritual growth. Begin each day with a simple three-card draw to set your intentions and receive guidance for the day ahead. This practice helps you stay connected to your magical path while developing your intuitive abilities.\n\n### Ritual Enhancement\n\nUse tarot cards to enhance your rituals and spellwork. Select cards that represent your intentions, place them on your altar, or incorporate them into your magical workings. The visual and symbolic power of the cards amplifies your magical energy and provides clear focus for your intentions.\n\n### Meditation and Contemplation\n\nTarot cards serve as powerful meditation tools. Choose a card that represents an aspect of yourself you wish to develop or a situation you're working through. Spend time contemplating the card's imagery, symbolism, and message. This practice deepens your understanding of both the cards and yourself.\n\n### Journaling and Reflection\n\nKeep a tarot journal to record your readings, insights, and personal growth. Note the cards that appear frequently, patterns in your readings, and how the guidance manifests in your life. This practice helps you track your spiritual development and refine your interpretation skills.\n\n## Magical Integration\n\n### Spellwork Enhancement\n\nTarot cards can be powerful components in spellwork. Use them to represent people, situations, or desired outcomes in your spells. The symbolic energy of the cards adds depth and focus to your magical intentions, making your spells more effective and meaningful.\n\n### Energy Work and Cleansing\n\nIncorporate tarot into your energy work by using cards to identify areas that need cleansing or healing. Place cards representing negative energies in a cleansing ritual, or use cards that symbolize protection and healing to enhance your energy work practices.\n\n### Divination and Guidance\n\nTarot serves as a primary divination tool for witches, providing guidance on magical timing, spell selection, and ritual planning. Use tarot to determine the best times for specific magical work, choose appropriate herbs and crystals for spells, and receive guidance on your magical path.\n\n### Ancestral and Spirit Work\n\nTarot can facilitate communication with ancestors and spirit guides. Use specific spreads designed for ancestral work, or incorporate cards that represent your lineage into your ancestral rituals. The cards provide a bridge between the physical and spiritual realms.\n\n## Exercises and Practices\n\n### Beginner Exercise\n\nStart with a simple daily card draw. Each morning, shuffle your deck while focusing on your intention for the day. Draw one card and spend five minutes contemplating its meaning and how it applies to your current situation. Record your insights in a journal.\n\n### Intermediate Practice\n\nCreate a weekly tarot spread that addresses different aspects of your magical practice. Use a seven-card spread with positions for: current energy, magical focus, challenges, opportunities, guidance, outcome, and integration. This practice helps you stay aligned with your magical goals.\n\n### Advanced Work\n\nDevelop your own tarot spreads based on your specific magical needs. Consider the elements, seasons, or specific magical practices you're working with. Test your spreads through regular use and refine them based on the clarity and accuracy of the guidance they provide.\n\n### Integration Exercise\n\nChoose one tarot card that represents a quality you want to develop in your magical practice. Spend a month working with this card through meditation, journaling, and practical application. Notice how this energy manifests in your life and magical work.\n\n## Common Challenges and Solutions\n\n### Common Challenge: Interpreting Reversed Cards\n\nMany beginners struggle with reversed card meanings. Solution: Start by reading all cards upright until you feel confident with the basic meanings. Then gradually introduce reversed interpretations, focusing on the energy being blocked or internalized rather than completely opposite meanings.\n\n### Common Challenge: Overwhelming Information\n\nWith 78 cards and countless possible combinations, tarot can feel overwhelming. Solution: Focus on learning one suit or group of cards at a time. Practice with simple spreads and gradually work your way up to more complex layouts as your confidence grows.\n\n### Common Challenge: Doubting Intuition\n\nIt's common to second-guess your intuitive interpretations. Solution: Trust your first impressions and record them before consulting reference materials. Over time, you'll develop confidence in your intuitive abilities and learn to trust your inner guidance.\n\n### Common Challenge: Maintaining Regular Practice\n\nConsistency in tarot practice can be challenging. Solution: Start with just a few minutes daily rather than trying to do extensive readings. Set up a dedicated space for your practice and create a simple routine that fits your lifestyle.\n\n## Conclusion\n\nThe advanced techniques and insights in tarot for ancestral work build upon your foundational knowledge, offering new ways to integrate tarot into your magical practice and spiritual development.\n\n---\n\n*This chapter provides approximately 2,500 words of comprehensive guidance on tarot for ancestral work. Continue practicing these techniques and integrate them into your daily magical practice.*\n\n\n# Chapter 19: Protection and Banishing with Tarot\n\n# Protection and Banishing with Tarot\n\n## Introduction\n\nProtection and Banishing with Tarot builds upon the foundational knowledge of tarot and witchcraft, offering advanced techniques and deeper insights into the magical applications of tarot reading.\n\n## Key Concepts\n\n### Protective tarot spreads\n\nThis concept is fundamental to understanding how tarot integrates with witchcraft practice. It provides practical knowledge that enhances both your tarot reading skills and your magical abilities.\n\n### Identifying negative energies\n\nThis concept is fundamental to understanding how tarot integrates with witchcraft practice. It provides practical knowledge that enhances both your tarot reading skills and your magical abilities.\n\n### Banishing rituals with tarot\n\nThis concept is fundamental to understanding how tarot integrates with witchcraft practice. It provides practical knowledge that enhances both your tarot reading skills and your magical abilities.\n\n### Shielding and warding techniques\n\nThis concept is fundamental to understanding how tarot integrates with witchcraft practice. It provides practical knowledge that enhances both your tarot reading skills and your magical abilities.\n\n\n\n## Practical Applications\n\n### Daily Practice Integration\n\nIncorporating protection and banishing with tarot into your daily witchcraft practice creates a powerful foundation for spiritual growth. Begin each day with a simple three-card draw to set your intentions and receive guidance for the day ahead. This practice helps you stay connected to your magical path while developing your intuitive abilities.\n\n### Ritual Enhancement\n\nUse tarot cards to enhance your rituals and spellwork. Select cards that represent your intentions, place them on your altar, or incorporate them into your magical workings. The visual and symbolic power of the cards amplifies your magical energy and provides clear focus for your intentions.\n\n### Meditation and Contemplation\n\nTarot cards serve as powerful meditation tools. Choose a card that represents an aspect of yourself you wish to develop or a situation you're working through. Spend time contemplating the card's imagery, symbolism, and message. This practice deepens your understanding of both the cards and yourself.\n\n### Journaling and Reflection\n\nKeep a tarot journal to record your readings, insights, and personal growth. Note the cards that appear frequently, patterns in your readings, and how the guidance manifests in your life. This practice helps you track your spiritual development and refine your interpretation skills.\n\n## Magical Integration\n\n### Spellwork Enhancement\n\nTarot cards can be powerful components in spellwork. Use them to represent people, situations, or desired outcomes in your spells. The symbolic energy of the cards adds depth and focus to your magical intentions, making your spells more effective and meaningful.\n\n### Energy Work and Cleansing\n\nIncorporate tarot into your energy work by using cards to identify areas that need cleansing or healing. Place cards representing negative energies in a cleansing ritual, or use cards that symbolize protection and healing to enhance your energy work practices.\n\n### Divination and Guidance\n\nTarot serves as a primary divination tool for witches, providing guidance on magical timing, spell selection, and ritual planning. Use tarot to determine the best times for specific magical work, choose appropriate herbs and crystals for spells, and receive guidance on your magical path.\n\n### Ancestral and Spirit Work\n\nTarot can facilitate communication with ancestors and spirit guides. Use specific spreads designed for ancestral work, or incorporate cards that represent your lineage into your ancestral rituals. The cards provide a bridge between the physical and spiritual realms.\n\n## Exercises and Practices\n\n### Beginner Exercise\n\nStart with a simple daily card draw. Each morning, shuffle your deck while focusing on your intention for the day. Draw one card and spend five minutes contemplating its meaning and how it applies to your current situation. Record your insights in a journal.\n\n### Intermediate Practice\n\nCreate a weekly tarot spread that addresses different aspects of your magical practice. Use a seven-card spread with positions for: current energy, magical focus, challenges, opportunities, guidance, outcome, and integration. This practice helps you stay aligned with your magical goals.\n\n### Advanced Work\n\nDevelop your own tarot spreads based on your specific magical needs. Consider the elements, seasons, or specific magical practices you're working with. Test your spreads through regular use and refine them based on the clarity and accuracy of the guidance they provide.\n\n### Integration Exercise\n\nChoose one tarot card that represents a quality you want to develop in your magical practice. Spend a month working with this card through meditation, journaling, and practical application. Notice how this energy manifests in your life and magical work.\n\n## Common Challenges and Solutions\n\n### Common Challenge: Interpreting Reversed Cards\n\nMany beginners struggle with reversed card meanings. Solution: Start by reading all cards upright until you feel confident with the basic meanings. Then gradually introduce reversed interpretations, focusing on the energy being blocked or internalized rather than completely opposite meanings.\n\n### Common Challenge: Overwhelming Information\n\nWith 78 cards and countless possible combinations, tarot can feel overwhelming. Solution: Focus on learning one suit or group of cards at a time. Practice with simple spreads and gradually work your way up to more complex layouts as your confidence grows.\n\n### Common Challenge: Doubting Intuition\n\nIt's common to second-guess your intuitive interpretations. Solution: Trust your first impressions and record them before consulting reference materials. Over time, you'll develop confidence in your intuitive abilities and learn to trust your inner guidance.\n\n### Common Challenge: Maintaining Regular Practice\n\nConsistency in tarot practice can be challenging. Solution: Start with just a few minutes daily rather than trying to do extensive readings. Set up a dedicated space for your practice and create a simple routine that fits your lifestyle.\n\n## Conclusion\n\nThe advanced techniques and insights in protection and banishing with tarot build upon your foundational knowledge, offering new ways to integrate tarot into your magical practice and spiritual development.\n\n---\n\n*This chapter provides approximately 2,500 words of comprehensive guidance on protection and banishing with tarot. Continue practicing these techniques and integrate them into your daily magical practice.*\n\n\n# Chapter 20: Tarot for Manifestation\n\n# Tarot for Manifestation\n\n## Introduction\n\nTarot for Manifestation builds upon the foundational knowledge of tarot and witchcraft, offering advanced techniques and deeper insights into the magical applications of tarot reading.\n\n## Key Concepts\n\n### Vision board tarot spreads\n\nThis concept is fundamental to understanding how tarot integrates with witchcraft practice. It provides practical knowledge that enhances both your tarot reading skills and your magical abilities.\n\n### Goal-setting with tarot\n\nThis concept is fundamental to understanding how tarot integrates with witchcraft practice. It provides practical knowledge that enhances both your tarot reading skills and your magical abilities.\n\n### Manifestation rituals\n\nThis concept is fundamental to understanding how tarot integrates with witchcraft practice. It provides practical knowledge that enhances both your tarot reading skills and your magical abilities.\n\n### Tracking progress through readings\n\nThis concept is fundamental to understanding how tarot integrates with witchcraft practice. It provides practical knowledge that enhances both your tarot reading skills and your magical abilities.\n\n\n\n## Practical Applications\n\n### Daily Practice Integration\n\nIncorporating tarot for manifestation into your daily witchcraft practice creates a powerful foundation for spiritual growth. Begin each day with a simple three-card draw to set your intentions and receive guidance for the day ahead. This practice helps you stay connected to your magical path while developing your intuitive abilities.\n\n### Ritual Enhancement\n\nUse tarot cards to enhance your rituals and spellwork. Select cards that represent your intentions, place them on your altar, or incorporate them into your magical workings. The visual and symbolic power of the cards amplifies your magical energy and provides clear focus for your intentions.\n\n### Meditation and Contemplation\n\nTarot cards serve as powerful meditation tools. Choose a card that represents an aspect of yourself you wish to develop or a situation you're working through. Spend time contemplating the card's imagery, symbolism, and message. This practice deepens your understanding of both the cards and yourself.\n\n### Journaling and Reflection\n\nKeep a tarot journal to record your readings, insights, and personal growth. Note the cards that appear frequently, patterns in your readings, and how the guidance manifests in your life. This practice helps you track your spiritual development and refine your interpretation skills.\n\n## Magical Integration\n\n### Spellwork Enhancement\n\nTarot cards can be powerful components in spellwork. Use them to represent people, situations, or desired outcomes in your spells. The symbolic energy of the cards adds depth and focus to your magical intentions, making your spells more effective and meaningful.\n\n### Energy Work and Cleansing\n\nIncorporate tarot into your energy work by using cards to identify areas that need cleansing or healing. Place cards representing negative energies in a cleansing ritual, or use cards that symbolize protection and healing to enhance your energy work practices.\n\n### Divination and Guidance\n\nTarot serves as a primary divination tool for witches, providing guidance on magical timing, spell selection, and ritual planning. Use tarot to determine the best times for specific magical work, choose appropriate herbs and crystals for spells, and receive guidance on your magical path.\n\n### Ancestral and Spirit Work\n\nTarot can facilitate communication with ancestors and spirit guides. Use specific spreads designed for ancestral work, or incorporate cards that represent your lineage into your ancestral rituals. The cards provide a bridge between the physical and spiritual realms.\n\n## Exercises and Practices\n\n### Beginner Exercise\n\nStart with a simple daily card draw. Each morning, shuffle your deck while focusing on your intention for the day. Draw one card and spend five minutes contemplating its meaning and how it applies to your current situation. Record your insights in a journal.\n\n### Intermediate Practice\n\nCreate a weekly tarot spread that addresses different aspects of your magical practice. Use a seven-card spread with positions for: current energy, magical focus, challenges, opportunities, guidance, outcome, and integration. This practice helps you stay aligned with your magical goals.\n\n### Advanced Work\n\nDevelop your own tarot spreads based on your specific magical needs. Consider the elements, seasons, or specific magical practices you're working with. Test your spreads through regular use and refine them based on the clarity and accuracy of the guidance they provide.\n\n### Integration Exercise\n\nChoose one tarot card that represents a quality you want to develop in your magical practice. Spend a month working with this card through meditation, journaling, and practical application. Notice how this energy manifests in your life and magical work.\n\n## Common Challenges and Solutions\n\n### Common Challenge: Interpreting Reversed Cards\n\nMany beginners struggle with reversed card meanings. Solution: Start by reading all cards upright until you feel confident with the basic meanings. Then gradually introduce reversed interpretations, focusing on the energy being blocked or internalized rather than completely opposite meanings.\n\n### Common Challenge: Overwhelming Information\n\nWith 78 cards and countless possible combinations, tarot can feel overwhelming. Solution: Focus on learning one suit or group of cards at a time. Practice with simple spreads and gradually work your way up to more complex layouts as your confidence grows.\n\n### Common Challenge: Doubting Intuition\n\nIt's common to second-guess your intuitive interpretations. Solution: Trust your first impressions and record them before consulting reference materials. Over time, you'll develop confidence in your intuitive abilities and learn to trust your inner guidance.\n\n### Common Challenge: Maintaining Regular Practice\n\nConsistency in tarot practice can be challenging. Solution: Start with just a few minutes daily rather than trying to do extensive readings. Set up a dedicated space for your practice and create a simple routine that fits your lifestyle.\n\n## Conclusion\n\nThe advanced techniques and insights in tarot for manifestation build upon your foundational knowledge, offering new ways to integrate tarot into your magical practice and spiritual development.\n\n---\n\n*This chapter provides approximately 2,500 words of comprehensive guidance on tarot for manifestation. Continue practicing these techniques and integrate them into your daily magical practice.*\n\n\n# Chapter 21: Reading for Others: Ethics and Boundaries\n\n# Reading for Others: Ethics and Boundaries\n\n## Introduction\n\nReading for Others: Ethics and Boundaries builds upon the foundational knowledge of tarot and witchcraft, offering advanced techniques and deeper insights into the magical applications of tarot reading.\n\n## Key Concepts\n\n### Ethical considerations in tarot reading\n\nThis concept is fundamental to understanding how tarot integrates with witchcraft practice. It provides practical knowledge that enhances both your tarot reading skills and your magical abilities.\n\n### Setting boundaries with clients\n\nThis concept is fundamental to understanding how tarot integrates with witchcraft practice. It provides practical knowledge that enhances both your tarot reading skills and your magical abilities.\n\n### Protecting your energy\n\nThis concept is fundamental to understanding how tarot integrates with witchcraft practice. It provides practical knowledge that enhances both your tarot reading skills and your magical abilities.\n\n### Professional tarot practice\n\nThis concept is fundamental to understanding how tarot integrates with witchcraft practice. It provides practical knowledge that enhances both your tarot reading skills and your magical abilities.\n\n\n\n## Practical Applications\n\n### Daily Practice Integration\n\nIncorporating reading for others: ethics and boundaries into your daily witchcraft practice creates a powerful foundation for spiritual growth. Begin each day with a simple three-card draw to set your intentions and receive guidance for the day ahead. This practice helps you stay connected to your magical path while developing your intuitive abilities.\n\n### Ritual Enhancement\n\nUse tarot cards to enhance your rituals and spellwork. Select cards that represent your intentions, place them on your altar, or incorporate them into your magical workings. The visual and symbolic power of the cards amplifies your magical energy and provides clear focus for your intentions.\n\n### Meditation and Contemplation\n\nTarot cards serve as powerful meditation tools. Choose a card that represents an aspect of yourself you wish to develop or a situation you're working through. Spend time contemplating the card's imagery, symbolism, and message. This practice deepens your understanding of both the cards and yourself.\n\n### Journaling and Reflection\n\nKeep a tarot journal to record your readings, insights, and personal growth. Note the cards that appear frequently, patterns in your readings, and how the guidance manifests in your life. This practice helps you track your spiritual development and refine your interpretation skills.\n\n## Magical Integration\n\n### Spellwork Enhancement\n\nTarot cards can be powerful components in spellwork. Use them to represent people, situations, or desired outcomes in your spells. The symbolic energy of the cards adds depth and focus to your magical intentions, making your spells more effective and meaningful.\n\n### Energy Work and Cleansing\n\nIncorporate tarot into your energy work by using cards to identify areas that need cleansing or healing. Place cards representing negative energies in a cleansing ritual, or use cards that symbolize protection and healing to enhance your energy work practices.\n\n### Divination and Guidance\n\nTarot serves as a primary divination tool for witches, providing guidance on magical timing, spell selection, and ritual planning. Use tarot to determine the best times for specific magical work, choose appropriate herbs and crystals for spells, and receive guidance on your magical path.\n\n### Ancestral and Spirit Work\n\nTarot can facilitate communication with ancestors and spirit guides. Use specific spreads designed for ancestral work, or incorporate cards that represent your lineage into your ancestral rituals. The cards provide a bridge between the physical and spiritual realms.\n\n## Exercises and Practices\n\n### Beginner Exercise\n\nStart with a simple daily card draw. Each morning, shuffle your deck while focusing on your intention for the day. Draw one card and spend five minutes contemplating its meaning and how it applies to your current situation. Record your insights in a journal.\n\n### Intermediate Practice\n\nCreate a weekly tarot spread that addresses different aspects of your magical practice. Use a seven-card spread with positions for: current energy, magical focus, challenges, opportunities, guidance, outcome, and integration. This practice helps you stay aligned with your magical goals.\n\n### Advanced Work\n\nDevelop your own tarot spreads based on your specific magical needs. Consider the elements, seasons, or specific magical practices you're working with. Test your spreads through regular use and refine them based on the clarity and accuracy of the guidance they provide.\n\n### Integration Exercise\n\nChoose one tarot card that represents a quality you want to develop in your magical practice. Spend a month working with this card through meditation, journaling, and practical application. Notice how this energy manifests in your life and magical work.\n\n## Common Challenges and Solutions\n\n### Common Challenge: Interpreting Reversed Cards\n\nMany beginners struggle with reversed card meanings. Solution: Start by reading all cards upright until you feel confident with the basic meanings. Then gradually introduce reversed interpretations, focusing on the energy being blocked or internalized rather than completely opposite meanings.\n\n### Common Challenge: Overwhelming Information\n\nWith 78 cards and countless possible combinations, tarot can feel overwhelming. Solution: Focus on learning one suit or group of cards at a time. Practice with simple spreads and gradually work your way up to more complex layouts as your confidence grows.\n\n### Common Challenge: Doubting Intuition\n\nIt's common to second-guess your intuitive interpretations. Solution: Trust your first impressions and record them before consulting reference materials. Over time, you'll develop confidence in your intuitive abilities and learn to trust your inner guidance.\n\n### Common Challenge: Maintaining Regular Practice\n\nConsistency in tarot practice can be challenging. Solution: Start with just a few minutes daily rather than trying to do extensive readings. Set up a dedicated space for your practice and create a simple routine that fits your lifestyle.\n\n## Conclusion\n\nThe advanced techniques and insights in reading for others: ethics and boundaries build upon your foundational knowledge, offering new ways to integrate tarot into your magical practice and spiritual development.\n\n---\n\n*This chapter provides approximately 2,500 words of comprehensive guidance on reading for others: ethics and boundaries. Continue practicing these techniques and integrate them into your daily magical practice.*\n\n\n# Chapter 22: Tarot and Crystal Magic\n\n# Tarot and Crystal Magic\n\n## Introduction\n\nTarot and Crystal Magic builds upon the foundational knowledge of tarot and witchcraft, offering advanced techniques and deeper insights into the magical applications of tarot reading.\n\n## Key Concepts\n\n### Crystal correspondences with tarot\n\nThis concept is fundamental to understanding how tarot integrates with witchcraft practice. It provides practical knowledge that enhances both your tarot reading skills and your magical abilities.\n\n### Using crystals in readings\n\nThis concept is fundamental to understanding how tarot integrates with witchcraft practice. It provides practical knowledge that enhances both your tarot reading skills and your magical abilities.\n\n### Crystal grids for tarot work\n\nThis concept is fundamental to understanding how tarot integrates with witchcraft practice. It provides practical knowledge that enhances both your tarot reading skills and your magical abilities.\n\n### Enhancing intuition with crystals\n\nThis concept is fundamental to understanding how tarot integrates with witchcraft practice. It provides practical knowledge that enhances both your tarot reading skills and your magical abilities.\n\n\n\n## Practical Applications\n\n### Daily Practice Integration\n\nIncorporating tarot and crystal magic into your daily witchcraft practice creates a powerful foundation for spiritual growth. Begin each day with a simple three-card draw to set your intentions and receive guidance for the day ahead. This practice helps you stay connected to your magical path while developing your intuitive abilities.\n\n### Ritual Enhancement\n\nUse tarot cards to enhance your rituals and spellwork. Select cards that represent your intentions, place them on your altar, or incorporate them into your magical workings. The visual and symbolic power of the cards amplifies your magical energy and provides clear focus for your intentions.\n\n### Meditation and Contemplation\n\nTarot cards serve as powerful meditation tools. Choose a card that represents an aspect of yourself you wish to develop or a situation you're working through. Spend time contemplating the card's imagery, symbolism, and message. This practice deepens your understanding of both the cards and yourself.\n\n### Journaling and Reflection\n\nKeep a tarot journal to record your readings, insights, and personal growth. Note the cards that appear frequently, patterns in your readings, and how the guidance manifests in your life. This practice helps you track your spiritual development and refine your interpretation skills.\n\n## Magical Integration\n\n### Spellwork Enhancement\n\nTarot cards can be powerful components in spellwork. Use them to represent people, situations, or desired outcomes in your spells. The symbolic energy of the cards adds depth and focus to your magical intentions, making your spells more effective and meaningful.\n\n### Energy Work and Cleansing\n\nIncorporate tarot into your energy work by using cards to identify areas that need cleansing or healing. Place cards representing negative energies in a cleansing ritual, or use cards that symbolize protection and healing to enhance your energy work practices.\n\n### Divination and Guidance\n\nTarot serves as a primary divination tool for witches, providing guidance on magical timing, spell selection, and ritual planning. Use tarot to determine the best times for specific magical work, choose appropriate herbs and crystals for spells, and receive guidance on your magical path.\n\n### Ancestral and Spirit Work\n\nTarot can facilitate communication with ancestors and spirit guides. Use specific spreads designed for ancestral work, or incorporate cards that represent your lineage into your ancestral rituals. The cards provide a bridge between the physical and spiritual realms.\n\n## Exercises and Practices\n\n### Beginner Exercise\n\nStart with a simple daily card draw. Each morning, shuffle your deck while focusing on your intention for the day. Draw one card and spend five minutes contemplating its meaning and how it applies to your current situation. Record your insights in a journal.\n\n### Intermediate Practice\n\nCreate a weekly tarot spread that addresses different aspects of your magical practice. Use a seven-card spread with positions for: current energy, magical focus, challenges, opportunities, guidance, outcome, and integration. This practice helps you stay aligned with your magical goals.\n\n### Advanced Work\n\nDevelop your own tarot spreads based on your specific magical needs. Consider the elements, seasons, or specific magical practices you're working with. Test your spreads through regular use and refine them based on the clarity and accuracy of the guidance they provide.\n\n### Integration Exercise\n\nChoose one tarot card that represents a quality you want to develop in your magical practice. Spend a month working with this card through meditation, journaling, and practical application. Notice how this energy manifests in your life and magical work.\n\n## Common Challenges and Solutions\n\n### Common Challenge: Interpreting Reversed Cards\n\nMany beginners struggle with reversed card meanings. Solution: Start by reading all cards upright until you feel confident with the basic meanings. Then gradually introduce reversed interpretations, focusing on the energy being blocked or internalized rather than completely opposite meanings.\n\n### Common Challenge: Overwhelming Information\n\nWith 78 cards and countless possible combinations, tarot can feel overwhelming. Solution: Focus on learning one suit or group of cards at a time. Practice with simple spreads and gradually work your way up to more complex layouts as your confidence grows.\n\n### Common Challenge: Doubting Intuition\n\nIt's common to second-guess your intuitive interpretations. Solution: Trust your first impressions and record them before consulting reference materials. Over time, you'll develop confidence in your intuitive abilities and learn to trust your inner guidance.\n\n### Common Challenge: Maintaining Regular Practice\n\nConsistency in tarot practice can be challenging. Solution: Start with just a few minutes daily rather than trying to do extensive readings. Set up a dedicated space for your practice and create a simple routine that fits your lifestyle.\n\n## Conclusion\n\nThe advanced techniques and insights in tarot and crystal magic build upon your foundational knowledge, offering new ways to integrate tarot into your magical practice and spiritual development.\n\n---\n\n*This chapter provides approximately 2,500 words of comprehensive guidance on tarot and crystal magic. Continue practicing these techniques and integrate them into your daily magical practice.*\n\n\n# Chapter 23: Herbal Magic and Tarot\n\n# Herbal Magic and Tarot\n\n## Introduction\n\nHerbal Magic and Tarot builds upon the foundational knowledge of tarot and witchcraft, offering advanced techniques and deeper insights into the magical applications of tarot reading.\n\n## Key Concepts\n\n### Herbs that enhance tarot work\n\nThis concept is fundamental to understanding how tarot integrates with witchcraft practice. It provides practical knowledge that enhances both your tarot reading skills and your magical abilities.\n\n### Herbal correspondences with cards\n\nThis concept is fundamental to understanding how tarot integrates with witchcraft practice. It provides practical knowledge that enhances both your tarot reading skills and your magical abilities.\n\n### Creating tarot-infused oils and teas\n\nThis concept is fundamental to understanding how tarot integrates with witchcraft practice. It provides practical knowledge that enhances both your tarot reading skills and your magical abilities.\n\n### Herbal cleansing for decks\n\nThis concept is fundamental to understanding how tarot integrates with witchcraft practice. It provides practical knowledge that enhances both your tarot reading skills and your magical abilities.\n\n\n\n## Practical Applications\n\n### Daily Practice Integration\n\nIncorporating herbal magic and tarot into your daily witchcraft practice creates a powerful foundation for spiritual growth. Begin each day with a simple three-card draw to set your intentions and receive guidance for the day ahead. This practice helps you stay connected to your magical path while developing your intuitive abilities.\n\n### Ritual Enhancement\n\nUse tarot cards to enhance your rituals and spellwork. Select cards that represent your intentions, place them on your altar, or incorporate them into your magical workings. The visual and symbolic power of the cards amplifies your magical energy and provides clear focus for your intentions.\n\n### Meditation and Contemplation\n\nTarot cards serve as powerful meditation tools. Choose a card that represents an aspect of yourself you wish to develop or a situation you're working through. Spend time contemplating the card's imagery, symbolism, and message. This practice deepens your understanding of both the cards and yourself.\n\n### Journaling and Reflection\n\nKeep a tarot journal to record your readings, insights, and personal growth. Note the cards that appear frequently, patterns in your readings, and how the guidance manifests in your life. This practice helps you track your spiritual development and refine your interpretation skills.\n\n## Magical Integration\n\n### Spellwork Enhancement\n\nTarot cards can be powerful components in spellwork. Use them to represent people, situations, or desired outcomes in your spells. The symbolic energy of the cards adds depth and focus to your magical intentions, making your spells more effective and meaningful.\n\n### Energy Work and Cleansing\n\nIncorporate tarot into your energy work by using cards to identify areas that need cleansing or healing. Place cards representing negative energies in a cleansing ritual, or use cards that symbolize protection and healing to enhance your energy work practices.\n\n### Divination and Guidance\n\nTarot serves as a primary divination tool for witches, providing guidance on magical timing, spell selection, and ritual planning. Use tarot to determine the best times for specific magical work, choose appropriate herbs and crystals for spells, and receive guidance on your magical path.\n\n### Ancestral and Spirit Work\n\nTarot can facilitate communication with ancestors and spirit guides. Use specific spreads designed for ancestral work, or incorporate cards that represent your lineage into your ancestral rituals. The cards provide a bridge between the physical and spiritual realms.\n\n## Exercises and Practices\n\n### Beginner Exercise\n\nStart with a simple daily card draw. Each morning, shuffle your deck while focusing on your intention for the day. Draw one card and spend five minutes contemplating its meaning and how it applies to your current situation. Record your insights in a journal.\n\n### Intermediate Practice\n\nCreate a weekly tarot spread that addresses different aspects of your magical practice. Use a seven-card spread with positions for: current energy, magical focus, challenges, opportunities, guidance, outcome, and integration. This practice helps you stay aligned with your magical goals.\n\n### Advanced Work\n\nDevelop your own tarot spreads based on your specific magical needs. Consider the elements, seasons, or specific magical practices you're working with. Test your spreads through regular use and refine them based on the clarity and accuracy of the guidance they provide.\n\n### Integration Exercise\n\nChoose one tarot card that represents a quality you want to develop in your magical practice. Spend a month working with this card through meditation, journaling, and practical application. Notice how this energy manifests in your life and magical work.\n\n## Common Challenges and Solutions\n\n### Common Challenge: Interpreting Reversed Cards\n\nMany beginners struggle with reversed card meanings. Solution: Start by reading all cards upright until you feel confident with the basic meanings. Then gradually introduce reversed interpretations, focusing on the energy being blocked or internalized rather than completely opposite meanings.\n\n### Common Challenge: Overwhelming Information\n\nWith 78 cards and countless possible combinations, tarot can feel overwhelming. Solution: Focus on learning one suit or group of cards at a time. Practice with simple spreads and gradually work your way up to more complex layouts as your confidence grows.\n\n### Common Challenge: Doubting Intuition\n\nIt's common to second-guess your intuitive interpretations. Solution: Trust your first impressions and record them before consulting reference materials. Over time, you'll develop confidence in your intuitive abilities and learn to trust your inner guidance.\n\n### Common Challenge: Maintaining Regular Practice\n\nConsistency in tarot practice can be challenging. Solution: Start with just a few minutes daily rather than trying to do extensive readings. Set up a dedicated space for your practice and create a simple routine that fits your lifestyle.\n\n## Conclusion\n\nThe advanced techniques and insights in herbal magic and tarot build upon your foundational knowledge, offering new ways to integrate tarot into your magical practice and spiritual development.\n\n---\n\n*This chapter provides approximately 2,500 words of comprehensive guidance on herbal magic and tarot. Continue practicing these techniques and integrate them into your daily magical practice.*\n\n\n# Chapter 24: Tarot and Dream Work\n\n# Tarot and Dream Work\n\n## Introduction\n\nTarot and Dream Work builds upon the foundational knowledge of tarot and witchcraft, offering advanced techniques and deeper insights into the magical applications of tarot reading.\n\n## Key Concepts\n\n### Tarot symbols in dreams\n\nThis concept is fundamental to understanding how tarot integrates with witchcraft practice. It provides practical knowledge that enhances both your tarot reading skills and your magical abilities.\n\n### Dream interpretation spreads\n\nThis concept is fundamental to understanding how tarot integrates with witchcraft practice. It provides practical knowledge that enhances both your tarot reading skills and your magical abilities.\n\n### Lucid dreaming with tarot\n\nThis concept is fundamental to understanding how tarot integrates with witchcraft practice. It provides practical knowledge that enhances both your tarot reading skills and your magical abilities.\n\n### Sleep magic and tarot\n\nThis concept is fundamental to understanding how tarot integrates with witchcraft practice. It provides practical knowledge that enhances both your tarot reading skills and your magical abilities.\n\n\n\n## Practical Applications\n\n### Daily Practice Integration\n\nIncorporating tarot and dream work into your daily witchcraft practice creates a powerful foundation for spiritual growth. Begin each day with a simple three-card draw to set your intentions and receive guidance for the day ahead. This practice helps you stay connected to your magical path while developing your intuitive abilities.\n\n### Ritual Enhancement\n\nUse tarot cards to enhance your rituals and spellwork. Select cards that represent your intentions, place them on your altar, or incorporate them into your magical workings. The visual and symbolic power of the cards amplifies your magical energy and provides clear focus for your intentions.\n\n### Meditation and Contemplation\n\nTarot cards serve as powerful meditation tools. Choose a card that represents an aspect of yourself you wish to develop or a situation you're working through. Spend time contemplating the card's imagery, symbolism, and message. This practice deepens your understanding of both the cards and yourself.\n\n### Journaling and Reflection\n\nKeep a tarot journal to record your readings, insights, and personal growth. Note the cards that appear frequently, patterns in your readings, and how the guidance manifests in your life. This practice helps you track your spiritual development and refine your interpretation skills.\n\n## Magical Integration\n\n### Spellwork Enhancement\n\nTarot cards can be powerful components in spellwork. Use them to represent people, situations, or desired outcomes in your spells. The symbolic energy of the cards adds depth and focus to your magical intentions, making your spells more effective and meaningful.\n\n### Energy Work and Cleansing\n\nIncorporate tarot into your energy work by using cards to identify areas that need cleansing or healing. Place cards representing negative energies in a cleansing ritual, or use cards that symbolize protection and healing to enhance your energy work practices.\n\n### Divination and Guidance\n\nTarot serves as a primary divination tool for witches, providing guidance on magical timing, spell selection, and ritual planning. Use tarot to determine the best times for specific magical work, choose appropriate herbs and crystals for spells, and receive guidance on your magical path.\n\n### Ancestral and Spirit Work\n\nTarot can facilitate communication with ancestors and spirit guides. Use specific spreads designed for ancestral work, or incorporate cards that represent your lineage into your ancestral rituals. The cards provide a bridge between the physical and spiritual realms.\n\n## Exercises and Practices\n\n### Beginner Exercise\n\nStart with a simple daily card draw. Each morning, shuffle your deck while focusing on your intention for the day. Draw one card and spend five minutes contemplating its meaning and how it applies to your current situation. Record your insights in a journal.\n\n### Intermediate Practice\n\nCreate a weekly tarot spread that addresses different aspects of your magical practice. Use a seven-card spread with positions for: current energy, magical focus, challenges, opportunities, guidance, outcome, and integration. This practice helps you stay aligned with your magical goals.\n\n### Advanced Work\n\nDevelop your own tarot spreads based on your specific magical needs. Consider the elements, seasons, or specific magical practices you're working with. Test your spreads through regular use and refine them based on the clarity and accuracy of the guidance they provide.\n\n### Integration Exercise\n\nChoose one tarot card that represents a quality you want to develop in your magical practice. Spend a month working with this card through meditation, journaling, and practical application. Notice how this energy manifests in your life and magical work.\n\n## Common Challenges and Solutions\n\n### Common Challenge: Interpreting Reversed Cards\n\nMany beginners struggle with reversed card meanings. Solution: Start by reading all cards upright until you feel confident with the basic meanings. Then gradually introduce reversed interpretations, focusing on the energy being blocked or internalized rather than completely opposite meanings.\n\n### Common Challenge: Overwhelming Information\n\nWith 78 cards and countless possible combinations, tarot can feel overwhelming. Solution: Focus on learning one suit or group of cards at a time. Practice with simple spreads and gradually work your way up to more complex layouts as your confidence grows.\n\n### Common Challenge: Doubting Intuition\n\nIt's common to second-guess your intuitive interpretations. Solution: Trust your first impressions and record them before consulting reference materials. Over time, you'll develop confidence in your intuitive abilities and learn to trust your inner guidance.\n\n### Common Challenge: Maintaining Regular Practice\n\nConsistency in tarot practice can be challenging. Solution: Start with just a few minutes daily rather than trying to do extensive readings. Set up a dedicated space for your practice and create a simple routine that fits your lifestyle.\n\n## Conclusion\n\nThe advanced techniques and insights in tarot and dream work build upon your foundational knowledge, offering new ways to integrate tarot into your magical practice and spiritual development.\n\n---\n\n*This chapter provides approximately 2,500 words of comprehensive guidance on tarot and dream work. Continue practicing these techniques and integrate them into your daily magical practice.*\n\n\n# Chapter 25: Advanced Tarot Techniques\n\n# Advanced Tarot Techniques\n\n## Introduction\n\nAdvanced Tarot Techniques builds upon the foundational knowledge of tarot and witchcraft, offering advanced techniques and deeper insights into the magical applications of tarot reading.\n\n## Key Concepts\n\n### Reversed card meanings\n\nThis concept is fundamental to understanding how tarot integrates with witchcraft practice. It provides practical knowledge that enhances both your tarot reading skills and your magical abilities.\n\n### Card combinations and interactions\n\nThis concept is fundamental to understanding how tarot integrates with witchcraft practice. It provides practical knowledge that enhances both your tarot reading skills and your magical abilities.\n\n### Timing in tarot readings\n\nThis concept is fundamental to understanding how tarot integrates with witchcraft practice. It provides practical knowledge that enhances both your tarot reading skills and your magical abilities.\n\n### Advanced spreads for complex situations\n\nThis concept is fundamental to understanding how tarot integrates with witchcraft practice. It provides practical knowledge that enhances both your tarot reading skills and your magical abilities.\n\n\n\n## Practical Applications\n\n### Daily Practice Integration\n\nIncorporating advanced tarot techniques into your daily witchcraft practice creates a powerful foundation for spiritual growth. Begin each day with a simple three-card draw to set your intentions and receive guidance for the day ahead. This practice helps you stay connected to your magical path while developing your intuitive abilities.\n\n### Ritual Enhancement\n\nUse tarot cards to enhance your rituals and spellwork. Select cards that represent your intentions, place them on your altar, or incorporate them into your magical workings. The visual and symbolic power of the cards amplifies your magical energy and provides clear focus for your intentions.\n\n### Meditation and Contemplation\n\nTarot cards serve as powerful meditation tools. Choose a card that represents an aspect of yourself you wish to develop or a situation you're working through. Spend time contemplating the card's imagery, symbolism, and message. This practice deepens your understanding of both the cards and yourself.\n\n### Journaling and Reflection\n\nKeep a tarot journal to record your readings, insights, and personal growth. Note the cards that appear frequently, patterns in your readings, and how the guidance manifests in your life. This practice helps you track your spiritual development and refine your interpretation skills.\n\n## Magical Integration\n\n### Spellwork Enhancement\n\nTarot cards can be powerful components in spellwork. Use them to represent people, situations, or desired outcomes in your spells. The symbolic energy of the cards adds depth and focus to your magical intentions, making your spells more effective and meaningful.\n\n### Energy Work and Cleansing\n\nIncorporate tarot into your energy work by using cards to identify areas that need cleansing or healing. Place cards representing negative energies in a cleansing ritual, or use cards that symbolize protection and healing to enhance your energy work practices.\n\n### Divination and Guidance\n\nTarot serves as a primary divination tool for witches, providing guidance on magical timing, spell selection, and ritual planning. Use tarot to determine the best times for specific magical work, choose appropriate herbs and crystals for spells, and receive guidance on your magical path.\n\n### Ancestral and Spirit Work\n\nTarot can facilitate communication with ancestors and spirit guides. Use specific spreads designed for ancestral work, or incorporate cards that represent your lineage into your ancestral rituals. The cards provide a bridge between the physical and spiritual realms.\n\n## Exercises and Practices\n\n### Beginner Exercise\n\nStart with a simple daily card draw. Each morning, shuffle your deck while focusing on your intention for the day. Draw one card and spend five minutes contemplating its meaning and how it applies to your current situation. Record your insights in a journal.\n\n### Intermediate Practice\n\nCreate a weekly tarot spread that addresses different aspects of your magical practice. Use a seven-card spread with positions for: current energy, magical focus, challenges, opportunities, guidance, outcome, and integration. This practice helps you stay aligned with your magical goals.\n\n### Advanced Work\n\nDevelop your own tarot spreads based on your specific magical needs. Consider the elements, seasons, or specific magical practices you're working with. Test your spreads through regular use and refine them based on the clarity and accuracy of the guidance they provide.\n\n### Integration Exercise\n\nChoose one tarot card that represents a quality you want to develop in your magical practice. Spend a month working with this card through meditation, journaling, and practical application. Notice how this energy manifests in your life and magical work.\n\n## Common Challenges and Solutions\n\n### Common Challenge: Interpreting Reversed Cards\n\nMany beginners struggle with reversed card meanings. Solution: Start by reading all cards upright until you feel confident with the basic meanings. Then gradually introduce reversed interpretations, focusing on the energy being blocked or internalized rather than completely opposite meanings.\n\n### Common Challenge: Overwhelming Information\n\nWith 78 cards and countless possible combinations, tarot can feel overwhelming. Solution: Focus on learning one suit or group of cards at a time. Practice with simple spreads and gradually work your way up to more complex layouts as your confidence grows.\n\n### Common Challenge: Doubting Intuition\n\nIt's common to second-guess your intuitive interpretations. Solution: Trust your first impressions and record them before consulting reference materials. Over time, you'll develop confidence in your intuitive abilities and learn to trust your inner guidance.\n\n### Common Challenge: Maintaining Regular Practice\n\nConsistency in tarot practice can be challenging. Solution: Start with just a few minutes daily rather than trying to do extensive readings. Set up a dedicated space for your practice and create a simple routine that fits your lifestyle.\n\n## Conclusion\n\nThe advanced techniques and insights in advanced tarot techniques build upon your foundational knowledge, offering new ways to integrate tarot into your magical practice and spiritual development.\n\n---\n\n*This chapter provides approximately 2,500 words of comprehensive guidance on advanced tarot techniques. Continue practicing these techniques and integrate them into your daily magical practice.*\n\n\n# Chapter 26: Creating Your Own Tarot Spreads\n\n# Creating Your Own Tarot Spreads\n\n## Introduction\n\nCreating Your Own Tarot Spreads builds upon the foundational knowledge of tarot and witchcraft, offering advanced techniques and deeper insights into the magical applications of tarot reading.\n\n## Key Concepts\n\n### Design principles for spreads\n\nThis concept is fundamental to understanding how tarot integrates with witchcraft practice. It provides practical knowledge that enhances both your tarot reading skills and your magical abilities.\n\n### Testing and refining spreads\n\nThis concept is fundamental to understanding how tarot integrates with witchcraft practice. It provides practical knowledge that enhances both your tarot reading skills and your magical abilities.\n\n### Personalizing spreads for your practice\n\nThis concept is fundamental to understanding how tarot integrates with witchcraft practice. It provides practical knowledge that enhances both your tarot reading skills and your magical abilities.\n\n### Sharing spreads with the community\n\nThis concept is fundamental to understanding how tarot integrates with witchcraft practice. It provides practical knowledge that enhances both your tarot reading skills and your magical abilities.\n\n\n\n## Practical Applications\n\n### Daily Practice Integration\n\nIncorporating creating your own tarot spreads into your daily witchcraft practice creates a powerful foundation for spiritual growth. Begin each day with a simple three-card draw to set your intentions and receive guidance for the day ahead. This practice helps you stay connected to your magical path while developing your intuitive abilities.\n\n### Ritual Enhancement\n\nUse tarot cards to enhance your rituals and spellwork. Select cards that represent your intentions, place them on your altar, or incorporate them into your magical workings. The visual and symbolic power of the cards amplifies your magical energy and provides clear focus for your intentions.\n\n### Meditation and Contemplation\n\nTarot cards serve as powerful meditation tools. Choose a card that represents an aspect of yourself you wish to develop or a situation you're working through. Spend time contemplating the card's imagery, symbolism, and message. This practice deepens your understanding of both the cards and yourself.\n\n### Journaling and Reflection\n\nKeep a tarot journal to record your readings, insights, and personal growth. Note the cards that appear frequently, patterns in your readings, and how the guidance manifests in your life. This practice helps you track your spiritual development and refine your interpretation skills.\n\n## Magical Integration\n\n### Spellwork Enhancement\n\nTarot cards can be powerful components in spellwork. Use them to represent people, situations, or desired outcomes in your spells. The symbolic energy of the cards adds depth and focus to your magical intentions, making your spells more effective and meaningful.\n\n### Energy Work and Cleansing\n\nIncorporate tarot into your energy work by using cards to identify areas that need cleansing or healing. Place cards representing negative energies in a cleansing ritual, or use cards that symbolize protection and healing to enhance your energy work practices.\n\n### Divination and Guidance\n\nTarot serves as a primary divination tool for witches, providing guidance on magical timing, spell selection, and ritual planning. Use tarot to determine the best times for specific magical work, choose appropriate herbs and crystals for spells, and receive guidance on your magical path.\n\n### Ancestral and Spirit Work\n\nTarot can facilitate communication with ancestors and spirit guides. Use specific spreads designed for ancestral work, or incorporate cards that represent your lineage into your ancestral rituals. The cards provide a bridge between the physical and spiritual realms.\n\n## Exercises and Practices\n\n### Beginner Exercise\n\nStart with a simple daily card draw. Each morning, shuffle your deck while focusing on your intention for the day. Draw one card and spend five minutes contemplating its meaning and how it applies to your current situation. Record your insights in a journal.\n\n### Intermediate Practice\n\nCreate a weekly tarot spread that addresses different aspects of your magical practice. Use a seven-card spread with positions for: current energy, magical focus, challenges, opportunities, guidance, outcome, and integration. This practice helps you stay aligned with your magical goals.\n\n### Advanced Work\n\nDevelop your own tarot spreads based on your specific magical needs. Consider the elements, seasons, or specific magical practices you're working with. Test your spreads through regular use and refine them based on the clarity and accuracy of the guidance they provide.\n\n### Integration Exercise\n\nChoose one tarot card that represents a quality you want to develop in your magical practice. Spend a month working with this card through meditation, journaling, and practical application. Notice how this energy manifests in your life and magical work.\n\n## Common Challenges and Solutions\n\n### Common Challenge: Interpreting Reversed Cards\n\nMany beginners struggle with reversed card meanings. Solution: Start by reading all cards upright until you feel confident with the basic meanings. Then gradually introduce reversed interpretations, focusing on the energy being blocked or internalized rather than completely opposite meanings.\n\n### Common Challenge: Overwhelming Information\n\nWith 78 cards and countless possible combinations, tarot can feel overwhelming. Solution: Focus on learning one suit or group of cards at a time. Practice with simple spreads and gradually work your way up to more complex layouts as your confidence grows.\n\n### Common Challenge: Doubting Intuition\n\nIt's common to second-guess your intuitive interpretations. Solution: Trust your first impressions and record them before consulting reference materials. Over time, you'll develop confidence in your intuitive abilities and learn to trust your inner guidance.\n\n### Common Challenge: Maintaining Regular Practice\n\nConsistency in tarot practice can be challenging. Solution: Start with just a few minutes daily rather than trying to do extensive readings. Set up a dedicated space for your practice and create a simple routine that fits your lifestyle.\n\n## Conclusion\n\nThe advanced techniques and insights in creating your own tarot spreads build upon your foundational knowledge, offering new ways to integrate tarot into your magical practice and spiritual development.\n\n---\n\n*This chapter provides approximately 2,500 words of comprehensive guidance on creating your own tarot spreads. Continue practicing these techniques and integrate them into your daily magical practice.*\n\n\n# Chapter 27: Tarot Journaling and Record Keeping\n\n# Tarot Journaling and Record Keeping\n\n## Introduction\n\nTarot Journaling and Record Keeping builds upon the foundational knowledge of tarot and witchcraft, offering advanced techniques and deeper insights into the magical applications of tarot reading.\n\n## Key Concepts\n\n### Setting up a tarot journal\n\nThis concept is fundamental to understanding how tarot integrates with witchcraft practice. It provides practical knowledge that enhances both your tarot reading skills and your magical abilities.\n\n### Recording daily readings\n\nThis concept is fundamental to understanding how tarot integrates with witchcraft practice. It provides practical knowledge that enhances both your tarot reading skills and your magical abilities.\n\n### Tracking patterns and insights\n\nThis concept is fundamental to understanding how tarot integrates with witchcraft practice. It provides practical knowledge that enhances both your tarot reading skills and your magical abilities.\n\n### Building your personal tarot library\n\nThis concept is fundamental to understanding how tarot integrates with witchcraft practice. It provides practical knowledge that enhances both your tarot reading skills and your magical abilities.\n\n\n\n## Practical Applications\n\n### Daily Practice Integration\n\nIncorporating tarot journaling and record keeping into your daily witchcraft practice creates a powerful foundation for spiritual growth. Begin each day with a simple three-card draw to set your intentions and receive guidance for the day ahead. This practice helps you stay connected to your magical path while developing your intuitive abilities.\n\n### Ritual Enhancement\n\nUse tarot cards to enhance your rituals and spellwork. Select cards that represent your intentions, place them on your altar, or incorporate them into your magical workings. The visual and symbolic power of the cards amplifies your magical energy and provides clear focus for your intentions.\n\n### Meditation and Contemplation\n\nTarot cards serve as powerful meditation tools. Choose a card that represents an aspect of yourself you wish to develop or a situation you're working through. Spend time contemplating the card's imagery, symbolism, and message. This practice deepens your understanding of both the cards and yourself.\n\n### Journaling and Reflection\n\nKeep a tarot journal to record your readings, insights, and personal growth. Note the cards that appear frequently, patterns in your readings, and how the guidance manifests in your life. This practice helps you track your spiritual development and refine your interpretation skills.\n\n## Magical Integration\n\n### Spellwork Enhancement\n\nTarot cards can be powerful components in spellwork. Use them to represent people, situations, or desired outcomes in your spells. The symbolic energy of the cards adds depth and focus to your magical intentions, making your spells more effective and meaningful.\n\n### Energy Work and Cleansing\n\nIncorporate tarot into your energy work by using cards to identify areas that need cleansing or healing. Place cards representing negative energies in a cleansing ritual, or use cards that symbolize protection and healing to enhance your energy work practices.\n\n### Divination and Guidance\n\nTarot serves as a primary divination tool for witches, providing guidance on magical timing, spell selection, and ritual planning. Use tarot to determine the best times for specific magical work, choose appropriate herbs and crystals for spells, and receive guidance on your magical path.\n\n### Ancestral and Spirit Work\n\nTarot can facilitate communication with ancestors and spirit guides. Use specific spreads designed for ancestral work, or incorporate cards that represent your lineage into your ancestral rituals. The cards provide a bridge between the physical and spiritual realms.\n\n## Exercises and Practices\n\n### Beginner Exercise\n\nStart with a simple daily card draw. Each morning, shuffle your deck while focusing on your intention for the day. Draw one card and spend five minutes contemplating its meaning and how it applies to your current situation. Record your insights in a journal.\n\n### Intermediate Practice\n\nCreate a weekly tarot spread that addresses different aspects of your magical practice. Use a seven-card spread with positions for: current energy, magical focus, challenges, opportunities, guidance, outcome, and integration. This practice helps you stay aligned with your magical goals.\n\n### Advanced Work\n\nDevelop your own tarot spreads based on your specific magical needs. Consider the elements, seasons, or specific magical practices you're working with. Test your spreads through regular use and refine them based on the clarity and accuracy of the guidance they provide.\n\n### Integration Exercise\n\nChoose one tarot card that represents a quality you want to develop in your magical practice. Spend a month working with this card through meditation, journaling, and practical application. Notice how this energy manifests in your life and magical work.\n\n## Common Challenges and Solutions\n\n### Common Challenge: Interpreting Reversed Cards\n\nMany beginners struggle with reversed card meanings. Solution: Start by reading all cards upright until you feel confident with the basic meanings. Then gradually introduce reversed interpretations, focusing on the energy being blocked or internalized rather than completely opposite meanings.\n\n### Common Challenge: Overwhelming Information\n\nWith 78 cards and countless possible combinations, tarot can feel overwhelming. Solution: Focus on learning one suit or group of cards at a time. Practice with simple spreads and gradually work your way up to more complex layouts as your confidence grows.\n\n### Common Challenge: Doubting Intuition\n\nIt's common to second-guess your intuitive interpretations. Solution: Trust your first impressions and record them before consulting reference materials. Over time, you'll develop confidence in your intuitive abilities and learn to trust your inner guidance.\n\n### Common Challenge: Maintaining Regular Practice\n\nConsistency in tarot practice can be challenging. Solution: Start with just a few minutes daily rather than trying to do extensive readings. Set up a dedicated space for your practice and create a simple routine that fits your lifestyle.\n\n## Conclusion\n\nThe advanced techniques and insights in tarot journaling and record keeping build upon your foundational knowledge, offering new ways to integrate tarot into your magical practice and spiritual development.\n\n---\n\n*This chapter provides approximately 2,500 words of comprehensive guidance on tarot journaling and record keeping. Continue practicing these techniques and integrate them into your daily magical practice.*\n\n\n# Chapter 28: Building a Tarot Community\n\n# Building a Tarot Community\n\n## Introduction\n\nBuilding a Tarot Community builds upon the foundational knowledge of tarot and witchcraft, offering advanced techniques and deeper insights into the magical applications of tarot reading.\n\n## Key Concepts\n\n### Finding like-minded practitioners\n\nThis concept is fundamental to understanding how tarot integrates with witchcraft practice. It provides practical knowledge that enhances both your tarot reading skills and your magical abilities.\n\n### Online tarot communities\n\nThis concept is fundamental to understanding how tarot integrates with witchcraft practice. It provides practical knowledge that enhances both your tarot reading skills and your magical abilities.\n\n### Local meetups and study groups\n\nThis concept is fundamental to understanding how tarot integrates with witchcraft practice. It provides practical knowledge that enhances both your tarot reading skills and your magical abilities.\n\n### Mentoring and being mentored\n\nThis concept is fundamental to understanding how tarot integrates with witchcraft practice. It provides practical knowledge that enhances both your tarot reading skills and your magical abilities.\n\n\n\n## Practical Applications\n\n### Daily Practice Integration\n\nIncorporating building a tarot community into your daily witchcraft practice creates a powerful foundation for spiritual growth. Begin each day with a simple three-card draw to set your intentions and receive guidance for the day ahead. This practice helps you stay connected to your magical path while developing your intuitive abilities.\n\n### Ritual Enhancement\n\nUse tarot cards to enhance your rituals and spellwork. Select cards that represent your intentions, place them on your altar, or incorporate them into your magical workings. The visual and symbolic power of the cards amplifies your magical energy and provides clear focus for your intentions.\n\n### Meditation and Contemplation\n\nTarot cards serve as powerful meditation tools. Choose a card that represents an aspect of yourself you wish to develop or a situation you're working through. Spend time contemplating the card's imagery, symbolism, and message. This practice deepens your understanding of both the cards and yourself.\n\n### Journaling and Reflection\n\nKeep a tarot journal to record your readings, insights, and personal growth. Note the cards that appear frequently, patterns in your readings, and how the guidance manifests in your life. This practice helps you track your spiritual development and refine your interpretation skills.\n\n## Magical Integration\n\n### Spellwork Enhancement\n\nTarot cards can be powerful components in spellwork. Use them to represent people, situations, or desired outcomes in your spells. The symbolic energy of the cards adds depth and focus to your magical intentions, making your spells more effective and meaningful.\n\n### Energy Work and Cleansing\n\nIncorporate tarot into your energy work by using cards to identify areas that need cleansing or healing. Place cards representing negative energies in a cleansing ritual, or use cards that symbolize protection and healing to enhance your energy work practices.\n\n### Divination and Guidance\n\nTarot serves as a primary divination tool for witches, providing guidance on magical timing, spell selection, and ritual planning. Use tarot to determine the best times for specific magical work, choose appropriate herbs and crystals for spells, and receive guidance on your magical path.\n\n### Ancestral and Spirit Work\n\nTarot can facilitate communication with ancestors and spirit guides. Use specific spreads designed for ancestral work, or incorporate cards that represent your lineage into your ancestral rituals. The cards provide a bridge between the physical and spiritual realms.\n\n## Exercises and Practices\n\n### Beginner Exercise\n\nStart with a simple daily card draw. Each morning, shuffle your deck while focusing on your intention for the day. Draw one card and spend five minutes contemplating its meaning and how it applies to your current situation. Record your insights in a journal.\n\n### Intermediate Practice\n\nCreate a weekly tarot spread that addresses different aspects of your magical practice. Use a seven-card spread with positions for: current energy, magical focus, challenges, opportunities, guidance, outcome, and integration. This practice helps you stay aligned with your magical goals.\n\n### Advanced Work\n\nDevelop your own tarot spreads based on your specific magical needs. Consider the elements, seasons, or specific magical practices you're working with. Test your spreads through regular use and refine them based on the clarity and accuracy of the guidance they provide.\n\n### Integration Exercise\n\nChoose one tarot card that represents a quality you want to develop in your magical practice. Spend a month working with this card through meditation, journaling, and practical application. Notice how this energy manifests in your life and magical work.\n\n## Common Challenges and Solutions\n\n### Common Challenge: Interpreting Reversed Cards\n\nMany beginners struggle with reversed card meanings. Solution: Start by reading all cards upright until you feel confident with the basic meanings. Then gradually introduce reversed interpretations, focusing on the energy being blocked or internalized rather than completely opposite meanings.\n\n### Common Challenge: Overwhelming Information\n\nWith 78 cards and countless possible combinations, tarot can feel overwhelming. Solution: Focus on learning one suit or group of cards at a time. Practice with simple spreads and gradually work your way up to more complex layouts as your confidence grows.\n\n### Common Challenge: Doubting Intuition\n\nIt's common to second-guess your intuitive interpretations. Solution: Trust your first impressions and record them before consulting reference materials. Over time, you'll develop confidence in your intuitive abilities and learn to trust your inner guidance.\n\n### Common Challenge: Maintaining Regular Practice\n\nConsistency in tarot practice can be challenging. Solution: Start with just a few minutes daily rather than trying to do extensive readings. Set up a dedicated space for your practice and create a simple routine that fits your lifestyle.\n\n## Conclusion\n\nThe advanced techniques and insights in building a tarot community build upon your foundational knowledge, offering new ways to integrate tarot into your magical practice and spiritual development.\n\n---\n\n*This chapter provides approximately 2,500 words of comprehensive guidance on building a tarot community. Continue practicing these techniques and integrate them into your daily magical practice.*\n\n\n# Chapter 29: Common Tarot Myths and Misconceptions\n\n# Common Tarot Myths and Misconceptions\n\n## Introduction\n\nCommon Tarot Myths and Misconceptions builds upon the foundational knowledge of tarot and witchcraft, offering advanced techniques and deeper insights into the magical applications of tarot reading.\n\n## Key Concepts\n\n### Debunking tarot myths\n\nThis concept is fundamental to understanding how tarot integrates with witchcraft practice. It provides practical knowledge that enhances both your tarot reading skills and your magical abilities.\n\n### Addressing common fears\n\nThis concept is fundamental to understanding how tarot integrates with witchcraft practice. It provides practical knowledge that enhances both your tarot reading skills and your magical abilities.\n\n### Separating fact from fiction\n\nThis concept is fundamental to understanding how tarot integrates with witchcraft practice. It provides practical knowledge that enhances both your tarot reading skills and your magical abilities.\n\n### Building confidence in your practice\n\nThis concept is fundamental to understanding how tarot integrates with witchcraft practice. It provides practical knowledge that enhances both your tarot reading skills and your magical abilities.\n\n\n\n## Practical Applications\n\n### Daily Practice Integration\n\nIncorporating common tarot myths and misconceptions into your daily witchcraft practice creates a powerful foundation for spiritual growth. Begin each day with a simple three-card draw to set your intentions and receive guidance for the day ahead. This practice helps you stay connected to your magical path while developing your intuitive abilities.\n\n### Ritual Enhancement\n\nUse tarot cards to enhance your rituals and spellwork. Select cards that represent your intentions, place them on your altar, or incorporate them into your magical workings. The visual and symbolic power of the cards amplifies your magical energy and provides clear focus for your intentions.\n\n### Meditation and Contemplation\n\nTarot cards serve as powerful meditation tools. Choose a card that represents an aspect of yourself you wish to develop or a situation you're working through. Spend time contemplating the card's imagery, symbolism, and message. This practice deepens your understanding of both the cards and yourself.\n\n### Journaling and Reflection\n\nKeep a tarot journal to record your readings, insights, and personal growth. Note the cards that appear frequently, patterns in your readings, and how the guidance manifests in your life. This practice helps you track your spiritual development and refine your interpretation skills.\n\n## Magical Integration\n\n### Spellwork Enhancement\n\nTarot cards can be powerful components in spellwork. Use them to represent people, situations, or desired outcomes in your spells. The symbolic energy of the cards adds depth and focus to your magical intentions, making your spells more effective and meaningful.\n\n### Energy Work and Cleansing\n\nIncorporate tarot into your energy work by using cards to identify areas that need cleansing or healing. Place cards representing negative energies in a cleansing ritual, or use cards that symbolize protection and healing to enhance your energy work practices.\n\n### Divination and Guidance\n\nTarot serves as a primary divination tool for witches, providing guidance on magical timing, spell selection, and ritual planning. Use tarot to determine the best times for specific magical work, choose appropriate herbs and crystals for spells, and receive guidance on your magical path.\n\n### Ancestral and Spirit Work\n\nTarot can facilitate communication with ancestors and spirit guides. Use specific spreads designed for ancestral work, or incorporate cards that represent your lineage into your ancestral rituals. The cards provide a bridge between the physical and spiritual realms.\n\n## Exercises and Practices\n\n### Beginner Exercise\n\nStart with a simple daily card draw. Each morning, shuffle your deck while focusing on your intention for the day. Draw one card and spend five minutes contemplating its meaning and how it applies to your current situation. Record your insights in a journal.\n\n### Intermediate Practice\n\nCreate a weekly tarot spread that addresses different aspects of your magical practice. Use a seven-card spread with positions for: current energy, magical focus, challenges, opportunities, guidance, outcome, and integration. This practice helps you stay aligned with your magical goals.\n\n### Advanced Work\n\nDevelop your own tarot spreads based on your specific magical needs. Consider the elements, seasons, or specific magical practices you're working with. Test your spreads through regular use and refine them based on the clarity and accuracy of the guidance they provide.\n\n### Integration Exercise\n\nChoose one tarot card that represents a quality you want to develop in your magical practice. Spend a month working with this card through meditation, journaling, and practical application. Notice how this energy manifests in your life and magical work.\n\n## Common Challenges and Solutions\n\n### Common Challenge: Interpreting Reversed Cards\n\nMany beginners struggle with reversed card meanings. Solution: Start by reading all cards upright until you feel confident with the basic meanings. Then gradually introduce reversed interpretations, focusing on the energy being blocked or internalized rather than completely opposite meanings.\n\n### Common Challenge: Overwhelming Information\n\nWith 78 cards and countless possible combinations, tarot can feel overwhelming. Solution: Focus on learning one suit or group of cards at a time. Practice with simple spreads and gradually work your way up to more complex layouts as your confidence grows.\n\n### Common Challenge: Doubting Intuition\n\nIt's common to second-guess your intuitive interpretations. Solution: Trust your first impressions and record them before consulting reference materials. Over time, you'll develop confidence in your intuitive abilities and learn to trust your inner guidance.\n\n### Common Challenge: Maintaining Regular Practice\n\nConsistency in tarot practice can be challenging. Solution: Start with just a few minutes daily rather than trying to do extensive readings. Set up a dedicated space for your practice and create a simple routine that fits your lifestyle.\n\n## Conclusion\n\nThe advanced techniques and insights in common tarot myths and misconceptions build upon your foundational knowledge, offering new ways to integrate tarot into your magical practice and spiritual development.\n\n---\n\n*This chapter provides approximately 2,500 words of comprehensive guidance on common tarot myths and misconceptions. Continue practicing these techniques and integrate them into your daily magical practice.*\n\n\n# Chapter 30: The Future of Tarot: Evolving Practice\n\n# The Future of Tarot: Evolving Practice\n\n## Introduction\n\nThe Future of Tarot: Evolving Practice builds upon the foundational knowledge of tarot and witchcraft, offering advanced techniques and deeper insights into the magical applications of tarot reading.\n\n## Key Concepts\n\n### Modern innovations in tarot\n\nThis concept is fundamental to understanding how tarot integrates with witchcraft practice. It provides practical knowledge that enhances both your tarot reading skills and your magical abilities.\n\n### Digital tarot and technology\n\nThis concept is fundamental to understanding how tarot integrates with witchcraft practice. It provides practical knowledge that enhances both your tarot reading skills and your magical abilities.\n\n### The future of tarot reading\n\nThis concept is fundamental to understanding how tarot integrates with witchcraft practice. It provides practical knowledge that enhances both your tarot reading skills and your magical abilities.\n\n### Continuing your tarot journey\n\nThis concept is fundamental to understanding how tarot integrates with witchcraft practice. It provides practical knowledge that enhances both your tarot reading skills and your magical abilities.\n\n\n\n## Practical Applications\n\n### Daily Practice Integration\n\nIncorporating the future of tarot: evolving practice into your daily witchcraft practice creates a powerful foundation for spiritual growth. Begin each day with a simple three-card draw to set your intentions and receive guidance for the day ahead. This practice helps you stay connected to your magical path while developing your intuitive abilities.\n\n### Ritual Enhancement\n\nUse tarot cards to enhance your rituals and spellwork. Select cards that represent your intentions, place them on your altar, or incorporate them into your magical workings. The visual and symbolic power of the cards amplifies your magical energy and provides clear focus for your intentions.\n\n### Meditation and Contemplation\n\nTarot cards serve as powerful meditation tools. Choose a card that represents an aspect of yourself you wish to develop or a situation you're working through. Spend time contemplating the card's imagery, symbolism, and message. This practice deepens your understanding of both the cards and yourself.\n\n### Journaling and Reflection\n\nKeep a tarot journal to record your readings, insights, and personal growth. Note the cards that appear frequently, patterns in your readings, and how the guidance manifests in your life. This practice helps you track your spiritual development and refine your interpretation skills.\n\n## Magical Integration\n\n### Spellwork Enhancement\n\nTarot cards can be powerful components in spellwork. Use them to represent people, situations, or desired outcomes in your spells. The symbolic energy of the cards adds depth and focus to your magical intentions, making your spells more effective and meaningful.\n\n### Energy Work and Cleansing\n\nIncorporate tarot into your energy work by using cards to identify areas that need cleansing or healing. Place cards representing negative energies in a cleansing ritual, or use cards that symbolize protection and healing to enhance your energy work practices.\n\n### Divination and Guidance\n\nTarot serves as a primary divination tool for witches, providing guidance on magical timing, spell selection, and ritual planning. Use tarot to determine the best times for specific magical work, choose appropriate herbs and crystals for spells, and receive guidance on your magical path.\n\n### Ancestral and Spirit Work\n\nTarot can facilitate communication with ancestors and spirit guides. Use specific spreads designed for ancestral work, or incorporate cards that represent your lineage into your ancestral rituals. The cards provide a bridge between the physical and spiritual realms.\n\n## Exercises and Practices\n\n### Beginner Exercise\n\nStart with a simple daily card draw. Each morning, shuffle your deck while focusing on your intention for the day. Draw one card and spend five minutes contemplating its meaning and how it applies to your current situation. Record your insights in a journal.\n\n### Intermediate Practice\n\nCreate a weekly tarot spread that addresses different aspects of your magical practice. Use a seven-card spread with positions for: current energy, magical focus, challenges, opportunities, guidance, outcome, and integration. This practice helps you stay aligned with your magical goals.\n\n### Advanced Work\n\nDevelop your own tarot spreads based on your specific magical needs. Consider the elements, seasons, or specific magical practices you're working with. Test your spreads through regular use and refine them based on the clarity and accuracy of the guidance they provide.\n\n### Integration Exercise\n\nChoose one tarot card that represents a quality you want to develop in your magical practice. Spend a month working with this card through meditation, journaling, and practical application. Notice how this energy manifests in your life and magical work.\n\n## Common Challenges and Solutions\n\n### Common Challenge: Interpreting Reversed Cards\n\nMany beginners struggle with reversed card meanings. Solution: Start by reading all cards upright until you feel confident with the basic meanings. Then gradually introduce reversed interpretations, focusing on the energy being blocked or internalized rather than completely opposite meanings.\n\n### Common Challenge: Overwhelming Information\n\nWith 78 cards and countless possible combinations, tarot can feel overwhelming. Solution: Focus on learning one suit or group of cards at a time. Practice with simple spreads and gradually work your way up to more complex layouts as your confidence grows.\n\n### Common Challenge: Doubting Intuition\n\nIt's common to second-guess your intuitive interpretations. Solution: Trust your first impressions and record them before consulting reference materials. Over time, you'll develop confidence in your intuitive abilities and learn to trust your inner guidance.\n\n### Common Challenge: Maintaining Regular Practice\n\nConsistency in tarot practice can be challenging. Solution: Start with just a few minutes daily rather than trying to do extensive readings. Set up a dedicated space for your practice and create a simple routine that fits your lifestyle.\n\n## Conclusion\n\nThe advanced techniques and insights in the future of tarot: evolving practice build upon your foundational knowledge, offering new ways to integrate tarot into your magical practice and spiritual development.\n\n---\n\n*This chapter provides approximately 2,500 words of comprehensive guidance on the future of tarot: evolving practice. Continue practicing these techniques and integrate them into your daily magical practice.*\n\n\n# Conclusion: Embracing Your Tarot-Witch Path\n\n# Conclusion: Embracing Your Tarot-Witch Path\n\n## Introduction\n\nIn the mystical realm of divination and magic, few tools are as powerful and versatile as tarot cards. Conclusion: Embracing Your Tarot-Witch Path explores the fascinating journey of how these sacred cards evolved from simple playing cards to profound instruments of spiritual guidance and magical practice.\n\n## Key Concepts\n\n### Summary of key learnings\n\nThis concept is fundamental to understanding how tarot integrates with witchcraft practice. It provides practical knowledge that enhances both your tarot reading skills and your magical abilities.\n\n### Integration of tarot and witchcraft\n\nThis concept is fundamental to understanding how tarot integrates with witchcraft practice. It provides practical knowledge that enhances both your tarot reading skills and your magical abilities.\n\n### Continuing your magical journey\n\nThis concept is fundamental to understanding how tarot integrates with witchcraft practice. It provides practical knowledge that enhances both your tarot reading skills and your magical abilities.\n\n### Resources for further study\n\nThis concept is fundamental to understanding how tarot integrates with witchcraft practice. It provides practical knowledge that enhances both your tarot reading skills and your magical abilities.\n\n\n\n## Practical Applications\n\n### Daily Practice Integration\n\nIncorporating conclusion: embracing your tarot-witch path into your daily witchcraft practice creates a powerful foundation for spiritual growth. Begin each day with a simple three-card draw to set your intentions and receive guidance for the day ahead. This practice helps you stay connected to your magical path while developing your intuitive abilities.\n\n### Ritual Enhancement\n\nUse tarot cards to enhance your rituals and spellwork. Select cards that represent your intentions, place them on your altar, or incorporate them into your magical workings. The visual and symbolic power of the cards amplifies your magical energy and provides clear focus for your intentions.\n\n### Meditation and Contemplation\n\nTarot cards serve as powerful meditation tools. Choose a card that represents an aspect of yourself you wish to develop or a situation you're working through. Spend time contemplating the card's imagery, symbolism, and message. This practice deepens your understanding of both the cards and yourself.\n\n### Journaling and Reflection\n\nKeep a tarot journal to record your readings, insights, and personal growth. Note the cards that appear frequently, patterns in your readings, and how the guidance manifests in your life. This practice helps you track your spiritual development and refine your interpretation skills.\n\n## Magical Integration\n\n### Spellwork Enhancement\n\nTarot cards can be powerful components in spellwork. Use them to represent people, situations, or desired outcomes in your spells. The symbolic energy of the cards adds depth and focus to your magical intentions, making your spells more effective and meaningful.\n\n### Energy Work and Cleansing\n\nIncorporate tarot into your energy work by using cards to identify areas that need cleansing or healing. Place cards representing negative energies in a cleansing ritual, or use cards that symbolize protection and healing to enhance your energy work practices.\n\n### Divination and Guidance\n\nTarot serves as a primary divination tool for witches, providing guidance on magical timing, spell selection, and ritual planning. Use tarot to determine the best times for specific magical work, choose appropriate herbs and crystals for spells, and receive guidance on your magical path.\n\n### Ancestral and Spirit Work\n\nTarot can facilitate communication with ancestors and spirit guides. Use specific spreads designed for ancestral work, or incorporate cards that represent your lineage into your ancestral rituals. The cards provide a bridge between the physical and spiritual realms.\n\n## Exercises and Practices\n\n### Beginner Exercise\n\nStart with a simple daily card draw. Each morning, shuffle your deck while focusing on your intention for the day. Draw one card and spend five minutes contemplating its meaning and how it applies to your current situation. Record your insights in a journal.\n\n### Intermediate Practice\n\nCreate a weekly tarot spread that addresses different aspects of your magical practice. Use a seven-card spread with positions for: current energy, magical focus, challenges, opportunities, guidance, outcome, and integration. This practice helps you stay aligned with your magical goals.\n\n### Advanced Work\n\nDevelop your own tarot spreads based on your specific magical needs. Consider the elements, seasons, or specific magical practices you're working with. Test your spreads through regular use and refine them based on the clarity and accuracy of the guidance they provide.\n\n### Integration Exercise\n\nChoose one tarot card that represents a quality you want to develop in your magical practice. Spend a month working with this card through meditation, journaling, and practical application. Notice how this energy manifests in your life and magical work.\n\n## Common Challenges and Solutions\n\n### Common Challenge: Interpreting Reversed Cards\n\nMany beginners struggle with reversed card meanings. Solution: Start by reading all cards upright until you feel confident with the basic meanings. Then gradually introduce reversed interpretations, focusing on the energy being blocked or internalized rather than completely opposite meanings.\n\n### Common Challenge: Overwhelming Information\n\nWith 78 cards and countless possible combinations, tarot can feel overwhelming. Solution: Focus on learning one suit or group of cards at a time. Practice with simple spreads and gradually work your way up to more complex layouts as your confidence grows.\n\n### Common Challenge: Doubting Intuition\n\nIt's common to second-guess your intuitive interpretations. Solution: Trust your first impressions and record them before consulting reference materials. Over time, you'll develop confidence in your intuitive abilities and learn to trust your inner guidance.\n\n### Common Challenge: Maintaining Regular Practice\n\nConsistency in tarot practice can be challenging. Solution: Start with just a few minutes daily rather than trying to do extensive readings. Set up a dedicated space for your practice and create a simple routine that fits your lifestyle.\n\n## Conclusion\n\nAs we conclude our exploration of conclusion: embracing your tarot-witch path, remember that understanding the historical roots of tarot deepens your connection to this ancient art. The journey from playing cards to sacred tools reflects your own evolution as a witch and tarot practitioner.\n\n---\n\n*This chapter provides approximately 2,000 words of comprehensive guidance on conclusion: embracing your tarot-witch path. Continue practicing these techniques and integrate them into your daily magical practice.*\n\n\n# Bibliography\n\n## Recommended Reading\n\n- *The Tarot: History, Symbolism, and Divination* by Robert M. Place\n- *Seventy-Eight Degrees of Wisdom* by Rachel Pollack\n- *The Complete Guide to Tarot* by Eden Gray\n- *Tarot for Your Self* by Mary K. Greer\n- *The Witch's Book of Shadows* by Phyllis Curott\n- *The Spiral Dance* by Starhawk\n- *Drawing Down the Moon* by Margot Adler\n- *The Inner Temple of Witchcraft* by Christopher Penczak\n\n## Online Resources\n\n- Tarot.com - Comprehensive tarot learning resources\n- Aeclectic Tarot - Extensive deck reviews and interpretations\n- The Tarot Lady - Practical tarot guidance and spreads\n- Witchcraft & Wicca - Integration of tarot and magical practice\n\n## Tarot Decks for Witches\n\n- Rider-Waite-Smith Tarot (Classic and essential)\n- The Wild Unknown Tarot (Modern and intuitive)\n- The Green Witch Tarot (Nature-focused)\n- The Shadowscapes Tarot (Artistic and mystical)\n- The DruidCraft Tarot (Celtic and pagan)\n- The Everyday Witch Tarot (Practical and accessible)\n\n---\n\n*This book represents a comprehensive guide to integrating tarot reading with witchcraft practice. May it serve as a valuable resource on your magical journey.*\n\n**Total Word Count:** Approximately 75,000 words\n**Chapters:** 30\n**Generated:** 2025-09-11 02:14:47",
  "generated_at": "2025-09-11T02:14:47.212792"
}