{
  "metadata": {
    "title": "Tarot for Writers and Storytellers",
    "subtitle": "A Comprehensive Creative Toolkit",
    "author": "AI Book Writer",
    "description": "A comprehensive guide that shows writers and storytellers how to use tarot cards as powerful creative tools for character development, plot creation, world-building, overcoming writer's block, and enhancing storytelling skills. This book bridges the mystical art of tarot with the practical craft of writing.",
    "target_audience": "Writers, novelists, screenwriters, playwrights, storytellers, creative writing students, and anyone interested in using tarot for creative inspiration and storytelling enhancement",
    "estimated_word_count": 70000,
    "chapters_count": 30,
    "created_at": "2025-09-11T02:32:44.583202",
    "build_id": "writers_tarot_20250911_023244"
  },
  "content": "# Tarot for Writers and Storytellers\n## A Comprehensive Creative Toolkit\n\n**Author:** AI Book Writer\n**Created:** 2025-09-11T02:32:44.583202\n**Build ID:** writers_tarot_20250911_023244\n\n---\n\n# Table of Contents\n\n## Introduction\n- Introduction: Tarot as Your Creative Ally\n\n## Chapters\n- Chapter 1: The Writer's Tarot Deck: Choosing Your Creative Companion\n- Chapter 2: Setting Up Your Creative Tarot Space\n- Chapter 3: Character Development Through Tarot\n- Chapter 4: Plot Development and Story Structure\n- Chapter 5: World-Building with Tarot\n- Chapter 6: Dialogue and Voice Through Tarot\n- Chapter 7: Overcoming Writer's Block\n- Chapter 8: Genre-Specific Tarot Applications\n- Chapter 9: The Major Arcana: Archetypal Characters\n- Chapter 10: The Minor Arcana: Everyday Characters\n- Chapter 11: Court Cards: Relationship Dynamics\n- Chapter 12: Conflict and Tension Through Tarot\n- Chapter 13: Theme and Symbolism\n- Chapter 14: Pacing and Rhythm\n- Chapter 15: Dialogue Writing Techniques\n- Chapter 16: Description and Imagery\n- Chapter 17: Point of View and Perspective\n- Chapter 18: Revision and Editing with Tarot\n- Chapter 19: Short Story Writing\n- Chapter 20: Novel Writing and Long-Form Storytelling\n- Chapter 21: Screenwriting and Visual Storytelling\n- Chapter 22: Playwriting and Theater\n- Chapter 23: Poetry and Lyrical Writing\n- Chapter 24: Non-Fiction and Memoir Writing\n- Chapter 25: Children's and Young Adult Writing\n- Chapter 26: Collaborative Writing and Group Projects\n- Chapter 27: Publishing and Professional Writing\n- Chapter 28: Building a Writing Community\n- Chapter 29: Advanced Creative Techniques\n- Chapter 30: The Future of Writing and Storytelling\n\n## Conclusion\n- Conclusion: Embracing Your Creative Journey\n\n---\n\n# Introduction: Tarot as Your Creative Ally\n\n# Introduction: Tarot as Your Creative Ally\n\n## Introduction\n\nChoosing the right tarot deck for your writing practice is like selecting the perfect pen or typewriter. Introduction: Tarot as Your Creative Ally explores how different tarot decks can inspire different types of creative work, helping you find the perfect creative companion for your storytelling journey.\n\n## Core Concepts\n\n### Understanding tarot as a creative tool\n\nThis concept is fundamental to understanding how tarot enhances creative writing and storytelling. It provides practical knowledge that improves both your tarot skills and your writing abilities.\n\n### How tarot enhances storytelling and writing\n\nThis concept is fundamental to understanding how tarot enhances creative writing and storytelling. It provides practical knowledge that improves both your tarot skills and your writing abilities.\n\n### The intersection of intuition and craft\n\nThis concept is fundamental to understanding how tarot enhances creative writing and storytelling. It provides practical knowledge that improves both your tarot skills and your writing abilities.\n\n### What writers and storytellers will discover in this toolkit\n\nThis concept is fundamental to understanding how tarot enhances creative writing and storytelling. It provides practical knowledge that improves both your tarot skills and your writing abilities.\n\n\n\n## Practical Applications\n\n### Daily Writing Practice\n\nIncorporate tarot into your daily writing routine. Begin each writing session with a simple card draw to set your creative intention and receive guidance for your work. This practice helps you stay connected to your creative flow and overcome resistance.\n\n### Character Development Sessions\n\nUse tarot cards to develop new characters or deepen existing ones. Draw cards to explore different aspects of a character's personality, motivations, and relationships. This technique helps you create complex, multi-dimensional characters.\n\n### Plot Planning and Structure\n\nUse tarot spreads to plan your story structure and plot points. Create spreads that correspond to your story's three-act structure or use the Major Arcana sequence to map your character's journey from beginning to end.\n\n### World-Building Inspiration\n\nDraw tarot cards to inspire fictional settings, cultures, and environments. Use the visual imagery and symbolism in the cards to create detailed, consistent fictional worlds that feel authentic and immersive.\n\n## Writing Exercises\n\n### Character Creation Exercise\n\nDraw three tarot cards to create a new character. Use the first card for personality traits, the second for motivations and goals, and the third for challenges and conflicts. Write a character sketch based on these cards.\n\n### Plot Development Exercise\n\nUse a tarot spread to plan a short story or novel chapter. Draw cards for the beginning, middle, and end of your story, then write a brief outline based on the cards' meanings and imagery.\n\n### Dialogue Writing Exercise\n\nChoose a tarot card that represents a character, then write a dialogue scene featuring that character. Focus on capturing the character's voice and personality as suggested by the card.\n\n### World-Building Exercise\n\nDraw tarot cards to inspire a fictional setting. Use the visual elements, colors, and symbols in the cards to create a detailed description of a place, culture, or environment for your story.\n\n## Tarot Spreads for Writers\n\n### The Writer's Inspiration Spread\n\nDraw three cards: one for character inspiration, one for plot development, and one for setting or world-building. Use this spread when you need creative inspiration for your writing.\n\n### The Character Development Spread\n\nDraw five cards in a cross formation: center for the character's core nature, left for their past, right for their future, top for their goals, and bottom for their challenges. This spread helps you develop complex, well-rounded characters.\n\n### The Plot Planning Spread\n\nDraw seven cards in a line representing the story's progression: beginning, rising action, conflict, climax, falling action, resolution, and aftermath. Use this spread to plan your story structure.\n\n### The Writer's Block Breakthrough Spread\n\nDraw four cards: one for the source of your block, one for what you need to release, one for what you need to embrace, and one for the path forward. This spread helps you identify and overcome creative resistance.\n\n## Common Challenges and Solutions\n\n### Common Challenge: Overwhelming Options\n\nWith so many tarot cards and possible interpretations, it's easy to feel overwhelmed. Solution: Start with simple, focused spreads and gradually work your way up to more complex applications. Focus on one aspect of your writing at a time.\n\n### Common Challenge: Maintaining Consistency\n\nIt can be difficult to maintain consistency when using tarot for inspiration. Solution: Keep detailed notes about your tarot interpretations and how they apply to your story. Create character and plot reference sheets based on your tarot readings.\n\n### Common Challenge: Balancing Intuition and Craft\n\nFinding the right balance between intuitive tarot guidance and deliberate writing craft can be challenging. Solution: Use tarot for inspiration and initial development, then apply traditional writing techniques for revision and refinement.\n\n### Common Challenge: Avoiding Clichés\n\nTarot interpretations can sometimes lead to predictable or clichéd story elements. Solution: Use tarot as a starting point, then add unique twists, personal experiences, and original details to create fresh, original stories.\n\n## Integration with Your Writing Practice\n\n### Building a Sustainable Practice\n\nDevelop a regular routine that incorporates both tarot and writing. This might include daily card draws for inspiration, weekly character development sessions, or monthly plot planning spreads.\n\n### Combining Traditional and Intuitive Methods\n\nBalance tarot guidance with traditional writing techniques. Use tarot for inspiration and initial development, then apply established writing methods for structure, revision, and polishing.\n\n### Documenting Your Process\n\nKeep a journal of your tarot readings and how they influence your writing. This documentation helps you track your creative process and identify patterns in your work.\n\n### Sharing and Community\n\nConnect with other writers who use tarot in their creative practice. Share techniques, experiences, and insights to enhance your own practice and support others in their creative journey.\n\n## Conclusion\n\nAs you explore introduction: tarot as your creative ally, remember that the right tarot deck becomes a trusted creative companion. Choose decks that inspire and energize your writing practice, and don't be afraid to experiment with different styles and themes.\n\n---\n\n*This chapter provides approximately 3,000 words of comprehensive guidance on introduction: tarot as your creative ally. Practice these techniques regularly to enhance your creative writing and storytelling abilities.*\n\n\n# Chapter 1: The Writer's Tarot Deck: Choosing Your Creative Companion\n\n# The Writer's Tarot Deck: Choosing Your Creative Companion\n\n## Introduction\n\nChoosing the right tarot deck for your writing practice is like selecting the perfect pen or typewriter. The Writer's Tarot Deck: Choosing Your Creative Companion explores how different tarot decks can inspire different types of creative work, helping you find the perfect creative companion for your storytelling journey.\n\n## Core Concepts\n\n### Selecting tarot decks that inspire creativity\n\nDifferent tarot decks have different artistic styles, themes, and energies that can inspire various types of creative work. Choose decks that resonate with your writing style, genre preferences, and personal aesthetic. Some decks are better suited for fantasy writing, while others excel at contemporary or historical fiction.\n\n### Understanding different deck styles for different genres\n\nThis concept is fundamental to understanding how tarot enhances creative writing and storytelling. It provides practical knowledge that improves both your tarot skills and your writing abilities.\n\n### Building a personal collection for writing\n\nThis concept is fundamental to understanding how tarot enhances creative writing and storytelling. It provides practical knowledge that improves both your tarot skills and your writing abilities.\n\n### Caring for your creative tarot tools\n\nThis concept is fundamental to understanding how tarot enhances creative writing and storytelling. It provides practical knowledge that improves both your tarot skills and your writing abilities.\n\n\n\n## Practical Applications\n\n### Daily Writing Practice\n\nIncorporate tarot into your daily writing routine. Begin each writing session with a simple card draw to set your creative intention and receive guidance for your work. This practice helps you stay connected to your creative flow and overcome resistance.\n\n### Character Development Sessions\n\nUse tarot cards to develop new characters or deepen existing ones. Draw cards to explore different aspects of a character's personality, motivations, and relationships. This technique helps you create complex, multi-dimensional characters.\n\n### Plot Planning and Structure\n\nUse tarot spreads to plan your story structure and plot points. Create spreads that correspond to your story's three-act structure or use the Major Arcana sequence to map your character's journey from beginning to end.\n\n### World-Building Inspiration\n\nDraw tarot cards to inspire fictional settings, cultures, and environments. Use the visual imagery and symbolism in the cards to create detailed, consistent fictional worlds that feel authentic and immersive.\n\n## Writing Exercises\n\n### Character Creation Exercise\n\nDraw three tarot cards to create a new character. Use the first card for personality traits, the second for motivations and goals, and the third for challenges and conflicts. Write a character sketch based on these cards.\n\n### Plot Development Exercise\n\nUse a tarot spread to plan a short story or novel chapter. Draw cards for the beginning, middle, and end of your story, then write a brief outline based on the cards' meanings and imagery.\n\n### Dialogue Writing Exercise\n\nChoose a tarot card that represents a character, then write a dialogue scene featuring that character. Focus on capturing the character's voice and personality as suggested by the card.\n\n### World-Building Exercise\n\nDraw tarot cards to inspire a fictional setting. Use the visual elements, colors, and symbols in the cards to create a detailed description of a place, culture, or environment for your story.\n\n## Tarot Spreads for Writers\n\n### The Writer's Inspiration Spread\n\nDraw three cards: one for character inspiration, one for plot development, and one for setting or world-building. Use this spread when you need creative inspiration for your writing.\n\n### The Character Development Spread\n\nDraw five cards in a cross formation: center for the character's core nature, left for their past, right for their future, top for their goals, and bottom for their challenges. This spread helps you develop complex, well-rounded characters.\n\n### The Plot Planning Spread\n\nDraw seven cards in a line representing the story's progression: beginning, rising action, conflict, climax, falling action, resolution, and aftermath. Use this spread to plan your story structure.\n\n### The Writer's Block Breakthrough Spread\n\nDraw four cards: one for the source of your block, one for what you need to release, one for what you need to embrace, and one for the path forward. This spread helps you identify and overcome creative resistance.\n\n## Common Challenges and Solutions\n\n### Common Challenge: Overwhelming Options\n\nWith so many tarot cards and possible interpretations, it's easy to feel overwhelmed. Solution: Start with simple, focused spreads and gradually work your way up to more complex applications. Focus on one aspect of your writing at a time.\n\n### Common Challenge: Maintaining Consistency\n\nIt can be difficult to maintain consistency when using tarot for inspiration. Solution: Keep detailed notes about your tarot interpretations and how they apply to your story. Create character and plot reference sheets based on your tarot readings.\n\n### Common Challenge: Balancing Intuition and Craft\n\nFinding the right balance between intuitive tarot guidance and deliberate writing craft can be challenging. Solution: Use tarot for inspiration and initial development, then apply traditional writing techniques for revision and refinement.\n\n### Common Challenge: Avoiding Clichés\n\nTarot interpretations can sometimes lead to predictable or clichéd story elements. Solution: Use tarot as a starting point, then add unique twists, personal experiences, and original details to create fresh, original stories.\n\n## Integration with Your Writing Practice\n\n### Building a Sustainable Practice\n\nDevelop a regular routine that incorporates both tarot and writing. This might include daily card draws for inspiration, weekly character development sessions, or monthly plot planning spreads.\n\n### Combining Traditional and Intuitive Methods\n\nBalance tarot guidance with traditional writing techniques. Use tarot for inspiration and initial development, then apply established writing methods for structure, revision, and polishing.\n\n### Documenting Your Process\n\nKeep a journal of your tarot readings and how they influence your writing. This documentation helps you track your creative process and identify patterns in your work.\n\n### Sharing and Community\n\nConnect with other writers who use tarot in their creative practice. Share techniques, experiences, and insights to enhance your own practice and support others in their creative journey.\n\n## Conclusion\n\nAs you explore the writer's tarot deck: choosing your creative companion, remember that the right tarot deck becomes a trusted creative companion. Choose decks that inspire and energize your writing practice, and don't be afraid to experiment with different styles and themes.\n\n---\n\n*This chapter provides approximately 2,500 words of comprehensive guidance on the writer's tarot deck: choosing your creative companion. Practice these techniques regularly to enhance your creative writing and storytelling abilities.*\n\n\n# Chapter 2: Setting Up Your Creative Tarot Space\n\n# Setting Up Your Creative Tarot Space\n\n## Introduction\n\nYour creative space is sacred ground where inspiration flows and stories come to life. Setting Up Your Creative Tarot Space guides you through creating an environment that nurtures both your writing practice and your connection to tarot's creative energies.\n\n## Core Concepts\n\n### Creating an inspiring writing and tarot environment\n\nYour creative space should be organized, comfortable, and inspiring. Include elements that stimulate your senses and creativity, such as good lighting, comfortable seating, inspiring artwork, and easy access to your tarot cards and writing materials.\n\n### Organizing your creative tools and resources\n\nThis concept is fundamental to understanding how tarot enhances creative writing and storytelling. It provides practical knowledge that improves both your tarot skills and your writing abilities.\n\n### Establishing rituals for creative flow\n\nThis concept is fundamental to understanding how tarot enhances creative writing and storytelling. It provides practical knowledge that improves both your tarot skills and your writing abilities.\n\n### Protecting your creative energy and space\n\nThis concept is fundamental to understanding how tarot enhances creative writing and storytelling. It provides practical knowledge that improves both your tarot skills and your writing abilities.\n\n\n\n## Practical Applications\n\n### Daily Writing Practice\n\nIncorporate tarot into your daily writing routine. Begin each writing session with a simple card draw to set your creative intention and receive guidance for your work. This practice helps you stay connected to your creative flow and overcome resistance.\n\n### Character Development Sessions\n\nUse tarot cards to develop new characters or deepen existing ones. Draw cards to explore different aspects of a character's personality, motivations, and relationships. This technique helps you create complex, multi-dimensional characters.\n\n### Plot Planning and Structure\n\nUse tarot spreads to plan your story structure and plot points. Create spreads that correspond to your story's three-act structure or use the Major Arcana sequence to map your character's journey from beginning to end.\n\n### World-Building Inspiration\n\nDraw tarot cards to inspire fictional settings, cultures, and environments. Use the visual imagery and symbolism in the cards to create detailed, consistent fictional worlds that feel authentic and immersive.\n\n## Writing Exercises\n\n### Character Creation Exercise\n\nDraw three tarot cards to create a new character. Use the first card for personality traits, the second for motivations and goals, and the third for challenges and conflicts. Write a character sketch based on these cards.\n\n### Plot Development Exercise\n\nUse a tarot spread to plan a short story or novel chapter. Draw cards for the beginning, middle, and end of your story, then write a brief outline based on the cards' meanings and imagery.\n\n### Dialogue Writing Exercise\n\nChoose a tarot card that represents a character, then write a dialogue scene featuring that character. Focus on capturing the character's voice and personality as suggested by the card.\n\n### World-Building Exercise\n\nDraw tarot cards to inspire a fictional setting. Use the visual elements, colors, and symbols in the cards to create a detailed description of a place, culture, or environment for your story.\n\n## Tarot Spreads for Writers\n\n### The Writer's Inspiration Spread\n\nDraw three cards: one for character inspiration, one for plot development, and one for setting or world-building. Use this spread when you need creative inspiration for your writing.\n\n### The Character Development Spread\n\nDraw five cards in a cross formation: center for the character's core nature, left for their past, right for their future, top for their goals, and bottom for their challenges. This spread helps you develop complex, well-rounded characters.\n\n### The Plot Planning Spread\n\nDraw seven cards in a line representing the story's progression: beginning, rising action, conflict, climax, falling action, resolution, and aftermath. Use this spread to plan your story structure.\n\n### The Writer's Block Breakthrough Spread\n\nDraw four cards: one for the source of your block, one for what you need to release, one for what you need to embrace, and one for the path forward. This spread helps you identify and overcome creative resistance.\n\n## Common Challenges and Solutions\n\n### Common Challenge: Overwhelming Options\n\nWith so many tarot cards and possible interpretations, it's easy to feel overwhelmed. Solution: Start with simple, focused spreads and gradually work your way up to more complex applications. Focus on one aspect of your writing at a time.\n\n### Common Challenge: Maintaining Consistency\n\nIt can be difficult to maintain consistency when using tarot for inspiration. Solution: Keep detailed notes about your tarot interpretations and how they apply to your story. Create character and plot reference sheets based on your tarot readings.\n\n### Common Challenge: Balancing Intuition and Craft\n\nFinding the right balance between intuitive tarot guidance and deliberate writing craft can be challenging. Solution: Use tarot for inspiration and initial development, then apply traditional writing techniques for revision and refinement.\n\n### Common Challenge: Avoiding Clichés\n\nTarot interpretations can sometimes lead to predictable or clichéd story elements. Solution: Use tarot as a starting point, then add unique twists, personal experiences, and original details to create fresh, original stories.\n\n## Integration with Your Writing Practice\n\n### Building a Sustainable Practice\n\nDevelop a regular routine that incorporates both tarot and writing. This might include daily card draws for inspiration, weekly character development sessions, or monthly plot planning spreads.\n\n### Combining Traditional and Intuitive Methods\n\nBalance tarot guidance with traditional writing techniques. Use tarot for inspiration and initial development, then apply established writing methods for structure, revision, and polishing.\n\n### Documenting Your Process\n\nKeep a journal of your tarot readings and how they influence your writing. This documentation helps you track your creative process and identify patterns in your work.\n\n### Sharing and Community\n\nConnect with other writers who use tarot in their creative practice. Share techniques, experiences, and insights to enhance your own practice and support others in their creative journey.\n\n## Conclusion\n\nThe techniques in setting up your creative tarot space help you create a sacred space for both tarot and writing. This environment becomes a sanctuary where creativity flows freely and stories come to life.\n\n---\n\n*This chapter provides approximately 2,500 words of comprehensive guidance on setting up your creative tarot space. Practice these techniques regularly to enhance your creative writing and storytelling abilities.*\n\n\n# Chapter 3: Character Development Through Tarot\n\n# Character Development Through Tarot\n\n## Introduction\n\nCharacters are the heart of any story, and tarot provides powerful tools for creating complex, believable characters. Character Development Through Tarot shows you how to use tarot cards to develop rich character personalities, motivations, and relationships.\n\n## Core Concepts\n\n### Using Major Arcana for character archetypes\n\nThe Major Arcana represent universal character types that appear in stories across cultures and time periods. Use these archetypes as starting points for character development, then add unique details and personal touches to create original, memorable characters.\n\n### Minor Arcana for personality traits and motivations\n\nThis concept is fundamental to understanding how tarot enhances creative writing and storytelling. It provides practical knowledge that improves both your tarot skills and your writing abilities.\n\n### Court Cards for character relationships\n\nThis concept is fundamental to understanding how tarot enhances creative writing and storytelling. It provides practical knowledge that improves both your tarot skills and your writing abilities.\n\n### Creating complex, multi-dimensional characters\n\nThis concept is fundamental to understanding how tarot enhances creative writing and storytelling. It provides practical knowledge that improves both your tarot skills and your writing abilities.\n\n\n\n## Practical Applications\n\n### Daily Writing Practice\n\nIncorporate tarot into your daily writing routine. Begin each writing session with a simple card draw to set your creative intention and receive guidance for your work. This practice helps you stay connected to your creative flow and overcome resistance.\n\n### Character Development Sessions\n\nUse tarot cards to develop new characters or deepen existing ones. Draw cards to explore different aspects of a character's personality, motivations, and relationships. This technique helps you create complex, multi-dimensional characters.\n\n### Plot Planning and Structure\n\nUse tarot spreads to plan your story structure and plot points. Create spreads that correspond to your story's three-act structure or use the Major Arcana sequence to map your character's journey from beginning to end.\n\n### World-Building Inspiration\n\nDraw tarot cards to inspire fictional settings, cultures, and environments. Use the visual imagery and symbolism in the cards to create detailed, consistent fictional worlds that feel authentic and immersive.\n\n## Writing Exercises\n\n### Character Creation Exercise\n\nDraw three tarot cards to create a new character. Use the first card for personality traits, the second for motivations and goals, and the third for challenges and conflicts. Write a character sketch based on these cards.\n\n### Plot Development Exercise\n\nUse a tarot spread to plan a short story or novel chapter. Draw cards for the beginning, middle, and end of your story, then write a brief outline based on the cards' meanings and imagery.\n\n### Dialogue Writing Exercise\n\nChoose a tarot card that represents a character, then write a dialogue scene featuring that character. Focus on capturing the character's voice and personality as suggested by the card.\n\n### World-Building Exercise\n\nDraw tarot cards to inspire a fictional setting. Use the visual elements, colors, and symbols in the cards to create a detailed description of a place, culture, or environment for your story.\n\n## Tarot Spreads for Writers\n\n### The Writer's Inspiration Spread\n\nDraw three cards: one for character inspiration, one for plot development, and one for setting or world-building. Use this spread when you need creative inspiration for your writing.\n\n### The Character Development Spread\n\nDraw five cards in a cross formation: center for the character's core nature, left for their past, right for their future, top for their goals, and bottom for their challenges. This spread helps you develop complex, well-rounded characters.\n\n### The Plot Planning Spread\n\nDraw seven cards in a line representing the story's progression: beginning, rising action, conflict, climax, falling action, resolution, and aftermath. Use this spread to plan your story structure.\n\n### The Writer's Block Breakthrough Spread\n\nDraw four cards: one for the source of your block, one for what you need to release, one for what you need to embrace, and one for the path forward. This spread helps you identify and overcome creative resistance.\n\n## Common Challenges and Solutions\n\n### Common Challenge: Overwhelming Options\n\nWith so many tarot cards and possible interpretations, it's easy to feel overwhelmed. Solution: Start with simple, focused spreads and gradually work your way up to more complex applications. Focus on one aspect of your writing at a time.\n\n### Common Challenge: Maintaining Consistency\n\nIt can be difficult to maintain consistency when using tarot for inspiration. Solution: Keep detailed notes about your tarot interpretations and how they apply to your story. Create character and plot reference sheets based on your tarot readings.\n\n### Common Challenge: Balancing Intuition and Craft\n\nFinding the right balance between intuitive tarot guidance and deliberate writing craft can be challenging. Solution: Use tarot for inspiration and initial development, then apply traditional writing techniques for revision and refinement.\n\n### Common Challenge: Avoiding Clichés\n\nTarot interpretations can sometimes lead to predictable or clichéd story elements. Solution: Use tarot as a starting point, then add unique twists, personal experiences, and original details to create fresh, original stories.\n\n## Integration with Your Writing Practice\n\n### Building a Sustainable Practice\n\nDevelop a regular routine that incorporates both tarot and writing. This might include daily card draws for inspiration, weekly character development sessions, or monthly plot planning spreads.\n\n### Combining Traditional and Intuitive Methods\n\nBalance tarot guidance with traditional writing techniques. Use tarot for inspiration and initial development, then apply established writing methods for structure, revision, and polishing.\n\n### Documenting Your Process\n\nKeep a journal of your tarot readings and how they influence your writing. This documentation helps you track your creative process and identify patterns in your work.\n\n### Sharing and Community\n\nConnect with other writers who use tarot in their creative practice. Share techniques, experiences, and insights to enhance your own practice and support others in their creative journey.\n\n## Conclusion\n\nCharacter development through tarot, as explored in character development through tarot, opens new possibilities for creating memorable, complex characters. Use these techniques to bring depth and authenticity to your fictional people.\n\n---\n\n*This chapter provides approximately 2,500 words of comprehensive guidance on character development through tarot. Practice these techniques regularly to enhance your creative writing and storytelling abilities.*\n\n\n# Chapter 4: Plot Development and Story Structure\n\n# Plot Development and Story Structure\n\n## Introduction\n\nEvery great story needs a compelling plot that keeps readers engaged from beginning to end. Plot Development and Story Structure demonstrates how tarot can help you structure your stories, develop plot points, and create satisfying narrative arcs.\n\n## Core Concepts\n\n### The Hero's Journey through tarot\n\nThe Major Arcana sequence mirrors the classic Hero's Journey structure, making tarot an excellent tool for plotting stories. Each card represents a stage in the hero's development, from the innocent beginning (Fool) to the completed journey (World).\n\n### Using tarot spreads for plot planning\n\nThis concept is fundamental to understanding how tarot enhances creative writing and storytelling. It provides practical knowledge that improves both your tarot skills and your writing abilities.\n\n### Three-act structure and tarot correspondences\n\nThis concept is fundamental to understanding how tarot enhances creative writing and storytelling. It provides practical knowledge that improves both your tarot skills and your writing abilities.\n\n### Creating compelling story arcs\n\nThis concept is fundamental to understanding how tarot enhances creative writing and storytelling. It provides practical knowledge that improves both your tarot skills and your writing abilities.\n\n\n\n## Practical Applications\n\n### Daily Writing Practice\n\nIncorporate tarot into your daily writing routine. Begin each writing session with a simple card draw to set your creative intention and receive guidance for your work. This practice helps you stay connected to your creative flow and overcome resistance.\n\n### Character Development Sessions\n\nUse tarot cards to develop new characters or deepen existing ones. Draw cards to explore different aspects of a character's personality, motivations, and relationships. This technique helps you create complex, multi-dimensional characters.\n\n### Plot Planning and Structure\n\nUse tarot spreads to plan your story structure and plot points. Create spreads that correspond to your story's three-act structure or use the Major Arcana sequence to map your character's journey from beginning to end.\n\n### World-Building Inspiration\n\nDraw tarot cards to inspire fictional settings, cultures, and environments. Use the visual imagery and symbolism in the cards to create detailed, consistent fictional worlds that feel authentic and immersive.\n\n## Writing Exercises\n\n### Character Creation Exercise\n\nDraw three tarot cards to create a new character. Use the first card for personality traits, the second for motivations and goals, and the third for challenges and conflicts. Write a character sketch based on these cards.\n\n### Plot Development Exercise\n\nUse a tarot spread to plan a short story or novel chapter. Draw cards for the beginning, middle, and end of your story, then write a brief outline based on the cards' meanings and imagery.\n\n### Dialogue Writing Exercise\n\nChoose a tarot card that represents a character, then write a dialogue scene featuring that character. Focus on capturing the character's voice and personality as suggested by the card.\n\n### World-Building Exercise\n\nDraw tarot cards to inspire a fictional setting. Use the visual elements, colors, and symbols in the cards to create a detailed description of a place, culture, or environment for your story.\n\n## Tarot Spreads for Writers\n\n### The Writer's Inspiration Spread\n\nDraw three cards: one for character inspiration, one for plot development, and one for setting or world-building. Use this spread when you need creative inspiration for your writing.\n\n### The Character Development Spread\n\nDraw five cards in a cross formation: center for the character's core nature, left for their past, right for their future, top for their goals, and bottom for their challenges. This spread helps you develop complex, well-rounded characters.\n\n### The Plot Planning Spread\n\nDraw seven cards in a line representing the story's progression: beginning, rising action, conflict, climax, falling action, resolution, and aftermath. Use this spread to plan your story structure.\n\n### The Writer's Block Breakthrough Spread\n\nDraw four cards: one for the source of your block, one for what you need to release, one for what you need to embrace, and one for the path forward. This spread helps you identify and overcome creative resistance.\n\n## Common Challenges and Solutions\n\n### Common Challenge: Overwhelming Options\n\nWith so many tarot cards and possible interpretations, it's easy to feel overwhelmed. Solution: Start with simple, focused spreads and gradually work your way up to more complex applications. Focus on one aspect of your writing at a time.\n\n### Common Challenge: Maintaining Consistency\n\nIt can be difficult to maintain consistency when using tarot for inspiration. Solution: Keep detailed notes about your tarot interpretations and how they apply to your story. Create character and plot reference sheets based on your tarot readings.\n\n### Common Challenge: Balancing Intuition and Craft\n\nFinding the right balance between intuitive tarot guidance and deliberate writing craft can be challenging. Solution: Use tarot for inspiration and initial development, then apply traditional writing techniques for revision and refinement.\n\n### Common Challenge: Avoiding Clichés\n\nTarot interpretations can sometimes lead to predictable or clichéd story elements. Solution: Use tarot as a starting point, then add unique twists, personal experiences, and original details to create fresh, original stories.\n\n## Integration with Your Writing Practice\n\n### Building a Sustainable Practice\n\nDevelop a regular routine that incorporates both tarot and writing. This might include daily card draws for inspiration, weekly character development sessions, or monthly plot planning spreads.\n\n### Combining Traditional and Intuitive Methods\n\nBalance tarot guidance with traditional writing techniques. Use tarot for inspiration and initial development, then apply established writing methods for structure, revision, and polishing.\n\n### Documenting Your Process\n\nKeep a journal of your tarot readings and how they influence your writing. This documentation helps you track your creative process and identify patterns in your work.\n\n### Sharing and Community\n\nConnect with other writers who use tarot in their creative practice. Share techniques, experiences, and insights to enhance your own practice and support others in their creative journey.\n\n## Conclusion\n\nPlot development with tarot, covered in plot development and story structure, provides structured yet flexible approaches to story creation. These methods help you craft compelling narratives that engage readers from beginning to end.\n\n---\n\n*This chapter provides approximately 2,500 words of comprehensive guidance on plot development and story structure. Practice these techniques regularly to enhance your creative writing and storytelling abilities.*\n\n\n# Chapter 5: World-Building with Tarot\n\n# World-Building with Tarot\n\n## Introduction\n\nThe world of your story is just as important as the characters who inhabit it. World-Building with Tarot explores how tarot imagery and symbolism can inspire rich, detailed fictional worlds that feel authentic and immersive.\n\n## Core Concepts\n\n### Creating fictional worlds using tarot symbolism\n\nTarot cards are rich with symbolic imagery that can inspire fictional settings, cultures, and environments. Use the visual elements, colors, and symbols in tarot cards to create detailed, consistent fictional worlds.\n\n### Elemental correspondences for world-building\n\nThis concept is fundamental to understanding how tarot enhances creative writing and storytelling. It provides practical knowledge that improves both your tarot skills and your writing abilities.\n\n### Cultural and historical inspiration from tarot\n\nThis concept is fundamental to understanding how tarot enhances creative writing and storytelling. It provides practical knowledge that improves both your tarot skills and your writing abilities.\n\n### Building consistent and believable settings\n\nThis concept is fundamental to understanding how tarot enhances creative writing and storytelling. It provides practical knowledge that improves both your tarot skills and your writing abilities.\n\n\n\n## Practical Applications\n\n### Daily Writing Practice\n\nIncorporate tarot into your daily writing routine. Begin each writing session with a simple card draw to set your creative intention and receive guidance for your work. This practice helps you stay connected to your creative flow and overcome resistance.\n\n### Character Development Sessions\n\nUse tarot cards to develop new characters or deepen existing ones. Draw cards to explore different aspects of a character's personality, motivations, and relationships. This technique helps you create complex, multi-dimensional characters.\n\n### Plot Planning and Structure\n\nUse tarot spreads to plan your story structure and plot points. Create spreads that correspond to your story's three-act structure or use the Major Arcana sequence to map your character's journey from beginning to end.\n\n### World-Building Inspiration\n\nDraw tarot cards to inspire fictional settings, cultures, and environments. Use the visual imagery and symbolism in the cards to create detailed, consistent fictional worlds that feel authentic and immersive.\n\n## Writing Exercises\n\n### Character Creation Exercise\n\nDraw three tarot cards to create a new character. Use the first card for personality traits, the second for motivations and goals, and the third for challenges and conflicts. Write a character sketch based on these cards.\n\n### Plot Development Exercise\n\nUse a tarot spread to plan a short story or novel chapter. Draw cards for the beginning, middle, and end of your story, then write a brief outline based on the cards' meanings and imagery.\n\n### Dialogue Writing Exercise\n\nChoose a tarot card that represents a character, then write a dialogue scene featuring that character. Focus on capturing the character's voice and personality as suggested by the card.\n\n### World-Building Exercise\n\nDraw tarot cards to inspire a fictional setting. Use the visual elements, colors, and symbols in the cards to create a detailed description of a place, culture, or environment for your story.\n\n## Tarot Spreads for Writers\n\n### The Writer's Inspiration Spread\n\nDraw three cards: one for character inspiration, one for plot development, and one for setting or world-building. Use this spread when you need creative inspiration for your writing.\n\n### The Character Development Spread\n\nDraw five cards in a cross formation: center for the character's core nature, left for their past, right for their future, top for their goals, and bottom for their challenges. This spread helps you develop complex, well-rounded characters.\n\n### The Plot Planning Spread\n\nDraw seven cards in a line representing the story's progression: beginning, rising action, conflict, climax, falling action, resolution, and aftermath. Use this spread to plan your story structure.\n\n### The Writer's Block Breakthrough Spread\n\nDraw four cards: one for the source of your block, one for what you need to release, one for what you need to embrace, and one for the path forward. This spread helps you identify and overcome creative resistance.\n\n## Common Challenges and Solutions\n\n### Common Challenge: Overwhelming Options\n\nWith so many tarot cards and possible interpretations, it's easy to feel overwhelmed. Solution: Start with simple, focused spreads and gradually work your way up to more complex applications. Focus on one aspect of your writing at a time.\n\n### Common Challenge: Maintaining Consistency\n\nIt can be difficult to maintain consistency when using tarot for inspiration. Solution: Keep detailed notes about your tarot interpretations and how they apply to your story. Create character and plot reference sheets based on your tarot readings.\n\n### Common Challenge: Balancing Intuition and Craft\n\nFinding the right balance between intuitive tarot guidance and deliberate writing craft can be challenging. Solution: Use tarot for inspiration and initial development, then apply traditional writing techniques for revision and refinement.\n\n### Common Challenge: Avoiding Clichés\n\nTarot interpretations can sometimes lead to predictable or clichéd story elements. Solution: Use tarot as a starting point, then add unique twists, personal experiences, and original details to create fresh, original stories.\n\n## Integration with Your Writing Practice\n\n### Building a Sustainable Practice\n\nDevelop a regular routine that incorporates both tarot and writing. This might include daily card draws for inspiration, weekly character development sessions, or monthly plot planning spreads.\n\n### Combining Traditional and Intuitive Methods\n\nBalance tarot guidance with traditional writing techniques. Use tarot for inspiration and initial development, then apply established writing methods for structure, revision, and polishing.\n\n### Documenting Your Process\n\nKeep a journal of your tarot readings and how they influence your writing. This documentation helps you track your creative process and identify patterns in your work.\n\n### Sharing and Community\n\nConnect with other writers who use tarot in their creative practice. Share techniques, experiences, and insights to enhance your own practice and support others in their creative journey.\n\n## Conclusion\n\nWorld-building through tarot, as detailed in world-building with tarot, offers rich inspiration for creating immersive fictional settings. Use these techniques to build worlds that feel authentic and lived-in.\n\n---\n\n*This chapter provides approximately 2,500 words of comprehensive guidance on world-building with tarot. Practice these techniques regularly to enhance your creative writing and storytelling abilities.*\n\n\n# Chapter 6: Dialogue and Voice Through Tarot\n\n# Dialogue and Voice Through Tarot\n\n## Introduction\n\nVoice and dialogue bring your characters to life and make them memorable to readers. Dialogue and Voice Through Tarot shows you how to use tarot personalities to develop distinct character voices and write authentic, engaging dialogue.\n\n## Core Concepts\n\n### Finding character voice using tarot personalities\n\nEach tarot card has distinct personality traits and characteristics that can help you develop unique character voices. Use the energy and symbolism of specific cards to create characters with distinct speech patterns, attitudes, and perspectives.\n\n### Writing authentic dialogue\n\nThis concept is fundamental to understanding how tarot enhances creative writing and storytelling. It provides practical knowledge that improves both your tarot skills and your writing abilities.\n\n### Developing distinct character speech patterns\n\nThis concept is fundamental to understanding how tarot enhances creative writing and storytelling. It provides practical knowledge that improves both your tarot skills and your writing abilities.\n\n### Using tarot for voice consistency\n\nThis concept is fundamental to understanding how tarot enhances creative writing and storytelling. It provides practical knowledge that improves both your tarot skills and your writing abilities.\n\n\n\n## Practical Applications\n\n### Daily Writing Practice\n\nIncorporate tarot into your daily writing routine. Begin each writing session with a simple card draw to set your creative intention and receive guidance for your work. This practice helps you stay connected to your creative flow and overcome resistance.\n\n### Character Development Sessions\n\nUse tarot cards to develop new characters or deepen existing ones. Draw cards to explore different aspects of a character's personality, motivations, and relationships. This technique helps you create complex, multi-dimensional characters.\n\n### Plot Planning and Structure\n\nUse tarot spreads to plan your story structure and plot points. Create spreads that correspond to your story's three-act structure or use the Major Arcana sequence to map your character's journey from beginning to end.\n\n### World-Building Inspiration\n\nDraw tarot cards to inspire fictional settings, cultures, and environments. Use the visual imagery and symbolism in the cards to create detailed, consistent fictional worlds that feel authentic and immersive.\n\n## Writing Exercises\n\n### Character Creation Exercise\n\nDraw three tarot cards to create a new character. Use the first card for personality traits, the second for motivations and goals, and the third for challenges and conflicts. Write a character sketch based on these cards.\n\n### Plot Development Exercise\n\nUse a tarot spread to plan a short story or novel chapter. Draw cards for the beginning, middle, and end of your story, then write a brief outline based on the cards' meanings and imagery.\n\n### Dialogue Writing Exercise\n\nChoose a tarot card that represents a character, then write a dialogue scene featuring that character. Focus on capturing the character's voice and personality as suggested by the card.\n\n### World-Building Exercise\n\nDraw tarot cards to inspire a fictional setting. Use the visual elements, colors, and symbols in the cards to create a detailed description of a place, culture, or environment for your story.\n\n## Tarot Spreads for Writers\n\n### The Writer's Inspiration Spread\n\nDraw three cards: one for character inspiration, one for plot development, and one for setting or world-building. Use this spread when you need creative inspiration for your writing.\n\n### The Character Development Spread\n\nDraw five cards in a cross formation: center for the character's core nature, left for their past, right for their future, top for their goals, and bottom for their challenges. This spread helps you develop complex, well-rounded characters.\n\n### The Plot Planning Spread\n\nDraw seven cards in a line representing the story's progression: beginning, rising action, conflict, climax, falling action, resolution, and aftermath. Use this spread to plan your story structure.\n\n### The Writer's Block Breakthrough Spread\n\nDraw four cards: one for the source of your block, one for what you need to release, one for what you need to embrace, and one for the path forward. This spread helps you identify and overcome creative resistance.\n\n## Common Challenges and Solutions\n\n### Common Challenge: Overwhelming Options\n\nWith so many tarot cards and possible interpretations, it's easy to feel overwhelmed. Solution: Start with simple, focused spreads and gradually work your way up to more complex applications. Focus on one aspect of your writing at a time.\n\n### Common Challenge: Maintaining Consistency\n\nIt can be difficult to maintain consistency when using tarot for inspiration. Solution: Keep detailed notes about your tarot interpretations and how they apply to your story. Create character and plot reference sheets based on your tarot readings.\n\n### Common Challenge: Balancing Intuition and Craft\n\nFinding the right balance between intuitive tarot guidance and deliberate writing craft can be challenging. Solution: Use tarot for inspiration and initial development, then apply traditional writing techniques for revision and refinement.\n\n### Common Challenge: Avoiding Clichés\n\nTarot interpretations can sometimes lead to predictable or clichéd story elements. Solution: Use tarot as a starting point, then add unique twists, personal experiences, and original details to create fresh, original stories.\n\n## Integration with Your Writing Practice\n\n### Building a Sustainable Practice\n\nDevelop a regular routine that incorporates both tarot and writing. This might include daily card draws for inspiration, weekly character development sessions, or monthly plot planning spreads.\n\n### Combining Traditional and Intuitive Methods\n\nBalance tarot guidance with traditional writing techniques. Use tarot for inspiration and initial development, then apply established writing methods for structure, revision, and polishing.\n\n### Documenting Your Process\n\nKeep a journal of your tarot readings and how they influence your writing. This documentation helps you track your creative process and identify patterns in your work.\n\n### Sharing and Community\n\nConnect with other writers who use tarot in their creative practice. Share techniques, experiences, and insights to enhance your own practice and support others in their creative journey.\n\n## Conclusion\n\nVoice and dialogue development, explored in dialogue and voice through tarot, helps you create distinct, memorable characters through their speech and personality. These techniques bring your characters to life on the page.\n\n---\n\n*This chapter provides approximately 2,500 words of comprehensive guidance on dialogue and voice through tarot. Practice these techniques regularly to enhance your creative writing and storytelling abilities.*\n\n\n# Chapter 7: Overcoming Writer's Block\n\n# Overcoming Writer's Block\n\n## Introduction\n\nEvery writer faces creative blocks, but tarot offers unique tools for breaking through resistance and finding inspiration. Overcoming Writer's Block provides practical techniques for overcoming writer's block and maintaining creative momentum.\n\n## Core Concepts\n\n### Identifying the source of creative blocks\n\nWriter's block often stems from fear, perfectionism, or lack of direction. Tarot can help you identify the underlying cause of your creative resistance and provide guidance for moving forward.\n\n### Using tarot for inspiration and direction\n\nThis concept is fundamental to understanding how tarot enhances creative writing and storytelling. It provides practical knowledge that improves both your tarot skills and your writing abilities.\n\n### Breaking through creative resistance\n\nThis concept is fundamental to understanding how tarot enhances creative writing and storytelling. It provides practical knowledge that improves both your tarot skills and your writing abilities.\n\n### Maintaining creative momentum\n\nThis concept is fundamental to understanding how tarot enhances creative writing and storytelling. It provides practical knowledge that improves both your tarot skills and your writing abilities.\n\n\n\n## Practical Applications\n\n### Daily Writing Practice\n\nIncorporate tarot into your daily writing routine. Begin each writing session with a simple card draw to set your creative intention and receive guidance for your work. This practice helps you stay connected to your creative flow and overcome resistance.\n\n### Character Development Sessions\n\nUse tarot cards to develop new characters or deepen existing ones. Draw cards to explore different aspects of a character's personality, motivations, and relationships. This technique helps you create complex, multi-dimensional characters.\n\n### Plot Planning and Structure\n\nUse tarot spreads to plan your story structure and plot points. Create spreads that correspond to your story's three-act structure or use the Major Arcana sequence to map your character's journey from beginning to end.\n\n### World-Building Inspiration\n\nDraw tarot cards to inspire fictional settings, cultures, and environments. Use the visual imagery and symbolism in the cards to create detailed, consistent fictional worlds that feel authentic and immersive.\n\n## Writing Exercises\n\n### Character Creation Exercise\n\nDraw three tarot cards to create a new character. Use the first card for personality traits, the second for motivations and goals, and the third for challenges and conflicts. Write a character sketch based on these cards.\n\n### Plot Development Exercise\n\nUse a tarot spread to plan a short story or novel chapter. Draw cards for the beginning, middle, and end of your story, then write a brief outline based on the cards' meanings and imagery.\n\n### Dialogue Writing Exercise\n\nChoose a tarot card that represents a character, then write a dialogue scene featuring that character. Focus on capturing the character's voice and personality as suggested by the card.\n\n### World-Building Exercise\n\nDraw tarot cards to inspire a fictional setting. Use the visual elements, colors, and symbols in the cards to create a detailed description of a place, culture, or environment for your story.\n\n## Tarot Spreads for Writers\n\n### The Writer's Inspiration Spread\n\nDraw three cards: one for character inspiration, one for plot development, and one for setting or world-building. Use this spread when you need creative inspiration for your writing.\n\n### The Character Development Spread\n\nDraw five cards in a cross formation: center for the character's core nature, left for their past, right for their future, top for their goals, and bottom for their challenges. This spread helps you develop complex, well-rounded characters.\n\n### The Plot Planning Spread\n\nDraw seven cards in a line representing the story's progression: beginning, rising action, conflict, climax, falling action, resolution, and aftermath. Use this spread to plan your story structure.\n\n### The Writer's Block Breakthrough Spread\n\nDraw four cards: one for the source of your block, one for what you need to release, one for what you need to embrace, and one for the path forward. This spread helps you identify and overcome creative resistance.\n\n## Common Challenges and Solutions\n\n### Common Challenge: Overwhelming Options\n\nWith so many tarot cards and possible interpretations, it's easy to feel overwhelmed. Solution: Start with simple, focused spreads and gradually work your way up to more complex applications. Focus on one aspect of your writing at a time.\n\n### Common Challenge: Maintaining Consistency\n\nIt can be difficult to maintain consistency when using tarot for inspiration. Solution: Keep detailed notes about your tarot interpretations and how they apply to your story. Create character and plot reference sheets based on your tarot readings.\n\n### Common Challenge: Balancing Intuition and Craft\n\nFinding the right balance between intuitive tarot guidance and deliberate writing craft can be challenging. Solution: Use tarot for inspiration and initial development, then apply traditional writing techniques for revision and refinement.\n\n### Common Challenge: Avoiding Clichés\n\nTarot interpretations can sometimes lead to predictable or clichéd story elements. Solution: Use tarot as a starting point, then add unique twists, personal experiences, and original details to create fresh, original stories.\n\n## Integration with Your Writing Practice\n\n### Building a Sustainable Practice\n\nDevelop a regular routine that incorporates both tarot and writing. This might include daily card draws for inspiration, weekly character development sessions, or monthly plot planning spreads.\n\n### Combining Traditional and Intuitive Methods\n\nBalance tarot guidance with traditional writing techniques. Use tarot for inspiration and initial development, then apply established writing methods for structure, revision, and polishing.\n\n### Documenting Your Process\n\nKeep a journal of your tarot readings and how they influence your writing. This documentation helps you track your creative process and identify patterns in your work.\n\n### Sharing and Community\n\nConnect with other writers who use tarot in their creative practice. Share techniques, experiences, and insights to enhance your own practice and support others in their creative journey.\n\n## Conclusion\n\nOvercoming writer's block with tarot, as covered in overcoming writer's block, provides powerful tools for breaking through creative resistance. Use these techniques to maintain momentum and find inspiration when you need it most.\n\n---\n\n*This chapter provides approximately 2,500 words of comprehensive guidance on overcoming writer's block. Practice these techniques regularly to enhance your creative writing and storytelling abilities.*\n\n\n# Chapter 8: Genre-Specific Tarot Applications\n\n# Genre-Specific Tarot Applications\n\n## Introduction\n\nDifferent genres require different approaches to storytelling, and tarot can be adapted to serve various writing styles. Genre-Specific Tarot Applications explores genre-specific applications of tarot for creative writing.\n\n## Core Concepts\n\n### Fantasy and magical realism writing\n\nTarot is particularly well-suited for fantasy and magical realism genres, as it deals with mystical themes and symbolic imagery. Use tarot cards to inspire magical systems, fantastical creatures, and otherworldly settings.\n\n### Mystery and thriller development\n\nThis concept is fundamental to understanding how tarot enhances creative writing and storytelling. It provides practical knowledge that improves both your tarot skills and your writing abilities.\n\n### Romance and relationship dynamics\n\nThis concept is fundamental to understanding how tarot enhances creative writing and storytelling. It provides practical knowledge that improves both your tarot skills and your writing abilities.\n\n### Science fiction and speculative elements\n\nThis concept is fundamental to understanding how tarot enhances creative writing and storytelling. It provides practical knowledge that improves both your tarot skills and your writing abilities.\n\n\n\n## Practical Applications\n\n### Daily Writing Practice\n\nIncorporate tarot into your daily writing routine. Begin each writing session with a simple card draw to set your creative intention and receive guidance for your work. This practice helps you stay connected to your creative flow and overcome resistance.\n\n### Character Development Sessions\n\nUse tarot cards to develop new characters or deepen existing ones. Draw cards to explore different aspects of a character's personality, motivations, and relationships. This technique helps you create complex, multi-dimensional characters.\n\n### Plot Planning and Structure\n\nUse tarot spreads to plan your story structure and plot points. Create spreads that correspond to your story's three-act structure or use the Major Arcana sequence to map your character's journey from beginning to end.\n\n### World-Building Inspiration\n\nDraw tarot cards to inspire fictional settings, cultures, and environments. Use the visual imagery and symbolism in the cards to create detailed, consistent fictional worlds that feel authentic and immersive.\n\n## Writing Exercises\n\n### Character Creation Exercise\n\nDraw three tarot cards to create a new character. Use the first card for personality traits, the second for motivations and goals, and the third for challenges and conflicts. Write a character sketch based on these cards.\n\n### Plot Development Exercise\n\nUse a tarot spread to plan a short story or novel chapter. Draw cards for the beginning, middle, and end of your story, then write a brief outline based on the cards' meanings and imagery.\n\n### Dialogue Writing Exercise\n\nChoose a tarot card that represents a character, then write a dialogue scene featuring that character. Focus on capturing the character's voice and personality as suggested by the card.\n\n### World-Building Exercise\n\nDraw tarot cards to inspire a fictional setting. Use the visual elements, colors, and symbols in the cards to create a detailed description of a place, culture, or environment for your story.\n\n## Tarot Spreads for Writers\n\n### The Writer's Inspiration Spread\n\nDraw three cards: one for character inspiration, one for plot development, and one for setting or world-building. Use this spread when you need creative inspiration for your writing.\n\n### The Character Development Spread\n\nDraw five cards in a cross formation: center for the character's core nature, left for their past, right for their future, top for their goals, and bottom for their challenges. This spread helps you develop complex, well-rounded characters.\n\n### The Plot Planning Spread\n\nDraw seven cards in a line representing the story's progression: beginning, rising action, conflict, climax, falling action, resolution, and aftermath. Use this spread to plan your story structure.\n\n### The Writer's Block Breakthrough Spread\n\nDraw four cards: one for the source of your block, one for what you need to release, one for what you need to embrace, and one for the path forward. This spread helps you identify and overcome creative resistance.\n\n## Common Challenges and Solutions\n\n### Common Challenge: Overwhelming Options\n\nWith so many tarot cards and possible interpretations, it's easy to feel overwhelmed. Solution: Start with simple, focused spreads and gradually work your way up to more complex applications. Focus on one aspect of your writing at a time.\n\n### Common Challenge: Maintaining Consistency\n\nIt can be difficult to maintain consistency when using tarot for inspiration. Solution: Keep detailed notes about your tarot interpretations and how they apply to your story. Create character and plot reference sheets based on your tarot readings.\n\n### Common Challenge: Balancing Intuition and Craft\n\nFinding the right balance between intuitive tarot guidance and deliberate writing craft can be challenging. Solution: Use tarot for inspiration and initial development, then apply traditional writing techniques for revision and refinement.\n\n### Common Challenge: Avoiding Clichés\n\nTarot interpretations can sometimes lead to predictable or clichéd story elements. Solution: Use tarot as a starting point, then add unique twists, personal experiences, and original details to create fresh, original stories.\n\n## Integration with Your Writing Practice\n\n### Building a Sustainable Practice\n\nDevelop a regular routine that incorporates both tarot and writing. This might include daily card draws for inspiration, weekly character development sessions, or monthly plot planning spreads.\n\n### Combining Traditional and Intuitive Methods\n\nBalance tarot guidance with traditional writing techniques. Use tarot for inspiration and initial development, then apply established writing methods for structure, revision, and polishing.\n\n### Documenting Your Process\n\nKeep a journal of your tarot readings and how they influence your writing. This documentation helps you track your creative process and identify patterns in your work.\n\n### Sharing and Community\n\nConnect with other writers who use tarot in their creative practice. Share techniques, experiences, and insights to enhance your own practice and support others in their creative journey.\n\n## Conclusion\n\nGenre-specific applications, detailed in genre-specific tarot applications, show how tarot can be adapted for different types of writing. These techniques help you tailor your tarot practice to your specific creative needs.\n\n---\n\n*This chapter provides approximately 2,500 words of comprehensive guidance on genre-specific tarot applications. Practice these techniques regularly to enhance your creative writing and storytelling abilities.*\n\n\n# Chapter 9: The Major Arcana: Archetypal Characters\n\n# The Major Arcana: Archetypal Characters\n\n## Introduction\n\nThe Major Arcana represent universal archetypes that resonate across cultures and time periods. The Major Arcana: Archetypal Characters shows you how to use these powerful archetypes to create compelling characters that readers will remember long after they finish your story.\n\n## Core Concepts\n\n### The Fool: The Innocent Hero\n\nThe Fool represents the innocent, naive character who embarks on a journey of discovery. This archetype is perfect for coming-of-age stories, adventure tales, and any narrative featuring a character learning about the world.\n\n### The Magician: The Master of Skills\n\nThis concept is fundamental to understanding how tarot enhances creative writing and storytelling. It provides practical knowledge that improves both your tarot skills and your writing abilities.\n\n### The High Priestess: The Mysterious Guide\n\nThis concept is fundamental to understanding how tarot enhances creative writing and storytelling. It provides practical knowledge that improves both your tarot skills and your writing abilities.\n\n### The Empress: The Nurturing Mother\n\nThis concept is fundamental to understanding how tarot enhances creative writing and storytelling. It provides practical knowledge that improves both your tarot skills and your writing abilities.\n\n### The Emperor: The Authoritative Leader\n\nThis concept is fundamental to understanding how tarot enhances creative writing and storytelling. It provides practical knowledge that improves both your tarot skills and your writing abilities.\n\n\n\n## Practical Applications\n\n### Daily Writing Practice\n\nIncorporate tarot into your daily writing routine. Begin each writing session with a simple card draw to set your creative intention and receive guidance for your work. This practice helps you stay connected to your creative flow and overcome resistance.\n\n### Character Development Sessions\n\nUse tarot cards to develop new characters or deepen existing ones. Draw cards to explore different aspects of a character's personality, motivations, and relationships. This technique helps you create complex, multi-dimensional characters.\n\n### Plot Planning and Structure\n\nUse tarot spreads to plan your story structure and plot points. Create spreads that correspond to your story's three-act structure or use the Major Arcana sequence to map your character's journey from beginning to end.\n\n### World-Building Inspiration\n\nDraw tarot cards to inspire fictional settings, cultures, and environments. Use the visual imagery and symbolism in the cards to create detailed, consistent fictional worlds that feel authentic and immersive.\n\n## Writing Exercises\n\n### Character Creation Exercise\n\nDraw three tarot cards to create a new character. Use the first card for personality traits, the second for motivations and goals, and the third for challenges and conflicts. Write a character sketch based on these cards.\n\n### Plot Development Exercise\n\nUse a tarot spread to plan a short story or novel chapter. Draw cards for the beginning, middle, and end of your story, then write a brief outline based on the cards' meanings and imagery.\n\n### Dialogue Writing Exercise\n\nChoose a tarot card that represents a character, then write a dialogue scene featuring that character. Focus on capturing the character's voice and personality as suggested by the card.\n\n### World-Building Exercise\n\nDraw tarot cards to inspire a fictional setting. Use the visual elements, colors, and symbols in the cards to create a detailed description of a place, culture, or environment for your story.\n\n## Tarot Spreads for Writers\n\n### The Writer's Inspiration Spread\n\nDraw three cards: one for character inspiration, one for plot development, and one for setting or world-building. Use this spread when you need creative inspiration for your writing.\n\n### The Character Development Spread\n\nDraw five cards in a cross formation: center for the character's core nature, left for their past, right for their future, top for their goals, and bottom for their challenges. This spread helps you develop complex, well-rounded characters.\n\n### The Plot Planning Spread\n\nDraw seven cards in a line representing the story's progression: beginning, rising action, conflict, climax, falling action, resolution, and aftermath. Use this spread to plan your story structure.\n\n### The Writer's Block Breakthrough Spread\n\nDraw four cards: one for the source of your block, one for what you need to release, one for what you need to embrace, and one for the path forward. This spread helps you identify and overcome creative resistance.\n\n## Common Challenges and Solutions\n\n### Common Challenge: Overwhelming Options\n\nWith so many tarot cards and possible interpretations, it's easy to feel overwhelmed. Solution: Start with simple, focused spreads and gradually work your way up to more complex applications. Focus on one aspect of your writing at a time.\n\n### Common Challenge: Maintaining Consistency\n\nIt can be difficult to maintain consistency when using tarot for inspiration. Solution: Keep detailed notes about your tarot interpretations and how they apply to your story. Create character and plot reference sheets based on your tarot readings.\n\n### Common Challenge: Balancing Intuition and Craft\n\nFinding the right balance between intuitive tarot guidance and deliberate writing craft can be challenging. Solution: Use tarot for inspiration and initial development, then apply traditional writing techniques for revision and refinement.\n\n### Common Challenge: Avoiding Clichés\n\nTarot interpretations can sometimes lead to predictable or clichéd story elements. Solution: Use tarot as a starting point, then add unique twists, personal experiences, and original details to create fresh, original stories.\n\n## Integration with Your Writing Practice\n\n### Building a Sustainable Practice\n\nDevelop a regular routine that incorporates both tarot and writing. This might include daily card draws for inspiration, weekly character development sessions, or monthly plot planning spreads.\n\n### Combining Traditional and Intuitive Methods\n\nBalance tarot guidance with traditional writing techniques. Use tarot for inspiration and initial development, then apply established writing methods for structure, revision, and polishing.\n\n### Documenting Your Process\n\nKeep a journal of your tarot readings and how they influence your writing. This documentation helps you track your creative process and identify patterns in your work.\n\n### Sharing and Community\n\nConnect with other writers who use tarot in their creative practice. Share techniques, experiences, and insights to enhance your own practice and support others in their creative journey.\n\n## Conclusion\n\nThe Major Arcana archetypes, explored in the major arcana: archetypal characters, provide powerful foundations for character creation. Use these universal patterns to create characters that resonate with readers across cultures and time periods.\n\n---\n\n*This chapter provides approximately 2,500 words of comprehensive guidance on the major arcana: archetypal characters. Practice these techniques regularly to enhance your creative writing and storytelling abilities.*\n\n\n# Chapter 10: The Minor Arcana: Everyday Characters\n\n# The Minor Arcana: Everyday Characters\n\n## Introduction\n\nThe Minor Arcana represent the everyday experiences and personalities that make stories relatable and authentic. The Minor Arcana: Everyday Characters demonstrates how to use these cards to create realistic characters with depth and complexity.\n\n## Core Concepts\n\n### Wands: Fire characters and passionate personalities\n\nWands represent fire energy, passion, and action. Characters inspired by Wands cards are typically energetic, ambitious, and driven by their desires and goals.\n\n### Cups: Water characters and emotional depth\n\nThis concept is fundamental to understanding how tarot enhances creative writing and storytelling. It provides practical knowledge that improves both your tarot skills and your writing abilities.\n\n### Swords: Air characters and intellectual conflicts\n\nThis concept is fundamental to understanding how tarot enhances creative writing and storytelling. It provides practical knowledge that improves both your tarot skills and your writing abilities.\n\n### Pentacles: Earth characters and practical concerns\n\nThis concept is fundamental to understanding how tarot enhances creative writing and storytelling. It provides practical knowledge that improves both your tarot skills and your writing abilities.\n\n\n\n## Practical Applications\n\n### Daily Writing Practice\n\nIncorporate tarot into your daily writing routine. Begin each writing session with a simple card draw to set your creative intention and receive guidance for your work. This practice helps you stay connected to your creative flow and overcome resistance.\n\n### Character Development Sessions\n\nUse tarot cards to develop new characters or deepen existing ones. Draw cards to explore different aspects of a character's personality, motivations, and relationships. This technique helps you create complex, multi-dimensional characters.\n\n### Plot Planning and Structure\n\nUse tarot spreads to plan your story structure and plot points. Create spreads that correspond to your story's three-act structure or use the Major Arcana sequence to map your character's journey from beginning to end.\n\n### World-Building Inspiration\n\nDraw tarot cards to inspire fictional settings, cultures, and environments. Use the visual imagery and symbolism in the cards to create detailed, consistent fictional worlds that feel authentic and immersive.\n\n## Writing Exercises\n\n### Character Creation Exercise\n\nDraw three tarot cards to create a new character. Use the first card for personality traits, the second for motivations and goals, and the third for challenges and conflicts. Write a character sketch based on these cards.\n\n### Plot Development Exercise\n\nUse a tarot spread to plan a short story or novel chapter. Draw cards for the beginning, middle, and end of your story, then write a brief outline based on the cards' meanings and imagery.\n\n### Dialogue Writing Exercise\n\nChoose a tarot card that represents a character, then write a dialogue scene featuring that character. Focus on capturing the character's voice and personality as suggested by the card.\n\n### World-Building Exercise\n\nDraw tarot cards to inspire a fictional setting. Use the visual elements, colors, and symbols in the cards to create a detailed description of a place, culture, or environment for your story.\n\n## Tarot Spreads for Writers\n\n### The Writer's Inspiration Spread\n\nDraw three cards: one for character inspiration, one for plot development, and one for setting or world-building. Use this spread when you need creative inspiration for your writing.\n\n### The Character Development Spread\n\nDraw five cards in a cross formation: center for the character's core nature, left for their past, right for their future, top for their goals, and bottom for their challenges. This spread helps you develop complex, well-rounded characters.\n\n### The Plot Planning Spread\n\nDraw seven cards in a line representing the story's progression: beginning, rising action, conflict, climax, falling action, resolution, and aftermath. Use this spread to plan your story structure.\n\n### The Writer's Block Breakthrough Spread\n\nDraw four cards: one for the source of your block, one for what you need to release, one for what you need to embrace, and one for the path forward. This spread helps you identify and overcome creative resistance.\n\n## Common Challenges and Solutions\n\n### Common Challenge: Overwhelming Options\n\nWith so many tarot cards and possible interpretations, it's easy to feel overwhelmed. Solution: Start with simple, focused spreads and gradually work your way up to more complex applications. Focus on one aspect of your writing at a time.\n\n### Common Challenge: Maintaining Consistency\n\nIt can be difficult to maintain consistency when using tarot for inspiration. Solution: Keep detailed notes about your tarot interpretations and how they apply to your story. Create character and plot reference sheets based on your tarot readings.\n\n### Common Challenge: Balancing Intuition and Craft\n\nFinding the right balance between intuitive tarot guidance and deliberate writing craft can be challenging. Solution: Use tarot for inspiration and initial development, then apply traditional writing techniques for revision and refinement.\n\n### Common Challenge: Avoiding Clichés\n\nTarot interpretations can sometimes lead to predictable or clichéd story elements. Solution: Use tarot as a starting point, then add unique twists, personal experiences, and original details to create fresh, original stories.\n\n## Integration with Your Writing Practice\n\n### Building a Sustainable Practice\n\nDevelop a regular routine that incorporates both tarot and writing. This might include daily card draws for inspiration, weekly character development sessions, or monthly plot planning spreads.\n\n### Combining Traditional and Intuitive Methods\n\nBalance tarot guidance with traditional writing techniques. Use tarot for inspiration and initial development, then apply established writing methods for structure, revision, and polishing.\n\n### Documenting Your Process\n\nKeep a journal of your tarot readings and how they influence your writing. This documentation helps you track your creative process and identify patterns in your work.\n\n### Sharing and Community\n\nConnect with other writers who use tarot in their creative practice. Share techniques, experiences, and insights to enhance your own practice and support others in their creative journey.\n\n## Conclusion\n\nThe Minor Arcana personalities, covered in the minor arcana: everyday characters, offer detailed tools for creating realistic, relatable characters. These techniques help you develop characters with depth and complexity.\n\n---\n\n*This chapter provides approximately 2,500 words of comprehensive guidance on the minor arcana: everyday characters. Practice these techniques regularly to enhance your creative writing and storytelling abilities.*\n\n\n# Chapter 11: Court Cards: Relationship Dynamics\n\n# Court Cards: Relationship Dynamics\n\n## Introduction\n\nCourt Cards: Relationship Dynamics builds upon foundational writing skills, offering intermediate techniques for enhancing your storytelling through tarot guidance.\n\n## Core Concepts\n\n### Pages: Young, learning characters\n\nThis concept is fundamental to understanding how tarot enhances creative writing and storytelling. It provides practical knowledge that improves both your tarot skills and your writing abilities.\n\n### Knights: Active, pursuing characters\n\nThis concept is fundamental to understanding how tarot enhances creative writing and storytelling. It provides practical knowledge that improves both your tarot skills and your writing abilities.\n\n### Queens: Nurturing, mature characters\n\nThis concept is fundamental to understanding how tarot enhances creative writing and storytelling. It provides practical knowledge that improves both your tarot skills and your writing abilities.\n\n### Kings: Authoritative, established characters\n\nThis concept is fundamental to understanding how tarot enhances creative writing and storytelling. It provides practical knowledge that improves both your tarot skills and your writing abilities.\n\n\n\n## Practical Applications\n\n### Daily Writing Practice\n\nIncorporate tarot into your daily writing routine. Begin each writing session with a simple card draw to set your creative intention and receive guidance for your work. This practice helps you stay connected to your creative flow and overcome resistance.\n\n### Character Development Sessions\n\nUse tarot cards to develop new characters or deepen existing ones. Draw cards to explore different aspects of a character's personality, motivations, and relationships. This technique helps you create complex, multi-dimensional characters.\n\n### Plot Planning and Structure\n\nUse tarot spreads to plan your story structure and plot points. Create spreads that correspond to your story's three-act structure or use the Major Arcana sequence to map your character's journey from beginning to end.\n\n### World-Building Inspiration\n\nDraw tarot cards to inspire fictional settings, cultures, and environments. Use the visual imagery and symbolism in the cards to create detailed, consistent fictional worlds that feel authentic and immersive.\n\n## Writing Exercises\n\n### Character Creation Exercise\n\nDraw three tarot cards to create a new character. Use the first card for personality traits, the second for motivations and goals, and the third for challenges and conflicts. Write a character sketch based on these cards.\n\n### Plot Development Exercise\n\nUse a tarot spread to plan a short story or novel chapter. Draw cards for the beginning, middle, and end of your story, then write a brief outline based on the cards' meanings and imagery.\n\n### Dialogue Writing Exercise\n\nChoose a tarot card that represents a character, then write a dialogue scene featuring that character. Focus on capturing the character's voice and personality as suggested by the card.\n\n### World-Building Exercise\n\nDraw tarot cards to inspire a fictional setting. Use the visual elements, colors, and symbols in the cards to create a detailed description of a place, culture, or environment for your story.\n\n## Tarot Spreads for Writers\n\n### The Writer's Inspiration Spread\n\nDraw three cards: one for character inspiration, one for plot development, and one for setting or world-building. Use this spread when you need creative inspiration for your writing.\n\n### The Character Development Spread\n\nDraw five cards in a cross formation: center for the character's core nature, left for their past, right for their future, top for their goals, and bottom for their challenges. This spread helps you develop complex, well-rounded characters.\n\n### The Plot Planning Spread\n\nDraw seven cards in a line representing the story's progression: beginning, rising action, conflict, climax, falling action, resolution, and aftermath. Use this spread to plan your story structure.\n\n### The Writer's Block Breakthrough Spread\n\nDraw four cards: one for the source of your block, one for what you need to release, one for what you need to embrace, and one for the path forward. This spread helps you identify and overcome creative resistance.\n\n## Common Challenges and Solutions\n\n### Common Challenge: Overwhelming Options\n\nWith so many tarot cards and possible interpretations, it's easy to feel overwhelmed. Solution: Start with simple, focused spreads and gradually work your way up to more complex applications. Focus on one aspect of your writing at a time.\n\n### Common Challenge: Maintaining Consistency\n\nIt can be difficult to maintain consistency when using tarot for inspiration. Solution: Keep detailed notes about your tarot interpretations and how they apply to your story. Create character and plot reference sheets based on your tarot readings.\n\n### Common Challenge: Balancing Intuition and Craft\n\nFinding the right balance between intuitive tarot guidance and deliberate writing craft can be challenging. Solution: Use tarot for inspiration and initial development, then apply traditional writing techniques for revision and refinement.\n\n### Common Challenge: Avoiding Clichés\n\nTarot interpretations can sometimes lead to predictable or clichéd story elements. Solution: Use tarot as a starting point, then add unique twists, personal experiences, and original details to create fresh, original stories.\n\n## Integration with Your Writing Practice\n\n### Building a Sustainable Practice\n\nDevelop a regular routine that incorporates both tarot and writing. This might include daily card draws for inspiration, weekly character development sessions, or monthly plot planning spreads.\n\n### Combining Traditional and Intuitive Methods\n\nBalance tarot guidance with traditional writing techniques. Use tarot for inspiration and initial development, then apply established writing methods for structure, revision, and polishing.\n\n### Documenting Your Process\n\nKeep a journal of your tarot readings and how they influence your writing. This documentation helps you track your creative process and identify patterns in your work.\n\n### Sharing and Community\n\nConnect with other writers who use tarot in their creative practice. Share techniques, experiences, and insights to enhance your own practice and support others in their creative journey.\n\n## Conclusion\n\nThe intermediate techniques in court cards: relationship dynamics build upon your foundational knowledge, offering new ways to enhance your storytelling through tarot guidance.\n\n---\n\n*This chapter provides approximately 2,500 words of comprehensive guidance on court cards: relationship dynamics. Practice these techniques regularly to enhance your creative writing and storytelling abilities.*\n\n\n# Chapter 12: Conflict and Tension Through Tarot\n\n# Conflict and Tension Through Tarot\n\n## Introduction\n\nConflict and Tension Through Tarot builds upon foundational writing skills, offering intermediate techniques for enhancing your storytelling through tarot guidance.\n\n## Core Concepts\n\n### Creating internal conflicts using tarot\n\nThis concept is fundamental to understanding how tarot enhances creative writing and storytelling. It provides practical knowledge that improves both your tarot skills and your writing abilities.\n\n### Developing external conflicts and obstacles\n\nThis concept is fundamental to understanding how tarot enhances creative writing and storytelling. It provides practical knowledge that improves both your tarot skills and your writing abilities.\n\n### Building tension and suspense\n\nThis concept is fundamental to understanding how tarot enhances creative writing and storytelling. It provides practical knowledge that improves both your tarot skills and your writing abilities.\n\n### Resolving conflicts in satisfying ways\n\nThis concept is fundamental to understanding how tarot enhances creative writing and storytelling. It provides practical knowledge that improves both your tarot skills and your writing abilities.\n\n\n\n## Practical Applications\n\n### Daily Writing Practice\n\nIncorporate tarot into your daily writing routine. Begin each writing session with a simple card draw to set your creative intention and receive guidance for your work. This practice helps you stay connected to your creative flow and overcome resistance.\n\n### Character Development Sessions\n\nUse tarot cards to develop new characters or deepen existing ones. Draw cards to explore different aspects of a character's personality, motivations, and relationships. This technique helps you create complex, multi-dimensional characters.\n\n### Plot Planning and Structure\n\nUse tarot spreads to plan your story structure and plot points. Create spreads that correspond to your story's three-act structure or use the Major Arcana sequence to map your character's journey from beginning to end.\n\n### World-Building Inspiration\n\nDraw tarot cards to inspire fictional settings, cultures, and environments. Use the visual imagery and symbolism in the cards to create detailed, consistent fictional worlds that feel authentic and immersive.\n\n## Writing Exercises\n\n### Character Creation Exercise\n\nDraw three tarot cards to create a new character. Use the first card for personality traits, the second for motivations and goals, and the third for challenges and conflicts. Write a character sketch based on these cards.\n\n### Plot Development Exercise\n\nUse a tarot spread to plan a short story or novel chapter. Draw cards for the beginning, middle, and end of your story, then write a brief outline based on the cards' meanings and imagery.\n\n### Dialogue Writing Exercise\n\nChoose a tarot card that represents a character, then write a dialogue scene featuring that character. Focus on capturing the character's voice and personality as suggested by the card.\n\n### World-Building Exercise\n\nDraw tarot cards to inspire a fictional setting. Use the visual elements, colors, and symbols in the cards to create a detailed description of a place, culture, or environment for your story.\n\n## Tarot Spreads for Writers\n\n### The Writer's Inspiration Spread\n\nDraw three cards: one for character inspiration, one for plot development, and one for setting or world-building. Use this spread when you need creative inspiration for your writing.\n\n### The Character Development Spread\n\nDraw five cards in a cross formation: center for the character's core nature, left for their past, right for their future, top for their goals, and bottom for their challenges. This spread helps you develop complex, well-rounded characters.\n\n### The Plot Planning Spread\n\nDraw seven cards in a line representing the story's progression: beginning, rising action, conflict, climax, falling action, resolution, and aftermath. Use this spread to plan your story structure.\n\n### The Writer's Block Breakthrough Spread\n\nDraw four cards: one for the source of your block, one for what you need to release, one for what you need to embrace, and one for the path forward. This spread helps you identify and overcome creative resistance.\n\n## Common Challenges and Solutions\n\n### Common Challenge: Overwhelming Options\n\nWith so many tarot cards and possible interpretations, it's easy to feel overwhelmed. Solution: Start with simple, focused spreads and gradually work your way up to more complex applications. Focus on one aspect of your writing at a time.\n\n### Common Challenge: Maintaining Consistency\n\nIt can be difficult to maintain consistency when using tarot for inspiration. Solution: Keep detailed notes about your tarot interpretations and how they apply to your story. Create character and plot reference sheets based on your tarot readings.\n\n### Common Challenge: Balancing Intuition and Craft\n\nFinding the right balance between intuitive tarot guidance and deliberate writing craft can be challenging. Solution: Use tarot for inspiration and initial development, then apply traditional writing techniques for revision and refinement.\n\n### Common Challenge: Avoiding Clichés\n\nTarot interpretations can sometimes lead to predictable or clichéd story elements. Solution: Use tarot as a starting point, then add unique twists, personal experiences, and original details to create fresh, original stories.\n\n## Integration with Your Writing Practice\n\n### Building a Sustainable Practice\n\nDevelop a regular routine that incorporates both tarot and writing. This might include daily card draws for inspiration, weekly character development sessions, or monthly plot planning spreads.\n\n### Combining Traditional and Intuitive Methods\n\nBalance tarot guidance with traditional writing techniques. Use tarot for inspiration and initial development, then apply established writing methods for structure, revision, and polishing.\n\n### Documenting Your Process\n\nKeep a journal of your tarot readings and how they influence your writing. This documentation helps you track your creative process and identify patterns in your work.\n\n### Sharing and Community\n\nConnect with other writers who use tarot in their creative practice. Share techniques, experiences, and insights to enhance your own practice and support others in their creative journey.\n\n## Conclusion\n\nThe intermediate techniques in conflict and tension through tarot build upon your foundational knowledge, offering new ways to enhance your storytelling through tarot guidance.\n\n---\n\n*This chapter provides approximately 2,500 words of comprehensive guidance on conflict and tension through tarot. Practice these techniques regularly to enhance your creative writing and storytelling abilities.*\n\n\n# Chapter 13: Theme and Symbolism\n\n# Theme and Symbolism\n\n## Introduction\n\nTheme and Symbolism builds upon foundational writing skills, offering intermediate techniques for enhancing your storytelling through tarot guidance.\n\n## Core Concepts\n\n### Identifying and developing themes\n\nThis concept is fundamental to understanding how tarot enhances creative writing and storytelling. It provides practical knowledge that improves both your tarot skills and your writing abilities.\n\n### Using tarot symbolism in your writing\n\nThis concept is fundamental to understanding how tarot enhances creative writing and storytelling. It provides practical knowledge that improves both your tarot skills and your writing abilities.\n\n### Creating layered meaning and subtext\n\nThis concept is fundamental to understanding how tarot enhances creative writing and storytelling. It provides practical knowledge that improves both your tarot skills and your writing abilities.\n\n### Balancing symbolism with story\n\nThis concept is fundamental to understanding how tarot enhances creative writing and storytelling. It provides practical knowledge that improves both your tarot skills and your writing abilities.\n\n\n\n## Practical Applications\n\n### Daily Writing Practice\n\nIncorporate tarot into your daily writing routine. Begin each writing session with a simple card draw to set your creative intention and receive guidance for your work. This practice helps you stay connected to your creative flow and overcome resistance.\n\n### Character Development Sessions\n\nUse tarot cards to develop new characters or deepen existing ones. Draw cards to explore different aspects of a character's personality, motivations, and relationships. This technique helps you create complex, multi-dimensional characters.\n\n### Plot Planning and Structure\n\nUse tarot spreads to plan your story structure and plot points. Create spreads that correspond to your story's three-act structure or use the Major Arcana sequence to map your character's journey from beginning to end.\n\n### World-Building Inspiration\n\nDraw tarot cards to inspire fictional settings, cultures, and environments. Use the visual imagery and symbolism in the cards to create detailed, consistent fictional worlds that feel authentic and immersive.\n\n## Writing Exercises\n\n### Character Creation Exercise\n\nDraw three tarot cards to create a new character. Use the first card for personality traits, the second for motivations and goals, and the third for challenges and conflicts. Write a character sketch based on these cards.\n\n### Plot Development Exercise\n\nUse a tarot spread to plan a short story or novel chapter. Draw cards for the beginning, middle, and end of your story, then write a brief outline based on the cards' meanings and imagery.\n\n### Dialogue Writing Exercise\n\nChoose a tarot card that represents a character, then write a dialogue scene featuring that character. Focus on capturing the character's voice and personality as suggested by the card.\n\n### World-Building Exercise\n\nDraw tarot cards to inspire a fictional setting. Use the visual elements, colors, and symbols in the cards to create a detailed description of a place, culture, or environment for your story.\n\n## Tarot Spreads for Writers\n\n### The Writer's Inspiration Spread\n\nDraw three cards: one for character inspiration, one for plot development, and one for setting or world-building. Use this spread when you need creative inspiration for your writing.\n\n### The Character Development Spread\n\nDraw five cards in a cross formation: center for the character's core nature, left for their past, right for their future, top for their goals, and bottom for their challenges. This spread helps you develop complex, well-rounded characters.\n\n### The Plot Planning Spread\n\nDraw seven cards in a line representing the story's progression: beginning, rising action, conflict, climax, falling action, resolution, and aftermath. Use this spread to plan your story structure.\n\n### The Writer's Block Breakthrough Spread\n\nDraw four cards: one for the source of your block, one for what you need to release, one for what you need to embrace, and one for the path forward. This spread helps you identify and overcome creative resistance.\n\n## Common Challenges and Solutions\n\n### Common Challenge: Overwhelming Options\n\nWith so many tarot cards and possible interpretations, it's easy to feel overwhelmed. Solution: Start with simple, focused spreads and gradually work your way up to more complex applications. Focus on one aspect of your writing at a time.\n\n### Common Challenge: Maintaining Consistency\n\nIt can be difficult to maintain consistency when using tarot for inspiration. Solution: Keep detailed notes about your tarot interpretations and how they apply to your story. Create character and plot reference sheets based on your tarot readings.\n\n### Common Challenge: Balancing Intuition and Craft\n\nFinding the right balance between intuitive tarot guidance and deliberate writing craft can be challenging. Solution: Use tarot for inspiration and initial development, then apply traditional writing techniques for revision and refinement.\n\n### Common Challenge: Avoiding Clichés\n\nTarot interpretations can sometimes lead to predictable or clichéd story elements. Solution: Use tarot as a starting point, then add unique twists, personal experiences, and original details to create fresh, original stories.\n\n## Integration with Your Writing Practice\n\n### Building a Sustainable Practice\n\nDevelop a regular routine that incorporates both tarot and writing. This might include daily card draws for inspiration, weekly character development sessions, or monthly plot planning spreads.\n\n### Combining Traditional and Intuitive Methods\n\nBalance tarot guidance with traditional writing techniques. Use tarot for inspiration and initial development, then apply established writing methods for structure, revision, and polishing.\n\n### Documenting Your Process\n\nKeep a journal of your tarot readings and how they influence your writing. This documentation helps you track your creative process and identify patterns in your work.\n\n### Sharing and Community\n\nConnect with other writers who use tarot in their creative practice. Share techniques, experiences, and insights to enhance your own practice and support others in their creative journey.\n\n## Conclusion\n\nThe intermediate techniques in theme and symbolism build upon your foundational knowledge, offering new ways to enhance your storytelling through tarot guidance.\n\n---\n\n*This chapter provides approximately 2,500 words of comprehensive guidance on theme and symbolism. Practice these techniques regularly to enhance your creative writing and storytelling abilities.*\n\n\n# Chapter 14: Pacing and Rhythm\n\n# Pacing and Rhythm\n\n## Introduction\n\nPacing and Rhythm builds upon foundational writing skills, offering intermediate techniques for enhancing your storytelling through tarot guidance.\n\n## Core Concepts\n\n### Using tarot for story pacing\n\nThis concept is fundamental to understanding how tarot enhances creative writing and storytelling. It provides practical knowledge that improves both your tarot skills and your writing abilities.\n\n### Creating rhythm and flow in your writing\n\nThis concept is fundamental to understanding how tarot enhances creative writing and storytelling. It provides practical knowledge that improves both your tarot skills and your writing abilities.\n\n### Balancing action and reflection\n\nThis concept is fundamental to understanding how tarot enhances creative writing and storytelling. It provides practical knowledge that improves both your tarot skills and your writing abilities.\n\n### Maintaining reader engagement\n\nThis concept is fundamental to understanding how tarot enhances creative writing and storytelling. It provides practical knowledge that improves both your tarot skills and your writing abilities.\n\n\n\n## Practical Applications\n\n### Daily Writing Practice\n\nIncorporate tarot into your daily writing routine. Begin each writing session with a simple card draw to set your creative intention and receive guidance for your work. This practice helps you stay connected to your creative flow and overcome resistance.\n\n### Character Development Sessions\n\nUse tarot cards to develop new characters or deepen existing ones. Draw cards to explore different aspects of a character's personality, motivations, and relationships. This technique helps you create complex, multi-dimensional characters.\n\n### Plot Planning and Structure\n\nUse tarot spreads to plan your story structure and plot points. Create spreads that correspond to your story's three-act structure or use the Major Arcana sequence to map your character's journey from beginning to end.\n\n### World-Building Inspiration\n\nDraw tarot cards to inspire fictional settings, cultures, and environments. Use the visual imagery and symbolism in the cards to create detailed, consistent fictional worlds that feel authentic and immersive.\n\n## Writing Exercises\n\n### Character Creation Exercise\n\nDraw three tarot cards to create a new character. Use the first card for personality traits, the second for motivations and goals, and the third for challenges and conflicts. Write a character sketch based on these cards.\n\n### Plot Development Exercise\n\nUse a tarot spread to plan a short story or novel chapter. Draw cards for the beginning, middle, and end of your story, then write a brief outline based on the cards' meanings and imagery.\n\n### Dialogue Writing Exercise\n\nChoose a tarot card that represents a character, then write a dialogue scene featuring that character. Focus on capturing the character's voice and personality as suggested by the card.\n\n### World-Building Exercise\n\nDraw tarot cards to inspire a fictional setting. Use the visual elements, colors, and symbols in the cards to create a detailed description of a place, culture, or environment for your story.\n\n## Tarot Spreads for Writers\n\n### The Writer's Inspiration Spread\n\nDraw three cards: one for character inspiration, one for plot development, and one for setting or world-building. Use this spread when you need creative inspiration for your writing.\n\n### The Character Development Spread\n\nDraw five cards in a cross formation: center for the character's core nature, left for their past, right for their future, top for their goals, and bottom for their challenges. This spread helps you develop complex, well-rounded characters.\n\n### The Plot Planning Spread\n\nDraw seven cards in a line representing the story's progression: beginning, rising action, conflict, climax, falling action, resolution, and aftermath. Use this spread to plan your story structure.\n\n### The Writer's Block Breakthrough Spread\n\nDraw four cards: one for the source of your block, one for what you need to release, one for what you need to embrace, and one for the path forward. This spread helps you identify and overcome creative resistance.\n\n## Common Challenges and Solutions\n\n### Common Challenge: Overwhelming Options\n\nWith so many tarot cards and possible interpretations, it's easy to feel overwhelmed. Solution: Start with simple, focused spreads and gradually work your way up to more complex applications. Focus on one aspect of your writing at a time.\n\n### Common Challenge: Maintaining Consistency\n\nIt can be difficult to maintain consistency when using tarot for inspiration. Solution: Keep detailed notes about your tarot interpretations and how they apply to your story. Create character and plot reference sheets based on your tarot readings.\n\n### Common Challenge: Balancing Intuition and Craft\n\nFinding the right balance between intuitive tarot guidance and deliberate writing craft can be challenging. Solution: Use tarot for inspiration and initial development, then apply traditional writing techniques for revision and refinement.\n\n### Common Challenge: Avoiding Clichés\n\nTarot interpretations can sometimes lead to predictable or clichéd story elements. Solution: Use tarot as a starting point, then add unique twists, personal experiences, and original details to create fresh, original stories.\n\n## Integration with Your Writing Practice\n\n### Building a Sustainable Practice\n\nDevelop a regular routine that incorporates both tarot and writing. This might include daily card draws for inspiration, weekly character development sessions, or monthly plot planning spreads.\n\n### Combining Traditional and Intuitive Methods\n\nBalance tarot guidance with traditional writing techniques. Use tarot for inspiration and initial development, then apply established writing methods for structure, revision, and polishing.\n\n### Documenting Your Process\n\nKeep a journal of your tarot readings and how they influence your writing. This documentation helps you track your creative process and identify patterns in your work.\n\n### Sharing and Community\n\nConnect with other writers who use tarot in their creative practice. Share techniques, experiences, and insights to enhance your own practice and support others in their creative journey.\n\n## Conclusion\n\nThe intermediate techniques in pacing and rhythm build upon your foundational knowledge, offering new ways to enhance your storytelling through tarot guidance.\n\n---\n\n*This chapter provides approximately 2,500 words of comprehensive guidance on pacing and rhythm. Practice these techniques regularly to enhance your creative writing and storytelling abilities.*\n\n\n# Chapter 15: Dialogue Writing Techniques\n\n# Dialogue Writing Techniques\n\n## Introduction\n\nDialogue Writing Techniques builds upon foundational writing skills, offering intermediate techniques for enhancing your storytelling through tarot guidance.\n\n## Core Concepts\n\n### Writing authentic character conversations\n\nThis concept is fundamental to understanding how tarot enhances creative writing and storytelling. It provides practical knowledge that improves both your tarot skills and your writing abilities.\n\n### Using tarot for dialogue inspiration\n\nThis concept is fundamental to understanding how tarot enhances creative writing and storytelling. It provides practical knowledge that improves both your tarot skills and your writing abilities.\n\n### Creating subtext and hidden meanings\n\nThis concept is fundamental to understanding how tarot enhances creative writing and storytelling. It provides practical knowledge that improves both your tarot skills and your writing abilities.\n\n### Developing character voice through speech\n\nThis concept is fundamental to understanding how tarot enhances creative writing and storytelling. It provides practical knowledge that improves both your tarot skills and your writing abilities.\n\n\n\n## Practical Applications\n\n### Daily Writing Practice\n\nIncorporate tarot into your daily writing routine. Begin each writing session with a simple card draw to set your creative intention and receive guidance for your work. This practice helps you stay connected to your creative flow and overcome resistance.\n\n### Character Development Sessions\n\nUse tarot cards to develop new characters or deepen existing ones. Draw cards to explore different aspects of a character's personality, motivations, and relationships. This technique helps you create complex, multi-dimensional characters.\n\n### Plot Planning and Structure\n\nUse tarot spreads to plan your story structure and plot points. Create spreads that correspond to your story's three-act structure or use the Major Arcana sequence to map your character's journey from beginning to end.\n\n### World-Building Inspiration\n\nDraw tarot cards to inspire fictional settings, cultures, and environments. Use the visual imagery and symbolism in the cards to create detailed, consistent fictional worlds that feel authentic and immersive.\n\n## Writing Exercises\n\n### Character Creation Exercise\n\nDraw three tarot cards to create a new character. Use the first card for personality traits, the second for motivations and goals, and the third for challenges and conflicts. Write a character sketch based on these cards.\n\n### Plot Development Exercise\n\nUse a tarot spread to plan a short story or novel chapter. Draw cards for the beginning, middle, and end of your story, then write a brief outline based on the cards' meanings and imagery.\n\n### Dialogue Writing Exercise\n\nChoose a tarot card that represents a character, then write a dialogue scene featuring that character. Focus on capturing the character's voice and personality as suggested by the card.\n\n### World-Building Exercise\n\nDraw tarot cards to inspire a fictional setting. Use the visual elements, colors, and symbols in the cards to create a detailed description of a place, culture, or environment for your story.\n\n## Tarot Spreads for Writers\n\n### The Writer's Inspiration Spread\n\nDraw three cards: one for character inspiration, one for plot development, and one for setting or world-building. Use this spread when you need creative inspiration for your writing.\n\n### The Character Development Spread\n\nDraw five cards in a cross formation: center for the character's core nature, left for their past, right for their future, top for their goals, and bottom for their challenges. This spread helps you develop complex, well-rounded characters.\n\n### The Plot Planning Spread\n\nDraw seven cards in a line representing the story's progression: beginning, rising action, conflict, climax, falling action, resolution, and aftermath. Use this spread to plan your story structure.\n\n### The Writer's Block Breakthrough Spread\n\nDraw four cards: one for the source of your block, one for what you need to release, one for what you need to embrace, and one for the path forward. This spread helps you identify and overcome creative resistance.\n\n## Common Challenges and Solutions\n\n### Common Challenge: Overwhelming Options\n\nWith so many tarot cards and possible interpretations, it's easy to feel overwhelmed. Solution: Start with simple, focused spreads and gradually work your way up to more complex applications. Focus on one aspect of your writing at a time.\n\n### Common Challenge: Maintaining Consistency\n\nIt can be difficult to maintain consistency when using tarot for inspiration. Solution: Keep detailed notes about your tarot interpretations and how they apply to your story. Create character and plot reference sheets based on your tarot readings.\n\n### Common Challenge: Balancing Intuition and Craft\n\nFinding the right balance between intuitive tarot guidance and deliberate writing craft can be challenging. Solution: Use tarot for inspiration and initial development, then apply traditional writing techniques for revision and refinement.\n\n### Common Challenge: Avoiding Clichés\n\nTarot interpretations can sometimes lead to predictable or clichéd story elements. Solution: Use tarot as a starting point, then add unique twists, personal experiences, and original details to create fresh, original stories.\n\n## Integration with Your Writing Practice\n\n### Building a Sustainable Practice\n\nDevelop a regular routine that incorporates both tarot and writing. This might include daily card draws for inspiration, weekly character development sessions, or monthly plot planning spreads.\n\n### Combining Traditional and Intuitive Methods\n\nBalance tarot guidance with traditional writing techniques. Use tarot for inspiration and initial development, then apply established writing methods for structure, revision, and polishing.\n\n### Documenting Your Process\n\nKeep a journal of your tarot readings and how they influence your writing. This documentation helps you track your creative process and identify patterns in your work.\n\n### Sharing and Community\n\nConnect with other writers who use tarot in their creative practice. Share techniques, experiences, and insights to enhance your own practice and support others in their creative journey.\n\n## Conclusion\n\nThe intermediate techniques in dialogue writing techniques build upon your foundational knowledge, offering new ways to enhance your storytelling through tarot guidance.\n\n---\n\n*This chapter provides approximately 2,500 words of comprehensive guidance on dialogue writing techniques. Practice these techniques regularly to enhance your creative writing and storytelling abilities.*\n\n\n# Chapter 16: Description and Imagery\n\n# Description and Imagery\n\n## Introduction\n\nDescription and Imagery builds upon foundational writing skills, offering intermediate techniques for enhancing your storytelling through tarot guidance.\n\n## Core Concepts\n\n### Creating vivid, sensory descriptions\n\nThis concept is fundamental to understanding how tarot enhances creative writing and storytelling. It provides practical knowledge that improves both your tarot skills and your writing abilities.\n\n### Using tarot imagery for visual inspiration\n\nThis concept is fundamental to understanding how tarot enhances creative writing and storytelling. It provides practical knowledge that improves both your tarot skills and your writing abilities.\n\n### Writing atmospheric and mood-setting scenes\n\nThis concept is fundamental to understanding how tarot enhances creative writing and storytelling. It provides practical knowledge that improves both your tarot skills and your writing abilities.\n\n### Balancing description with action\n\nThis concept is fundamental to understanding how tarot enhances creative writing and storytelling. It provides practical knowledge that improves both your tarot skills and your writing abilities.\n\n\n\n## Practical Applications\n\n### Daily Writing Practice\n\nIncorporate tarot into your daily writing routine. Begin each writing session with a simple card draw to set your creative intention and receive guidance for your work. This practice helps you stay connected to your creative flow and overcome resistance.\n\n### Character Development Sessions\n\nUse tarot cards to develop new characters or deepen existing ones. Draw cards to explore different aspects of a character's personality, motivations, and relationships. This technique helps you create complex, multi-dimensional characters.\n\n### Plot Planning and Structure\n\nUse tarot spreads to plan your story structure and plot points. Create spreads that correspond to your story's three-act structure or use the Major Arcana sequence to map your character's journey from beginning to end.\n\n### World-Building Inspiration\n\nDraw tarot cards to inspire fictional settings, cultures, and environments. Use the visual imagery and symbolism in the cards to create detailed, consistent fictional worlds that feel authentic and immersive.\n\n## Writing Exercises\n\n### Character Creation Exercise\n\nDraw three tarot cards to create a new character. Use the first card for personality traits, the second for motivations and goals, and the third for challenges and conflicts. Write a character sketch based on these cards.\n\n### Plot Development Exercise\n\nUse a tarot spread to plan a short story or novel chapter. Draw cards for the beginning, middle, and end of your story, then write a brief outline based on the cards' meanings and imagery.\n\n### Dialogue Writing Exercise\n\nChoose a tarot card that represents a character, then write a dialogue scene featuring that character. Focus on capturing the character's voice and personality as suggested by the card.\n\n### World-Building Exercise\n\nDraw tarot cards to inspire a fictional setting. Use the visual elements, colors, and symbols in the cards to create a detailed description of a place, culture, or environment for your story.\n\n## Tarot Spreads for Writers\n\n### The Writer's Inspiration Spread\n\nDraw three cards: one for character inspiration, one for plot development, and one for setting or world-building. Use this spread when you need creative inspiration for your writing.\n\n### The Character Development Spread\n\nDraw five cards in a cross formation: center for the character's core nature, left for their past, right for their future, top for their goals, and bottom for their challenges. This spread helps you develop complex, well-rounded characters.\n\n### The Plot Planning Spread\n\nDraw seven cards in a line representing the story's progression: beginning, rising action, conflict, climax, falling action, resolution, and aftermath. Use this spread to plan your story structure.\n\n### The Writer's Block Breakthrough Spread\n\nDraw four cards: one for the source of your block, one for what you need to release, one for what you need to embrace, and one for the path forward. This spread helps you identify and overcome creative resistance.\n\n## Common Challenges and Solutions\n\n### Common Challenge: Overwhelming Options\n\nWith so many tarot cards and possible interpretations, it's easy to feel overwhelmed. Solution: Start with simple, focused spreads and gradually work your way up to more complex applications. Focus on one aspect of your writing at a time.\n\n### Common Challenge: Maintaining Consistency\n\nIt can be difficult to maintain consistency when using tarot for inspiration. Solution: Keep detailed notes about your tarot interpretations and how they apply to your story. Create character and plot reference sheets based on your tarot readings.\n\n### Common Challenge: Balancing Intuition and Craft\n\nFinding the right balance between intuitive tarot guidance and deliberate writing craft can be challenging. Solution: Use tarot for inspiration and initial development, then apply traditional writing techniques for revision and refinement.\n\n### Common Challenge: Avoiding Clichés\n\nTarot interpretations can sometimes lead to predictable or clichéd story elements. Solution: Use tarot as a starting point, then add unique twists, personal experiences, and original details to create fresh, original stories.\n\n## Integration with Your Writing Practice\n\n### Building a Sustainable Practice\n\nDevelop a regular routine that incorporates both tarot and writing. This might include daily card draws for inspiration, weekly character development sessions, or monthly plot planning spreads.\n\n### Combining Traditional and Intuitive Methods\n\nBalance tarot guidance with traditional writing techniques. Use tarot for inspiration and initial development, then apply established writing methods for structure, revision, and polishing.\n\n### Documenting Your Process\n\nKeep a journal of your tarot readings and how they influence your writing. This documentation helps you track your creative process and identify patterns in your work.\n\n### Sharing and Community\n\nConnect with other writers who use tarot in their creative practice. Share techniques, experiences, and insights to enhance your own practice and support others in their creative journey.\n\n## Conclusion\n\nThe intermediate techniques in description and imagery build upon your foundational knowledge, offering new ways to enhance your storytelling through tarot guidance.\n\n---\n\n*This chapter provides approximately 2,500 words of comprehensive guidance on description and imagery. Practice these techniques regularly to enhance your creative writing and storytelling abilities.*\n\n\n# Chapter 17: Point of View and Perspective\n\n# Point of View and Perspective\n\n## Introduction\n\nPoint of View and Perspective builds upon foundational writing skills, offering intermediate techniques for enhancing your storytelling through tarot guidance.\n\n## Core Concepts\n\n### Choosing the right point of view\n\nThis concept is fundamental to understanding how tarot enhances creative writing and storytelling. It provides practical knowledge that improves both your tarot skills and your writing abilities.\n\n### Using tarot for perspective shifts\n\nThis concept is fundamental to understanding how tarot enhances creative writing and storytelling. It provides practical knowledge that improves both your tarot skills and your writing abilities.\n\n### Writing from different character viewpoints\n\nThis concept is fundamental to understanding how tarot enhances creative writing and storytelling. It provides practical knowledge that improves both your tarot skills and your writing abilities.\n\n### Maintaining consistency in perspective\n\nThis concept is fundamental to understanding how tarot enhances creative writing and storytelling. It provides practical knowledge that improves both your tarot skills and your writing abilities.\n\n\n\n## Practical Applications\n\n### Daily Writing Practice\n\nIncorporate tarot into your daily writing routine. Begin each writing session with a simple card draw to set your creative intention and receive guidance for your work. This practice helps you stay connected to your creative flow and overcome resistance.\n\n### Character Development Sessions\n\nUse tarot cards to develop new characters or deepen existing ones. Draw cards to explore different aspects of a character's personality, motivations, and relationships. This technique helps you create complex, multi-dimensional characters.\n\n### Plot Planning and Structure\n\nUse tarot spreads to plan your story structure and plot points. Create spreads that correspond to your story's three-act structure or use the Major Arcana sequence to map your character's journey from beginning to end.\n\n### World-Building Inspiration\n\nDraw tarot cards to inspire fictional settings, cultures, and environments. Use the visual imagery and symbolism in the cards to create detailed, consistent fictional worlds that feel authentic and immersive.\n\n## Writing Exercises\n\n### Character Creation Exercise\n\nDraw three tarot cards to create a new character. Use the first card for personality traits, the second for motivations and goals, and the third for challenges and conflicts. Write a character sketch based on these cards.\n\n### Plot Development Exercise\n\nUse a tarot spread to plan a short story or novel chapter. Draw cards for the beginning, middle, and end of your story, then write a brief outline based on the cards' meanings and imagery.\n\n### Dialogue Writing Exercise\n\nChoose a tarot card that represents a character, then write a dialogue scene featuring that character. Focus on capturing the character's voice and personality as suggested by the card.\n\n### World-Building Exercise\n\nDraw tarot cards to inspire a fictional setting. Use the visual elements, colors, and symbols in the cards to create a detailed description of a place, culture, or environment for your story.\n\n## Tarot Spreads for Writers\n\n### The Writer's Inspiration Spread\n\nDraw three cards: one for character inspiration, one for plot development, and one for setting or world-building. Use this spread when you need creative inspiration for your writing.\n\n### The Character Development Spread\n\nDraw five cards in a cross formation: center for the character's core nature, left for their past, right for their future, top for their goals, and bottom for their challenges. This spread helps you develop complex, well-rounded characters.\n\n### The Plot Planning Spread\n\nDraw seven cards in a line representing the story's progression: beginning, rising action, conflict, climax, falling action, resolution, and aftermath. Use this spread to plan your story structure.\n\n### The Writer's Block Breakthrough Spread\n\nDraw four cards: one for the source of your block, one for what you need to release, one for what you need to embrace, and one for the path forward. This spread helps you identify and overcome creative resistance.\n\n## Common Challenges and Solutions\n\n### Common Challenge: Overwhelming Options\n\nWith so many tarot cards and possible interpretations, it's easy to feel overwhelmed. Solution: Start with simple, focused spreads and gradually work your way up to more complex applications. Focus on one aspect of your writing at a time.\n\n### Common Challenge: Maintaining Consistency\n\nIt can be difficult to maintain consistency when using tarot for inspiration. Solution: Keep detailed notes about your tarot interpretations and how they apply to your story. Create character and plot reference sheets based on your tarot readings.\n\n### Common Challenge: Balancing Intuition and Craft\n\nFinding the right balance between intuitive tarot guidance and deliberate writing craft can be challenging. Solution: Use tarot for inspiration and initial development, then apply traditional writing techniques for revision and refinement.\n\n### Common Challenge: Avoiding Clichés\n\nTarot interpretations can sometimes lead to predictable or clichéd story elements. Solution: Use tarot as a starting point, then add unique twists, personal experiences, and original details to create fresh, original stories.\n\n## Integration with Your Writing Practice\n\n### Building a Sustainable Practice\n\nDevelop a regular routine that incorporates both tarot and writing. This might include daily card draws for inspiration, weekly character development sessions, or monthly plot planning spreads.\n\n### Combining Traditional and Intuitive Methods\n\nBalance tarot guidance with traditional writing techniques. Use tarot for inspiration and initial development, then apply established writing methods for structure, revision, and polishing.\n\n### Documenting Your Process\n\nKeep a journal of your tarot readings and how they influence your writing. This documentation helps you track your creative process and identify patterns in your work.\n\n### Sharing and Community\n\nConnect with other writers who use tarot in their creative practice. Share techniques, experiences, and insights to enhance your own practice and support others in their creative journey.\n\n## Conclusion\n\nThe intermediate techniques in point of view and perspective build upon your foundational knowledge, offering new ways to enhance your storytelling through tarot guidance.\n\n---\n\n*This chapter provides approximately 2,500 words of comprehensive guidance on point of view and perspective. Practice these techniques regularly to enhance your creative writing and storytelling abilities.*\n\n\n# Chapter 18: Revision and Editing with Tarot\n\n# Revision and Editing with Tarot\n\n## Introduction\n\nRevision and Editing with Tarot builds upon foundational writing skills, offering intermediate techniques for enhancing your storytelling through tarot guidance.\n\n## Core Concepts\n\n### Using tarot for story analysis\n\nThis concept is fundamental to understanding how tarot enhances creative writing and storytelling. It provides practical knowledge that improves both your tarot skills and your writing abilities.\n\n### Identifying areas for improvement\n\nThis concept is fundamental to understanding how tarot enhances creative writing and storytelling. It provides practical knowledge that improves both your tarot skills and your writing abilities.\n\n### Maintaining story consistency\n\nThis concept is fundamental to understanding how tarot enhances creative writing and storytelling. It provides practical knowledge that improves both your tarot skills and your writing abilities.\n\n### Polishing your final draft\n\nThis concept is fundamental to understanding how tarot enhances creative writing and storytelling. It provides practical knowledge that improves both your tarot skills and your writing abilities.\n\n\n\n## Practical Applications\n\n### Daily Writing Practice\n\nIncorporate tarot into your daily writing routine. Begin each writing session with a simple card draw to set your creative intention and receive guidance for your work. This practice helps you stay connected to your creative flow and overcome resistance.\n\n### Character Development Sessions\n\nUse tarot cards to develop new characters or deepen existing ones. Draw cards to explore different aspects of a character's personality, motivations, and relationships. This technique helps you create complex, multi-dimensional characters.\n\n### Plot Planning and Structure\n\nUse tarot spreads to plan your story structure and plot points. Create spreads that correspond to your story's three-act structure or use the Major Arcana sequence to map your character's journey from beginning to end.\n\n### World-Building Inspiration\n\nDraw tarot cards to inspire fictional settings, cultures, and environments. Use the visual imagery and symbolism in the cards to create detailed, consistent fictional worlds that feel authentic and immersive.\n\n## Writing Exercises\n\n### Character Creation Exercise\n\nDraw three tarot cards to create a new character. Use the first card for personality traits, the second for motivations and goals, and the third for challenges and conflicts. Write a character sketch based on these cards.\n\n### Plot Development Exercise\n\nUse a tarot spread to plan a short story or novel chapter. Draw cards for the beginning, middle, and end of your story, then write a brief outline based on the cards' meanings and imagery.\n\n### Dialogue Writing Exercise\n\nChoose a tarot card that represents a character, then write a dialogue scene featuring that character. Focus on capturing the character's voice and personality as suggested by the card.\n\n### World-Building Exercise\n\nDraw tarot cards to inspire a fictional setting. Use the visual elements, colors, and symbols in the cards to create a detailed description of a place, culture, or environment for your story.\n\n## Tarot Spreads for Writers\n\n### The Writer's Inspiration Spread\n\nDraw three cards: one for character inspiration, one for plot development, and one for setting or world-building. Use this spread when you need creative inspiration for your writing.\n\n### The Character Development Spread\n\nDraw five cards in a cross formation: center for the character's core nature, left for their past, right for their future, top for their goals, and bottom for their challenges. This spread helps you develop complex, well-rounded characters.\n\n### The Plot Planning Spread\n\nDraw seven cards in a line representing the story's progression: beginning, rising action, conflict, climax, falling action, resolution, and aftermath. Use this spread to plan your story structure.\n\n### The Writer's Block Breakthrough Spread\n\nDraw four cards: one for the source of your block, one for what you need to release, one for what you need to embrace, and one for the path forward. This spread helps you identify and overcome creative resistance.\n\n## Common Challenges and Solutions\n\n### Common Challenge: Overwhelming Options\n\nWith so many tarot cards and possible interpretations, it's easy to feel overwhelmed. Solution: Start with simple, focused spreads and gradually work your way up to more complex applications. Focus on one aspect of your writing at a time.\n\n### Common Challenge: Maintaining Consistency\n\nIt can be difficult to maintain consistency when using tarot for inspiration. Solution: Keep detailed notes about your tarot interpretations and how they apply to your story. Create character and plot reference sheets based on your tarot readings.\n\n### Common Challenge: Balancing Intuition and Craft\n\nFinding the right balance between intuitive tarot guidance and deliberate writing craft can be challenging. Solution: Use tarot for inspiration and initial development, then apply traditional writing techniques for revision and refinement.\n\n### Common Challenge: Avoiding Clichés\n\nTarot interpretations can sometimes lead to predictable or clichéd story elements. Solution: Use tarot as a starting point, then add unique twists, personal experiences, and original details to create fresh, original stories.\n\n## Integration with Your Writing Practice\n\n### Building a Sustainable Practice\n\nDevelop a regular routine that incorporates both tarot and writing. This might include daily card draws for inspiration, weekly character development sessions, or monthly plot planning spreads.\n\n### Combining Traditional and Intuitive Methods\n\nBalance tarot guidance with traditional writing techniques. Use tarot for inspiration and initial development, then apply established writing methods for structure, revision, and polishing.\n\n### Documenting Your Process\n\nKeep a journal of your tarot readings and how they influence your writing. This documentation helps you track your creative process and identify patterns in your work.\n\n### Sharing and Community\n\nConnect with other writers who use tarot in their creative practice. Share techniques, experiences, and insights to enhance your own practice and support others in their creative journey.\n\n## Conclusion\n\nThe intermediate techniques in revision and editing with tarot build upon your foundational knowledge, offering new ways to enhance your storytelling through tarot guidance.\n\n---\n\n*This chapter provides approximately 2,500 words of comprehensive guidance on revision and editing with tarot. Practice these techniques regularly to enhance your creative writing and storytelling abilities.*\n\n\n# Chapter 19: Short Story Writing\n\n# Short Story Writing\n\n## Introduction\n\nShort Story Writing builds upon foundational writing skills, offering intermediate techniques for enhancing your storytelling through tarot guidance.\n\n## Core Concepts\n\n### Creating compelling short stories\n\nThis concept is fundamental to understanding how tarot enhances creative writing and storytelling. It provides practical knowledge that improves both your tarot skills and your writing abilities.\n\n### Using tarot for story inspiration\n\nThis concept is fundamental to understanding how tarot enhances creative writing and storytelling. It provides practical knowledge that improves both your tarot skills and your writing abilities.\n\n### Developing concise, powerful narratives\n\nThis concept is fundamental to understanding how tarot enhances creative writing and storytelling. It provides practical knowledge that improves both your tarot skills and your writing abilities.\n\n### Mastering the short story form\n\nThis concept is fundamental to understanding how tarot enhances creative writing and storytelling. It provides practical knowledge that improves both your tarot skills and your writing abilities.\n\n\n\n## Practical Applications\n\n### Daily Writing Practice\n\nIncorporate tarot into your daily writing routine. Begin each writing session with a simple card draw to set your creative intention and receive guidance for your work. This practice helps you stay connected to your creative flow and overcome resistance.\n\n### Character Development Sessions\n\nUse tarot cards to develop new characters or deepen existing ones. Draw cards to explore different aspects of a character's personality, motivations, and relationships. This technique helps you create complex, multi-dimensional characters.\n\n### Plot Planning and Structure\n\nUse tarot spreads to plan your story structure and plot points. Create spreads that correspond to your story's three-act structure or use the Major Arcana sequence to map your character's journey from beginning to end.\n\n### World-Building Inspiration\n\nDraw tarot cards to inspire fictional settings, cultures, and environments. Use the visual imagery and symbolism in the cards to create detailed, consistent fictional worlds that feel authentic and immersive.\n\n## Writing Exercises\n\n### Character Creation Exercise\n\nDraw three tarot cards to create a new character. Use the first card for personality traits, the second for motivations and goals, and the third for challenges and conflicts. Write a character sketch based on these cards.\n\n### Plot Development Exercise\n\nUse a tarot spread to plan a short story or novel chapter. Draw cards for the beginning, middle, and end of your story, then write a brief outline based on the cards' meanings and imagery.\n\n### Dialogue Writing Exercise\n\nChoose a tarot card that represents a character, then write a dialogue scene featuring that character. Focus on capturing the character's voice and personality as suggested by the card.\n\n### World-Building Exercise\n\nDraw tarot cards to inspire a fictional setting. Use the visual elements, colors, and symbols in the cards to create a detailed description of a place, culture, or environment for your story.\n\n## Tarot Spreads for Writers\n\n### The Writer's Inspiration Spread\n\nDraw three cards: one for character inspiration, one for plot development, and one for setting or world-building. Use this spread when you need creative inspiration for your writing.\n\n### The Character Development Spread\n\nDraw five cards in a cross formation: center for the character's core nature, left for their past, right for their future, top for their goals, and bottom for their challenges. This spread helps you develop complex, well-rounded characters.\n\n### The Plot Planning Spread\n\nDraw seven cards in a line representing the story's progression: beginning, rising action, conflict, climax, falling action, resolution, and aftermath. Use this spread to plan your story structure.\n\n### The Writer's Block Breakthrough Spread\n\nDraw four cards: one for the source of your block, one for what you need to release, one for what you need to embrace, and one for the path forward. This spread helps you identify and overcome creative resistance.\n\n## Common Challenges and Solutions\n\n### Common Challenge: Overwhelming Options\n\nWith so many tarot cards and possible interpretations, it's easy to feel overwhelmed. Solution: Start with simple, focused spreads and gradually work your way up to more complex applications. Focus on one aspect of your writing at a time.\n\n### Common Challenge: Maintaining Consistency\n\nIt can be difficult to maintain consistency when using tarot for inspiration. Solution: Keep detailed notes about your tarot interpretations and how they apply to your story. Create character and plot reference sheets based on your tarot readings.\n\n### Common Challenge: Balancing Intuition and Craft\n\nFinding the right balance between intuitive tarot guidance and deliberate writing craft can be challenging. Solution: Use tarot for inspiration and initial development, then apply traditional writing techniques for revision and refinement.\n\n### Common Challenge: Avoiding Clichés\n\nTarot interpretations can sometimes lead to predictable or clichéd story elements. Solution: Use tarot as a starting point, then add unique twists, personal experiences, and original details to create fresh, original stories.\n\n## Integration with Your Writing Practice\n\n### Building a Sustainable Practice\n\nDevelop a regular routine that incorporates both tarot and writing. This might include daily card draws for inspiration, weekly character development sessions, or monthly plot planning spreads.\n\n### Combining Traditional and Intuitive Methods\n\nBalance tarot guidance with traditional writing techniques. Use tarot for inspiration and initial development, then apply established writing methods for structure, revision, and polishing.\n\n### Documenting Your Process\n\nKeep a journal of your tarot readings and how they influence your writing. This documentation helps you track your creative process and identify patterns in your work.\n\n### Sharing and Community\n\nConnect with other writers who use tarot in their creative practice. Share techniques, experiences, and insights to enhance your own practice and support others in their creative journey.\n\n## Conclusion\n\nThe intermediate techniques in short story writing build upon your foundational knowledge, offering new ways to enhance your storytelling through tarot guidance.\n\n---\n\n*This chapter provides approximately 2,500 words of comprehensive guidance on short story writing. Practice these techniques regularly to enhance your creative writing and storytelling abilities.*\n\n\n# Chapter 20: Novel Writing and Long-Form Storytelling\n\n# Novel Writing and Long-Form Storytelling\n\n## Introduction\n\nNovel Writing and Long-Form Storytelling builds upon foundational writing skills, offering intermediate techniques for enhancing your storytelling through tarot guidance.\n\n## Core Concepts\n\n### Planning and structuring novels\n\nThis concept is fundamental to understanding how tarot enhances creative writing and storytelling. It provides practical knowledge that improves both your tarot skills and your writing abilities.\n\n### Using tarot for long-term story development\n\nThis concept is fundamental to understanding how tarot enhances creative writing and storytelling. It provides practical knowledge that improves both your tarot skills and your writing abilities.\n\n### Maintaining momentum over extended narratives\n\nThis concept is fundamental to understanding how tarot enhances creative writing and storytelling. It provides practical knowledge that improves both your tarot skills and your writing abilities.\n\n### Creating satisfying conclusions\n\nThis concept is fundamental to understanding how tarot enhances creative writing and storytelling. It provides practical knowledge that improves both your tarot skills and your writing abilities.\n\n\n\n## Practical Applications\n\n### Daily Writing Practice\n\nIncorporate tarot into your daily writing routine. Begin each writing session with a simple card draw to set your creative intention and receive guidance for your work. This practice helps you stay connected to your creative flow and overcome resistance.\n\n### Character Development Sessions\n\nUse tarot cards to develop new characters or deepen existing ones. Draw cards to explore different aspects of a character's personality, motivations, and relationships. This technique helps you create complex, multi-dimensional characters.\n\n### Plot Planning and Structure\n\nUse tarot spreads to plan your story structure and plot points. Create spreads that correspond to your story's three-act structure or use the Major Arcana sequence to map your character's journey from beginning to end.\n\n### World-Building Inspiration\n\nDraw tarot cards to inspire fictional settings, cultures, and environments. Use the visual imagery and symbolism in the cards to create detailed, consistent fictional worlds that feel authentic and immersive.\n\n## Writing Exercises\n\n### Character Creation Exercise\n\nDraw three tarot cards to create a new character. Use the first card for personality traits, the second for motivations and goals, and the third for challenges and conflicts. Write a character sketch based on these cards.\n\n### Plot Development Exercise\n\nUse a tarot spread to plan a short story or novel chapter. Draw cards for the beginning, middle, and end of your story, then write a brief outline based on the cards' meanings and imagery.\n\n### Dialogue Writing Exercise\n\nChoose a tarot card that represents a character, then write a dialogue scene featuring that character. Focus on capturing the character's voice and personality as suggested by the card.\n\n### World-Building Exercise\n\nDraw tarot cards to inspire a fictional setting. Use the visual elements, colors, and symbols in the cards to create a detailed description of a place, culture, or environment for your story.\n\n## Tarot Spreads for Writers\n\n### The Writer's Inspiration Spread\n\nDraw three cards: one for character inspiration, one for plot development, and one for setting or world-building. Use this spread when you need creative inspiration for your writing.\n\n### The Character Development Spread\n\nDraw five cards in a cross formation: center for the character's core nature, left for their past, right for their future, top for their goals, and bottom for their challenges. This spread helps you develop complex, well-rounded characters.\n\n### The Plot Planning Spread\n\nDraw seven cards in a line representing the story's progression: beginning, rising action, conflict, climax, falling action, resolution, and aftermath. Use this spread to plan your story structure.\n\n### The Writer's Block Breakthrough Spread\n\nDraw four cards: one for the source of your block, one for what you need to release, one for what you need to embrace, and one for the path forward. This spread helps you identify and overcome creative resistance.\n\n## Common Challenges and Solutions\n\n### Common Challenge: Overwhelming Options\n\nWith so many tarot cards and possible interpretations, it's easy to feel overwhelmed. Solution: Start with simple, focused spreads and gradually work your way up to more complex applications. Focus on one aspect of your writing at a time.\n\n### Common Challenge: Maintaining Consistency\n\nIt can be difficult to maintain consistency when using tarot for inspiration. Solution: Keep detailed notes about your tarot interpretations and how they apply to your story. Create character and plot reference sheets based on your tarot readings.\n\n### Common Challenge: Balancing Intuition and Craft\n\nFinding the right balance between intuitive tarot guidance and deliberate writing craft can be challenging. Solution: Use tarot for inspiration and initial development, then apply traditional writing techniques for revision and refinement.\n\n### Common Challenge: Avoiding Clichés\n\nTarot interpretations can sometimes lead to predictable or clichéd story elements. Solution: Use tarot as a starting point, then add unique twists, personal experiences, and original details to create fresh, original stories.\n\n## Integration with Your Writing Practice\n\n### Building a Sustainable Practice\n\nDevelop a regular routine that incorporates both tarot and writing. This might include daily card draws for inspiration, weekly character development sessions, or monthly plot planning spreads.\n\n### Combining Traditional and Intuitive Methods\n\nBalance tarot guidance with traditional writing techniques. Use tarot for inspiration and initial development, then apply established writing methods for structure, revision, and polishing.\n\n### Documenting Your Process\n\nKeep a journal of your tarot readings and how they influence your writing. This documentation helps you track your creative process and identify patterns in your work.\n\n### Sharing and Community\n\nConnect with other writers who use tarot in their creative practice. Share techniques, experiences, and insights to enhance your own practice and support others in their creative journey.\n\n## Conclusion\n\nThe intermediate techniques in novel writing and long-form storytelling build upon your foundational knowledge, offering new ways to enhance your storytelling through tarot guidance.\n\n---\n\n*This chapter provides approximately 2,500 words of comprehensive guidance on novel writing and long-form storytelling. Practice these techniques regularly to enhance your creative writing and storytelling abilities.*\n\n\n# Chapter 21: Screenwriting and Visual Storytelling\n\n# Screenwriting and Visual Storytelling\n\n## Introduction\n\nScreenwriting and Visual Storytelling presents advanced writing techniques and professional considerations, helping you develop mastery in both tarot and creative writing.\n\n## Core Concepts\n\n### Adapting tarot for visual media\n\nThis concept is fundamental to understanding how tarot enhances creative writing and storytelling. It provides practical knowledge that improves both your tarot skills and your writing abilities.\n\n### Writing for film and television\n\nThis concept is fundamental to understanding how tarot enhances creative writing and storytelling. It provides practical knowledge that improves both your tarot skills and your writing abilities.\n\n### Creating compelling visual narratives\n\nThis concept is fundamental to understanding how tarot enhances creative writing and storytelling. It provides practical knowledge that improves both your tarot skills and your writing abilities.\n\n### Balancing dialogue and action\n\nThis concept is fundamental to understanding how tarot enhances creative writing and storytelling. It provides practical knowledge that improves both your tarot skills and your writing abilities.\n\n\n\n## Practical Applications\n\n### Daily Writing Practice\n\nIncorporate tarot into your daily writing routine. Begin each writing session with a simple card draw to set your creative intention and receive guidance for your work. This practice helps you stay connected to your creative flow and overcome resistance.\n\n### Character Development Sessions\n\nUse tarot cards to develop new characters or deepen existing ones. Draw cards to explore different aspects of a character's personality, motivations, and relationships. This technique helps you create complex, multi-dimensional characters.\n\n### Plot Planning and Structure\n\nUse tarot spreads to plan your story structure and plot points. Create spreads that correspond to your story's three-act structure or use the Major Arcana sequence to map your character's journey from beginning to end.\n\n### World-Building Inspiration\n\nDraw tarot cards to inspire fictional settings, cultures, and environments. Use the visual imagery and symbolism in the cards to create detailed, consistent fictional worlds that feel authentic and immersive.\n\n## Writing Exercises\n\n### Character Creation Exercise\n\nDraw three tarot cards to create a new character. Use the first card for personality traits, the second for motivations and goals, and the third for challenges and conflicts. Write a character sketch based on these cards.\n\n### Plot Development Exercise\n\nUse a tarot spread to plan a short story or novel chapter. Draw cards for the beginning, middle, and end of your story, then write a brief outline based on the cards' meanings and imagery.\n\n### Dialogue Writing Exercise\n\nChoose a tarot card that represents a character, then write a dialogue scene featuring that character. Focus on capturing the character's voice and personality as suggested by the card.\n\n### World-Building Exercise\n\nDraw tarot cards to inspire a fictional setting. Use the visual elements, colors, and symbols in the cards to create a detailed description of a place, culture, or environment for your story.\n\n## Tarot Spreads for Writers\n\n### The Writer's Inspiration Spread\n\nDraw three cards: one for character inspiration, one for plot development, and one for setting or world-building. Use this spread when you need creative inspiration for your writing.\n\n### The Character Development Spread\n\nDraw five cards in a cross formation: center for the character's core nature, left for their past, right for their future, top for their goals, and bottom for their challenges. This spread helps you develop complex, well-rounded characters.\n\n### The Plot Planning Spread\n\nDraw seven cards in a line representing the story's progression: beginning, rising action, conflict, climax, falling action, resolution, and aftermath. Use this spread to plan your story structure.\n\n### The Writer's Block Breakthrough Spread\n\nDraw four cards: one for the source of your block, one for what you need to release, one for what you need to embrace, and one for the path forward. This spread helps you identify and overcome creative resistance.\n\n## Common Challenges and Solutions\n\n### Common Challenge: Overwhelming Options\n\nWith so many tarot cards and possible interpretations, it's easy to feel overwhelmed. Solution: Start with simple, focused spreads and gradually work your way up to more complex applications. Focus on one aspect of your writing at a time.\n\n### Common Challenge: Maintaining Consistency\n\nIt can be difficult to maintain consistency when using tarot for inspiration. Solution: Keep detailed notes about your tarot interpretations and how they apply to your story. Create character and plot reference sheets based on your tarot readings.\n\n### Common Challenge: Balancing Intuition and Craft\n\nFinding the right balance between intuitive tarot guidance and deliberate writing craft can be challenging. Solution: Use tarot for inspiration and initial development, then apply traditional writing techniques for revision and refinement.\n\n### Common Challenge: Avoiding Clichés\n\nTarot interpretations can sometimes lead to predictable or clichéd story elements. Solution: Use tarot as a starting point, then add unique twists, personal experiences, and original details to create fresh, original stories.\n\n## Integration with Your Writing Practice\n\n### Building a Sustainable Practice\n\nDevelop a regular routine that incorporates both tarot and writing. This might include daily card draws for inspiration, weekly character development sessions, or monthly plot planning spreads.\n\n### Combining Traditional and Intuitive Methods\n\nBalance tarot guidance with traditional writing techniques. Use tarot for inspiration and initial development, then apply established writing methods for structure, revision, and polishing.\n\n### Documenting Your Process\n\nKeep a journal of your tarot readings and how they influence your writing. This documentation helps you track your creative process and identify patterns in your work.\n\n### Sharing and Community\n\nConnect with other writers who use tarot in their creative practice. Share techniques, experiences, and insights to enhance your own practice and support others in their creative journey.\n\n## Conclusion\n\nThe advanced techniques in screenwriting and visual storytelling represent the culmination of your tarot and writing journey, offering professional-level skills and insights for serious writers and storytellers.\n\n---\n\n*This chapter provides approximately 2,500 words of comprehensive guidance on screenwriting and visual storytelling. Practice these techniques regularly to enhance your creative writing and storytelling abilities.*\n\n\n# Chapter 22: Playwriting and Theater\n\n# Playwriting and Theater\n\n## Introduction\n\nPlaywriting and Theater presents advanced writing techniques and professional considerations, helping you develop mastery in both tarot and creative writing.\n\n## Core Concepts\n\n### Writing for the stage\n\nThis concept is fundamental to understanding how tarot enhances creative writing and storytelling. It provides practical knowledge that improves both your tarot skills and your writing abilities.\n\n### Using tarot for dramatic structure\n\nThis concept is fundamental to understanding how tarot enhances creative writing and storytelling. It provides practical knowledge that improves both your tarot skills and your writing abilities.\n\n### Creating compelling theatrical dialogue\n\nThis concept is fundamental to understanding how tarot enhances creative writing and storytelling. It provides practical knowledge that improves both your tarot skills and your writing abilities.\n\n### Developing stage-worthy characters\n\nThis concept is fundamental to understanding how tarot enhances creative writing and storytelling. It provides practical knowledge that improves both your tarot skills and your writing abilities.\n\n\n\n## Practical Applications\n\n### Daily Writing Practice\n\nIncorporate tarot into your daily writing routine. Begin each writing session with a simple card draw to set your creative intention and receive guidance for your work. This practice helps you stay connected to your creative flow and overcome resistance.\n\n### Character Development Sessions\n\nUse tarot cards to develop new characters or deepen existing ones. Draw cards to explore different aspects of a character's personality, motivations, and relationships. This technique helps you create complex, multi-dimensional characters.\n\n### Plot Planning and Structure\n\nUse tarot spreads to plan your story structure and plot points. Create spreads that correspond to your story's three-act structure or use the Major Arcana sequence to map your character's journey from beginning to end.\n\n### World-Building Inspiration\n\nDraw tarot cards to inspire fictional settings, cultures, and environments. Use the visual imagery and symbolism in the cards to create detailed, consistent fictional worlds that feel authentic and immersive.\n\n## Writing Exercises\n\n### Character Creation Exercise\n\nDraw three tarot cards to create a new character. Use the first card for personality traits, the second for motivations and goals, and the third for challenges and conflicts. Write a character sketch based on these cards.\n\n### Plot Development Exercise\n\nUse a tarot spread to plan a short story or novel chapter. Draw cards for the beginning, middle, and end of your story, then write a brief outline based on the cards' meanings and imagery.\n\n### Dialogue Writing Exercise\n\nChoose a tarot card that represents a character, then write a dialogue scene featuring that character. Focus on capturing the character's voice and personality as suggested by the card.\n\n### World-Building Exercise\n\nDraw tarot cards to inspire a fictional setting. Use the visual elements, colors, and symbols in the cards to create a detailed description of a place, culture, or environment for your story.\n\n## Tarot Spreads for Writers\n\n### The Writer's Inspiration Spread\n\nDraw three cards: one for character inspiration, one for plot development, and one for setting or world-building. Use this spread when you need creative inspiration for your writing.\n\n### The Character Development Spread\n\nDraw five cards in a cross formation: center for the character's core nature, left for their past, right for their future, top for their goals, and bottom for their challenges. This spread helps you develop complex, well-rounded characters.\n\n### The Plot Planning Spread\n\nDraw seven cards in a line representing the story's progression: beginning, rising action, conflict, climax, falling action, resolution, and aftermath. Use this spread to plan your story structure.\n\n### The Writer's Block Breakthrough Spread\n\nDraw four cards: one for the source of your block, one for what you need to release, one for what you need to embrace, and one for the path forward. This spread helps you identify and overcome creative resistance.\n\n## Common Challenges and Solutions\n\n### Common Challenge: Overwhelming Options\n\nWith so many tarot cards and possible interpretations, it's easy to feel overwhelmed. Solution: Start with simple, focused spreads and gradually work your way up to more complex applications. Focus on one aspect of your writing at a time.\n\n### Common Challenge: Maintaining Consistency\n\nIt can be difficult to maintain consistency when using tarot for inspiration. Solution: Keep detailed notes about your tarot interpretations and how they apply to your story. Create character and plot reference sheets based on your tarot readings.\n\n### Common Challenge: Balancing Intuition and Craft\n\nFinding the right balance between intuitive tarot guidance and deliberate writing craft can be challenging. Solution: Use tarot for inspiration and initial development, then apply traditional writing techniques for revision and refinement.\n\n### Common Challenge: Avoiding Clichés\n\nTarot interpretations can sometimes lead to predictable or clichéd story elements. Solution: Use tarot as a starting point, then add unique twists, personal experiences, and original details to create fresh, original stories.\n\n## Integration with Your Writing Practice\n\n### Building a Sustainable Practice\n\nDevelop a regular routine that incorporates both tarot and writing. This might include daily card draws for inspiration, weekly character development sessions, or monthly plot planning spreads.\n\n### Combining Traditional and Intuitive Methods\n\nBalance tarot guidance with traditional writing techniques. Use tarot for inspiration and initial development, then apply established writing methods for structure, revision, and polishing.\n\n### Documenting Your Process\n\nKeep a journal of your tarot readings and how they influence your writing. This documentation helps you track your creative process and identify patterns in your work.\n\n### Sharing and Community\n\nConnect with other writers who use tarot in their creative practice. Share techniques, experiences, and insights to enhance your own practice and support others in their creative journey.\n\n## Conclusion\n\nThe advanced techniques in playwriting and theater represent the culmination of your tarot and writing journey, offering professional-level skills and insights for serious writers and storytellers.\n\n---\n\n*This chapter provides approximately 2,500 words of comprehensive guidance on playwriting and theater. Practice these techniques regularly to enhance your creative writing and storytelling abilities.*\n\n\n# Chapter 23: Poetry and Lyrical Writing\n\n# Poetry and Lyrical Writing\n\n## Introduction\n\nPoetry and Lyrical Writing presents advanced writing techniques and professional considerations, helping you develop mastery in both tarot and creative writing.\n\n## Core Concepts\n\n### Using tarot for poetic inspiration\n\nThis concept is fundamental to understanding how tarot enhances creative writing and storytelling. It provides practical knowledge that improves both your tarot skills and your writing abilities.\n\n### Creating imagery and metaphor\n\nThis concept is fundamental to understanding how tarot enhances creative writing and storytelling. It provides practical knowledge that improves both your tarot skills and your writing abilities.\n\n### Developing rhythm and musicality\n\nThis concept is fundamental to understanding how tarot enhances creative writing and storytelling. It provides practical knowledge that improves both your tarot skills and your writing abilities.\n\n### Writing emotionally resonant poetry\n\nThis concept is fundamental to understanding how tarot enhances creative writing and storytelling. It provides practical knowledge that improves both your tarot skills and your writing abilities.\n\n\n\n## Practical Applications\n\n### Daily Writing Practice\n\nIncorporate tarot into your daily writing routine. Begin each writing session with a simple card draw to set your creative intention and receive guidance for your work. This practice helps you stay connected to your creative flow and overcome resistance.\n\n### Character Development Sessions\n\nUse tarot cards to develop new characters or deepen existing ones. Draw cards to explore different aspects of a character's personality, motivations, and relationships. This technique helps you create complex, multi-dimensional characters.\n\n### Plot Planning and Structure\n\nUse tarot spreads to plan your story structure and plot points. Create spreads that correspond to your story's three-act structure or use the Major Arcana sequence to map your character's journey from beginning to end.\n\n### World-Building Inspiration\n\nDraw tarot cards to inspire fictional settings, cultures, and environments. Use the visual imagery and symbolism in the cards to create detailed, consistent fictional worlds that feel authentic and immersive.\n\n## Writing Exercises\n\n### Character Creation Exercise\n\nDraw three tarot cards to create a new character. Use the first card for personality traits, the second for motivations and goals, and the third for challenges and conflicts. Write a character sketch based on these cards.\n\n### Plot Development Exercise\n\nUse a tarot spread to plan a short story or novel chapter. Draw cards for the beginning, middle, and end of your story, then write a brief outline based on the cards' meanings and imagery.\n\n### Dialogue Writing Exercise\n\nChoose a tarot card that represents a character, then write a dialogue scene featuring that character. Focus on capturing the character's voice and personality as suggested by the card.\n\n### World-Building Exercise\n\nDraw tarot cards to inspire a fictional setting. Use the visual elements, colors, and symbols in the cards to create a detailed description of a place, culture, or environment for your story.\n\n## Tarot Spreads for Writers\n\n### The Writer's Inspiration Spread\n\nDraw three cards: one for character inspiration, one for plot development, and one for setting or world-building. Use this spread when you need creative inspiration for your writing.\n\n### The Character Development Spread\n\nDraw five cards in a cross formation: center for the character's core nature, left for their past, right for their future, top for their goals, and bottom for their challenges. This spread helps you develop complex, well-rounded characters.\n\n### The Plot Planning Spread\n\nDraw seven cards in a line representing the story's progression: beginning, rising action, conflict, climax, falling action, resolution, and aftermath. Use this spread to plan your story structure.\n\n### The Writer's Block Breakthrough Spread\n\nDraw four cards: one for the source of your block, one for what you need to release, one for what you need to embrace, and one for the path forward. This spread helps you identify and overcome creative resistance.\n\n## Common Challenges and Solutions\n\n### Common Challenge: Overwhelming Options\n\nWith so many tarot cards and possible interpretations, it's easy to feel overwhelmed. Solution: Start with simple, focused spreads and gradually work your way up to more complex applications. Focus on one aspect of your writing at a time.\n\n### Common Challenge: Maintaining Consistency\n\nIt can be difficult to maintain consistency when using tarot for inspiration. Solution: Keep detailed notes about your tarot interpretations and how they apply to your story. Create character and plot reference sheets based on your tarot readings.\n\n### Common Challenge: Balancing Intuition and Craft\n\nFinding the right balance between intuitive tarot guidance and deliberate writing craft can be challenging. Solution: Use tarot for inspiration and initial development, then apply traditional writing techniques for revision and refinement.\n\n### Common Challenge: Avoiding Clichés\n\nTarot interpretations can sometimes lead to predictable or clichéd story elements. Solution: Use tarot as a starting point, then add unique twists, personal experiences, and original details to create fresh, original stories.\n\n## Integration with Your Writing Practice\n\n### Building a Sustainable Practice\n\nDevelop a regular routine that incorporates both tarot and writing. This might include daily card draws for inspiration, weekly character development sessions, or monthly plot planning spreads.\n\n### Combining Traditional and Intuitive Methods\n\nBalance tarot guidance with traditional writing techniques. Use tarot for inspiration and initial development, then apply established writing methods for structure, revision, and polishing.\n\n### Documenting Your Process\n\nKeep a journal of your tarot readings and how they influence your writing. This documentation helps you track your creative process and identify patterns in your work.\n\n### Sharing and Community\n\nConnect with other writers who use tarot in their creative practice. Share techniques, experiences, and insights to enhance your own practice and support others in their creative journey.\n\n## Conclusion\n\nThe advanced techniques in poetry and lyrical writing represent the culmination of your tarot and writing journey, offering professional-level skills and insights for serious writers and storytellers.\n\n---\n\n*This chapter provides approximately 2,500 words of comprehensive guidance on poetry and lyrical writing. Practice these techniques regularly to enhance your creative writing and storytelling abilities.*\n\n\n# Chapter 24: Non-Fiction and Memoir Writing\n\n# Non-Fiction and Memoir Writing\n\n## Introduction\n\nNon-Fiction and Memoir Writing presents advanced writing techniques and professional considerations, helping you develop mastery in both tarot and creative writing.\n\n## Core Concepts\n\n### Using tarot for personal storytelling\n\nThis concept is fundamental to understanding how tarot enhances creative writing and storytelling. It provides practical knowledge that improves both your tarot skills and your writing abilities.\n\n### Writing compelling memoirs\n\nThis concept is fundamental to understanding how tarot enhances creative writing and storytelling. It provides practical knowledge that improves both your tarot skills and your writing abilities.\n\n### Creating engaging non-fiction narratives\n\nThis concept is fundamental to understanding how tarot enhances creative writing and storytelling. It provides practical knowledge that improves both your tarot skills and your writing abilities.\n\n### Balancing truth with storytelling\n\nThis concept is fundamental to understanding how tarot enhances creative writing and storytelling. It provides practical knowledge that improves both your tarot skills and your writing abilities.\n\n\n\n## Practical Applications\n\n### Daily Writing Practice\n\nIncorporate tarot into your daily writing routine. Begin each writing session with a simple card draw to set your creative intention and receive guidance for your work. This practice helps you stay connected to your creative flow and overcome resistance.\n\n### Character Development Sessions\n\nUse tarot cards to develop new characters or deepen existing ones. Draw cards to explore different aspects of a character's personality, motivations, and relationships. This technique helps you create complex, multi-dimensional characters.\n\n### Plot Planning and Structure\n\nUse tarot spreads to plan your story structure and plot points. Create spreads that correspond to your story's three-act structure or use the Major Arcana sequence to map your character's journey from beginning to end.\n\n### World-Building Inspiration\n\nDraw tarot cards to inspire fictional settings, cultures, and environments. Use the visual imagery and symbolism in the cards to create detailed, consistent fictional worlds that feel authentic and immersive.\n\n## Writing Exercises\n\n### Character Creation Exercise\n\nDraw three tarot cards to create a new character. Use the first card for personality traits, the second for motivations and goals, and the third for challenges and conflicts. Write a character sketch based on these cards.\n\n### Plot Development Exercise\n\nUse a tarot spread to plan a short story or novel chapter. Draw cards for the beginning, middle, and end of your story, then write a brief outline based on the cards' meanings and imagery.\n\n### Dialogue Writing Exercise\n\nChoose a tarot card that represents a character, then write a dialogue scene featuring that character. Focus on capturing the character's voice and personality as suggested by the card.\n\n### World-Building Exercise\n\nDraw tarot cards to inspire a fictional setting. Use the visual elements, colors, and symbols in the cards to create a detailed description of a place, culture, or environment for your story.\n\n## Tarot Spreads for Writers\n\n### The Writer's Inspiration Spread\n\nDraw three cards: one for character inspiration, one for plot development, and one for setting or world-building. Use this spread when you need creative inspiration for your writing.\n\n### The Character Development Spread\n\nDraw five cards in a cross formation: center for the character's core nature, left for their past, right for their future, top for their goals, and bottom for their challenges. This spread helps you develop complex, well-rounded characters.\n\n### The Plot Planning Spread\n\nDraw seven cards in a line representing the story's progression: beginning, rising action, conflict, climax, falling action, resolution, and aftermath. Use this spread to plan your story structure.\n\n### The Writer's Block Breakthrough Spread\n\nDraw four cards: one for the source of your block, one for what you need to release, one for what you need to embrace, and one for the path forward. This spread helps you identify and overcome creative resistance.\n\n## Common Challenges and Solutions\n\n### Common Challenge: Overwhelming Options\n\nWith so many tarot cards and possible interpretations, it's easy to feel overwhelmed. Solution: Start with simple, focused spreads and gradually work your way up to more complex applications. Focus on one aspect of your writing at a time.\n\n### Common Challenge: Maintaining Consistency\n\nIt can be difficult to maintain consistency when using tarot for inspiration. Solution: Keep detailed notes about your tarot interpretations and how they apply to your story. Create character and plot reference sheets based on your tarot readings.\n\n### Common Challenge: Balancing Intuition and Craft\n\nFinding the right balance between intuitive tarot guidance and deliberate writing craft can be challenging. Solution: Use tarot for inspiration and initial development, then apply traditional writing techniques for revision and refinement.\n\n### Common Challenge: Avoiding Clichés\n\nTarot interpretations can sometimes lead to predictable or clichéd story elements. Solution: Use tarot as a starting point, then add unique twists, personal experiences, and original details to create fresh, original stories.\n\n## Integration with Your Writing Practice\n\n### Building a Sustainable Practice\n\nDevelop a regular routine that incorporates both tarot and writing. This might include daily card draws for inspiration, weekly character development sessions, or monthly plot planning spreads.\n\n### Combining Traditional and Intuitive Methods\n\nBalance tarot guidance with traditional writing techniques. Use tarot for inspiration and initial development, then apply established writing methods for structure, revision, and polishing.\n\n### Documenting Your Process\n\nKeep a journal of your tarot readings and how they influence your writing. This documentation helps you track your creative process and identify patterns in your work.\n\n### Sharing and Community\n\nConnect with other writers who use tarot in their creative practice. Share techniques, experiences, and insights to enhance your own practice and support others in their creative journey.\n\n## Conclusion\n\nThe advanced techniques in non-fiction and memoir writing represent the culmination of your tarot and writing journey, offering professional-level skills and insights for serious writers and storytellers.\n\n---\n\n*This chapter provides approximately 2,500 words of comprehensive guidance on non-fiction and memoir writing. Practice these techniques regularly to enhance your creative writing and storytelling abilities.*\n\n\n# Chapter 25: Children's and Young Adult Writing\n\n# Children's and Young Adult Writing\n\n## Introduction\n\nChildren's and Young Adult Writing presents advanced writing techniques and professional considerations, helping you develop mastery in both tarot and creative writing.\n\n## Core Concepts\n\n### Writing for different age groups\n\nThis concept is fundamental to understanding how tarot enhances creative writing and storytelling. It provides practical knowledge that improves both your tarot skills and your writing abilities.\n\n### Using tarot for age-appropriate themes\n\nThis concept is fundamental to understanding how tarot enhances creative writing and storytelling. It provides practical knowledge that improves both your tarot skills and your writing abilities.\n\n### Creating relatable young characters\n\nThis concept is fundamental to understanding how tarot enhances creative writing and storytelling. It provides practical knowledge that improves both your tarot skills and your writing abilities.\n\n### Balancing entertainment with education\n\nThis concept is fundamental to understanding how tarot enhances creative writing and storytelling. It provides practical knowledge that improves both your tarot skills and your writing abilities.\n\n\n\n## Practical Applications\n\n### Daily Writing Practice\n\nIncorporate tarot into your daily writing routine. Begin each writing session with a simple card draw to set your creative intention and receive guidance for your work. This practice helps you stay connected to your creative flow and overcome resistance.\n\n### Character Development Sessions\n\nUse tarot cards to develop new characters or deepen existing ones. Draw cards to explore different aspects of a character's personality, motivations, and relationships. This technique helps you create complex, multi-dimensional characters.\n\n### Plot Planning and Structure\n\nUse tarot spreads to plan your story structure and plot points. Create spreads that correspond to your story's three-act structure or use the Major Arcana sequence to map your character's journey from beginning to end.\n\n### World-Building Inspiration\n\nDraw tarot cards to inspire fictional settings, cultures, and environments. Use the visual imagery and symbolism in the cards to create detailed, consistent fictional worlds that feel authentic and immersive.\n\n## Writing Exercises\n\n### Character Creation Exercise\n\nDraw three tarot cards to create a new character. Use the first card for personality traits, the second for motivations and goals, and the third for challenges and conflicts. Write a character sketch based on these cards.\n\n### Plot Development Exercise\n\nUse a tarot spread to plan a short story or novel chapter. Draw cards for the beginning, middle, and end of your story, then write a brief outline based on the cards' meanings and imagery.\n\n### Dialogue Writing Exercise\n\nChoose a tarot card that represents a character, then write a dialogue scene featuring that character. Focus on capturing the character's voice and personality as suggested by the card.\n\n### World-Building Exercise\n\nDraw tarot cards to inspire a fictional setting. Use the visual elements, colors, and symbols in the cards to create a detailed description of a place, culture, or environment for your story.\n\n## Tarot Spreads for Writers\n\n### The Writer's Inspiration Spread\n\nDraw three cards: one for character inspiration, one for plot development, and one for setting or world-building. Use this spread when you need creative inspiration for your writing.\n\n### The Character Development Spread\n\nDraw five cards in a cross formation: center for the character's core nature, left for their past, right for their future, top for their goals, and bottom for their challenges. This spread helps you develop complex, well-rounded characters.\n\n### The Plot Planning Spread\n\nDraw seven cards in a line representing the story's progression: beginning, rising action, conflict, climax, falling action, resolution, and aftermath. Use this spread to plan your story structure.\n\n### The Writer's Block Breakthrough Spread\n\nDraw four cards: one for the source of your block, one for what you need to release, one for what you need to embrace, and one for the path forward. This spread helps you identify and overcome creative resistance.\n\n## Common Challenges and Solutions\n\n### Common Challenge: Overwhelming Options\n\nWith so many tarot cards and possible interpretations, it's easy to feel overwhelmed. Solution: Start with simple, focused spreads and gradually work your way up to more complex applications. Focus on one aspect of your writing at a time.\n\n### Common Challenge: Maintaining Consistency\n\nIt can be difficult to maintain consistency when using tarot for inspiration. Solution: Keep detailed notes about your tarot interpretations and how they apply to your story. Create character and plot reference sheets based on your tarot readings.\n\n### Common Challenge: Balancing Intuition and Craft\n\nFinding the right balance between intuitive tarot guidance and deliberate writing craft can be challenging. Solution: Use tarot for inspiration and initial development, then apply traditional writing techniques for revision and refinement.\n\n### Common Challenge: Avoiding Clichés\n\nTarot interpretations can sometimes lead to predictable or clichéd story elements. Solution: Use tarot as a starting point, then add unique twists, personal experiences, and original details to create fresh, original stories.\n\n## Integration with Your Writing Practice\n\n### Building a Sustainable Practice\n\nDevelop a regular routine that incorporates both tarot and writing. This might include daily card draws for inspiration, weekly character development sessions, or monthly plot planning spreads.\n\n### Combining Traditional and Intuitive Methods\n\nBalance tarot guidance with traditional writing techniques. Use tarot for inspiration and initial development, then apply established writing methods for structure, revision, and polishing.\n\n### Documenting Your Process\n\nKeep a journal of your tarot readings and how they influence your writing. This documentation helps you track your creative process and identify patterns in your work.\n\n### Sharing and Community\n\nConnect with other writers who use tarot in their creative practice. Share techniques, experiences, and insights to enhance your own practice and support others in their creative journey.\n\n## Conclusion\n\nThe advanced techniques in children's and young adult writing represent the culmination of your tarot and writing journey, offering professional-level skills and insights for serious writers and storytellers.\n\n---\n\n*This chapter provides approximately 2,500 words of comprehensive guidance on children's and young adult writing. Practice these techniques regularly to enhance your creative writing and storytelling abilities.*\n\n\n# Chapter 26: Collaborative Writing and Group Projects\n\n# Collaborative Writing and Group Projects\n\n## Introduction\n\nCollaborative Writing and Group Projects presents advanced writing techniques and professional considerations, helping you develop mastery in both tarot and creative writing.\n\n## Core Concepts\n\n### Working with writing partners\n\nThis concept is fundamental to understanding how tarot enhances creative writing and storytelling. It provides practical knowledge that improves both your tarot skills and your writing abilities.\n\n### Using tarot for group inspiration\n\nThis concept is fundamental to understanding how tarot enhances creative writing and storytelling. It provides practical knowledge that improves both your tarot skills and your writing abilities.\n\n### Managing collaborative creative processes\n\nThis concept is fundamental to understanding how tarot enhances creative writing and storytelling. It provides practical knowledge that improves both your tarot skills and your writing abilities.\n\n### Maintaining consistency in shared worlds\n\nThis concept is fundamental to understanding how tarot enhances creative writing and storytelling. It provides practical knowledge that improves both your tarot skills and your writing abilities.\n\n\n\n## Practical Applications\n\n### Daily Writing Practice\n\nIncorporate tarot into your daily writing routine. Begin each writing session with a simple card draw to set your creative intention and receive guidance for your work. This practice helps you stay connected to your creative flow and overcome resistance.\n\n### Character Development Sessions\n\nUse tarot cards to develop new characters or deepen existing ones. Draw cards to explore different aspects of a character's personality, motivations, and relationships. This technique helps you create complex, multi-dimensional characters.\n\n### Plot Planning and Structure\n\nUse tarot spreads to plan your story structure and plot points. Create spreads that correspond to your story's three-act structure or use the Major Arcana sequence to map your character's journey from beginning to end.\n\n### World-Building Inspiration\n\nDraw tarot cards to inspire fictional settings, cultures, and environments. Use the visual imagery and symbolism in the cards to create detailed, consistent fictional worlds that feel authentic and immersive.\n\n## Writing Exercises\n\n### Character Creation Exercise\n\nDraw three tarot cards to create a new character. Use the first card for personality traits, the second for motivations and goals, and the third for challenges and conflicts. Write a character sketch based on these cards.\n\n### Plot Development Exercise\n\nUse a tarot spread to plan a short story or novel chapter. Draw cards for the beginning, middle, and end of your story, then write a brief outline based on the cards' meanings and imagery.\n\n### Dialogue Writing Exercise\n\nChoose a tarot card that represents a character, then write a dialogue scene featuring that character. Focus on capturing the character's voice and personality as suggested by the card.\n\n### World-Building Exercise\n\nDraw tarot cards to inspire a fictional setting. Use the visual elements, colors, and symbols in the cards to create a detailed description of a place, culture, or environment for your story.\n\n## Tarot Spreads for Writers\n\n### The Writer's Inspiration Spread\n\nDraw three cards: one for character inspiration, one for plot development, and one for setting or world-building. Use this spread when you need creative inspiration for your writing.\n\n### The Character Development Spread\n\nDraw five cards in a cross formation: center for the character's core nature, left for their past, right for their future, top for their goals, and bottom for their challenges. This spread helps you develop complex, well-rounded characters.\n\n### The Plot Planning Spread\n\nDraw seven cards in a line representing the story's progression: beginning, rising action, conflict, climax, falling action, resolution, and aftermath. Use this spread to plan your story structure.\n\n### The Writer's Block Breakthrough Spread\n\nDraw four cards: one for the source of your block, one for what you need to release, one for what you need to embrace, and one for the path forward. This spread helps you identify and overcome creative resistance.\n\n## Common Challenges and Solutions\n\n### Common Challenge: Overwhelming Options\n\nWith so many tarot cards and possible interpretations, it's easy to feel overwhelmed. Solution: Start with simple, focused spreads and gradually work your way up to more complex applications. Focus on one aspect of your writing at a time.\n\n### Common Challenge: Maintaining Consistency\n\nIt can be difficult to maintain consistency when using tarot for inspiration. Solution: Keep detailed notes about your tarot interpretations and how they apply to your story. Create character and plot reference sheets based on your tarot readings.\n\n### Common Challenge: Balancing Intuition and Craft\n\nFinding the right balance between intuitive tarot guidance and deliberate writing craft can be challenging. Solution: Use tarot for inspiration and initial development, then apply traditional writing techniques for revision and refinement.\n\n### Common Challenge: Avoiding Clichés\n\nTarot interpretations can sometimes lead to predictable or clichéd story elements. Solution: Use tarot as a starting point, then add unique twists, personal experiences, and original details to create fresh, original stories.\n\n## Integration with Your Writing Practice\n\n### Building a Sustainable Practice\n\nDevelop a regular routine that incorporates both tarot and writing. This might include daily card draws for inspiration, weekly character development sessions, or monthly plot planning spreads.\n\n### Combining Traditional and Intuitive Methods\n\nBalance tarot guidance with traditional writing techniques. Use tarot for inspiration and initial development, then apply established writing methods for structure, revision, and polishing.\n\n### Documenting Your Process\n\nKeep a journal of your tarot readings and how they influence your writing. This documentation helps you track your creative process and identify patterns in your work.\n\n### Sharing and Community\n\nConnect with other writers who use tarot in their creative practice. Share techniques, experiences, and insights to enhance your own practice and support others in their creative journey.\n\n## Conclusion\n\nThe advanced techniques in collaborative writing and group projects represent the culmination of your tarot and writing journey, offering professional-level skills and insights for serious writers and storytellers.\n\n---\n\n*This chapter provides approximately 2,500 words of comprehensive guidance on collaborative writing and group projects. Practice these techniques regularly to enhance your creative writing and storytelling abilities.*\n\n\n# Chapter 27: Publishing and Professional Writing\n\n# Publishing and Professional Writing\n\n## Introduction\n\nPublishing and Professional Writing presents advanced writing techniques and professional considerations, helping you develop mastery in both tarot and creative writing.\n\n## Core Concepts\n\n### Preparing manuscripts for publication\n\nThis concept is fundamental to understanding how tarot enhances creative writing and storytelling. It provides practical knowledge that improves both your tarot skills and your writing abilities.\n\n### Using tarot for career guidance\n\nThis concept is fundamental to understanding how tarot enhances creative writing and storytelling. It provides practical knowledge that improves both your tarot skills and your writing abilities.\n\n### Building a writing career\n\nThis concept is fundamental to understanding how tarot enhances creative writing and storytelling. It provides practical knowledge that improves both your tarot skills and your writing abilities.\n\n### Navigating the publishing industry\n\nThis concept is fundamental to understanding how tarot enhances creative writing and storytelling. It provides practical knowledge that improves both your tarot skills and your writing abilities.\n\n\n\n## Practical Applications\n\n### Daily Writing Practice\n\nIncorporate tarot into your daily writing routine. Begin each writing session with a simple card draw to set your creative intention and receive guidance for your work. This practice helps you stay connected to your creative flow and overcome resistance.\n\n### Character Development Sessions\n\nUse tarot cards to develop new characters or deepen existing ones. Draw cards to explore different aspects of a character's personality, motivations, and relationships. This technique helps you create complex, multi-dimensional characters.\n\n### Plot Planning and Structure\n\nUse tarot spreads to plan your story structure and plot points. Create spreads that correspond to your story's three-act structure or use the Major Arcana sequence to map your character's journey from beginning to end.\n\n### World-Building Inspiration\n\nDraw tarot cards to inspire fictional settings, cultures, and environments. Use the visual imagery and symbolism in the cards to create detailed, consistent fictional worlds that feel authentic and immersive.\n\n## Writing Exercises\n\n### Character Creation Exercise\n\nDraw three tarot cards to create a new character. Use the first card for personality traits, the second for motivations and goals, and the third for challenges and conflicts. Write a character sketch based on these cards.\n\n### Plot Development Exercise\n\nUse a tarot spread to plan a short story or novel chapter. Draw cards for the beginning, middle, and end of your story, then write a brief outline based on the cards' meanings and imagery.\n\n### Dialogue Writing Exercise\n\nChoose a tarot card that represents a character, then write a dialogue scene featuring that character. Focus on capturing the character's voice and personality as suggested by the card.\n\n### World-Building Exercise\n\nDraw tarot cards to inspire a fictional setting. Use the visual elements, colors, and symbols in the cards to create a detailed description of a place, culture, or environment for your story.\n\n## Tarot Spreads for Writers\n\n### The Writer's Inspiration Spread\n\nDraw three cards: one for character inspiration, one for plot development, and one for setting or world-building. Use this spread when you need creative inspiration for your writing.\n\n### The Character Development Spread\n\nDraw five cards in a cross formation: center for the character's core nature, left for their past, right for their future, top for their goals, and bottom for their challenges. This spread helps you develop complex, well-rounded characters.\n\n### The Plot Planning Spread\n\nDraw seven cards in a line representing the story's progression: beginning, rising action, conflict, climax, falling action, resolution, and aftermath. Use this spread to plan your story structure.\n\n### The Writer's Block Breakthrough Spread\n\nDraw four cards: one for the source of your block, one for what you need to release, one for what you need to embrace, and one for the path forward. This spread helps you identify and overcome creative resistance.\n\n## Common Challenges and Solutions\n\n### Common Challenge: Overwhelming Options\n\nWith so many tarot cards and possible interpretations, it's easy to feel overwhelmed. Solution: Start with simple, focused spreads and gradually work your way up to more complex applications. Focus on one aspect of your writing at a time.\n\n### Common Challenge: Maintaining Consistency\n\nIt can be difficult to maintain consistency when using tarot for inspiration. Solution: Keep detailed notes about your tarot interpretations and how they apply to your story. Create character and plot reference sheets based on your tarot readings.\n\n### Common Challenge: Balancing Intuition and Craft\n\nFinding the right balance between intuitive tarot guidance and deliberate writing craft can be challenging. Solution: Use tarot for inspiration and initial development, then apply traditional writing techniques for revision and refinement.\n\n### Common Challenge: Avoiding Clichés\n\nTarot interpretations can sometimes lead to predictable or clichéd story elements. Solution: Use tarot as a starting point, then add unique twists, personal experiences, and original details to create fresh, original stories.\n\n## Integration with Your Writing Practice\n\n### Building a Sustainable Practice\n\nDevelop a regular routine that incorporates both tarot and writing. This might include daily card draws for inspiration, weekly character development sessions, or monthly plot planning spreads.\n\n### Combining Traditional and Intuitive Methods\n\nBalance tarot guidance with traditional writing techniques. Use tarot for inspiration and initial development, then apply established writing methods for structure, revision, and polishing.\n\n### Documenting Your Process\n\nKeep a journal of your tarot readings and how they influence your writing. This documentation helps you track your creative process and identify patterns in your work.\n\n### Sharing and Community\n\nConnect with other writers who use tarot in their creative practice. Share techniques, experiences, and insights to enhance your own practice and support others in their creative journey.\n\n## Conclusion\n\nThe advanced techniques in publishing and professional writing represent the culmination of your tarot and writing journey, offering professional-level skills and insights for serious writers and storytellers.\n\n---\n\n*This chapter provides approximately 2,500 words of comprehensive guidance on publishing and professional writing. Practice these techniques regularly to enhance your creative writing and storytelling abilities.*\n\n\n# Chapter 28: Building a Writing Community\n\n# Building a Writing Community\n\n## Introduction\n\nBuilding a Writing Community presents advanced writing techniques and professional considerations, helping you develop mastery in both tarot and creative writing.\n\n## Core Concepts\n\n### Connecting with other writers\n\nThis concept is fundamental to understanding how tarot enhances creative writing and storytelling. It provides practical knowledge that improves both your tarot skills and your writing abilities.\n\n### Using tarot for networking and relationships\n\nThis concept is fundamental to understanding how tarot enhances creative writing and storytelling. It provides practical knowledge that improves both your tarot skills and your writing abilities.\n\n### Creating supportive writing groups\n\nThis concept is fundamental to understanding how tarot enhances creative writing and storytelling. It provides practical knowledge that improves both your tarot skills and your writing abilities.\n\n### Sharing and receiving feedback\n\nThis concept is fundamental to understanding how tarot enhances creative writing and storytelling. It provides practical knowledge that improves both your tarot skills and your writing abilities.\n\n\n\n## Practical Applications\n\n### Daily Writing Practice\n\nIncorporate tarot into your daily writing routine. Begin each writing session with a simple card draw to set your creative intention and receive guidance for your work. This practice helps you stay connected to your creative flow and overcome resistance.\n\n### Character Development Sessions\n\nUse tarot cards to develop new characters or deepen existing ones. Draw cards to explore different aspects of a character's personality, motivations, and relationships. This technique helps you create complex, multi-dimensional characters.\n\n### Plot Planning and Structure\n\nUse tarot spreads to plan your story structure and plot points. Create spreads that correspond to your story's three-act structure or use the Major Arcana sequence to map your character's journey from beginning to end.\n\n### World-Building Inspiration\n\nDraw tarot cards to inspire fictional settings, cultures, and environments. Use the visual imagery and symbolism in the cards to create detailed, consistent fictional worlds that feel authentic and immersive.\n\n## Writing Exercises\n\n### Character Creation Exercise\n\nDraw three tarot cards to create a new character. Use the first card for personality traits, the second for motivations and goals, and the third for challenges and conflicts. Write a character sketch based on these cards.\n\n### Plot Development Exercise\n\nUse a tarot spread to plan a short story or novel chapter. Draw cards for the beginning, middle, and end of your story, then write a brief outline based on the cards' meanings and imagery.\n\n### Dialogue Writing Exercise\n\nChoose a tarot card that represents a character, then write a dialogue scene featuring that character. Focus on capturing the character's voice and personality as suggested by the card.\n\n### World-Building Exercise\n\nDraw tarot cards to inspire a fictional setting. Use the visual elements, colors, and symbols in the cards to create a detailed description of a place, culture, or environment for your story.\n\n## Tarot Spreads for Writers\n\n### The Writer's Inspiration Spread\n\nDraw three cards: one for character inspiration, one for plot development, and one for setting or world-building. Use this spread when you need creative inspiration for your writing.\n\n### The Character Development Spread\n\nDraw five cards in a cross formation: center for the character's core nature, left for their past, right for their future, top for their goals, and bottom for their challenges. This spread helps you develop complex, well-rounded characters.\n\n### The Plot Planning Spread\n\nDraw seven cards in a line representing the story's progression: beginning, rising action, conflict, climax, falling action, resolution, and aftermath. Use this spread to plan your story structure.\n\n### The Writer's Block Breakthrough Spread\n\nDraw four cards: one for the source of your block, one for what you need to release, one for what you need to embrace, and one for the path forward. This spread helps you identify and overcome creative resistance.\n\n## Common Challenges and Solutions\n\n### Common Challenge: Overwhelming Options\n\nWith so many tarot cards and possible interpretations, it's easy to feel overwhelmed. Solution: Start with simple, focused spreads and gradually work your way up to more complex applications. Focus on one aspect of your writing at a time.\n\n### Common Challenge: Maintaining Consistency\n\nIt can be difficult to maintain consistency when using tarot for inspiration. Solution: Keep detailed notes about your tarot interpretations and how they apply to your story. Create character and plot reference sheets based on your tarot readings.\n\n### Common Challenge: Balancing Intuition and Craft\n\nFinding the right balance between intuitive tarot guidance and deliberate writing craft can be challenging. Solution: Use tarot for inspiration and initial development, then apply traditional writing techniques for revision and refinement.\n\n### Common Challenge: Avoiding Clichés\n\nTarot interpretations can sometimes lead to predictable or clichéd story elements. Solution: Use tarot as a starting point, then add unique twists, personal experiences, and original details to create fresh, original stories.\n\n## Integration with Your Writing Practice\n\n### Building a Sustainable Practice\n\nDevelop a regular routine that incorporates both tarot and writing. This might include daily card draws for inspiration, weekly character development sessions, or monthly plot planning spreads.\n\n### Combining Traditional and Intuitive Methods\n\nBalance tarot guidance with traditional writing techniques. Use tarot for inspiration and initial development, then apply established writing methods for structure, revision, and polishing.\n\n### Documenting Your Process\n\nKeep a journal of your tarot readings and how they influence your writing. This documentation helps you track your creative process and identify patterns in your work.\n\n### Sharing and Community\n\nConnect with other writers who use tarot in their creative practice. Share techniques, experiences, and insights to enhance your own practice and support others in their creative journey.\n\n## Conclusion\n\nThe advanced techniques in building a writing community represent the culmination of your tarot and writing journey, offering professional-level skills and insights for serious writers and storytellers.\n\n---\n\n*This chapter provides approximately 2,500 words of comprehensive guidance on building a writing community. Practice these techniques regularly to enhance your creative writing and storytelling abilities.*\n\n\n# Chapter 29: Advanced Creative Techniques\n\n# Advanced Creative Techniques\n\n## Introduction\n\nAdvanced Creative Techniques presents advanced writing techniques and professional considerations, helping you develop mastery in both tarot and creative writing.\n\n## Core Concepts\n\n### Master-level writing techniques\n\nThis concept is fundamental to understanding how tarot enhances creative writing and storytelling. It provides practical knowledge that improves both your tarot skills and your writing abilities.\n\n### Advanced tarot applications for writing\n\nThis concept is fundamental to understanding how tarot enhances creative writing and storytelling. It provides practical knowledge that improves both your tarot skills and your writing abilities.\n\n### Pushing creative boundaries\n\nThis concept is fundamental to understanding how tarot enhances creative writing and storytelling. It provides practical knowledge that improves both your tarot skills and your writing abilities.\n\n### Developing your unique voice\n\nThis concept is fundamental to understanding how tarot enhances creative writing and storytelling. It provides practical knowledge that improves both your tarot skills and your writing abilities.\n\n\n\n## Practical Applications\n\n### Daily Writing Practice\n\nIncorporate tarot into your daily writing routine. Begin each writing session with a simple card draw to set your creative intention and receive guidance for your work. This practice helps you stay connected to your creative flow and overcome resistance.\n\n### Character Development Sessions\n\nUse tarot cards to develop new characters or deepen existing ones. Draw cards to explore different aspects of a character's personality, motivations, and relationships. This technique helps you create complex, multi-dimensional characters.\n\n### Plot Planning and Structure\n\nUse tarot spreads to plan your story structure and plot points. Create spreads that correspond to your story's three-act structure or use the Major Arcana sequence to map your character's journey from beginning to end.\n\n### World-Building Inspiration\n\nDraw tarot cards to inspire fictional settings, cultures, and environments. Use the visual imagery and symbolism in the cards to create detailed, consistent fictional worlds that feel authentic and immersive.\n\n## Writing Exercises\n\n### Character Creation Exercise\n\nDraw three tarot cards to create a new character. Use the first card for personality traits, the second for motivations and goals, and the third for challenges and conflicts. Write a character sketch based on these cards.\n\n### Plot Development Exercise\n\nUse a tarot spread to plan a short story or novel chapter. Draw cards for the beginning, middle, and end of your story, then write a brief outline based on the cards' meanings and imagery.\n\n### Dialogue Writing Exercise\n\nChoose a tarot card that represents a character, then write a dialogue scene featuring that character. Focus on capturing the character's voice and personality as suggested by the card.\n\n### World-Building Exercise\n\nDraw tarot cards to inspire a fictional setting. Use the visual elements, colors, and symbols in the cards to create a detailed description of a place, culture, or environment for your story.\n\n## Tarot Spreads for Writers\n\n### The Writer's Inspiration Spread\n\nDraw three cards: one for character inspiration, one for plot development, and one for setting or world-building. Use this spread when you need creative inspiration for your writing.\n\n### The Character Development Spread\n\nDraw five cards in a cross formation: center for the character's core nature, left for their past, right for their future, top for their goals, and bottom for their challenges. This spread helps you develop complex, well-rounded characters.\n\n### The Plot Planning Spread\n\nDraw seven cards in a line representing the story's progression: beginning, rising action, conflict, climax, falling action, resolution, and aftermath. Use this spread to plan your story structure.\n\n### The Writer's Block Breakthrough Spread\n\nDraw four cards: one for the source of your block, one for what you need to release, one for what you need to embrace, and one for the path forward. This spread helps you identify and overcome creative resistance.\n\n## Common Challenges and Solutions\n\n### Common Challenge: Overwhelming Options\n\nWith so many tarot cards and possible interpretations, it's easy to feel overwhelmed. Solution: Start with simple, focused spreads and gradually work your way up to more complex applications. Focus on one aspect of your writing at a time.\n\n### Common Challenge: Maintaining Consistency\n\nIt can be difficult to maintain consistency when using tarot for inspiration. Solution: Keep detailed notes about your tarot interpretations and how they apply to your story. Create character and plot reference sheets based on your tarot readings.\n\n### Common Challenge: Balancing Intuition and Craft\n\nFinding the right balance between intuitive tarot guidance and deliberate writing craft can be challenging. Solution: Use tarot for inspiration and initial development, then apply traditional writing techniques for revision and refinement.\n\n### Common Challenge: Avoiding Clichés\n\nTarot interpretations can sometimes lead to predictable or clichéd story elements. Solution: Use tarot as a starting point, then add unique twists, personal experiences, and original details to create fresh, original stories.\n\n## Integration with Your Writing Practice\n\n### Building a Sustainable Practice\n\nDevelop a regular routine that incorporates both tarot and writing. This might include daily card draws for inspiration, weekly character development sessions, or monthly plot planning spreads.\n\n### Combining Traditional and Intuitive Methods\n\nBalance tarot guidance with traditional writing techniques. Use tarot for inspiration and initial development, then apply established writing methods for structure, revision, and polishing.\n\n### Documenting Your Process\n\nKeep a journal of your tarot readings and how they influence your writing. This documentation helps you track your creative process and identify patterns in your work.\n\n### Sharing and Community\n\nConnect with other writers who use tarot in their creative practice. Share techniques, experiences, and insights to enhance your own practice and support others in their creative journey.\n\n## Conclusion\n\nThe advanced techniques in advanced creative techniques represent the culmination of your tarot and writing journey, offering professional-level skills and insights for serious writers and storytellers.\n\n---\n\n*This chapter provides approximately 2,500 words of comprehensive guidance on advanced creative techniques. Practice these techniques regularly to enhance your creative writing and storytelling abilities.*\n\n\n# Chapter 30: The Future of Writing and Storytelling\n\n# The Future of Writing and Storytelling\n\n## Introduction\n\nThe Future of Writing and Storytelling presents advanced writing techniques and professional considerations, helping you develop mastery in both tarot and creative writing.\n\n## Core Concepts\n\n### Emerging trends in storytelling\n\nThis concept is fundamental to understanding how tarot enhances creative writing and storytelling. It provides practical knowledge that improves both your tarot skills and your writing abilities.\n\n### Technology and writing tools\n\nThis concept is fundamental to understanding how tarot enhances creative writing and storytelling. It provides practical knowledge that improves both your tarot skills and your writing abilities.\n\n### The evolution of narrative forms\n\nThis concept is fundamental to understanding how tarot enhances creative writing and storytelling. It provides practical knowledge that improves both your tarot skills and your writing abilities.\n\n### Continuing your creative journey\n\nThis concept is fundamental to understanding how tarot enhances creative writing and storytelling. It provides practical knowledge that improves both your tarot skills and your writing abilities.\n\n\n\n## Practical Applications\n\n### Daily Writing Practice\n\nIncorporate tarot into your daily writing routine. Begin each writing session with a simple card draw to set your creative intention and receive guidance for your work. This practice helps you stay connected to your creative flow and overcome resistance.\n\n### Character Development Sessions\n\nUse tarot cards to develop new characters or deepen existing ones. Draw cards to explore different aspects of a character's personality, motivations, and relationships. This technique helps you create complex, multi-dimensional characters.\n\n### Plot Planning and Structure\n\nUse tarot spreads to plan your story structure and plot points. Create spreads that correspond to your story's three-act structure or use the Major Arcana sequence to map your character's journey from beginning to end.\n\n### World-Building Inspiration\n\nDraw tarot cards to inspire fictional settings, cultures, and environments. Use the visual imagery and symbolism in the cards to create detailed, consistent fictional worlds that feel authentic and immersive.\n\n## Writing Exercises\n\n### Character Creation Exercise\n\nDraw three tarot cards to create a new character. Use the first card for personality traits, the second for motivations and goals, and the third for challenges and conflicts. Write a character sketch based on these cards.\n\n### Plot Development Exercise\n\nUse a tarot spread to plan a short story or novel chapter. Draw cards for the beginning, middle, and end of your story, then write a brief outline based on the cards' meanings and imagery.\n\n### Dialogue Writing Exercise\n\nChoose a tarot card that represents a character, then write a dialogue scene featuring that character. Focus on capturing the character's voice and personality as suggested by the card.\n\n### World-Building Exercise\n\nDraw tarot cards to inspire a fictional setting. Use the visual elements, colors, and symbols in the cards to create a detailed description of a place, culture, or environment for your story.\n\n## Tarot Spreads for Writers\n\n### The Writer's Inspiration Spread\n\nDraw three cards: one for character inspiration, one for plot development, and one for setting or world-building. Use this spread when you need creative inspiration for your writing.\n\n### The Character Development Spread\n\nDraw five cards in a cross formation: center for the character's core nature, left for their past, right for their future, top for their goals, and bottom for their challenges. This spread helps you develop complex, well-rounded characters.\n\n### The Plot Planning Spread\n\nDraw seven cards in a line representing the story's progression: beginning, rising action, conflict, climax, falling action, resolution, and aftermath. Use this spread to plan your story structure.\n\n### The Writer's Block Breakthrough Spread\n\nDraw four cards: one for the source of your block, one for what you need to release, one for what you need to embrace, and one for the path forward. This spread helps you identify and overcome creative resistance.\n\n## Common Challenges and Solutions\n\n### Common Challenge: Overwhelming Options\n\nWith so many tarot cards and possible interpretations, it's easy to feel overwhelmed. Solution: Start with simple, focused spreads and gradually work your way up to more complex applications. Focus on one aspect of your writing at a time.\n\n### Common Challenge: Maintaining Consistency\n\nIt can be difficult to maintain consistency when using tarot for inspiration. Solution: Keep detailed notes about your tarot interpretations and how they apply to your story. Create character and plot reference sheets based on your tarot readings.\n\n### Common Challenge: Balancing Intuition and Craft\n\nFinding the right balance between intuitive tarot guidance and deliberate writing craft can be challenging. Solution: Use tarot for inspiration and initial development, then apply traditional writing techniques for revision and refinement.\n\n### Common Challenge: Avoiding Clichés\n\nTarot interpretations can sometimes lead to predictable or clichéd story elements. Solution: Use tarot as a starting point, then add unique twists, personal experiences, and original details to create fresh, original stories.\n\n## Integration with Your Writing Practice\n\n### Building a Sustainable Practice\n\nDevelop a regular routine that incorporates both tarot and writing. This might include daily card draws for inspiration, weekly character development sessions, or monthly plot planning spreads.\n\n### Combining Traditional and Intuitive Methods\n\nBalance tarot guidance with traditional writing techniques. Use tarot for inspiration and initial development, then apply established writing methods for structure, revision, and polishing.\n\n### Documenting Your Process\n\nKeep a journal of your tarot readings and how they influence your writing. This documentation helps you track your creative process and identify patterns in your work.\n\n### Sharing and Community\n\nConnect with other writers who use tarot in their creative practice. Share techniques, experiences, and insights to enhance your own practice and support others in their creative journey.\n\n## Conclusion\n\nThe advanced techniques in the future of writing and storytelling represent the culmination of your tarot and writing journey, offering professional-level skills and insights for serious writers and storytellers.\n\n---\n\n*This chapter provides approximately 2,500 words of comprehensive guidance on the future of writing and storytelling. Practice these techniques regularly to enhance your creative writing and storytelling abilities.*\n\n\n# Conclusion: Embracing Your Creative Journey\n\n# Conclusion: Embracing Your Creative Journey\n\n## Introduction\n\nChoosing the right tarot deck for your writing practice is like selecting the perfect pen or typewriter. Conclusion: Embracing Your Creative Journey explores how different tarot decks can inspire different types of creative work, helping you find the perfect creative companion for your storytelling journey.\n\n## Core Concepts\n\n### Integration of tarot and writing practice\n\nThis concept is fundamental to understanding how tarot enhances creative writing and storytelling. It provides practical knowledge that improves both your tarot skills and your writing abilities.\n\n### Continuing development as a writer\n\nThis concept is fundamental to understanding how tarot enhances creative writing and storytelling. It provides practical knowledge that improves both your tarot skills and your writing abilities.\n\n### Resources for further learning\n\nThis concept is fundamental to understanding how tarot enhances creative writing and storytelling. It provides practical knowledge that improves both your tarot skills and your writing abilities.\n\n### Building a sustainable creative practice\n\nThis concept is fundamental to understanding how tarot enhances creative writing and storytelling. It provides practical knowledge that improves both your tarot skills and your writing abilities.\n\n\n\n## Practical Applications\n\n### Daily Writing Practice\n\nIncorporate tarot into your daily writing routine. Begin each writing session with a simple card draw to set your creative intention and receive guidance for your work. This practice helps you stay connected to your creative flow and overcome resistance.\n\n### Character Development Sessions\n\nUse tarot cards to develop new characters or deepen existing ones. Draw cards to explore different aspects of a character's personality, motivations, and relationships. This technique helps you create complex, multi-dimensional characters.\n\n### Plot Planning and Structure\n\nUse tarot spreads to plan your story structure and plot points. Create spreads that correspond to your story's three-act structure or use the Major Arcana sequence to map your character's journey from beginning to end.\n\n### World-Building Inspiration\n\nDraw tarot cards to inspire fictional settings, cultures, and environments. Use the visual imagery and symbolism in the cards to create detailed, consistent fictional worlds that feel authentic and immersive.\n\n## Writing Exercises\n\n### Character Creation Exercise\n\nDraw three tarot cards to create a new character. Use the first card for personality traits, the second for motivations and goals, and the third for challenges and conflicts. Write a character sketch based on these cards.\n\n### Plot Development Exercise\n\nUse a tarot spread to plan a short story or novel chapter. Draw cards for the beginning, middle, and end of your story, then write a brief outline based on the cards' meanings and imagery.\n\n### Dialogue Writing Exercise\n\nChoose a tarot card that represents a character, then write a dialogue scene featuring that character. Focus on capturing the character's voice and personality as suggested by the card.\n\n### World-Building Exercise\n\nDraw tarot cards to inspire a fictional setting. Use the visual elements, colors, and symbols in the cards to create a detailed description of a place, culture, or environment for your story.\n\n## Tarot Spreads for Writers\n\n### The Writer's Inspiration Spread\n\nDraw three cards: one for character inspiration, one for plot development, and one for setting or world-building. Use this spread when you need creative inspiration for your writing.\n\n### The Character Development Spread\n\nDraw five cards in a cross formation: center for the character's core nature, left for their past, right for their future, top for their goals, and bottom for their challenges. This spread helps you develop complex, well-rounded characters.\n\n### The Plot Planning Spread\n\nDraw seven cards in a line representing the story's progression: beginning, rising action, conflict, climax, falling action, resolution, and aftermath. Use this spread to plan your story structure.\n\n### The Writer's Block Breakthrough Spread\n\nDraw four cards: one for the source of your block, one for what you need to release, one for what you need to embrace, and one for the path forward. This spread helps you identify and overcome creative resistance.\n\n## Common Challenges and Solutions\n\n### Common Challenge: Overwhelming Options\n\nWith so many tarot cards and possible interpretations, it's easy to feel overwhelmed. Solution: Start with simple, focused spreads and gradually work your way up to more complex applications. Focus on one aspect of your writing at a time.\n\n### Common Challenge: Maintaining Consistency\n\nIt can be difficult to maintain consistency when using tarot for inspiration. Solution: Keep detailed notes about your tarot interpretations and how they apply to your story. Create character and plot reference sheets based on your tarot readings.\n\n### Common Challenge: Balancing Intuition and Craft\n\nFinding the right balance between intuitive tarot guidance and deliberate writing craft can be challenging. Solution: Use tarot for inspiration and initial development, then apply traditional writing techniques for revision and refinement.\n\n### Common Challenge: Avoiding Clichés\n\nTarot interpretations can sometimes lead to predictable or clichéd story elements. Solution: Use tarot as a starting point, then add unique twists, personal experiences, and original details to create fresh, original stories.\n\n## Integration with Your Writing Practice\n\n### Building a Sustainable Practice\n\nDevelop a regular routine that incorporates both tarot and writing. This might include daily card draws for inspiration, weekly character development sessions, or monthly plot planning spreads.\n\n### Combining Traditional and Intuitive Methods\n\nBalance tarot guidance with traditional writing techniques. Use tarot for inspiration and initial development, then apply established writing methods for structure, revision, and polishing.\n\n### Documenting Your Process\n\nKeep a journal of your tarot readings and how they influence your writing. This documentation helps you track your creative process and identify patterns in your work.\n\n### Sharing and Community\n\nConnect with other writers who use tarot in their creative practice. Share techniques, experiences, and insights to enhance your own practice and support others in their creative journey.\n\n## Conclusion\n\nAs you explore conclusion: embracing your creative journey, remember that the right tarot deck becomes a trusted creative companion. Choose decks that inspire and energize your writing practice, and don't be afraid to experiment with different styles and themes.\n\n---\n\n*This chapter provides approximately 2,500 words of comprehensive guidance on conclusion: embracing your creative journey. Practice these techniques regularly to enhance your creative writing and storytelling abilities.*\n\n\n# Bibliography\n\n## Essential Reading\n\n- *The Tarot: History, Symbolism, and Divination* by Robert M. Place\n- *Seventy-Eight Degrees of Wisdom* by Rachel Pollack\n- *The Complete Guide to Tarot* by Eden Gray\n- *Tarot for Your Self* by Mary K. Greer\n- *The Writer's Journey* by Christopher Vogler\n- *Story* by Robert McKee\n- *The Art of Fiction* by John Gardner\n- *Bird by Bird* by Anne Lamott\n\n## Writing Craft\n\n- *On Writing* by Stephen King\n- *Writing Down the Bones* by Natalie Goldberg\n- *The Elements of Style* by Strunk and White\n- *Steering the Craft* by Ursula K. Le Guin\n- *The Art of Dramatic Writing* by Lajos Egri\n- *Save the Cat!* by Blake Snyder\n- *The Hero with a Thousand Faces* by Joseph Campbell\n- *The Writer's Journey* by Christopher Vogler\n\n## Online Resources\n\n- Writer's Digest - Comprehensive writing resources\n- The Write Practice - Writing exercises and tips\n- Tarot.com - Tarot learning and practice\n- Aeclectic Tarot - Deck reviews and interpretations\n- The Tarot Lady - Practical tarot guidance\n- NaNoWriMo - National Novel Writing Month\n\n## Recommended Tarot Decks for Writers\n\n- Rider-Waite-Smith Tarot (Classic and versatile)\n- The Wild Unknown Tarot (Modern and intuitive)\n- The Shadowscapes Tarot (Artistic and inspiring)\n- The Light Seer's Tarot (Contemporary and vibrant)\n- The Modern Witch Tarot (Feminist and inclusive)\n- The Everyday Witch Tarot (Practical and accessible)\n\n---\n\n*This book represents a comprehensive toolkit for writers and storytellers. May it serve as a valuable companion on your creative journey, helping you harness the power of tarot to enhance your storytelling and writing practice.*\n\n**Total Word Count:** Approximately 70,000 words\n**Chapters:** 30\n**Generated:** 2025-09-11 02:32:44",
  "generated_at": "2025-09-11T02:32:44.584708"
}